Thời gian,Tiêu đề,URL,Nội dung,positive,neutral,negative
2024-07-05 09:14:00,Chính sách mới đứng sau cú 'phi' của Petrolimex và PV OIL tạo nên cột mốc chưa từng có trong hơn 2 năm,https://cafef.vn/du-lieu/plx-2018224/chinh-sach-moi-dung-sau-cu-phi-cua-petrolimex-va-pv-oil-tao-nen-cot-moc-chua-tung-co-trong-hon-2-nam.chn,"Ngày 04/07/2024, Bộ Công Thương và Bộ Tài chính điều chỉnh giá bán lẻ xăng dầu theo chu kỳ điều chỉnh 7 ngày. Đây là lần tăng giá thứ 4 liên tiếp kể từ giữa tháng 6, phản ánh đà tăng của giá dầu Brent.
Báo cáo của VietCap lưu ý, kỳ điều chỉnh giá lần này áp dụng chi phí kinh doanh định mức trên mỗi lít xăng dầu mới theo Công văn số 6808/BTC-QLG ngày 01/07/2024, thay thế Công văn số 6800/BTC-QLG ngày 30/06/2023 trước đó.
Theo đó:
- Chi phí kinh doanh định mức của xăng 95 tăng 60 đồng/lít lên 1.140 đồng/lít (+5,6% YoY; tăng gấp 2 lần mức tăng 30 đồng/lít năm trước).
- Chi phí kinh doanh định mức của diesel tăng 140 đồng/lít lên 1.170 đồng/lít (+13,6% YoY; gấp 4,7 lần mức tăng 30 đồng/lít năm trước).
- Chi phí kinh doanh định mức của dầu hỏa tăng 230 đồng/lít lên 1.180 đồng/lít (+24,2% YoY; năm trước không thay đổi).
- Chi phí kinh doanh định mức của mazut tăng 70 đồng/lít lên 430 đồng/lít (+19,4% YoY; năm trước
giảm 184 đồng/lít).
VietCap đánh giá, mức tăng này sẽ có tác động tích cực đáng kể đến các thương nhân đầu mối/phân phối xăng dầu như Tổng công ty dầu Việt Nam (PV OIL, mã chứng khoán OIL) và Tập đoàn Xăng dầu Việt Nam (Petrolimex, mã chứng khoán PLX), cho phép công ty đạt lợi nhuận gộp cao hơn trên mỗi lít bằng cách trang trải tốt hơn chi phí vận hành thực tế.
Trong khi đó, báo cáo phân tích của CTCK VNDIRECT đề cập đến lợi ích của 2 ""ông lớn"" phân phối xăng dầu nói trên từ việc ﻿Bộ Công Thương đã trình Dự thảo Nghị định kinh doanh xăng dầu mới lần thứ hai với những thay đổi quan trọng cơ chế xác định giá bán lẻ và chi phí kinh doanh/lợi nhuận định mức mới.
Theo đánh giá của CTCK VNDIRECT, Nghị định này sẽ cho phép các đầu mối kinh doanh xăng dầu: 1) tự quyết định giá bán lẻ dựa trên điều kiện của thị trường; và 2) kịp thời điều chỉnh chi phí kinh doanh cố định và lợi nhuận định mức (yếu tố ảnh hưởng chính đến LN gộp của PLX) trong giai đoạn giá dầu thế giới biến động mạnh.
Cụ thể, Bộ Công Thương và Bộ Tài chính sẽ không trực tiếp tính toán ban hành giá cơ sở để xác định giá bán lẻ vì quá trình này có hai vấn đề.
Thứ nhất, cơ quan quản lý nhà nước và doanh nghiệp phải thực hiện nhiều bước và mất nhiều thời gian.
Thứ hai, các thành phần trong giá cơ sở được tính theo các dữ liệu được hình thành trong quá khứ với thời gian tương đối dài theo quý, khiến giá cơ sở không phản ánh đầy đủ tình hình thực tế của thị trường.
Thay vào đó, nhà nước sẽ chỉ công bố giá thế giới bình quân trên cơ sở 7 ngày/lần (hoặc 15 ngày). Các thương nhân đầu mối xăng dầu sẽ căn cứ các yếu tố cố định như thuế các loại, được quyền cộng thêm các khoản chi phí kinh doanh, lợi nhuận định mức được quy định trong nghị định để công bố giá bán lẻ trên thị trường.
Ngoài ra, giá bán lẻ không được phép vượt quá giá tối đa được xác định theo công thức của nghị định mới (chỉ được phép vượt không
quá 2% giá tối đa đối với địa bàn xa cảng xa kho đầu mối, xa cơ sở sản xuất xăng dầu khiến chi phí tăng cao).
""Do đó, chúng tôi kỳ vọng nghị định có thể có hiệu lực vào cuối năm 2024 và sẽ hỗ trợ biên LN gộp của PLX tăng 0,5% điểm lên 6,1%"" - Báo cáo đánh giá.
Bên cạnh đó, một con số ước tính từ VNDIRECT cho biết, sản lượng xăng dầu của Petrolimex trong Q1/24 tăng hơn 10% so với cùng kỳ và cao hơn 18% so với sản lượng bán trung bình theo quý trong 5 năm qua.
Sản lượng tiêu thụ tăng đáng kể cho thấy có thể Petrolimex đã giành được thị phần từ các nhà phân phối nhỏ hơn khác, đặc biệt là từ một số thương nhân kinh doanh xăng dầu và nhà phân phối đã bị thu hồi giấy phép hoạt động trong thời gian gần đây như Xuyên Việt Oil và Hải Hà Petro.
Tại ĐHCĐ thường niên 2024, Petrolimex cũng đã chia sẻ rằng tình hình này đã có tác động tích cực tới thị phần của doanh nghiệp. Nhờ vị thế thống lĩnh thị trường, Petrolimex có thể thu hút thêm các đại lý/tổng đại lý (DODO) khi họ tìm kiếm các thương nhân đầu mối đáng tin cậy.
Trong phiên giao dịch ngày 4/7, cổ phiếu PLX và OIL cùng tăng mạnh. Thị giá PLX tăng 4,9% lên mức 43.900 đồng/cp trong khi OIL tăng đến 13,6% lên 14.200 đồng/cp. Đây đều là mức giá cao nhất của 2 cổ phiếu này trong hơn 2 năm trở lại đây.
Tính từ đầu năm 2024 đến nay, cổ phiếu PLX đã tăng 32% qua đó đẩy vốn hóa thị trường của Petrolimex lên gần 56.000 tỷ đồng (hơn 2 tỷ USD). Tương tự, cổ phiếu OIL cũng tăng 42% sau nửa năm, đẩy vốn hóa lên 14.600 tỷ đồng (hơn 500 triệu USD). Dù vậy, những con số này vẫn còn kém xa mức kỷ lục mà hai doanh nghiệp từng đạt được.",0.2707275553679495,0.72012573022858,0.0091466902149536
2024-07-05 00:03:00,Hai nhà bán lẻ xăng dầu lớn nhất Việt Nam cùng đạt cột mốc chưa từng có trong hơn 2 năm,https://cafef.vn/du-lieu/plx-2018192/hai-nha-ban-le-xang-dau-lon-nhat-viet-nam-cung-dat-cot-moc-chua-tung-co-trong-hon-2-nam.chn,"Chiều ngày 4/7, Liên Bộ Tài chính - Công Thương phát đi thông tin về việc điều hành giá xăng dầu. Theo đó, Liên Bộ quyết định tăng 450 đồng/lít với xăng E5 RON 92 lên 22.460 đồng/lít; tăng 540 đồng/lít đối với xăng RON 95, giá mới là 23.550 đồng/lít. Tương tự, giá dầu diesel cũng được điều chỉnh tăng 490 đồng/lít, giá bán ở mức 21.170 đồng/lít. Đây là đợt điều chỉnh tăng giá thứ 4 liên tiếp của mặt hàng quan trọng này.
Cùng ngày, cổ phiếu của hai nhà bán lẻ xăng dầu lớn nhất cả nước là Petrolimex (PLX) và PV Oil (OIL) cũng tăng mạnh. Thị giá PLX tăng 4,9% phiên 4/7 lên mức 43.900 đồng/cp trong khi OIL tăng đến 13,6% lên 14.200 đồng/cp. Đây đều là mức giá cao nhất của 2 cổ phiếu này trong hơn 2 năm trở lại đây.
Tính từ đầu năm 2024 đến nay, cổ phiếu PLX đã tăng 32% qua đó đẩy vốn hóa thị trường của Petrolimex lên gần 56.000 tỷ đồng (hơn 2 tỷ USD). Tương tự, cổ phiếu OIL cũng tăng 42% sau nửa năm, đẩy vốn hóa lên 14.600 tỷ đồng (hơn 500 triệu USD). Dù vậy, những con số này vẫn còn kém xa mức kỷ lục mà hai doanh nghiệp từng đạt được.
Theo ước tính, Việt Nam hiện có hơn 17.000 cửa hàng bán lẻ xăng dầu, cung cấp hàng chục triệu tấn sản phẩm cho người tiêu dùng mỗi năm. Khoảng gần 70% thị phần xăng dầu dựa trên doanh thu nội địa hiện nằm trong tay ""bộ đôi"" Petrolimex và PV Oil. Trong đó, Petrolimex dẫn đầu với thị phần 50% cùng 5.500 cửa hàng trên toàn quốc. PV Oil xếp thứ 2 với thị phần 18% cùng 700 cửa hàng trực thuộc.
Trong quý đầu năm 2024, tổng doanh thu của Petrolimex và PV Oil lên đến gần 105.000 tỷ đồng, cao nhất kể từ quý 2/2022. Bình quân mỗi ngày hai nhà bán lẻ xăng dầu này thu về 1.150 tỷ đồng. Petrolimex ghi nhận doanh thu quý 1 đạt hơn 75.000 tỷ đồng, tăng 11% so với cùng kỳ 2023 trong khi doanh thu của PV Oil tăng đến hơn 44% lên 29.600 tỷ đồng.
Cùng bội thu trong quý đầu năm nhưng lợi nhuận của hai nhà bán lẻ xăng dầu này lại biến động trái chiều so với cùng kỳ năm ngoái. Lợi nhuận sau thuế quý 1 của Petrolimex tăng gần 70% lên hơn 1.300 tỷ đồng trong khi PV Oil lại báo lãi giảm hơn 8% so với cùng kỳ 2023, xuống mức 244 tỷ đồng.
Đánh giá về triển vọng kinh doanh quý 2, báo cáo mới đây của ACBS cho rằng Petrolimex có thể sẽ kém khả quan hơn so với quý 1. Trong tháng 5/2024, giá bán xăng dầu đang sụt giàm so với tháng 3&4/2024 do giá dầu giảm. Mức giảm này có thể khiến cho Petrolimex chịu bất lợi về tồn kho giá cao. Ngoài ra, thuế nhập khẩu xăng dầu từ 2024 giàm về 0% theo các hiệp định FTAcó thể làm giảm phần lợi thuế chênh lệch của doanh nghiệp này.
Tính chung cả năm 2024, cùng với nguồn xăng dầu ổn định, Petrolimex sẽ được hưởng lợi nhờ áp dụng chi phí định mức mới trong cả năm 2024 thay vì từ tháng 7/2023. Sản lượng tiêu thụ ước tính tăng 4% so với năm trước nhờ hoạt động sản xuất phục hồi.
Bên cạnh đó, theo nghị định 80/2023, các chi phí vận chuyển đưa xăng dầu từ nước ngoài về cảng Việt Nam, chi phí bảo hiểm, premium trong công thức tính giá bán ra cũng được điều chình thường xuyên hơn, 3 tháng/lần (thay vì 6 tháng như trước đây) giúp làm giảm rủ ro đóng cửa của một số CHXD nhỏ như năm 2022. Ngoài ra, dự thảo sửa đổi Nghị định 80/2023 cũng có nhiều điểm hỗ trợ cho các doanh nghiệp đầu mối xăng dầu như Petrolimex.
Với PV Oil, tổng công ty vừa tổ chức sơ kết 6 tháng đầu năm với sản lượng kinh doanh xăng dầu ước đạt 2,8 triệu m3/tấn. Doanh thu và lợi nhuận trước thuế ước đạt lần lượt gần 64.000 tỷ và 390 tỷ đồng. Tính riêng quý 2, doanh thu PV Oil ước đạt 34.376 tỷ đồng, tăng 54% nhưng lợi nhuận trước thuế lại giảm 64% so với cùng kỳ 2023, ước đạt 91 tỷ đồng.",0.4927394228296948,0.4644137295248007,0.0428468265043441
2024-07-05 00:00:00,PLX: Thông báo ký hợp đồng kiểm toán BCTC 2024,https://cafef.vn/du-lieu/plx-2019145/plx-thong-bao-ky-hop-dong-kiem-toan-bctc-2024.chn,,0.00837301928550005,0.9898200631141663,0.0018069730140268803
2024-05-09 00:00:00,"PLX: 14.5.2024, ngày GDKHQ trả cổ tức năm 2023 bằng tiền mặt (1.500 đ/cp)",https://cafef.vn/du-lieu/plx-1989312/plx-1452024-ngay-gdkhq-tra-co-tuc-nam-2023-bang-tien-mat-1500-dcp.chn,,0.026101378723978996,0.6074808239936829,0.3664177656173706
2024-05-08 16:46:00,"Vừa báo lãi đậm, cổ phiếu nhà bán lẻ xăng dầu lớn nhất Việt Nam tăng bốc lên đỉnh 9 tháng, nhà đầu tư ồ ạt chen mua trước thềm ""lăn chốt"" nhận 1.900 tỷ tiền cổ tức",https://cafef.vn/du-lieu/plx-1988945/vua-bao-lai-dam-co-phieu-nha-ban-le-xang-dau-lon-nhat-viet-nam-tang-boc-len-dinh-9-thang-nha-dau-tu-o-at-chen-mua-truoc-them-lan-chot-nhan-1900-ty-tien-co-tuc.chn,"Hòa cùng diễn biến khởi sắc của nhóm dầu khí, cổ phiếu PLX của Tập đoàn Xăng dầu Việt Nam (Petrolimex) ghi nhận phiên tăng thứ 6 liên tiếp, nhanh chóng có thêm 14% giá trị chỉ sau khoảng một tuần giao dịch. Hiện thị giá đạt 40.000 đồng/cp, vượt qua vùng đỉnh hồi tháng 9 năm ngoái và là mức giá cao nhất trong vòng 9 tháng (từ tháng 8/2023).
Đi cùng giá tăng, giao dịch tại PLX tương đối sôi động với thanh khoản hai phiên gần nhất đều trong khoảng 3-4 triệu đơn vị/phiên, giá trị trên trăm nghìn tỷ đồng, vượt trội so với con số vài chục tỷ giai đoạn trước đó.
Đà tăng bốc của PLX diễn ra trong thời điểm sát ngày chốt quyền thực hiện chi trả cổ tức năm 2023 của doanh nghiệp này. Cụ thể, ngày 15/5 tới, Petrolimex sẽ chốt danh sách cổ đông trả cổ tức bằng tiền, tỷ lệ 15% (tương ứng mỗi 1 cổ phiếu sẽ nhận 1.500 đồng). Thời gian thanh toán cổ tức dự kiến vào ngày 28/5.
Với hơn 1,27 tỷ cổ phiếu đang lưu hành, ước tính Petrolimex sẽ cần chi khoảng 1.906 tỷ đồng để hoàn thành thanh toán cổ tức đợt này cho cổ đông.
Ủy ban Quản lý vốn Nhà nước tại doanh nghiệp (CMSC) đang nắm gần 76% vốn tại Petrolimex dự kiến sẽ nhận về khoảng 1.440 tỷ đồng. Ngoài ra, cổ đông lớn từ Nhật Bản Eneos Việt Nam nắm hơn 13% vốn điều lệ sẽ nhận được khoảng 247 tỷ đồng.
Lãi đậm quý 1, hoàn thành một nửa kế hoạch lợi nhuận cả năm chỉ sau 3 tháng
Petrolimex hiện là nhà bán lẻ xăng dầu lớn nhất Việt Nam với 17.000 cửa hàng trên toàn quốc, chiếm hơn 50% thị phần kinh doanh, bán lẻ xăng dầu cả nước. Kết quả kinh doanh khởi sắc cũng có thể là động lực thúc đẩy đà tăng của PLX thêm bền vững. Theo BCTC hợp nhất quý 1/2024, doanh thu thuần của Petrolimex tăng 11% so với cùng kỳ đạt 75.106 tỷ đồng. ﻿Lợi nhuận gộp đạt 4.669 tỷ đồng, tăng 31% so với cùng kỳ.
Trừ đi các chi phí, Petrolimex ghi nhận lợi nhuận trước thuế đạt 1.441 tỷ đồng, tăng gần 72% so với cùng kỳ. Lợi nhuận sau thuế đạt 1.133 tỷ, tăng 70% so với cùng kỳ.
Petrolimex cho biết nguyên nhân chủ yếu khiến lợi nhuận sau thuế quý 1/2024 tăng so với cùng kỳ năm 2023 là do hiệu quả từ hoạt động kinh doanh xăng dầu, hoạt động kinh doanh thuộc các lĩnh vực khác của Tập đoàn về cơ bản ổn định và tăng trưởng so với cùng kỳ.
Theo DN, nguồn cung năng lượng và giá dầu thế giới ổn định, không biến động mạnh như các năm; nguồn cung xăng dầu từ các nhà máy lọc dầu trong nước khá ổn định, các thương nhân thực hiện nhập mua xăng dầu theo đúng kế hoạch và đảm bảo hiệu quả.
Lợi nhuận hoạt động tài chính cũng tăng so với cùng kỳ năm trước do: nhận cổ tức được chia mà cùng kỳ không có; hiệu quả khi sử dụng các hợp đồng bảo hiểm tỷ giá đã hạn chế rủi ro lỗ chênh lệch tỷ giá; và kinh doanh đạt hiệu quả tốt đã làm gia tăng dòng tiền thuần và tăng lãi tiền gửi khi sử dụng dòng tiền thuần so với cùng kỳ.
Năm 2024, Petrolimex lên chỉ tiêu thận trọng với doanh thu hợp nhất tương ứng 188.000 tỷ đồng, giảm 32% so với thực hiện 2023. Lợi nhuận trước thuế hợp nhất kế hoạch đạt 2.900 tỷ đồng, giảm 26% so với kết quả đạt được năm ngoái. Như vậy chỉ sau quý đầu năm, doanh nghiệp đã thực hiện được xấp xỉ 50% mục tiêu lợi nhuận năm.",0.985653831093919,0.012902553035768,0.0014436244129291
2024-05-06 00:00:00,PLX: Thông báo ngày ĐKCC để thực hiện quyền chi trả cổ tức năm 2023 bằng tiền,https://cafef.vn/du-lieu/plx-1988091/plx-thong-bao-ngay-dkcc-de-thuc-hien-quyen-chi-tra-co-tuc-nam-2023-bang-tien.chn,,0.01588938571512699,0.8952815532684326,0.08882907032966614
2024-05-04 00:00:00,PLX: Nghị quyết HĐQT về việc chi trả cổ tức năm 2023,https://cafef.vn/du-lieu/plx-1988887/plx-nghi-quyet-hdqt-ve-viec-chi-tra-co-tuc-nam-2023.chn,,0.02062554843723774,0.976036012172699,0.0033384724520146847
2024-05-04 00:00:00,PLX: Giấy chứng nhận đăng ký doanh nghiệp thay đổi lần thứ 14,https://cafef.vn/du-lieu/plx-1988888/plx-giay-chung-nhan-dang-ky-doanh-nghiep-thay-doi-lan-thu-14.chn,,0.8254776000976562,0.0020103284623473883,0.17251209914684296
2024-05-03 00:00:00,PLX: Bổ nhiệm ông Trần Sỹ Giang phụ trách quản trị từ 1.5.2024,https://cafef.vn/du-lieu/plx-2011429/plx-bo-nhiem-ong-tran-sy-giang-phu-trach-quan-tri-tu-152024.chn,,0.2596815824508667,0.0065809874795377254,0.7337374091148376
2024-05-02 10:27:00,"Petrolimex (PLX) báo lãi hơn 1.000 tỷ, tăng 70% so với cùng kỳ, cầm hơn 25.000 tỷ tiền nhàn rỗi",https://cafef.vn/du-lieu/plx-1985460/petrolimex-plx-bao-lai-hon-1000-ty-tang-70-so-voi-cung-ky-cam-hon-25000-ty-tien-nhan-roi.chn,"Tập đoàn Xăng dầu Việt Nam (Petrolimex, mã: PLX) vừa công bố BCTC hợp nhất quý 1/2024 ghi nhận doanh thu thuần tăng 11% so với cùng kỳ đạt 75.106 tỷ đồng. ﻿Lợi nhuận gộp đạt 4.669 tỷ đồng, tăng 31% so với cùng kỳ.
Trừ đi các chi phí, Petrolimex ghi nhận lợi nhuận trước thuế đạt 1.441 tỷ đồng, tăng gần 72% so với cùng kỳ. Lợi nhuận sau thuế đạt 1.133 tỷ, tăng 70% so với cùng kỳ.
Petrolimex cho biết nguyên nhân chủ yếu khiến lợi nhuận sau thuế quý 1/2024 tăng so với cùng kỳ năm 2023 là do hiệu quả từ hoạt động kinh doanh xăng dầu, hoạt động kinh doanh thuộc các lĩnh vực khác của Tập đoàn về cơ bản ổn định và tăng trưởng so với cùng kỳ.
Theo Petrolimex, nguồn cung năng lượng và giá dầu thế giới ổn định, không biến động mạnh như các năm; nguồn cung xăng dầu từ các nhà máy lọc dầu trong nước khá ổn định, các thương nhân thực hiện nhập mua xăng dầu theo đúng kế hoạch và đảm bảo hiệu quả.
Lợi nhuận hoạt động tài chính cũng tăng so với cùng kỳ năm trước do: nhận cổ tức được chia mà cùng kỳ không có; hiệu quả khi sử dụng các hợp đồng bảo hiểm tỷ giá đã hạn chế rủi ro lỗ chênh lệch tỷ giá; và kinh doanh đạt hiệu quả tốt đã làm gia tăng dòng tiền thuần và tăng lãi tiền gửi khi sử dụng dòng tiền thuần so với cùng kỳ.
Tại thời điểm 31/3/2024, tổng tài sản của Petrolimex đạt 80.732 tỷ đồng, tăng 1% so với đầu năm. Lượng tiền mặt, tương đương tiền và tiền gửi ngân hàng khoảng 25.086 tỷ đồng, giảm 3.530 tỷ đồng so với hồi đầu năm.
Phía bên kia bảng cân đối, tổng nợ phải trả ở mức 50.419 tỷ đồng, giảm 54 tỷ đồng so với đầu năm, tổng nợ vay ở mức 16.624 tỷ đồng. Vốn chủ sở hữu đạt 30.313 tỷ đồng.
Báo cáo của SSI Research kỳ vọng năm 2024, Petrolimex sẽ có cơ hội giành thêm thị phần, nhờ việc kiểm soát chặt chẽ hơn hoạt động của các nhà phân phối xăng dầu.
Thứ nhất, Hải Hà Petro và Xuyên Việt Oil là những nhà phân phối xăng dầu lớn với tổng doanh thu khoảng 40.000 tỷ đồng trong năm 2022 đã bị thu hồi giấy phép và dừng việc thông quan xăng dầu do không đủ điều kiện làm thương nhân đầu mối xăng dầu và có các vi phạm liên quan đến nợ thuế, hay sử dụng sai quỹ bình ổn giá xăng dầu.
Thứ hai, Petrolimex cũng có thể được hưởng lợi từ việc Chính phủ yêu cầu các đại lý bán lẻ phát hành hóa đơn điện tử cho từng giao dịch nhằm tăng cường tính minh bạch trong ngành xăng dầu Việt Nam.
Hiện tại theo ước tính mới chỉ có khoảng 36% trong số 17.000 đơn vị bán lẻ trong nước phát hành hóa đơn điện tử vào đầu tháng 2. Các cửa hàng xăng dầu không phát hành hóa đơn điện tử có thể đối mặt với nguy cơ bị thu hồi giấy phép hoạt động.
Trong khi đó, Petrolimex là đơn vị tiên phong phát hành hóa đơn điện tử và đã triển khai hệ thống này tại 2.700 điểm bán lẻ của doanh nghiệp từ giữa năm 2023. Do đó, quy định mới có thể giúp Petrolimex giành được thị phần trong thời gian tới.",0.6691605868477369,0.3290279143537851,0.0018114919130952
2024-05-02 00:00:00,PLX: Giải trình biến động kết quả kinh doanh quý 1/2024 so với quý 1/2023,https://cafef.vn/du-lieu/plx-2021571/plx-giai-trinh-bien-dong-ket-qua-kinh-doanh-quy-12024-so-voi-quy-12023.chn,,0.34771546721458435,0.4079083502292633,0.24437624216079712
2024-04-26 00:00:00,PLX: Công bố đường dẫn Báo cáo Phát triển bền vững năm 2023,https://cafef.vn/du-lieu/plx-1985495/plx-cong-bo-duong-dan-bao-cao-phat-trien-ben-vung-nam-2023.chn,,0.9084267616271973,0.08440405130386353,0.0071692257188260555
2024-04-26 00:00:00,PLX: Nghị quyết và Biên bản họp ĐHĐCĐ thường niên năm 2024,https://cafef.vn/du-lieu/plx-1985766/plx-nghi-quyet-va-bien-ban-hop-dhdcd-thuong-nien-nam-2024.chn,,0.07656402140855789,0.9221827983856201,0.001253147958777845
2024-04-26 00:00:00,PLX: Bổ nhiệm ông Nguyễn Đình Dương giữ chức Phó Tổng giám đốc từ 1.5.2024,https://cafef.vn/du-lieu/plx-1996715/plx-bo-nhiem-ong-nguyen-dinh-duong-giu-chuc-pho-tong-giam-doc-tu-152024.chn,,0.09585142880678177,0.039058126509189606,0.8650904297828674
2024-04-26 00:00:00,PLX: Thông báo thay đổi nhân sự công ty,https://cafef.vn/du-lieu/plx-1996718/plx-thong-bao-thay-doi-nhan-su-cong-ty.chn,,0.9961128234863281,0.0007823012419976294,0.003104847390204668
2024-04-19 00:00:00,PLX: Link công bố báo cáo thường niên năm 2024,https://cafef.vn/du-lieu/plx-1979674/plx-link-cong-bo-bao-cao-thuong-nien-nam-2024.chn,,0.07502571493387222,0.9137813448905945,0.011192967183887959
