Thời gian,Tiêu đề,URL,Nội dung,positive,neutral,negative
2024-12-07 09:29:00,"""Siêu ủy ban"" quản lý vốn nhà nước sắp kết thúc hoạt động: Nắm giữ 7 cổ phiếu có trị giá 515.000 tỷ đồng, cùng SCIC nắm giữ 10% vốn hóa TTCK Việt Nam",https://cafef.vn/du-lieu/plx-2095952/sieu-uy-ban-quan-ly-von-nha-nuoc-sap-ket-thuc-hoat-dong-nam-giu-7-co-phieu-co-tri-gia-515000-ty-dong-cung-scic-nam-giu-10-von-hoa-ttck-viet-nam.chn,"Phó Thủ tướng Thường trực Nguyễn Hòa Bình - Phó Trưởng Ban Chỉ đạo về tổng kết việc thực hiện Nghị quyết 18 đã ký ban hành kế hoạch định hướng sắp xếp, tinh gọn tổ chức bộ máy của Chính phủ.
Theo kế hoạch được ban hành, Ủy ban Quản lý vốn Nhà nước tại doanh nghiệp sẽ kết thúc hoạt động và chuyển chức năng, nhiệm vụ về Bộ Tài chính, các bộ chuyên ngành và các cơ quan liên quan.
Thực hiện theo phương án này, dự kiến sẽ chuyển chức năng, nhiệm vụ thực hiện quyền đại diện chủ sở hữu đối với 19 tập đoàn, tổng công ty (hiện đang giao Ủy ban Quản lý vốn Nhà nước tại doanh nghiệp quản lý) về Bộ Tài chính và Đầu tư phát triển hoặc Bộ Kinh tế phát triển.
Đối với các nhiệm vụ quản lý Nhà nước về ngành, lĩnh vực liên quan đến phạm vi hoạt động của các tập đoàn, tổng công ty sẽ do các bộ quản lý ngành, lĩnh vực chịu trách nhiệm quản lý, bảo đảm tách chức năng quản lý Nhà nước với chức năng đại diện chủ sở hữu.
Đối với một số tập đoàn lớn, như Tập đoàn Dầu khí Việt Nam ( PVN ), Tập đoàn Điện lực Việt Nam ( EVN ), Tập đoàn Bưu chính Viễn thông Việt Nam, Tổng Công ty đường sắt Việt Nam, Tổng Công ty Đầu tư phát triển đường cao tốc Việt Nam... thì nghiên cứu xác định là đầu mối tổ chức Đảng trực thuộc Đảng bộ Chính phủ.
Chiều 6/12, Ủy ban Quản lý vốn Nhà nước tại doanh nghiệp (CMSC) tổ chức Hội nghị tổng kết công tác năm 2024 cùng với 19 tập đoàn, tổng công ty.
Theo báo cáo tại hội nghị, đến nay Ủy ban đã cơ bản tách chức năng đại diện chủ sở hữu vốn nhà nước tại doanh nghiệp của 5 bộ để các bộ tập trung nhiệm vụ quản lý nhà nước, ban hành chính sách.
Được biết, Ủy ban Quản lý vốn nhà nước tại doanh nghiệp là cơ quan thuộc Chính phủ; được Chính phủ giao thực hiện quyền, trách nhiệm của đại diện chủ sở hữu nhà nước đối với doanh nghiệp do Nhà nước nắm giữ 100% vốn điều lệ và phần vốn nhà nước đầu tư tại công ty cổ phần, công ty trách nhiệm hữu hạn hai thành viên trở lên theo quy định của pháp luật.
Cụ thể, CMSC trực tiếp làm đại diện chủ sỡ hữu vốn nhà nước tại 19 doanh nghiệp bao gồm 7 tập đoàn lớn là
- Tập đoàn Xăng dầu Việt Nam (Petrolimex); Tập đoàn Hóa chất Việt Nam (Vinachem)
- Tập đoàn Điện lực Việt Nam (EVN); Tập đoàn Dầu khí Việt Nam (PVN)
- Tập đoàn Công nghiệp cao su Việt Nam (VRG)
- Tập đoàn Công nghiệp than khoáng sản Việt Nam (TKV)
- Tập đoàn Bưu chính Viễn thông Việt Nam (VNPT).
Cùng với đó là 11 tổng công ty bao gồm: Tổng công ty Đầu tư và Kinh doanh vốn nhà nước (SCIC), Tổng Công ty Hàng không Việt Nam (Vietnam Airlines); Tổng Công ty Viễn thông MobiFone; Tổng Công ty Thuốc lá Việt Nam (Vinataba); Tổng Công ty Hàng hải Việt Nam (Vinalines); Tổng Công ty Đường sắt Việt Nam (VNR); Tổng Công ty Đầu tư phát triển đường cao tốc Việt Nam (VEC); Tổng Công ty Cảng Hàng không (ACV); Tổng Công ty Cà phê Việt Nam (Vinacafe); Tổng Công ty Lương thực miền Nam (Vinafood 2); Tổng Công ty lương thực miền Bắc (Vinafood 1) và Tổng Công ty Lâm nghiệp Việt Nam (Vinafor).
Đây đều là những tập đoàn, những tổng công ty lớn hàng đầu cả nước.
Về tình hình tài chính hợp nhất của các Tập đoàn, Tổng công ty do Ủy ban làm đại diện chủ sở hữu, doanh thu ước đạt 2.030.572 tỷ đồng, bằng 120% kế hoạch năm và bằng 107% so với cùng kỳ. Lợi nhuận trước thuế ước đạt 111.692 tỷ đồng, bằng 158% kế hoạch năm và bằng 156% so với cùng kỳ. Giá trị nộp Ngân sách Nhà nước ước đạt 206.206 tỷ đồng, bằng 153% kế hoạch năm và bằng 105% so với cùng kỳ.
Trong số đó, nhiều doanh nghiệp đang niêm yết trên sàn chứng khoán. Tính đến 5/12, 7 cổ phiếu do CMSC đang trực tiếp sở hữu có tổng giá trị thị trường đạt 515.000 tỷ đồng (gần 21 tỷ USD).
Trong đó, CMSC sở hữu lượng cổ phiếu của ACV và Tập đoàn Công nghiệp cao su Việt Nam (GVR) hơn 100.000 tỷ. Cụ thể, CMSC sở hữu hơn 2 tỷ cổ phiếu ACV (tương ứng tỷ lệ sở hữu 95,4%), số cổ phiếu này có giá trị tại ngày 5/12 hơn 254.000 tỷ đồng. Và CMSC sở hữu hơn 3,87 tỷ cổ phiếu GVR, có giá trị hơn 121.000 tỷ đồng.
Bên cạnh sở hữu trực tiếp, CMSC còn sở hữu gián tiếp cổ phiếu thông qua Tổng công ty Đầu tư và Kinh doanh vốn nhà nước (SCIC) - vốn cũng là một đơn vị được chỉ định để tiếp nhận nhiều phần vốn nhà nước từ các bộ ngành, địa phương.
Hiện tổng giá trị các cổ phiếu do SCIC nắm giữ đạt gần 190.000 tỷ đồng.
Trong đó, SCIC sở hữu lượng cổ phiếu trị giá hơn 10.000 tỷ đồng tại Vinamilk, Sabeco, FPT Telecom, Vietnam Airlines, MB, FPT.
Tổng giá trị vốn hóa của thị trường UpCOM là ﻿1,55 triệu tỷ, của HNX gần 331 nghìn tỷ, của HoSE hơn 5,2 triệu tỷ. Tổng giá trị vốn hóa của các thị trường chứng khoán Việt Nam lên hơn 7 triệu tỷ.
Số cổ phiếu tại các doanh nghiệp do CMSC quản lý Ủy ban đang sở hữu trực tiếp và số cổ phiếu sở hữu gián tiếp thông qua SCIC có giá trị khoảng 703.000 tỷ đồng, bằng khoảng 10% giá trị thị trường chứng khoán. Nếu tính cả lượng cổ phiếu tại các tập đoàn CMSC không nắm quyền chi phối đang sở hữu tỷ lệ này có thể lên đến 15%.",0.4543496243611541,0.5437876412242443,0.0018627390262398
2024-11-02 14:25:00,"Các “sếu đầu đàn” PVN, Petrolimex, Vitas, Sữa TH… đang dẫn dắt nền kinh tế ESG Việt Nam",https://cafef.vn/du-lieu/plx-2078220/cac-seu-dau-dan-pvn-petrolimex-vitas-sua-th-dang-dan-dat-nen-kinh-te-esg-viet-nam.chn,"Việt Nam là quốc gia đầu tiên trên thế giới được IIA công nhận là Viện Kiểm toán viên nội bộ độc lập chỉ sau 2 năm
“IIA Việt Nam là quốc gia đầu tiên trên thế giới được IIA quốc tế công nhận là Viện Kiểm toán viên nội bộ độc lập chỉ sau 2 năm thành lập . Đặc biệt, nếu tất cả các nước khác phải mất 3 năm để được đánh giá, thì IIA Vietnam chỉ mất 22 tháng để được công nhận là Viện Kiểm toán viên nội bộ độc lập ”, chia sẻ đáng chú ý tại Hội nghị Kiểm toán Nội bộ thường niên 2024.
Được biết, Việt Nam gia nhập mạng lưới kiểm toán nội bộ quốc tế IIA Global từ năm 2022. IIA là tổ chức Kiểm toán Nội bộ đi đầu về chuẩn mực, chứng chỉ, đào tạo, nghiên cứu và hướng dẫn chuyên môn nghiệp vụ toàn cầu. Năm 2024, các doanh nghiệp niêm yết Việt Nam đã có sự tiến triển vượt bậc trong nhận thức cũng như chuyển đổi sang phát triển bền vững.
So với các năm trước đó, khảo sát của IIA Việt Nam năm 2022 cho thấy doanh nghiệp Việt Nam chưa nhận thức đủ về ESG, thậm chí đang thực hiện kiểm toán nội bộ cho chủ đề ESG ở mức độ khác nhau. Báo cáo năm 2023, nhận thức đã được nâng lên song việc triển khai ESG trong kiểm toán nội bộ vẫn còn nhiều vướng mắc. Dù rằng, từ năm 2023 hầu hết các doanh nghiệp đều có quy chế/quyết định thành lập hoặc tổ chức hoạt động kiểm toán nội bộ.
Đối tượng tham gia khảo sát là doanh nghiệp niêm yết trên 2 sàn chứng khoán Tp.HCM và Hà Nội, doanh nghiệp có vốn nhà nước trên 50% là công ty hoạt động theo mô hình công ty mẹ con, doanh nghiệp nhà nước là công ty hoạt động theo mô hình công ty mẹ – con.
Các “sếu đầu đàn” PVN, Petrolimex, Vitas, Sữa TH… đang dẫn dắt nền kinh tế ESG Việt Nam
Thực tế, ghi nhận từ Green Media Hub, nhiều doanh nghiệp niêm yết, doanh nghiệp lớn đã và đang đồng hành thúc đẩy ESG – chỉ số cực quan trọng trong nền kinh tế mới, quyết định việc giao thương với nước ngoài cũng như thu hút dòng vốn đầu tư vào Việt Nam.
Trong đó, với vai trò “cánh chim đầu đàn”, Petrovietnam (PVN) cho biết đề mục tiêu đạt tỷ lệ nguồn năng lượng tái tạo trong tổng cung năng lượng sơ cấp đạt 15 - 20%vào năm 2030 và 25 - 30% vào năm 2045. Song song, PVN cũng nỗ lực giảm phát thải khí nhà kính từ hoạt động năng lượng đạt 15% năm 2030 và 20% năm 2045; nâng cao năng lực nhập khẩu LNG lên 8 tỷ m3/năm 2030 và 15 tỷ m3/năm 2045...
Để thực hiện được các mục tiêu này, PVN được biết đã và đang xây dựng chiến lược tổng thể phát triển bền vững đến năm 2045, trong đó chú trọng vào đổi mới công nghệ và chuyển dịch năng lượng. Tập đoàn cũng định hướng giai đoạn 2025 - 2030 sẽ triển khai thí điểm các dự án sản xuất hydrogen “sạch”; đến năm 2030 – 2045 chính thức sản xuất thương mại hydrogen “sạch” sử dụng cho các nhà máy lọc dầu, nhà máy đạm. Hiện, các nhà máy lọc dầu Dung Quất và Nghi Sơn đang xây dựng kế hoạch nghiên cứu dài hạn về hydrogen. Hai nhà máy Đạm Phú Mỹ và Đạm Cà Mau cũng có kế hoạch thử nghiệm sử dụng hydrogen xanh thay thế một phần sản xuất amoniac.
Là đơn vị đầu mối kinh doanh xăng dầu chiếm thị phần lớn nhất cả nước, Petrolimex (PLX) cho biết là đơn vị tiên phong hoàn thành thay thế toàn bộ sản phẩm xăng RON 92 bằng xăng sinh học E5 từ tháng 1/2022. Công ty đề mục tiêu đạt 50% doanh thu từ sản phẩm nhiên liệu và năng lượng sạch, thân thiện với môi trường vào năm 2030, đến năm 2045 sẽ đạt 100% tỷ trọng năng lượng sạch và thân thiện với môi trường.
Ảnh: Các nhà máy lọc dầu Dung Quất và Nghi Sơn đang xây dựng kế hoạch nghiên cứu dài hạn về hydrogen.
Ở nhóm dệt may, ông Nguyễn Văn Tuấn - Giám đốc Trung tâm hỗ trợ doanh nghiệp của Hiệp hội Dệt may Việt Nam (VITAS) – chia sẻ với Green Media Hub: “Thực tế, doanh nghiệp dệt may Việt Nam đã thực hiện chuyển đổi xanh từ năm 2018 từ định hướng phát triển của Chính phủ cũng như từ việc đáp ứng yêu cầu của các nước nhập khẩu thông qua các Hiệp định thương mại tự do (FTA) thế hệ mới” .
Trong đó, doanh nghiệp dệt may Việt Nam đã áp dụng chứng chỉ LEED (Leadership in Energy & Environment Design); gần 1.000 đơn vị cũng đã áp dụng Higg FEM - Facility Environmental Module (Mô-đun Môi trường Cơ sở Higg) được xây dựng bởi Liên minh May mặc Bền vững (SAC) tiếp nối là Cascale; Việt Nam hiện là quốc gia có thứ hạng cao thứ hai về điểm trung bình quốc gia v-Higg FEM (Higg FEM 2022) đứng sau Trung Quốc và trước Bangladesh.
Vị này nhấn mạnh, những kết quả mà ngành dệt may Việt Nam đã đạt được trong những năm gần đây về kim ngạch xuất khẩu với sự tăng trưởng đáng ghi nhận (8-10%/năm) đã chứng minh được chiến lược phát triển đúng đắn. Tuy nhiên, ông Tuấn cũng cho biết hiện doanh nghiệp vẫn chưa thực hiện việc đánh giá và công nhận chứng chỉ này do chi phí cao (chiếm 10-15% chi phí).
Tại nhóm sản xuất, đại diện Heineken Việt Nam đặt mục tiêu năm 2030 là giảm phát thải về 0 (Net Zero) trong phạm vi sản xuất trực tiếp. Cụ thể là các hoạt động như sản xuất, xử lý chất thải, và quản lý năng lượng nội bộ. Bà Trần Ngọc Ánh, Giám đốc Ngoại vụ cấp cao Heineken Việt Nam cho biết Công ty đang tiên phong sử dụng 99% năng lượng tái tạo trong sản xuất đồng thời hoàn thành chỉ tiêu nấu bia bằng nhiệt năng sinh khối tại toàn bộ 5 nhà máy bia trên toàn quốc.
Trong khi chờ các giải pháp về năng lượng tái tạo, Heineken Việt Nam đã mua các Chứng chỉ thuộc tính năng lượng (EAC) cho 100% lượng điện năng tiêu thụ tại 6 nhà máy. Toàn bộ 5 nhà máy Heineken Việt Nam áp dụng mô hình kinh tế tuần hoàn ""tái sử dụng - chia sẻ - sửa chữa"", không còn rác thải chôn lấp từ năm 2021, sớm hơn 4 năm so với dự kiến ban đầu.
Tương tự, ông Arghya Mandal - Tổng Giám đốc CTCP Sữa TH - cũng chia sẻ TH đã sớm triển nhà máy xanh ở Việt Nam, từ năm 2020 đã sử dụng năng lượng tái tạo. Ông Mandal cho rằng để đạt được mục tiêu Net Zero carbon với nền kinh tế phát thải thấp, phát triển bền vững thì hoạt động của các doanh nghiệp và các nhà sản xuất đóng vai trò quan trọng trong việc phát triển nhà máy xanh và thực hiện trách nhiệm của nhà sản xuất (EPR)...
Ảnh: TH đã sớm triển nhà máy xanh ở Việt Nam, từ năm 2020 đã sử dụng năng lượng tái tạo.
Với nhóm doanh nghiệp gỗ, ông Nguyễn Chánh Phương - Phó Chủ tịch Hội Mỹ nghệ và Chế biến gỗ Tp.HCM (Hawa) cho biết hoạt động xuất khẩu là chủ yếu, nên nhận thức về chuyển đổi xanh của ngành gỗ phải được đề cao từ sớm. Bởi, thị trường thế giới chuyển dịch rất nhanh về hướng xanh yêu cầu doanh nghiệp chuyển đổi mô hình kinh doanh và sản phẩm, tiêu chuẩn sản phẩm đáp ứng nhu cầu thị trường. Thách thức lớn nhất không chỉ ở tiêu chuẩn mà là khả năng sáng tạo, tự chủ thiết kế để gia tăng tính cạnh tranh.
Dù vậy, tương tự dệt may, vấn đề lớn nhất là vốn, đặc biệt trong quá trình sản xuất. Bởi, để chuyển đổi xanh đòi hỏi doanh nghiệp đầu tư vào cơ sở hạ tầng, đổi mới thiết bị, tiết giảm phát thải. Song song, chuỗi cung ứng gỗ cũng là thách thức không nhỏ với doanh nghiệp hiện nay.
Tựu chung, ESG là một trong những con đường bắt buột toàn nền kinh tế phải đi qua. PGS.TS Nguyễn Đình Thọ, Viện trưởng Viện Chính sách Bộ TN&MT cho biết tại COP26 năm 2021, Thủ tướng Chính phủ đã đưa ra cam kết rất mạnh mẽ là Việt Nam sẽ đạt phát thải ròng bằng 0 vào năm 2050. Vị này cũng chia sẻ một điều đáng mừng là Việt Nam đang cải thiện về kinh tế xanh với tốc độ nhanh so với trên thế giới, khoảng 12-14%/năm. Tuy vậy quy mô nền kinh xanh đang còn nhỏ, năm 2020 chỉ ở mức 2%, cho đến bây giờ 4-4,5%...",0.4956692292960021,0.5026615788573564,0.0016691989326806
2024-10-30 00:00:00,PLX: Giải trình BCTC quý 3/2024 so với cùng kỳ năm trước,https://cafef.vn/du-lieu/plx-2080188/plx-giai-trinh-bctc-quy-32024-so-voi-cung-ky-nam-truoc.chn,,0.06529413908720016,0.8661189675331116,0.06858696788549423
2024-08-30 00:00:00,PLX: Giải trình BCTC soát xét bán niên năm 2024,https://cafef.vn/du-lieu/plx-2048026/plx-giai-trinh-bctc-soat-xet-ban-nien-nam-2024.chn,,0.4757363796234131,0.49958229064941406,0.024681277573108673
2024-08-14 15:19:00,"Cổ phiếu PLX lên đỉnh 28 tháng, vốn hóa Petrolimex vượt nhiều ngân hàng",https://cafef.vn/du-lieu/plx-2038603/co-phieu-plx-len-dinh-28-thang-von-hoa-petrolimex-vuot-nhieu-ngan-hang.chn,"Thị trường chứng khoán “dập dìu” dưới 1.300 điểm nhưng vẫn có những điểm sáng trong nhóm Bluechips, điển hình như cổ phiếu PLX của Tập đoàn Xăng dầu Việt Nam (Petrolimex). Từ đáy ngắn hạn hồi giữa tháng 4 đến nay, cổ phiếu này đã tăng gần 50% và hiện đang dừng ở mức 49.200 đồng/cp, cao nhất trong vòng 28 tháng.
Vốn hóa thị trường cũng theo đó tăng khoảng 20.000 tỷ sau chưa đầy 4 tháng, lên hơn 62.500 tỷ đồng. Con số này đưa Petrolimex vượt qua nhiều ngân hàng như Sacombank (STB), SeABank (SSB), VIB,…
Với mạng lưới phân phối hơn 5.500 trạm bán lẻ và các đại lý trên toàn quốc, Petrolimex hiện đang là nhà cung cấp các sản phẩm xăng dầu lớn nhất trên thị trường nội địa, chiếm 50% thị phần sản lượng trong nước. Đáng chú ý, doanh nghiệp này còn là quán quân sàn chứng khoán về doanh thu với hàng trăm nghìn tỷ mỗi năm.
6 tháng đầu năm, doanh thu của Petrolimex đạt trên 148.943 tỷ đồng, tăng 11,8% so với cùng kỳ 2023. Lợi nhuận trước thuế đạt 2.994 tỷ đồng, tăng gấp 1,6 lần so với cùng kỳ năm trước. Với kết quả đạt được, Petrolimex đã thực hiện khoảng 79% kế hoạch doanh thu và hoàn thành vượt chỉ tiêu lợi nhuận cả năm đề ra.
Trong báo cáo mới đây, Chứng khoán DSC tiếp tục giữ mức dự phóng lợi nhuận 2024 của Petrlomiex tăng 29% dù doanh thu có thể giảm nhẹ so với năm trước. Theo DSC, biên độ biến động giá xăng dầu trong năm 2024 sẽ không cao và các nghị định liên quan đến ổn định giá và nguồn cung xăng dầu sẽ hỗ trợ cho các doanh nghiệp tại khâu hạ nguồn dầu khí.
Giá dầu thô cũng như xăng dầu thế giới ít biến động mạnh, tạo điều kiện cho Petrolimex quản lý tốt hàng tồn kho. Từ đầu năm tới nay, Petrolimex không phải gia tăng các khoản dự phòng liên quan tới hàng tồn kho, đồng thời số ngày tồn kho bình quân cũng thấp hơn tương đối so với trung bình các năm trước đó.
DSC cho rằng khả năng quản lý hàng tồn kho cũng như giá vốn của Petrolimex sẽ tiếp tục phát huy trong 6 tháng cuối năm nhờ các điểm mới trong Nghị định kinh doanh xăng dầu, cũng như giá xăng dầu thế giới sẽ tiếp tục ổn định. CTCK này cũng đánh giá cao việc Petrolimex tương đối linh hoạt trong khả năng tìm kiếm các nguồn cung thay thế.
Bên cạnh đó, Dự thảo sửa đổi Nghị định 95/NĐ-P và Nghị định 83/NĐ-P lần 2 được Bộ Công Thương trình lên Chính Phủ vào tháng 7 tiếp tục tập trung vào hỗ trợ hoạt động kinh doanh xăng dầu tại khu vực hạ nguồn. Các nghị định mới dự kiến sẽ được ban hành rộng rãi vào quý 3/2024 với các điểm nhấn đáng chú ý như:
(1) Quy định 7 ngày sẽ công bố giá thế giới bình quân để đầu mối được cộng các khoản chi phí liên quan, từ đó công bố giá bán ra thị trường.
(2) Xác định chi phí vận hành và lợi nhuận trên mỗi lít xăng theo Phương pháp cố định (1800 - 2500 VND/lít tùy sản phẩm) hoặc theo Mức linh hoạt (dựa trên tỷ lệ phần trăm liên quan đến giá quốc tế).
(3) Hạn chế phân phối các khâu phân phối trung gian, tập trung vào các đầu mối lớn nhằm hạn chế chi phí phát sinh.
DSC cho rằng điểm (1) và (2) đem lại những ảnh hưởng tích cực chung cho các doanh nghiệp kinh doanh xăng dầu. Song, điểm (3) sẽ đem lại lợi thế cho các nhà phân phối lớn, đặc biệt là Petrlimex, nhờ cắt giảm các bước trung gian và các chi phí phát sinh, trong khi các nhà phân phối nhỏ sẽ gặp bất lợi do giảm khả năng thương lượng.",0.6374638942910023,0.3618978247988698,0.0006382845729846
