Thời gian,Tiêu đề,URL,Nội dung,positive,neutral,negative
2024-02-15 00:01:00,"Năm rực rỡ của cổ phiếu “họ” FPT, vẫn có một cái tên “lạc lõng”",https://cafef.vn/du-lieu/fox-1944400/nam-ruc-ro-cua-co-phieu-ho-fpt-van-co-mot-cai-ten-lac-long.chn,"Quý Mão nhìn chung là một năm không dễ dàng đối với nhà đầu tư chứng khoán tại Việt Nam dù VN-Index đã hồi về gần 1.200 điểm. Rất nhiều cổ phiếu trồi sụt thất thường, thậm chí chưa thoát khỏi vùng đáy. Trong bối cảnh đó, các cổ phiếu ""họ"" FPT trở thành điểm sáng khi FPT, FPT Retail, FPT Telecom, FPTS đều tăng mạnh, thậm chí lên đỉnh lịch sử.
FPT - tập đoàn công nghệ số 1 Việt Nam
Sau giai đoạn đi ngang tích luỹ, cổ phiếu FPT đã bất ngờ tăng tốc ngoạn mục từ đầu tháng 2 qua đó leo lên lập đỉnh lịch sử mới 104.900 đồng/cp. Vốn hóa thị trường tương ứng hơn 133.000 tỷ đồng (~5,5 tỷ USD), tăng gần 50% so với thời điểm cách đây một năm. Con số này cũng đưa FPT trở lại top 10 doanh nghiệp niêm yết giá trị nhất sàn chứng khoán sau nhiều năm vắng bóng, đồng thời củng cố vững chắc vị trí số 1 trong ngành công nghệ tại Việt Nam.
Đà tăng của FPT được hỗ trợ tích cực bởi kết quả kinh doanh khởi sắc với doanh thu và lợi nhuận liên tục tăng trưởng qua từng năm. Năm 2023, FPT ghi nhận doanh thu 52.618 tỷ đồng, lợi nhuận trước thuế 9.203 tỷ đồng, lần lượt tăng 19,6% và 20,1% so với cùng kỳ năm ngoái. Đây là mức doanh thu và lợi nhuận kỷ lục của công ty công nghệ này kể từ khi hoạt động.
Năm 2023, doanh thu mảng dịch vụ CNTT nước ngoài đạt 24.288 tỷ đồng (1 tỷ USD), tăng 28,4% svck, nhờ mức tăng trưởng mạnh mẽ đến từ thị trường Nhật Bản (+43,4%) và Châu Á-Thái Bình Dương (APAC) (+37,7%). Doanh thu ký mới của mảng CNTT nước ngoài đạt 29.777 tỷ đồng (+37,6% svck), trong đó có 37 dự án (+19,4% svck) với quy mô trên 5 triệu USD. FPT đặt mục tiêu doanh thu mảng CNTT nước ngoài đạt 5 tỷ USD vào năm 2030 (tương đương mức tăng trưởng kép 26% trong giai đoạn 2024-2030).
Trong năm 2023, FPT cũng đã quyết liệt mở rộng thị trường thông qua M&A trong năm 2023 để thúc đẩy tăng trưởng trong tương lai. FPT đã mở rộng phạm vi địa lý bằng việc mua lại 3 công ty Mỹ và 1 công ty EU trong năm 2023, nhờ đó tăng cường đáng kể khả năng công nghệ và năng lực bán hàng. Cụ thể, FPT đã công bố việc mua lại Intertec vào tháng 2, Landing AI (Mỹ) vào tháng 10, Cardinal Peak (Mỹ) vào tháng 11 và Aosis (Pháp) vào tháng 12.
FPT Telecom (FOX) – cái tên tỷ USD ngành viễn thông
Một doanh nghiệp đầu ngành khác mang ""họ"" FPT là FPT Telecom (FOX) cũng bứt phá rất mạnh trong năm vừa qua. Cổ phiếu này đã tăng hơn 60% trong năm Quý Mão và hiện đang giao dịch trên vùng đỉnh lịch sử với thị giá 61.000 đồng/cp. Vốn hóa thị trường tương ứng đạt hơn 30.000 tỷ đồng (~1,3 tỷ USD). Con số này giúp FPT Telecom giữ vững vị trí số 1 về vốn hóa trong ngành viễn thông trên sàn chứng khoán.
Tương tự như FPT, đà tăng của cổ phiếu FOX cũng được hỗ trợ bởi kết quả kinh doanh khởi sắc của FPT Telecom. Riêng trong quý 4/2023, doanh nghiệp viễn thông này ghi nhận doanh thu thuần 4.115 tỷ đồng, tăng 5% so với cùng kỳ 2022. Lợi nhuận sau thuế đạt 590 tỷ đồng, tăng gần 14% so với quý 4/2022.
Lũy kế cả năm 2023, FPT Telecom ghi nhận doanh thu thuần đạt 15.806 tỷ đồng và lợi nhuận sau thuế 2.428 tỷ đồng, lần lượt tăng 7% và 8% so với năm trước. Đây là mức lợi nhuận kỷ lục doanh nghiệp này từng đạt được trong một năm. Kết quả này đã nối dài chuỗi tăng trưởng lợi nhuận lên 6 năm liên tiếp.
FPT Retail (FRT) - kỳ vọng ""át chủ bài"" Long Châu
Cũng lập đỉnh lịch sử nhưng đà bứt phá của cổ phiếu FPT Retail (FRT) thậm chí còn gây ấn tượng hơn. Sau một năm, thị giá FRT đã tăng gấp đôi lên mức 125.000 đồng/cp, tương ứng giá trị vốn hóa hơn 17.000 tỷ đồng. Con số này gấp hơn 3 lần so với thời điểm cổ phiếu FRT mới chào sàn chứng khoán cách đây gần 6 năm.
Đáng chú ý, đà bứt phá của FRT lại diễn ra trong giai đoạn ngành bán lẻ ICT (một trong những trụ cột của FPT Retail) gặp rất nhiều khó khăn do sức mua suy yếu. Thực tế, trong năm 2023, FPT Retail đã lỗ 3/4 quý, lợi nhuận trước thuế cả năm âm 294 tỷ đồng. Đây là năm đầu tiên doanh nghiệp bán lẻ này thua lỗ kể từ khi niêm yết.
Tuy nhiên, FPT Retail vẫn đón những tín hiệu tích cực từ Long Châu, động lực tăng trưởng chính trong tương lai. Riêng quý cuối năm 2023, doanh thu chuỗi nhà thuốc này đã tăng khoảng 60% lên gần 5.000 tỷ đồng. Đây là quý đầu tiên doanh thu chuỗi dược phẩm của FPT Retail vượt chuỗi bán lẻ ICT.
Năm 2023, FPT Retail đã tiếp tục mở rộng chuỗi Long Châu với 560 cửa hàng mở mới, nâng số lượng nhà thuốc ra doanh thu lên 1.497 cửa hàng. Con số này đưa Long Châu trở thành chuỗi nhà thuốc lớn nhất Việt Nam. Doanh thu bình quân mỗi nhà thuốc trên một tháng vẫn duy trì 1,1 tỷ đồng năm 2023, các cửa hàng mới mở chỉ cần khoảng 6 tháng để đạt điểm hoà vốn.
FPTS (FTS) - cổ phiếu tăng bằng lần
Dù chưa vượt đỉnh lịch sử trong năm Quý Mão vừa qua nhưng cổ phiếu chứng khoán FPT (FPTS, mã FTS) đã gây ấn tượng rất mạnh với mức tăng đến 150%. Cổ phiếu này hiện đang dừng ở mức 48.650 đồng/cp, tương ứng vốn hóa thị trường hơn 10.400 tỷ đồng. Con số này chỉ thấp hơn khoảng 6% so với mức cao nhất mà công ty chứng khoán này từng đạt được hồi tháng 11/2021.
Giống như FRT, cổ phiếu FTS tăng mạnh trong bối cảnh tình hình kinh doanh không thật sự khởi sắc. Quý 4/2023, FPTS ghi nhận doanh thu hoạt động đạt hơn 181 tỷ đồng, giảm 17% so với cùng kỳ 2022, chủ yếu do từ doanh và môi giới kém hiệu quả. Sau khi trừ chi phí, FPTS lãi trước thuế 63,6 tỷ đồng, giảm 42% so với cùng kỳ 2022.
Dù vậy, lợi nhuận trước thuế luỹ kế cả năm vẫn tăng gần 23% so với năm 2022, đạt gần 542 tỷ đồng, tăng 23% so với năm 2022. Với kết quả đạt được, công ty chứng khoán này đã hoàn thành vượt kế hoạch lợi nhuận cả năm đề ra.
FPT Online (FOC) - cổ phiếu cùng chiều lợi nhuận
Khác biệt nhất trong ""họ"" FPT, FPT Online (FOC) lại có một năm Quý Mão đáng quên khi thị giá giảm gần 27%. Cổ phiếu này thậm chí còn có thời điểm rơi xuống vùng giá thấp nhất kể từ khi lên sàn. Vốn hóa thị trường tương ứng 1.400 tỷ đồng, nhỏ nhất trong số các doanh nghiệp ""họ"" FPT trên sàn chứng khoán.
Đà giảm của cổ phiếu FOC cũng đồng pha với lợi nhuận của FPT Online. Trong quý 4/2023, doanh nghiệp ghi nhận doanh thu thuần đạt 207 tỷ đồng, giảm nhẹ so với cùng kỳ. Trừ các chi phí, lợi nhuận sau thuế giảm gần 15% so với quý 4/2022, xuống còn 47 tỷ đồng.
Lũy kế cả năm 2023, FPT Online ghi nhận doanh thu đạt 620 tỷ đồng, giảm 20% so với năm trước. Lợi nhuận sau thuế đạt 113 tỷ đồng, giảm 54% so với thực hiện năm 2022. Đây là mức lợi nhuận mức thấp nhất của doanh nghiệp này đạt được kể từ năm 2015.",0.8452285095338222,0.15232412051969235,0.0024473822913407156
2024-02-02 00:00:00,FOX: Báo cáo quản trị công ty năm 2023,https://cafef.vn/du-lieu/fox-1939854/fox-bao-cao-quan-tri-cong-ty-nam-2023.chn,,0.005677985027432442,0.9916219711303711,0.002700066426768899
2024-01-29 00:00:00,FOX: CTCP HNT đăng ký bán 3.452.453 cổ phiếu,https://cafef.vn/du-lieu/fox-1937775/fox-ctcp-hnt-dang-ky-ban-3452453-co-phieu.chn,,0.005080149043351412,0.9467545747756958,0.048165272921323776
2024-01-29 00:00:00,FOX: Bà Chu Thị Thanh Hà-Ủy viên HĐQT đăng ký mua 3.406.094 cổ phiếu,https://cafef.vn/du-lieu/fox-1937780/fox-ba-chu-thi-thanh-hauy-vien-hdqt-dang-ky-mua-3406094-co-phieu.chn,,0.009607561863958836,0.8789671659469604,0.1114252582192421
2024-01-28 11:08:00,"Doanh nghiệp cung cấp dịch vụ không thể thiếu cho hàng chục triệu người Việt, cổ phiếu bứt phá lên đỉnh lịch sử sau khi hé lộ lợi nhuận cao kỷ lục, vốn hoá chạm ngưỡng tỷ USD",https://cafef.vn/du-lieu/fox-1937104/doanh-nghiep-cung-cap-dich-vu-khong-the-thieu-cho-hang-chuc-trieu-nguoi-viet-co-phieu-but-pha-len-dinh-lich-su-sau-khi-he-lo-loi-nhuan-cao-ky-luc-von-hoa-cham-nguong-ty-usd.chn,"Trong bối cảnh thị trường giao dịch lình xình trước kỳ nghỉ Tết, cổ phiếu FOX của Công ty Cổ phần Viễn Thông FPT (FPT Telecom) vẫn liên tục bứt phá.
Kết phiên 26/1, FOX bứt phá lên 57.000 đồng/cp, tương đương tăng xấp xỉ 11% trong vòng chưa đầy 1 tháng và chính thức thiết lập mức đỉnh lịch sử mới. Vốn hoá thị trường tương ứng vượt 28.000 tỷ đồng, tăng 2.700 tỷ đồng so với thời điểm đầu năm 2024.
Đà tăng của cổ phiếu được hỗ trợ tích cực từ kết quả kinh doanh khởi sắc. Theo báo cáo tài chính hợp nhất quý 4/2023, FPT Telecom ghi nhận doanh thu thuần 4.115 tỷ đồng, tăng 5% so với cùng kỳ năm 2022. Lợi nhuận sau thuế đạt 590 tỷ đồng, tăng gần 14% so với cùng kỳ năm ngoái.
Lũy kế cả năm 2023, FPT Telecom đạt 15.806 tỷ đồng doanh thu thuần, tăng 7% so với năm trước. Lợi nhuận sau thuế cũng tăng 8% lên 2.428 tỷ đồng. Đây cũng là kết quả tốt nhất từ trước tới nay của FPT Telecom và là năm thứ 6 liên tiếp doanh nghiệp ghi nhận lợi nhuận tăng trưởng.
Năm 2023, doanh nghiệp lên mục tiêu doanh thu là 16.730 tỷ đồng, lợi nhuận trước thuế 3.230 tỷ đồng. Như vậy, với 3.036 tỷ đồng lãi trước thuế, doanh nghiệp mới thực hiện được 94% chỉ tiêu lợi nhuận và 95% kế hoạch doanh thu năm.
Thực tế, FPT Telecom luôn được đánh giá là doanh nghiệp tăng trưởng ổn định và bền vững trong “họ” FPT. Trong 5 năm gần đây, công ty luôn duy trì doanh thu xấp xỉ trên 10.000 tỷ đồng và lợi nhuận sau thuế trên mức nghìn tỷ đồng.
Đặc biệt, FPT Telecom cũng được xem là một “đại gia” nhiều tiền trên sàn chứng khoán. Tính đến cuối năm 2023, công ty ghi nhận hơn 8.651 tỷ đồng tiền gửi có kỳ hạn tại ngân hàng, tăng gần 2.800 tỷ đồng so với cuối năm 2022.
Bên cạnh “tin vui” từ cổ phiếu thăng hoa, lợi nhuận năm 2023 lập đỉnh, cổ đông FPT Telecom còn chuẩn bị nhận “lì xì” bằng cổ tức tiền mặt. Theo đó, FPT Telecom sẽ tạm ứng cổ tức đợt 1/2023 bằng tiền với tỷ lệ 20% (sở hữu 1 cổ phiếu được nhận 2.000 đồng). Ngày giao dịch không hưởng quyền là 28/02/2024 và ngày thanh toán là 29/03/2024. Với hơn 492,5 triệu cổ phiếu đang lưu hành, ước tính FOX cần chi hơn 985 tỷ đồng cho đợt cổ tức này.
Nhìn lại lịch sử, FPT Telecom chưa năm nào quên trả cổ tức tiền mặt cho cổ đông với tỷ lệ dao động từ 20-30%/năm. Trước đó, tổng tỷ lệ cổ tức 2022 là 30% bằng tiền. Sang năm 2023, công ty dự kiến mức cổ tức không thấp hơn 20%.
FPT Telecom là thành viên thuộc Tập đoàn công nghệ hàng đầu Việt Nam FPT. Được thành lập ngày 31/01/1997, Viễn thông FPT (FPT Telecom) khởi đầu với tên gọi Trung tâm Dịch vụ Trực tuyến với 4 thành viên sáng lập cùng sản phẩm mạng Intranet đầu tiên của Việt Nam mang tên “Trí tuệ Việt Nam – TTVN”, sản phẩm được coi là đặt nền móng cho sự phát triển của Internet tại Việt Nam.
Hiện tại, FPT Telecom là một trong những nhà cung cấp dịch vụ Viễn thông và Internet hàng đầu khu vực. Sau hơn 25 năm hoạt động, FPT Telecom đã có hơn 8.900 nhân viên và hàng chục chi nhánh phủ sóng trên khắp 63 tỉnh thành trên toàn quốc.
FPT Telecom đang cung cấp dịch vụ tới hàng triệu hộ gia đình Việt và hàng chục triệu người dùng cá nhân, không chỉ Internet mà còn phát triển các dịch vụ giá trị gia tăng nhằm tạo ra hệ sinh thái công nghệ toàn diện cho khách hàng trải nghiệm.
Một số sản phẩm và dịch vụ nổi bật của công ty như cung cấp dịch vụ internet thông qua các mạng kết nối giữa khách hàng ISP; cung cấp dịch vụ viễn thông qua các kết nối viễn thông hiện có như VOIP (điện thoại internet); hoạt động của các điều truy cập internet Internet băng thông rộng: ADSL/VDSL, TripplePlay, FTTH; truyền hình trực tuyến OneTV, giám sát từ xa IP Camera, điện toán đám mây.
Bên cạnh đó, FOX có nhiều dịch vụ trực tuyến như: Online media, FPT Play, FShare, Fsend, Mix166, Startalk (nền tảng truyền hình trực tuyến đầu tiên của Việt Nam).",0.7511994040243534,0.24840945234750453,0.0003911471867180621
2024-01-26 00:00:00,"FOX: 28.2.2024, tạm ứng cổ tức đợt 1/2023 (2.000 đ/cp)",https://cafef.vn/du-lieu/fox-1936468/fox-2822024-tam-ung-co-tuc-dot-12023-2000-dcp.chn,,0.003676704363897443,0.9928826093673706,0.003440683474764228
2024-01-18 00:00:00,FOX: Bà Đỗ Xuân Anh làm người CBTT từ 15.1.2024,https://cafef.vn/du-lieu/fox-1932600/fox-ba-do-xuan-anh-lam-nguoi-cbtt-tu-1512024.chn,,0.21484649181365967,0.007046275772154331,0.7781072854995728
2023-12-29 00:00:00,FOX: Thay đổi giấy ĐKKD do tăng VĐL,https://cafef.vn/du-lieu/fox-1922823/fox-thay-doi-giay-dkkd-do-tang-vdl.chn,,,,
2023-12-18 00:00:00,"FOX: Nghị quyết HĐQT thông qua giải thể chi nhánh Sơn La, lập các điểm giao dịch tại Sơn La",https://cafef.vn/du-lieu/fox-1916137/fox-nghi-quyet-hdqt-thong-qua-giai-the-chi-nhanh-son-la-lap-cac-diem-giao-dich-tai-son-la.chn,,,,
2023-12-15 00:00:00,"FOX: 27.12.2023, giao dịch 164.169.626 cổ phiếu ĐKGD bổ sung",https://cafef.vn/du-lieu/fox-1915040/fox-27122023-giao-dich-164169626-co-phieu-dkgd-bo-sung.chn,,,,
2023-12-12 00:00:00,FOX: ĐKGD bổ sung 164.169.626 cổ phiếu,https://cafef.vn/du-lieu/fox-1913085/fox-dkgd-bo-sung-164169626-co-phieu.chn,,,,
2023-12-05 00:00:00,FOX: Thưởng cổ phiếu (tỷ lệ 100:50),https://cafef.vn/du-lieu/fox-1909964/fox-thuong-co-phieu-ty-le-10050.chn,,,,
2023-11-28 00:00:00,FOX: UBCKNN đã nhận tài liệu kết quả tăng vốn từ nguồn VCSH,https://cafef.vn/du-lieu/fox-1900900/fox-ubcknn-da-nhan-tai-lieu-ket-qua-tang-von-tu-nguon-vcsh.chn,,,,
2023-11-28 00:00:00,FOX: Nghị quyết ĐHCĐ thường niên năm 2023,https://cafef.vn/du-lieu/fox-1900942/fox-nghi-quyet-dhcd-thuong-nien-nam-2023.chn,,,,
2023-11-17 00:00:00,FOX: Nghị quyết HĐQT thông qua đầu tư dự án TT Dữ liệu FPT Telecom HN03,https://cafef.vn/du-lieu/fox-1886341/fox-nghi-quyet-hdqt-thong-qua-dau-tu-du-an-tt-du-lieu-fpt-telecom-hn03.chn,,,,
2023-11-06 00:00:00,FOX: Số lượng cổ phiếu có quyền biểu quyết đang lưu hành là 492.509.164 cp,https://cafef.vn/du-lieu/fox-1875640/fox-so-luong-co-phieu-co-quyen-bieu-quyet-dang-luu-hanh-la-492509164-cp.chn,,,,
2023-11-01 00:00:00,FOX: Đã phát hành 164.169.626 cổ phiếu thưởng,https://cafef.vn/du-lieu/fox-1868677/fox-da-phat-hanh-164169626-co-phieu-thuong.chn,,,,
2023-10-25 16:01:00,"FPT Telecom (FOX) lãi gần 2.300 tỷ đồng sau 9 tháng, đem 50% tài sản đi gửi ngân hàng",https://cafef.vn/du-lieu/fox-1860388/fpt-telecom-fox-lai-gan-2300-ty-dong-sau-9-thang-dem-50-tai-san-di-gui-ngan-hang.chn,,,,
2023-10-13 12:16:00,"FPT Telecom chốt danh sách thưởng 164 triệu cổ phiếu, nâng vốn điều lệ lên gần 5.000 tỷ đồng",https://cafef.vn/du-lieu/fox-1843261/fpt-telecom-chot-danh-sach-thuong-164-trieu-co-phieu-nang-von-dieu-le-len-gan-5000-ty-dong.chn,,,,
2023-10-13 00:00:00,"FOX: 19.10.2023, ngày GDKHQ thưởng cổ phiếu (tỷ lệ 100:50)",https://cafef.vn/du-lieu/fox-1900909/fox-19102023-ngay-gdkhq-thuong-co-phieu-ty-le-10050.chn,,,,
2023-08-10 00:00:00,FOX: Giải trình biến động LNST trên báo cáo riêng giữa niên độ năm 2023 đã được kiểm toán so với cùng kỳ năm trước,https://cafef.vn/du-lieu/fox-1760621/fox-giai-trinh-bien-dong-lnst-tren-bao-cao-rieng-giua-nien-do-nam-2023-da-duoc-kiem-toan-so-voi-cung-ky-nam-truoc.chn,,,,
2023-08-04 00:00:00,FOX: Nghị quyết HĐQT thông qua kết quả kinh doanh quý 2/2023,https://cafef.vn/du-lieu/fox-1754136/fox-nghi-quyet-hdqt-thong-qua-ket-qua-kinh-doanh-quy-22023.chn,,,,
2023-08-02 00:00:00,FOX: Báo cáo quản trị công ty bán niên 2023,https://cafef.vn/du-lieu/fox-1757597/fox-bao-cao-quan-tri-cong-ty-ban-nien-2023.chn,,,,
2023-07-27 11:01:00,"FPT Telecom (FOX) lãi kỷ lục quý 2, tiền gửi ngân hàng hơn một vạn tỷ",https://cafef.vn/du-lieu/fox-776023/fpt-telecom-fox-lai-ky-luc-quy-2-tien-gui-ngan-hang-hon-mot-van-ty.chn,,,,
2023-07-19 00:00:00,FOX: Công bố công ty kiểm toán đã ký hợp đồng kiểm toán BCTC 2023,https://cafef.vn/du-lieu/fox-766399/fox-cong-bo-cong-ty-kiem-toan-da-ky-hop-dong-kiem-toan-bctc-2023.chn,,,,
2023-06-02 14:04:00,FOX: Nghị quyết HĐQT thông qua kết quả kinh doanh quý 1/2023,https://cafef.vn/du-lieu/fox-221576/fox-nghi-quyet-hdqt-thong-qua-ket-qua-kinh-doanh-quy-12023.chn,,,,
2023-05-30 14:53:00,"FOX: 8.6.2023, ngày GDKHQ trả cổ tức bằng tiền mặt (2.000đ/cp)",https://cafef.vn/du-lieu/fox-224132/fox-862023-ngay-gdkhq-tra-co-tuc-bang-tien-mat-2000dcp.chn,,,,
2023-05-29 10:44:00,"FOX: Thông báo về ngày đăng ký cuối cùng trả cổ tức lần 2, năm 2022",https://cafef.vn/du-lieu/fox-225362/fox-thong-bao-ve-ngay-dang-ky-cuoi-cung-tra-co-tuc-lan-2-nam-2022.chn,,,,
2023-05-27 14:11:00,Cổ đông FPT Telecom (FOX) sắp nhận về gần 700 tỷ đồng tiền cổ tức,https://cafef.vn/du-lieu/fox-225527/co-dong-fpt-telecom-fox-sap-nhan-ve-gan-700-ty-dong-tien-co-tuc.chn,,,,
2023-05-25 15:59:00,FOX: Thay đổi giấy đăng ký kinh doanh,https://cafef.vn/du-lieu/fox-226781/fox-thay-doi-giay-dang-ky-kinh-doanh.chn,,,,
2023-05-09 15:42:00,FOX: Bổ nhiệm ông Nguyễn Hoàng Linh giữ chức Tổng giám đốc từ 25/04/2023,https://cafef.vn/du-lieu/fox-237050/fox-bo-nhiem-ong-nguyen-hoang-linh-giu-chuc-tong-giam-doc-tu-25042023.chn,,,,
2023-04-27 17:11:00,FOX: Bổ nhiệm ông Hoàng Việt Anh giữ chức Chủ tịch HĐQT từ 25/04/2023,https://cafef.vn/du-lieu/fox-244163/fox-bo-nhiem-ong-hoang-viet-anh-giu-chuc-chu-tich-hdqt-tu-25042023.chn,,,,
2023-04-27 13:40:00,FPT Telecom (FOX) báo lãi kỷ lục trong quý cuối cùng ông Hoàng Nam Tiến giữ chức Chủ tịch,https://cafef.vn/du-lieu/fox-245060/fpt-telecom-fox-bao-lai-ky-luc-trong-quy-cuoi-cung-ong-hoang-nam-tien-giu-chuc-chu-tich.chn,,,,
2023-04-06 15:00:00,FOX: Tài liệu họp Đại hội đồng cổ đông,https://cafef.vn/du-lieu/fox-278732/fox-tai-lieu-hop-dai-hoi-dong-co-dong.chn,,,,
2023-04-06 15:00:00,FOX: Tài liệu họp Đại hội đồng cổ đông,https://cafef.vn/du-lieu/fox-278738/fox-tai-lieu-hop-dai-hoi-dong-co-dong.chn,,,,
2023-03-15 18:17:00,FOX: Nghị quyết HĐQT thông qua kết quả kinh doanh quý 4/2022 và cả năm 2022,https://cafef.vn/du-lieu/fox-305609/fox-nghi-quyet-hdqt-thong-qua-ket-qua-kinh-doanh-quy-42022-va-ca-nam-2022.chn,,,,
2023-03-03 15:48:00,"FOX: 27.3.2023, ngày GDKHQ Đại hội đồng cổ đông thường niên năm 2023",https://cafef.vn/du-lieu/fox-313274/fox-2732023-ngay-gdkhq-dai-hoi-dong-co-dong-thuong-nien-nam-2023.chn,,,,
2023-02-27 16:58:00,FOX: Nghị quyết HĐQT thông qua việc tổ chức ĐHĐCĐ thường niên 2023,https://cafef.vn/du-lieu/fox-316820/fox-nghi-quyet-hdqt-thong-qua-viec-to-chuc-dhdcd-thuong-nien-2023.chn,,,,
2023-01-19 16:54:00,FOX: Báo cáo quản trị công ty năm 2022,https://cafef.vn/du-lieu/fox-334403/fox-bao-cao-quan-tri-cong-ty-nam-2022.chn,,,,
2022-11-23 14:50:00,FOX: Nghị quyết HĐQT thông qua kết quả kinh doanh quý 3/2022,https://cafef.vn/du-lieu/fox-361421/fox-nghi-quyet-hdqt-thong-qua-ket-qua-kinh-doanh-quy-32022.chn,,,,
2022-11-15 14:00:00,"FOX: 5.1.2023, ngày GDKHQ trả cổ tức bằng tiền mặt (1.000đ/cp)",https://cafef.vn/du-lieu/fox-365063/fox-512023-ngay-gdkhq-tra-co-tuc-bang-tien-mat-1000dcp.chn,,,,
2022-11-11 16:51:00,FOX: Nghị quyết HĐQT v/v điều chỉnh kế hoạch tạm ứng cổ tức đợt 1 năm 2022,https://cafef.vn/du-lieu/fox-366242/fox-nghi-quyet-hdqt-vv-dieu-chinh-ke-hoach-tam-ung-co-tuc-dot-1-nam-2022.chn,,,,
2022-10-27 10:41:00,"FOX: 29.11.2022, ngày GDKHQ trả cổ tức bằng tiền mặt (1.000đ/cp)",https://cafef.vn/du-lieu/fox-374237/fox-29112022-ngay-gdkhq-tra-co-tuc-bang-tien-mat-1000dcp.chn,,,,
2022-10-25 09:53:00,FOX: Giải trình LNST hợp nhất quý 3/2022,https://cafef.vn/du-lieu/fox-375914/fox-giai-trinh-lnst-hop-nhat-quy-32022.chn,,,,
2022-10-25 09:52:00,FOX: Giải trình Báo cáo tài chính quý 3/2022 (công ty mẹ),https://cafef.vn/du-lieu/fox-375917/fox-giai-trinh-bao-cao-tai-chinh-quy-32022-cong-ty-me.chn,,,,
2022-10-25 09:19:00,FOX: Nghị quyết HĐQT thông qua việc tạm ứng cổ tức bằng tiền đợt 1/2022,https://cafef.vn/du-lieu/fox-375995/fox-nghi-quyet-hdqt-thong-qua-viec-tam-ung-co-tuc-bang-tien-dot-12022.chn,,,,
2022-10-24 19:30:00,"FPT Telecom (FOX) báo lãi quý 3 tăng trưởng 22%, vẫn còn 11.300 tỷ đồng gửi ngân hàng",https://cafef.vn/du-lieu/fox-376067/fpt-telecom-fox-bao-lai-quy-3-tang-truong-22-van-con-11300-ty-dong-gui-ngan-hang.chn,,,,
2022-10-18 15:15:00,FOX: Giải trình biến động LNST trên báo cáo hợp nhất giữa niên độ năm 2022 đã kiểm toán so với cùng kỳ năm trước,https://cafef.vn/du-lieu/fox-379859/fox-giai-trinh-bien-dong-lnst-tren-bao-cao-hop-nhat-giua-nien-do-nam-2022-da-kiem-toan-so-voi-cung-ky-nam-truoc.chn,,,,
2022-10-18 15:15:00,FOX: Giải trình biến động LNST trên báo cáo riêng giữa niên độ 2022 đã kiểm toán so với cùng kỳ năm trước,https://cafef.vn/du-lieu/fox-379862/fox-giai-trinh-bien-dong-lnst-tren-bao-cao-rieng-giua-nien-do-2022-da-kiem-toan-so-voi-cung-ky-nam-truoc.chn,,,,
2022-09-05 09:44:00,FOX: Đính chính Báo cáo quản trị công ty bán niên năm 2022,https://cafef.vn/du-lieu/fox-400175/fox-dinh-chinh-bao-cao-quan-tri-cong-ty-ban-nien-nam-2022.chn,,,,
2022-08-25 10:00:00,FOX: Báo cáo quản trị công ty bán niên 2022,https://cafef.vn/du-lieu/fox-404576/fox-bao-cao-quan-tri-cong-ty-ban-nien-2022.chn,,,,
2022-08-19 14:21:00,FOX: Nghị quyết HĐQT về hoạt động SXKD,https://cafef.vn/du-lieu/fox-407321/fox-nghi-quyet-hdqt-ve-hoat-dong-sxkd.chn,,,,
2022-08-09 17:47:00,FOX: Đính chính Báo cáo tài chính quý Q2.2022,https://cafef.vn/du-lieu/fox-412763/fox-dinh-chinh-bao-cao-tai-chinh-quy-q22022.chn,,,,
2022-07-14 17:16:00,FOX: FPT Telecom công bố thông tin hợp đồng kiểm toán 2022,https://cafef.vn/du-lieu/fox-430895/fox-fpt-telecom-cong-bo-thong-tin-hop-dong-kiem-toan-2022.chn,,,,
2022-06-01 16:33:00,FOX: Thay đổi giấy đăng ký kinh doanh,https://cafef.vn/du-lieu/fox-454751/fox-thay-doi-giay-dang-ky-kinh-doanh.chn,,,,
2022-05-23 15:48:00,FOX: Nghị quyết HĐQT v/v chấp thuận thay đổi đăng ký giao dịch cổ phiếu,https://cafef.vn/du-lieu/fox-459953/fox-nghi-quyet-hdqt-vv-chap-thuan-thay-doi-dang-ky-giao-dich-co-phieu.chn,,,,
2022-05-19 14:43:00,"FOX: 23.5.2022, ngày GDKHQ trả cổ tức bằng tiền mặt (1.000đ/cp)",https://cafef.vn/du-lieu/fox-461759/fox-2352022-ngay-gdkhq-tra-co-tuc-bang-tien-mat-1000dcp.chn,,,,
2022-05-17 11:47:00,FOX: Chấp thuận niêm yết bổ sung 30.015 cổ phiếu,https://cafef.vn/du-lieu/fox-463295/fox-chap-thuan-niem-yet-bo-sung-30015-co-phieu.chn,,,,
2022-05-01 20:20:00,FOX: Giải trình lợi nhuận Báo cáo tài chính hợp nhất quý 1/2022,https://cafef.vn/du-lieu/fox-473363/fox-giai-trinh-loi-nhuan-bao-cao-tai-chinh-hop-nhat-quy-12022.chn,,,,
2022-05-01 20:20:00,FOX: Giải trình lợi nhuận Báo cáo tài chính quý 1/2022 (công ty mẹ),https://cafef.vn/du-lieu/fox-473378/fox-giai-trinh-loi-nhuan-bao-cao-tai-chinh-quy-12022-cong-ty-me.chn,,,,
2022-04-27 09:29:00,FOX: Nghị quyết Đại hội đồng cổ đông thường niên năm 2022,https://cafef.vn/du-lieu/fox-477653/fox-nghi-quyet-dai-hoi-dong-co-dong-thuong-nien-nam-2022.chn,,,,
