Thời gian,Tiêu đề,URL,Nội dung,positive,neutral,negative
2024-06-05 00:01:00,"Cổ phiếu “họ” FPT nổi sóng: “gã khổng lồ” công nghệ 25 lần vượt đỉnh từ đầu năm, FPT Telecom tăng bằng lần sau 5 tháng, FPT Retail gần chạm ngưỡng tỷ USD vốn hóa",https://cafef.vn/du-lieu/fox-2002379/co-phieu-ho-fpt-noi-song-ga-khong-lo-cong-nghe-25-lan-vuot-dinh-tu-dau-nam-fpt-telecom-tang-bang-lan-sau-5-thang-fpt-retail-gan-cham-nguong-ty-usd-von-hoa.chn,"Trong các hệ sinh thái trên sàn chứng khoán Việt Nam, cổ phiếu ""họ"" FPT đặc biệt gây ấn tượng khi đồng loạt bứt phá mạnh. Từ đầu năm 2024 đến nay, FPT (+45%), FRT (+60%), FTS (+45%), FOX (+100%), FOC (+34%) đều đã tăng hàng chục %, thậm chí bằng lần. Đáng chú ý, FPT, FRT, FTS, FOX đều đang trên vùng đỉnh cao nhất lịch sử (tính theo giá điều chỉnh). Với riêng FPT, cổ phiếu này đã 25 lần vượt đỉnh từ đầu năm.
Cổ phiếu tăng mạnh đẩy vốn hóa thị trường các doanh nghiệp ""họ"" FPT lên cao kỷ lục. Đặc biệt, giá trị của tập đoàn công nghệ số 1 Việt Nam đã lên đến gần 176.700 tỷ đồng (7,3 tỷ USD), xếp thứ 5 trong danh sách các công ty niêm yết giá trị nhất thị trường chứng khoán Việt Nam, chỉ kém Vietcombank, BIDV, PV Gas và Hòa Phát.
Trong khi đó, vốn hóa FPT Telecom (FOX) đã vượt 49.800 tỷ đồng (2 tỷ USD). FPT Retail (FRT) cũng gần chạm ngưỡng tỷ USD vốn hoá. FPTS (FTS) hiện có vốn hoá 13.800 tỷ đồng (khoảng 500 triệu USD). Khiêm tốn nhất là FPT Online với giá trị xấp xỉ 1.700 tỷ đồng và là cái tên duy nhất trong ""họ"" FPT chưa vượt đỉnh. Điều đặc biệt là mỗi cổ phiếu trong hệ sinh thái FPT lại có những câu chuyện hấp dẫn riêng.
FPT đi lên cùng ""trend"" bán dẫn
Với vị thế là tập đoàn công nghệ số 1 Việt Nam, FPT đang đi lên mạnh mẽ cùng ""trend"" bán dẫn trên toàn cầu. Báo cáo phân tích mới đây của VNDirect cho rằng, giá cổ phiếu FPT đã tăng vọt từ khi tin tức về mối quan hệ hợp tác với NVIDIA xuất hiện, đẩy P/E lên mức 25,5x, cao nhất mọi thời đại.
Theo VNDirect, thị trường đang phản ứng tích cực với câu chuyện bán dẫn, đặc biệt là khi các cổ phiếu liên quan đến chip bán dẫn đã được định giá lại mạnh mẽ trong những năm gần đây. P/E của SOX (Chỉ số Bán dẫn Philadelphia) vượt trội so với thị trường cho thấy sự quan tâm mạnh mẽ của nhà đầu tư và niềm tin vào câu chuyện bán dẫn. P/E của NVIDIA cũng đã tăng đáng kể trong năm 2023 do niềm tin của thị trường vào triển vọng tương lai của hãng, được thúc đẩy bởi các khoản đầu tư chiến lược vào các ứng dụng hỗ trợ AI vượt xa chip bán dẫn.
""Mặc dù đóng góp trực tiếp của bán dẫn hiện tại vào kết quả tài chính của FPT có thể không đáng kể, nhưng thị trường có thể sẵn sàng trả FPT một mức giá cao hơn và chờ đợi một câu chuyện xa hơn"", báo cáo của VNDirect nhận định. Các câu chuyện liên quan đến chip bán dẫn đều khiến nhà đầu tư đánh giá công ty cao hơn.
Ngoài ra, đà tăng của FPT còn được hỗ trợ khá tích cực bởi thông tin chia cổ tức tiền mặt và phát hành tăng vốn. Theo đó, ngày 13/6 tới đây, FPT sẽ là ngày chốt danh sách cổ đông thực hiện chi trả cổ tức còn lại năm 2023 với tỷ lệ 10%. Với gần 1,27 tỷ cổ phiếu đang lưu hành, FPT dự chi khoảng 1.300 tỷ đồng cho đợt cổ tức này. Thời gian thanh toán dự kiến là 20/6, tức là chỉ 1 tuần sau khi lăn chốt.
Cùng ngày 13/6, FPT cũng sẽ chốt danh sách cổ đông thực hiện phát hành cổ phiếu để tăng vốn từ nguồn vốn chủ sở hữu. FPT sẽ phát hành thêm 190,5 triệu cổ phiếu với tỷ lệ 20:3 (cổ đông sở hữu 20 cổ phiếu sẽ nhận thêm 3 cổ phiếu mới). Nguồn vốn trích từ lợi nhuận sau thuế chưa phân phối tại ngày 31/12/2023 trên BCTC kiểm toán 2023. Sau phát hành, vốn điều lệ của FPT sẽ tăng từ 12.700 tỷ đồng lên 14.605 tỷ đồng.
FPT Telecom cùng câu chuyện phủ sóng 5G
Với vị thế top 3 trong mảng viễn thông cố định sau VNPT và Viettel, FPT Telecom đang đẩy mạnh cung cấp các dịch vụ cộng thêm như truyền hình số tương tác, dịch vụ camera, Playbox và ghi nhận lợi nhuận từ PayTV. FPT Telecom sẽ tập trung hơn vào phát triển cơ sở hạ tầng trung tâm dữ liệu để đáp ứng nhu cầu đám mây (cloud).
Các chuyên gia kỳ vọng năm 2024-2025 sẽ bắt đầu thời kỳ 5G phát triển đại trà ở Việt Nam. Trong đó 55 tỉnh thành phố đã triển khai thí điểm, giai đoạn đầu thí điểm cho các khu công nghiệp, trường học, cơ quan nhà nước, đặt mục tiêu năm 2030 tỷ lệ 100% dân số có kết nối 5G. Theo đánh giá của Chứng khoán TPS, việc triển khai 5G sẽ có tác động lớn đến ngành viễn thông.
Tốc độ cao hơn và độ trễ thấp hơn của 5G sẽ cho phép các dịch vụ và ứng dụng mới không thể thực hiện được trước đây. Điều này sẽ dẫn đến một sự thay đổi lớn trong cách thức kinh doanh của các nhà khai thác viễn thông và có thể giúp các nhà mạng di động tăng doanh thu thêm 300 triệu USD mỗi năm.
FPT Retail kỳ vọng vào ""viên ngọc"" Long Châu
Với FPT Retail, nhà đầu tư đang đặt nhiều kỳ vọng vào chuỗi nhà thuốc Long Châu khi mảng bán lẻ ICT vẫn đang hồi phục khá chậm. Theo báo cáo mới đây của MBS, triển vọng của Long Châu được đánh giá cao nhờ (1) tốc độ chi tiêu cho thuốc cao hơn so với tốc độ gia tăng thu nhập bình quân đầu người tại Việt Nam; (2) xu hướng cơ cấu già hóa dân số ngày một rõ rệt cùng với thói quen tiêu dùng cho các sản phẩm vitamin nhiều hơn thúc đẩy sự tăng trưởng của thị trường thuốc.
Tỷ trọng thuốc tại Long Châu chiếm khoảng 70-80% trong cơ cấu sản phẩm, cao hơn mức trung bình 50-60% của các chuỗi nhà thuốc hiện nay. Trong thời gian đầu của thời kỳ tăng tốc mở mới, Long Châu hướng đến chiến dịch bán thuốc theo đơn, với tiêu chí ban đầu là đủ thuốc với giá cả hợp lý, cạnh tranh.
Trong bán lẻ dược phẩm, việc quản lý hàng tồn kho và logistic là vấn đề nan giải và tốn khá nhiều chi phí của doanh nghiệp. MBS cho rằng, Long Châu có các thế mạnh về (1) công nghệ, cách thức áp dụng số hóa và AI trong việc quản lý và điều phối hàng hóa đã giúp họ luôn đảm bảo nguồn cung sản phẩm cho người tiêu dùng, (2) giá bán cạnh tranh so với các chuỗi bán lẻ dược phẩm hiện đại khác, (3) Dịch vụ tốt, thanh toán nhanh chóng, tiện lợi.
Bên cạnh đó, Long Châu đã mở rộng mạnh mẽ và cán mốc 60 trung tâm tiêm chủng sau chưa đầy một năm (tính theo số liệu tháng 5/2024). Theo MBS, thị trường này tại Việt Nam còn nhiều tiềm năng khi tỷ lệ bao phủ vaccine vẫn còn ít, các trung tâm tiêm chủng hiện đại đặc thù chưa có nhiều (dẫn đầu là VNVC với hơn 160 trung tâm).
Tuy nhiên, MBS cho rằng, bước đầu việc mở rộng lớn các trung tâm tiêm chủng sẽ khiến cho Long Châu tốn nhiều chi phí đầu vào và hoạt động chưa ghi nhận lợi nhuận. Theo kế hoạch, FPT Retail có đến 100 trung tâm tiêm chủng vaccine vào cuối năm nay. Bên cạnh đó, công ty cũng dự kiến sẽ nâng tổng số nhà thuốc của Long Châu vào cuối năm lên 1.900 cửa hàng.
FPTS tăng vốn lên trên 3.000 tỷ
Cũng giống như các công ty chứng khoán khác, tăng vốn cũng là chủ đề được quan tâm nhất đối với FPTS. Tháng 5 vừa qua, CTCK này đã hoàn tất phát hành tổng cộng 91,3 triệu cổ phiếu mới để tăng vốn từ nguồn vốn chủ sở hữu và ESOP.
Trong đó, FPTS đã phát hành 85,8 triệu cổ phiếu tăng vốn điều lệ cho cổ đông hiện hữu. Tỷ lệ phát hành là 10:4 (cổ đông sở hữu 100 cổ phiếu được nhận thêm 40 cổ phiếu mới). Nguồn vốn thực hiện từ lợi nhuận sau thuế chưa phân phối tại ngày 31/12/2023 trên báo cáo tài chính năm 2023 đã được kiểm toán.
Cổ phiếu phát hành không bị hạn chế chuyển nhượng, trừ trường hợp hưởng quyền nhận cổ phiếu từ cổ phiếu phát hành theo chương trình lựa chọn cho người lao động (ESOP) năm 2022 đang trong thời gian hạn chế chuyển nhượng.
Bên cạnh đó, FPTS cũng đã phát hành 5,5 triệu cổ phiếu ESOP năm 2024 cho cán bộ quản lý với giá phát hành bằng mệnh giá 10.000 đồng/cp. Cổ phiếu ESOP phát hành sẽ bị hạn chế chuyển nhượng trong vòng 2 năm, được giải tỏa dần theo tỷ lệ: 50% số cổ phiếu sẽ được tự do chuyển nhượng sau 1 năm từ ngày kết thúc đợt phát hành, 50% còn lại sau 2 năm kể từ ngày phát hành.
FPT Online với truyền thống cổ tức
FPT Online là công ty con của tập đoàn FPT chuyên về quảng cáo trực tuyến với nguồn thu chính đến từ khai thác quảng cáo trên báo điện tử Vnexpress. Giai đoạn từ năm 2017 đến 2022, doanh nghiệp này lãi ròng đều đặn 200-250 tỷ đồng mỗi năm trước khi bất ngờ giảm mạnh xuống chỉ còn 117 tỷ đồng vào năm ngoái.
Với tình hình kinh doanh tương đối ổn định và không có nhiều đột phá, nhà đầu tư nắm giữ cổ phiếu FOC chủ yếu trông chờ vào cổ tức. FPT Online cũng là doanh nghiệp có truyền thống chia cổ tức cao hàng năm. Từ khi lên sàn cuối 2018, năm nào cổ đông FPT Online cũng được nhận cổ tức bằng tiền, đỉnh điểm là mức 200% của năm 2020 được thanh toán vào tháng 4/2021.
Ngày 26/6 tới đây, FPT Online sẽ tổ chức Đại hội đồng cổ đông thường niên 2024. Đến thời điểm hiện tại, tài liệu họp chi tiết chưa được công bố. Mặc dù lợi nhuận năm 2023 sụt giảm mạnh nhưng cổ đông vẫn kỳ vọng doanh nghiệp sẽ tiếp tục chính sách cổ tức bằng tiền như mọi năm.
Nhìn chung, các doanh nghiệp ""họ"" FPT trên sàn chứng khoán đa phần đều hoạt động trong các lĩnh vực ""hot"" như công nghệ, viễn thông, bán lẻ, tài chính,… Với những câu chuyện riêng, hấp dẫn, các cổ phiếu nhóm này được kỳ vọng sẽ còn chinh phục những đỉnh cao mới. Dù vậy, triển vọng cần được phản ánh lên kết quả kinh doanh thực tế mới thực sự trở thành bệ phóng vững vàng.",0.5577858397614684,0.4415311936027202,0.0006829808824786589
2024-06-05 00:00:00,FOX: Nghị quyết Hội đồng quản trị Công ty cổ phần viễn thông FPT,https://cafef.vn/du-lieu/fox-2003436/fox-nghi-quyet-hoi-dong-quan-tri-cong-ty-co-phan-vien-thong-fpt.chn,,0.004305669106543064,0.9942159056663513,0.0014784246450290084
2024-06-05 00:00:00,FOX: Công văn đính chính v/v bổ sung nội dung Nghị Quyết ĐHĐCĐ thường niên 2024,https://cafef.vn/du-lieu/fox-2003467/fox-cong-van-dinh-chinh-vv-bo-sung-noi-dung-nghi-quyet-dhdcd-thuong-nien-2024.chn,,0.08115091174840927,0.91680508852005,0.0020440237130969763
2024-06-03 15:42:00,"Thêm một công ty công nghệ Việt lập kỷ lục vốn hóa mới, cổ phiếu tăng 70% chỉ sau gần hai tháng",https://cafef.vn/du-lieu/fox-2001556/them-mot-cong-ty-cong-nghe-viet-lap-ky-luc-von-hoa-moi-co-phieu-tang-70-chi-sau-gan-hai-thang.chn,"Cổ phiếu FOX của FPT Telecom vừa tiếp tục ghi nhận sư thăng hoa kể từ đầu năm cho tới nay. Cụ thể, kết thúc phiên giao dịch đầu tiên của tháng 6 cổ phiếu này đã kịch trần trên sàn UPCoM lên mức 92.500 đồng/cp. Đây cũng là cột mốc kỷ lục mới của FOX.
Nhìn xa hơn, kể từ đầu năm thị giá của FOX cũng đã tăng 83%. Tuy nhiên, đà tăng ""chóng mặt"" của cổ phiếu này diễn ra kể từ thời điểm cuối tháng 4 vớ mức tăng được ghi nhận là gần 70%. Với mức giá hiện tại, vốn hóa của FPT Telecom đạt 45.555 tỷ đồng, tăng gần 21.000 tỷ đồng trong 6 tháng qua.
Đà tăng tích cực của cổ phiếu này đến từ những kỳ vọng của nhà đầu tư vào các doanh nghiệp công nghệ tại Việt Nam. Khi cả thế giới đang trong một cuộc chạy đua về công nghệ, AI hay bán dẫn thì các doanh nghiệp trong ngành sẽ được hưởng lợi rất nhiều.
Bên cạnh yếu tố thuận lợi của ngành, bản thân FPT Telecom cũng đang ghi nhận những điểm tích cực đến từ hoạt động kinh doanh. FPT Telecom là thành viên thuộc Tập đoàn FPT, cung cấp dịch vụ Viễn thông và Internet, truyền hình trực tuyến, điện toán đám mây... Bên cạnh đó, công ty có nhiều dịch vụ trực tuyến như: Online media, FPT Play, FShare, Fsend, Mix166, Startalk.
Theo BCTC hợp nhất quý 1/2024, FPT Telecom ghi nhận doanh thu thuần 4.012 tỷ đồng, tăng 6% so với cùng kỳ năm 2022. Lợi nhuận sau thuế cổ đông công ty mẹ đạt 653 tỷ đồng, tăng gần 12,7% so với cùng kỳ năm ngoái.
Đây cũng là mức lợi nhuận kỷ lục mà doanh nghiệp này từng đạt được. Qua từng quý, công ty vẫn đang duy trì sự tăng trưởng đều đặn 2 chữ số so với cùng kỳ năm trước.
Thực tế, FPT Telecom luôn được đánh giá là doanh nghiệp tăng trưởng ổn định và bền vững trong “họ” FPT. Trong 5 năm gần đây, công ty luôn duy trì doanh thu xấp xỉ trên 10.000 tỷ đồng và lợi nhuận sau thuế trên mức nghìn tỷ đồng. Tuy nhiên, không dậm chân tại chỗ mà lợi nhuận của công ty vẫn tăng trưởng đều đặn.
Năm 2024, FPT Telecom đặt mục tiêu kinh doanh với doanh thu 17.600 tỷ đồng, lợi nhuận trước thuế 3.510 tỷ đồng, lần lượt tăng 11,4% và 15,4% so với thực hiện năm trước.
Đặc biệt, FPT Telecom cũng được xem là một “đại gia” nhiều tiền trên sàn chứng khoán. Tại thời điểm cuối quý 1/2024, công ty ghi nhận gần 10.400 tỷ đồng tiền gửi có kỳ hạn tại ngân hàng, tăng hơn 1.300 tỷ đồng chỉ sau 3 tháng.
Ngoài ra, doanh nghiệp này còn là một công ty thường xuyên chia cổ tức bằng tiền mặt, dao động quanh mức 20-30%/năm. ﻿Trước đó, tổng tỷ lệ cổ tức 2022 là 30% bằng tiền. Sang năm 2023, công ty dự kiến mức cổ tức không thấp hơn 20%.
Về tiềm năng trong tương lai của nóm cổ phiếu công nghệ tại Việt Nam, Chứng khoán KBSV dẫn dự báo của Gartner cho thấy, chi tiêu cho lĩnh vực công nghệ thông tin trong năm 2024 trên thế giới sẽ tăng trưởng ổn định ở mức 8%, đạt 5.100 tỷ USD nhờ kỳ vọng đầu tư vào Cloud, bảo mật thông tin, AI và tự động hoá. Lĩnh vực phần mềm và dịch vụ công nghệ thông tin được cho là sẽ tăng trưởng lần lượt 13,8% và 10,4%.
Công ty chứng khoán này cũng cho rằng, tiềm năng tăng trưởng của Trung tâm dữ liệu và Cloud ở Việt Nam là lớn nhờ dư địa nhiều cho phát triển. Báo cáo của Savills Châu Á Thái Bình Dương cho thấy Indonesia, Malaysia, Thái Lan và Việt Nam có ít trung tâm dữ liệu hơn Hong Kong và Singapore, mặc dù có dân số gấp hơn 30 lần. Chính phủ cũng đặt mục tiêu Việt Nam trở thành trung tâm kỹ thuật số quan trọng.
Về dài hạn, KBSV cho rằng chi tiêu cho lĩnh vực công nghệ thông tin sẽ tiếp tục tăng trưởng do sự phát triển nhanh của công nghệ, đòi hỏi các doanh nghiệp, tổ chức phải mạnh tay đầu tư để cạnh tranh, thích nghi với xu thế tất yếu; thói quen của người tiêu dùng dần thay đổi, phụ thuộc vào các sản phẩm công nghệ thông tin; Chính phủ các nước ưu tiên phát triển công nghệ để bắt kịp sự thay đổi của thế giới. Với triển vọng vững chắc về nhu cầu, nhóm phân tích của KBSV dự báo các công ty công nghệ vẫn sẽ duy trì được đà tăng trưởng kết quả kinh doanh hai chữ số.
Theo thông tin từ Bộ Kế hoạch và Đầu tư, hiện đang có 14 dự án FDI đầu tư trong các lĩnh vực như công nghiệp bán dẫn, công nghệ tương lai, hỗ trợ đào tạo nguồn nhân lực chất lượng cao, dự án hợp tác Mỹ - Hàn Quốc - Việt Nam về khai thác, chế biến đất hiếm đang được thương thảo, trong đó một số dự án được thực hiện trong năm 2024.",0.8969787245928162,0.10240529684025407,0.0006159808130079366
2024-05-27 00:00:00,FOX: Nghị quyết Hội đồng quản trị Công ty cổ phần viễn thông FPT,https://cafef.vn/du-lieu/fox-1998530/fox-nghi-quyet-hoi-dong-quan-tri-cong-ty-co-phan-vien-thong-fpt.chn,,0.004305669106543064,0.9942159056663513,0.0014784246450290084
2024-05-24 15:49:00,"Khi nhà đầu tư 'chốt lời' cổ phiếu công nghệ: Viettel Global trả lại vị trí công ty giá trị thứ 2 sàn chứng khoán cho BIDV, FPT khớp lệnh kỷ lục, khối ngoại bán ròng 350 tỷ",https://cafef.vn/du-lieu/fox-1997303/khi-nha-dau-tu-chot-loi-co-phieu-cong-nghe-viettel-global-tra-lai-vi-tri-cong-ty-gia-tri-thu-2-san-chung-khoan-cho-bidv-fpt-khop-lenh-ky-luc-khoi-ngoai-ban-rong-350-ty.chn,"Kết thúc ngày 24/5, thị trường chứng khoán chứng kiến sự ""lao dốc: khi VN-Index giảm gần 20 điểm về mức 1.261,93 điểm. Thanh khoản thị trường ở mức cao, đạt 35.530 tỷ đồng. Trong đà giảm kể trên, các cổ phiếu công nghệ đã bị bán mạnh.
Cụ thể, cổ phiếu FPT đã giảm hơn 4% về mức giá 131.900 đồng/cp. Thanh khoản cổ phiếu này còn đặc biệt sôi động với hơn 13 triệu cổ phiếu được khớp lệnh, kỷ lục trong lịch sử niêm yết gần 18 năm. Giá trị giao dịch tương ứng gần 1.800 tỷ đồng, cao nhất sàn chứng khoán phiên 24/5. Khối ngoại cũng xả mạnh FPT với khối lượng bán ròng gần 2,7 triệu đơn vị, tương ứng giá trị xấp xỉ 350 tỷ đồng.
Một cổ phiếu khác trong nhóm công nghệ là VGI của Viettel Global cũng giảm 6,19% còn 86.300 đồng/cp. Thị giá của VGI đã tăng ""chóng mặt"" kể từ đầu năm, giúp vốn hóa của công ty này có lúc đã vượt mốc 11 tỷ USD, xếp thứ 2 trên thị trường chứng khoán. Tuy nhiên, sau phiên 24/5 Viettel Glbal đã phải trả lại vị trí này cho BIDV.
Ngoài 2 cái tên kể trên, một loạt những cổ phiếu trong nhóm công nghệ thông tin khác cũng giảm trong phiên 24/5. Ví dụ như CMG (giảm 6,2%), ELC (giảm 4%), VNZ (giảm 0,4%), SGT (giảm 3,7%)... Chỉ mỗi cổ phiếu FOX của FPT Telecom vẫn duy trì đà thăng hoa khi tăng 2,32% lên mức giá 79.400 đồng/cp.
Các cổ phiếu ngành công nghệ thông tin thăng hoa trong quãng đầu năm nhờ vào việc kết quả kinh doanh tăng trưởng mạnh. Thậm chí, một số doanh nghiệp còn lập kỷ lục lợi nhuận mới.
Sự thăng hoa của nhóm công nghệ nằm trong bối cảnh ngành này được xác định là động lực tăng trưởng kinh tế và đang thu hút nhiều ""đại bàng"" quốc tế.
Theo thông tin từ Bộ Kế hoạch và Đầu tư, hiện đang có 14 dự án FDI đầu tư trong các lĩnh vực như công nghiệp bán dẫn, công nghệ tương lai, hỗ trợ đào tạo nguồn nhân lực chất lượng cao, dự án hợp tác Mỹ - Hàn Quốc - Việt Nam về khai thác, chế biến đất hiếm đang được thương thảo, trong đó một số dự án được thực hiện trong năm 2024.
Chứng khoán KBSV dẫn dự báo của Gartner cho thấy, chi tiêu cho lĩnh vực công nghệ thông tin trong năm 2024 trên thế giới sẽ tăng trưởng ổn định ở mức 8%, đạt 5.100 tỷ USD nhờ kỳ vọng đầu tư vào Cloud, bảo mật thông tin, AI và tự động hoá. Lĩnh vực phần mềm và dịch vụ công nghệ thông tin được cho là sẽ tăng trưởng lần lượt 13,8% và 10,4%.
Công ty chứng khoán này cũng cho rằng, tiềm năng tăng trưởng của Trung tâm dữ liệu và Cloud ở Việt Nam là lớn nhờ dư địa nhiều cho phát triển. Báo cáo của Savills Châu Á Thái Bình Dương cho thấy Indonesia, Malaysia, Thái Lan và Việt Nam có ít trung tâm dữ liệu hơn Hong Kong và Singapore, mặc dù có dân số gấp hơn 30 lần. Chính phủ cũng đặt mục tiêu Việt Nam trở thành trung tâm kỹ thuật số quan trọng.
Về dài hạn, KBSV cho rằng chi tiêu cho lĩnh vực công nghệ thông tin sẽ tiếp tục tăng trưởng do sự phát triển nhanh của công nghệ, đòi hỏi các doanh nghiệp, tổ chức phải mạnh tay đầu tư để cạnh tranh, thích nghi với xu thế tất yếu; thói quen của người tiêu dùng dần thay đổi, phụ thuộc vào các sản phẩm công nghệ thông tin; Chính phủ các nước ưu tiên phát triển công nghệ để bắt kịp sự thay đổi của thế giới. Với triển vọng vững chắc về nhu cầu, nhóm phân tích của KBSV dự báo các công ty công nghệ vẫn sẽ duy trì được đà tăng trưởng kết quả kinh doanh hai chữ số.
Tuy nhiên, sự kiện có nhiều ảnh hưởng nhất có thể kể đến việc CEO Jensen Huang của tập đoàn Nvidia - gã khổng lồ sản xuất chip trị giá 2.000 tỷ USD đến thăm Việt Nam vào cuối năm 2023. Tại Việt Nam, vị CEO này mong muốn thiết lập một trung tâm, cứ điểm tại Việt Nam để thu hút nhân tài trên khắp thế giới, qua đó góp phần phát triển hệ sinh thái bán dẫn và trí tuệ nhân tạo, thúc đẩy các công ty khởi nghiệp, thiết kế, phát triển các siêu máy tính, sản xuất các phần mềm của tương lai…, góp phần vào tương lai số hóa của Việt Nam.
Ngay lập tức, những công ty như FPT hay VNG trong thời gian gần đây đã liên tiếp công bố những thỏa thuận với Nvidia trong mảng AI hay Cloud với những hợp đồng trị giá trăm triệu USD. Không chỉ là những lời hứa xuông mà các công ty công nghệ Việt Nam đã có thể hợp tác với Nvidia.
Ngoài ra, CMC Corp đã công bố kế hoạch đầu tư 1.000 GPU NVIDIA GH 200 trị giá 250 triệu USD trong giai đoạn 2024-25, góp phần thúc đẩy phát triển mạnh các ứng dụng và giải pháp tiên tiến, tập trung hệ sinh thái sản phẩm công nghệ tương tác ở 6 lĩnh vực chính, gồm: Thiết kế chip, AI, Dữ liệu lớn (Bigdata), Dữ liệu mạng xã hội (Social data), Internet vạn vật – Thiết bị thông minh – Xử lý ảnh (IoT) và Công nghệ chuỗi khối/An toàn thông tin (Blockchain)…",0.7728195589287836,0.1517731743205709,0.07540729195315238
