Thời gian,Tiêu đề,URL,Nội dung,positive,neutral,negative
2024-10-08 00:00:00,PVD: Nghị quyết HĐQT số 02 và 03 ngày 08/10/2024,https://cafef.vn/du-lieu/pvd-2065793/pvd-nghi-quyet-hdqt-so-02-va-03-ngay-08102024.chn,,0.020375525578856468,0.9790149331092834,0.0006095964345149696
2024-10-08 00:00:00,PVD: Nghị quyết HĐQT số 02/10/2024 và số 03/10/2024 về việc chấp thuận giao dịch các bên liên quan,https://cafef.vn/du-lieu/pvd-2065796/pvd-nghi-quyet-hdqt-so-02102024-va-so-03102024-ve-viec-chap-thuan-giao-dich-cac-ben-lien-quan.chn,,0.0006972533301450312,0.9987298846244812,0.0005728701362386346
2024-10-03 00:00:00,PVD: Báo cáo về ngày trở thành cổ đông lớn của nhóm nhà đầu tư nước ngoài,https://cafef.vn/du-lieu/pvd-2063618/pvd-bao-cao-ve-ngay-tro-thanh-co-dong-lon-cua-nhom-nha-dau-tu-nuoc-ngoai.chn,,0.30579590797424316,0.499602347612381,0.19460175931453705
2024-10-01 00:00:00,PVD: Nghị quyết HĐQT về việc hổ trợ tài chính Công ty con,https://cafef.vn/du-lieu/pvd-2062306/pvd-nghi-quyet-hdqt-ve-viec-ho-tro-tai-chinh-cong-ty-con.chn,,0.015805473551154137,0.9683799743652344,0.01581457257270813
2024-09-27 00:00:00,PVD: Quyết định của HĐQT về việc chấm dứt hoạt động của Chi nhánh - Xí nghiệp Dịch vụ Đầu tư Khoan Dầu khí (PVD Invest),https://cafef.vn/du-lieu/pvd-2060334/pvd-quyet-dinh-cua-hdqt-ve-viec-cham-dut-hoat-dong-cua-chi-nhanh-xi-nghiep-dich-vu-dau-tu-khoan-dau-khi-pvd-invest.chn,,0.0008027779404073954,0.9915027618408203,0.0076944222673773766
2024-09-26 00:00:00,PVD: Báo cáo thay đổi về sở hữu của nhóm nhà đầu tư nước ngoài có liên quan là cổ đông lớn,https://cafef.vn/du-lieu/pvd-2061416/pvd-bao-cao-thay-doi-ve-so-huu-cua-nhom-nha-dau-tu-nuoc-ngoai-co-lien-quan-la-co-dong-lon.chn,,0.009911026805639267,0.019148483872413635,0.9709404706954956
2024-09-24 00:00:00,PVD: Báo cáo kết quả giao dịch cổ phiếu của nhóm cổ đông (trở thành cổ đông lớn),https://cafef.vn/du-lieu/pvd-2058991/pvd-bao-cao-ket-qua-giao-dich-co-phieu-cua-nhom-co-dong-tro-thanh-co-dong-lon.chn,,0.005613372661173344,0.9862262606620789,0.0081603629514575
2024-09-19 00:00:00,PVD: Nghị quyết HĐQT về việc chấp thuận giao dịch các bên liên quan,https://cafef.vn/du-lieu/pvd-2056545/pvd-nghi-quyet-hdqt-ve-viec-chap-thuan-giao-dich-cac-ben-lien-quan.chn,,0.0035899628419429064,0.995518684387207,0.0008913747151382267
2024-09-18 00:00:00,PVD: Nghị quyết HĐQT về việc chấp thuận Phụ lục số 01 cho gói dịch vụ số 4 của Hợp đồng số PVEPPOC-DRL-2024-039,https://cafef.vn/du-lieu/pvd-2055581/pvd-nghi-quyet-hdqt-ve-viec-chap-thuan-phu-luc-so-01-cho-goi-dich-vu-so-4-cua-hop-dong-so-pveppocdrl2024039.chn,,0.0006390858325175941,0.998638927936554,0.0007220075931400061
2024-09-16 00:00:00,PVD: Nghị quyết HĐQT số 01/09 và 02/09 ngày 06/09/2024,https://cafef.vn/du-lieu/pvd-2056502/pvd-nghi-quyet-hdqt-so-0109-va-0209-ngay-06092024.chn,,0.0021240245550870895,0.9971631169319153,0.0007128887227736413
2024-09-12 00:00:00,PVD: Nghị quyết HĐQT về việc chấp thuận các Phụ lục hợp đống dịch vụ cho thuê lại lao động với PVD Training,https://cafef.vn/du-lieu/pvd-2053206/pvd-nghi-quyet-hdqt-ve-viec-chap-thuan-cac-phu-luc-hop-dong-dich-vu-cho-thue-lai-lao-dong-voi-pvd-training.chn,,0.0006966034998185933,0.9981117248535156,0.0011916959192603827
2024-08-30 00:00:00,PVD: Giải trình BCTC Hợp nhất và Công ty mẹ soát xét bán niên năm 2024,https://cafef.vn/du-lieu/pvd-2048053/pvd-giai-trinh-bctc-hop-nhat-va-cong-ty-me-soat-xet-ban-nien-nam-2024.chn,,0.03288893774151802,0.5589637160301208,0.40814733505249023
2024-08-09 00:00:00,PVD: Nghị quyết HĐQT về việc chấp thuận giao dịch với các bên có liên quan,https://cafef.vn/du-lieu/pvd-2037225/pvd-nghi-quyet-hdqt-ve-viec-chap-thuan-giao-dich-voi-cac-ben-co-lien-quan.chn,,0.006519353482872248,0.9924870729446411,0.0009935462148860097
2024-08-06 00:00:00,PVD: Nghị quyết HĐQT về việc chấp thuận giao dịch với các bên có liên quan,https://cafef.vn/du-lieu/pvd-2034665/pvd-nghi-quyet-hdqt-ve-viec-chap-thuan-giao-dich-voi-cac-ben-co-lien-quan.chn,,0.006519353482872248,0.9924870729446411,0.0009935462148860097
2024-07-30 00:00:00,PVD: Giải trình chênh lệch lợi nhuận sau thuế quý 2/2024 so với quý 2/2023,https://cafef.vn/du-lieu/pvd-2032845/pvd-giai-trinh-chenh-lech-loi-nhuan-sau-thue-quy-22024-so-voi-quy-22023.chn,,0.003312909509986639,0.9608848094940186,0.035802293568849564
2024-07-30 00:00:00,PVD: Báo cáo tình hình quản trị công ty 6 tháng đầu năm 2024,https://cafef.vn/du-lieu/pvd-2063234/pvd-bao-cao-tinh-hinh-quan-tri-cong-ty-6-thang-dau-nam-2024.chn,,0.02280447445809841,0.916550874710083,0.06064467504620552
2024-07-26 00:00:00,PVD: Nghị quyết HĐQT thông qua giao dịch với bên có liên quan,https://cafef.vn/du-lieu/pvd-2029993/pvd-nghi-quyet-hdqt-thong-qua-giao-dich-voi-ben-co-lien-quan.chn,,0.0011508503230288625,0.9972178936004639,0.001631291932426393
2024-07-18 00:00:00,PVD: Nghị quyết HĐQT chấp thuận hợp đồng dịch vụ cung cấp dịch vụ hành chính văn phòng tổng hợp,https://cafef.vn/du-lieu/pvd-2025704/pvd-nghi-quyet-hdqt-chap-thuan-hop-dong-dich-vu-cung-cap-dich-vu-hanh-chinh-van-phong-tong-hop.chn,,0.039576251059770584,0.9586011171340942,0.001822659745812416
2024-07-12 00:00:00,PVD: Thông báo ký kết hợp đồng kiểm toán BCTC 2024,https://cafef.vn/du-lieu/pvd-2023169/pvd-thong-bao-ky-ket-hop-dong-kiem-toan-bctc-2024.chn,,0.0014548426261171699,0.9979811310768127,0.0005640069139190018
2024-07-09 00:00:00,PVD: Nghị quyết HĐQT chấp thuận các thỏa thuận chuyển giao một phần Hợp đồng PVEPPOC-DRL-2024-039 và các thỏa thuận bổ sung có liên quan,https://cafef.vn/du-lieu/pvd-2020635/pvd-nghi-quyet-hdqt-chap-thuan-cac-thoa-thuan-chuyen-giao-mot-phan-hop-dong-pveppocdrl2024039-va-cac-thoa-thuan-bo-sung-co-lien-quan.chn,,0.0016540766227990389,0.9978470802307129,0.0004988583386875689
2024-07-02 00:00:00,PVD: Nhắc nhở chậm công bố thông tin thay đổi nhân sự và bổ sung thông tin NNB,https://cafef.vn/du-lieu/pvd-2017164/pvd-nhac-nho-cham-cong-bo-thong-tin-thay-doi-nhan-su-va-bo-sung-thong-tin-nnb.chn,,0.04045533388853073,0.0016785975312814116,0.9578660726547241
2024-07-01 00:00:00,PVD: Ông Lương Thanh Tịnh thôi giữ chức Trưởng BKS từ 24.4.2024,https://cafef.vn/du-lieu/pvd-2019504/pvd-ong-luong-thanh-tinh-thoi-giu-chuc-truong-bks-tu-2442024.chn,,0.013808049261569977,0.003008136060088873,0.9831838011741638
2024-06-25 00:00:00,PVD: Nghị quyết HĐQT về việc lựa chọn đơn vị kiểm toán cho năm 2024,https://cafef.vn/du-lieu/pvd-2013277/pvd-nghi-quyet-hdqt-ve-viec-lua-chon-don-vi-kiem-toan-cho-nam-2024.chn,,0.0029399977065622807,0.9956191182136536,0.0014408723218366504
2024-06-25 00:00:00,PVD: Thông báo thay đổi nhân sự công ty,https://cafef.vn/du-lieu/pvd-2014175/pvd-thong-bao-thay-doi-nhan-su-cong-ty.chn,,0.9818159341812134,0.006243107840418816,0.01194093469530344
2024-06-21 00:00:00,PVD: Nghị quyết HĐQT về việc chấp thuận bảo lãnh HMTD ngắn hạn cho PVD Tubulars,https://cafef.vn/du-lieu/pvd-2011503/pvd-nghi-quyet-hdqt-ve-viec-chap-thuan-bao-lanh-hmtd-ngan-han-cho-pvd-tubulars.chn,,0.02540438249707222,0.923393189907074,0.051202449947595596
2024-06-18 00:00:00,PVD: Nghị quyết HĐQT thông qua giao dịch với bên có liên quan,https://cafef.vn/du-lieu/pvd-2009871/pvd-nghi-quyet-hdqt-thong-qua-giao-dich-voi-ben-co-lien-quan.chn,,0.0011508503230288625,0.9972178936004639,0.001631291932426393
2024-06-18 00:00:00,PVD: Bổ nhiệm ông Nguyễn Đình Dương giữ chức Phó Tổng giám đốc từ 17.6.2024,https://cafef.vn/du-lieu/pvd-2010069/pvd-bo-nhiem-ong-nguyen-dinh-duong-giu-chuc-pho-tong-giam-doc-tu-1762024.chn,,0.08886910229921341,0.26101621985435486,0.6501147150993347
2024-06-13 00:00:00,PVD: Nghị quyết HĐQT về việc chấp thuận Hợp đồng số PVEPPOC-DRL-2024-039,https://cafef.vn/du-lieu/pvd-2007504/pvd-nghi-quyet-hdqt-ve-viec-chap-thuan-hop-dong-so-pveppocdrl2024039.chn,,0.0025191721506416798,0.9965638518333435,0.000916978984605521
2024-06-04 00:00:00,PVD: Nghị quyết HĐQT số 01 và 02 ngày 04/06/2024,https://cafef.vn/du-lieu/pvd-2002623/pvd-nghi-quyet-hdqt-so-01-va-02-ngay-04062024.chn,,0.0017658822471275926,0.9977578520774841,0.0004762467578984797
2024-05-23 00:00:00,PVD: Nghị quyết HĐQT chấp thuận sửa đổi số 01 hợp đồng số PQ-CTR-DEW-2020-106C và các thỏa thuận chuyển giao hợp đồng số PVEP POC-DEV3-PRJ-2022-002A,https://cafef.vn/du-lieu/pvd-1996821/pvd-nghi-quyet-hdqt-chap-thuan-sua-doi-so-01-hop-dong-so-pqctrdew2020106c-va-cac-thoa-thuan-chuyen-giao-hop-dong-so-pvep-pocdev3prj2022002a.chn,,0.0007507064146921039,0.998719334602356,0.0005300367483869195
2024-05-22 08:40:00,"PSI: Giá dầu năm 2024 giữ quanh mốc 85 USD/thùng, chỉ ra mức ảnh hưởng với DN trong chuỗi sản xuất, phân phối dầu khí",https://cafef.vn/du-lieu/pvd-1995766/psi-gia-dau-nam-2024-giu-quanh-moc-85-usdthung-chi-ra-muc-anh-huong-voi-dn-trong-chuoi-san-xuat-phan-phoi-dau-khi.chn,"Theo báo cáo phân tích giá dầu và ngành Dầu khí của Công ty Cổ phần Chứng khoán Dầu khí (PSI), nhu cầu dầu thô thế giới trong năm 2024 sẽ tăng nhẹ do tình hình kinh tế tại các nước phục hồi chậm, sản lượng khai thác tại các nước ngoài OPEC lại tăng nhanh hơn ước tính, qua đó giúp cho thị trường chỉ ở trạng thái thâm hụt nhẹ.
Ngoài ra, việc tồn kho dầu tại các khu vực gần mức trung bình nhiều năm, công suất dự phòng vẫn khá dồi dào cho thấy thị trường dường như không ở trong giai đoạn của một đợt tăng giá lớn và kéo dài. Trong năm 2024, PSI dự báo giá dầu bình quân cả năm sẽ neo trên mức 85 USD/thùng, mức giá này sẽ tạo điều kiện thuận lợi để thúc đẩy hoạt động E&P (Exploration & Production - thăm dò và khai thác) trên toàn thế giới khi đã vượt xa điểm hòa vốn đối với các doanh nghiệp khai thác.
Các Chuyên gia Dầu khí và PSI đánh giá, trên thị trường chứng khoán Việt Nam, cổ phiếu dầu khí rất nhạy cảm với giá dầu Brent. Sau khi tiến hành phân tích hồi quy tuyến tính giữa giá cổ phiếu dầu khí và giá dầu Brent, PSI nhận thấy giá cổ phiếu Dầu khí như: GAS, BSR, PVD, PVT, PVS,… có mức độ tương quan với giá dầu cao, biến động thuận chiều với giá dầu Brent.
Nguồn Bloomberg, PSI tổng hợp
Tuy nhiên, mỗi doanh nghiệp đều có những mảng hoạt động khác nhau (sản xuất, vận chuyển, dịch vụ, khai thác,…) và sản phẩm khác nhau (khí đốt, dầu, xăng,…). Do đó, mức độ chịu ảnh hưởng, độ trễ sẽ phụ thuộc vào vị trí của doanh nghiệp trong chuỗi sản xuất, phân phối dầu khí. Việc giá dầu thô neo cao sẽ tiếp tục thúc đẩy nhu cầu thăm dò, khai thác và vận tải dầu khí, giúp các doanh nghiệp liên quan hưởng lợi và có triển vọng tương sáng trong năm 2024.
Nguồn: PSI
Ở thượng nguồn, giá dầu neo cao thúc đẩy các hoạt động thăm dò, khai thác dầu khí; qua đó các doanh nghiệp dịch vụ dầu khí như: PVD, PVS sẽ hưởng lợi.
Cụ thể, với Tổng công ty CP Khoan và Dịch vụ Khoan Dầu khí – PV Drilling (HOSE: PVD), các giàn khoan của PVD đã ký hợp đồng năm 2024 với các đối tác trong khu vực với giá thuê giàn cao.
Các giàn I, II, III, V, VI có việc làm liên tục trong năm nay. Giàn 11 cũng đã được đối tác tại GBRS tại Algeria gia hạn hợp đồng tới giữa năm 2024. Cùng với đó, các dự án đầu tư thượng nguồn trong nước sẽ là nguồn công việc cho PVD trong trung và dài hạn; đặc biệt là việc khởi động dự án khí Lô B sẽ tác động tích cực đến ngành E&P Việt Nam và thúc đẩy kết quả kinh doanh của doanh nghiệp.
Với Tổng công ty CP Dịch vụ Kỹ thuật Dầu khí Việt Nam – PTSC (HOSE: PVS): mảng M&C tiếp tục là mảng kinh doanh chiến lược, tập trung vào các dự án EPCI ngoài khơi, EPC cho các nhà máy công nghiệp và gần đây là các tuabin gió năng lượng tái tạo. Ngoài việc nhận được FID từ Murphy Oil của Mỹ vào tháng 11/2023 cho dự án Lạc Đà Vàng, PVS còn được trao thư mời thầu có giới hạn (LLOA) cho dự án thượng nguồn khí phát điện Lô B – Ô Môn.
Bên cạnh đó, trong mảng FPSO/FSO: với kỳ vọng giá dầu cao của năm 2024, sự hồi sinh của các hoạt động kinh doanh dầu khí thượng nguồn trong nước và tỷ lệ sử dụng tàu cao, PSI nhận định mảng FPSO/FSO sẽ tiếp tục tạo ra nguồn doanh thu và lợi nhuận ổn định cho PVS.
Ở lĩnh vực trung nguồn, Tổng công ty Khí Việt Nam - PV GAS (HOSE: GAS), giá khí khô và LPG phục hồi trong năm 2024 nhờ giá dầu neo cao khi nhu cầu gia tăng và nguồn cung thắt chặt. Nhu cầu khí khô tiếp tục tăng trưởng đạt mức 2,6% trong năm 2024. Chuỗi dự án khí Lô B – Ô Môn được xúc tiến mạnh.
EVN đã trao lại dự án Nhà máy điện Ô Môn 3 và 4 cho Petrovietnam trong tháng 5/2023, gỡ bỏ một trong những nút thắt quan trọng là đảm bảo đầu ra cho nguồn khí từ Lô B.
Ở lĩnh vực hạ nguồn, biên lợi nhuận lọc dầu vẫn duy trì ở mức cao, tiếp tục tạo thuận lợi cho hoạt động của Công ty CP Lọc hóa dầu Bình Sơn (UPCoM: BSR). Bên cạnh đó, biên lợi nhuận của BSR sẽ có sự cải thiện do nhu cầu tiêu thụ nhiên liệu máy bay tăng trưởng; Crack Spread các sản phẩm dầu Diesel, nhiên liệu máy bay tại khu vực Châu Á đang ở mức cao, theo đà tăng của các loại dầu thành phẩm.
Ngoài ra, Dự án nâng cấp, mở rộng Nhà máy lọc dầu Dung Quất dự kiến sẽ hoàn thành và đưa vào vận hành trong Quý 1 năm 2028 sẽ mang lại lợi thế trong dài hạn cho BSR.",0.5963756380845671,0.4025702939992365,0.0010540797954182
2024-05-20 11:21:00,"Sở hữu 6 giàn khoan tìm kiếm các 'kho báu' nghìn tỷ, doanh nghiệp khoan lớn nhất Việt Nam trung bình mỗi ngày lãi 1,5 tỷ",https://cafef.vn/du-lieu/pvd-1994584/so-huu-6-gian-khoan-tim-kiem-cac-kho-bau-nghin-ty-doanh-nghiep-khoan-lon-nhat-viet-nam-trung-binh-moi-ngay-lai-15-ty.chn,"Ngày 17/5, Chủ tịch HĐTV Tập đoàn Dầu khí Việt Nam (Petrovietnam) Lê Mạnh Hùng chủ trì buổi làm việc về chiến lược/kế hoạch phát triển trung, dài hạn và thực hiện kế hoạch năm 2024 của Tổng công ty Cổ phần Khoan và Dịch vụ Khoan Dầu khí (PV Drilling - mã CK: PVD).
Báo cáo tại buổi họp, ông Nguyễn Xuân Cường - Tổng Giám đốc PV Drilling cho biết hiện tất cả các giàn sở hữu đã có hợp đồng dài hạn ở nước ngoài, PV Driling đang tích cực đầu tư và thuê thêm giàn khoan; song song, tăng cường quản trị doanh nghiệp, quản trị tài chính, ... Đồng thời, PV Drilling tập trung vào dịch vụ kỹ thuật cao, nâng cấp các giàn khoan để tăng tính cạnh tranh…
Về kết quả sản xuất kinh doanh 4 tháng đầu năm của PV Drilling, doanh thu ước thực hiện 2.436 tỷ đồng (tăng 20% so với KH), LNTT ước thực hiện 279 tỷ đồng (tăng 97% so với KH) và LNST ước thực hiện 190 tỷ đồng. 4 tháng đầu năm, doanh thu Công ty mẹ tăng 17% so với KH và lợi nhuận trước thuế tăng 102% so với KH. Về kế hoạch cho cả năm, PV Drilling đang kiểm soát tốt so với kế hoạch quản trị, kỳ vọng đạt doanh thu khoảng 8.005 tỷ đồng.
Đánh giá về kết quả thực hiện giai đoạn 2021 - 2025 so với kế hoạch 5 năm Tập đoàn duyệt, PV Drilling đang triển khai tốt, đảm bảo mục tiêu và tự tin hoàn thành kế hoạch 5 năm đã đề ra.
Tổng công ty cổ phần Khoan và Dịch vụ Khoan Dầu khí (PV Drilling) là đơn vị thành viên của Tập đoàn Dầu khí Việt Nam (PETROVIETNAM), được thành lập ngày 26/11/2001 trên cơ sở nhận chuyển giao các nguồn lực từ Xí nghiệp Dịch vụ Kỹ thuật Dầu khí Biển (PTSC Offshore) thuộc Công ty Dịch vụ Kỹ thuật Dầu khí (PTSC). PV Drilling hoạt động trong lĩnh vực cung cấp giàn khoan, dịch vụ kỹ thuật về khoan và giếng khoan, dịch vụ cung ứng nhân lực trong lĩnh vực khoan và giếng khoan dầu khí (ngoài khơi lẫn trên đất liền).
PV Drilling sở hữu 6 giàn khoan bao gồm 4 giàn khoan tự nâng (jack up), 1 giàn khoan tiếp trợ nửa nổi nửa chìm (TAD) và 1 giàn khoan đất liền (land rig). Công ty hiện đang nắm giữ khoảng 70% thị phần khoan tại Việt Nam. Năm 2023, PV Drilling chủ yếu hoạt động tại các thị trường nước ngoài như Algeria (giàn land rig), Thái Lan, Malaysia và Indonesia (giàn jack up), Brunei (giàn TAD).
Trên thị trường chứng khoán, kết phiên 17/5, cổ phiếu PVD có giá 32.600 đồng/cp, tăng 15% kể từ đầu năm.",0.776333237119416,0.2226003355326183,0.0010664679971669
2024-05-20 00:00:00,PVD: Báo cáo thay đổi sở hữu của nhóm NĐTNN là CĐL Trương Ngọc Phượng,https://cafef.vn/du-lieu/pvd-1995122/pvd-bao-cao-thay-doi-so-huu-cua-nhom-ndtnn-la-cdl-truong-ngoc-phuong.chn,,0.9893569350242615,0.0007511485600844026,0.009891861118376255
2024-05-15 10:21:00,"Nhóm quỹ ngoại quy mô lớn nhất Việt Nam liên tục “lướt sóng”, trở thành cổ đông lớn tại PVD",https://cafef.vn/du-lieu/pvd-1992306/nhom-quy-ngoai-quy-mo-lon-nhat-viet-nam-lien-tuc-luot-song-tro-thanh-co-dong-lon-tai-pvd.chn,"Trong thông báo mới nhất, nhóm quỹ thuộc quản lý của Dragon Capital đã báo cáo hoàn tất mua vào hơn 204 nghìn cổ phiếu PVD của Tổng CTCP Khoan và Dịch vụ khoan Dầu khí (PV Drilling).
Cụ thể, quỹ thành viên DC Developing Markets Strategies Public Limited Company mua 304.300 cổ phiếu, ngược chiều Norges Bank bán ra 100.000 đơn vị.
Sau giao dịch, sở hữu của cả nhóm quỹ Dragon Capital tăng từ 27,6 triệu cổ phiếu (tỷ lệ 4,96%) lên 27,8 triệu cổ phiếu (tỷ lệ 5%), qua đó chính thức trở lại làm cổ đông lớn tại PV Drilling. Giao dịch thực hiện trong phiên 9/5.
Tạm tính theo giá đóng cửa phiên 9/5 của cổ phiếu PVD, ước tính nhóm Dragon Capital đã bỏ ra khoảng gần 7 tỷ để mua ròng lượng cổ phiếu trên.
Dragon Capital trở lại là cổ đông lớn tại PVD trong phiên 9/5...
Đáng chú ý, ngay trong phiên trước 8/5, Dragon Capital vừa mới bán ra 1 triệu cổ phiếu PVD thông qua 2 quỹ thành viên để giảm lượng cổ phiếu sở hữu từ 28,6 triệu đơn vị (tỷ lệ 5,14%) xuống còn 27,6 triệu đơn vị (tỷ lệ 4,96%) và không còn là cổ đông lớn. Ước tính Dragon Capital thu về khoảng 32 tỷ đồng. Như vậy chỉ trong vòng 2 ngày nhóm quỹ ngoại đã liên tục ra vào cơ cấu cổ đông lớn tại doanh nghiệp dầu khí này.
... khi vừa không còn là cổ đông lớn tại PVD trong phiên 8/5 liền trước
Trên thị trường, cổ phiếu PVD ghi nhận diễn biến tích cực, chốt phiên 14/5 đạt 31.900 đồng/cp.
Về tình hình kinh doanh, quý 1/2024 PV Drilling ghi nhận doanh thu thuần 1.756 tỷ đồng, tăng 43% so với cùng kỳ năm ngoái. Kết quả, lợi nhuận sau thuế của PV Drilling xấp xỉ 149 tỷ đồng, gấp gần 3 lần so với quý 1/2023. Tuy nhiên, con số này vẫn thấp hơn đáng kể so với mức 207 tỷ đồng của quý 4 liền trước đó. Nguyên nhân chủ yếu do khoản lỗ tỷ giá 40 tỷ đồng khi USD tăng mạnh so với VND, và ghi nhận lỗ 10 tỷ đồng từ hoạt động liên doanh.
Năm 2024, PV Drilling đặt kế hoạch tổng doanh thu 6.200 tỷ đồng, tăng nhẹ so với thực hiện năm 2023 nhưng kế hoạch lợi nhuận sau thuế 380 tỷ đồng, giảm 30% so với năm 2023.﻿ Như vậy sau quý đầu năm, công ty đã hoàn thành 39% mục tiêu lợi nhuận cả năm.",0.4276944844455187,0.4009318314302313,0.1713736820208413
2024-05-14 00:00:00,PVD: Báo cáo thay đổi sở hữu của nhóm NĐTNN là CĐL Trương Ngọc Phượng,https://cafef.vn/du-lieu/pvd-1992320/pvd-bao-cao-thay-doi-so-huu-cua-nhom-ndtnn-la-cdl-truong-ngoc-phuong.chn,,0.9893569350242615,0.0007511485600844026,0.009891861118376255
2024-05-14 00:00:00,PVD: Nghị quyết HĐQT về việc chấp thuận Hợp đồng số PVN/PRO/2024/026 và hợp đồng số PO4100000184,https://cafef.vn/du-lieu/pvd-1992360/pvd-nghi-quyet-hdqt-ve-viec-chap-thuan-hop-dong-so-pvnpro2024026-va-hop-dong-so-po4100000184.chn,,0.0011914341012015939,0.9983589053153992,0.00044962644460611045
2024-05-07 00:00:00,PVD: Bổ nhiệm ông Nguyễn Văn Tứ giữ chức Trưởng tiểu ban Kiểm toán nội bộ,https://cafef.vn/du-lieu/pvd-1988882/pvd-bo-nhiem-ong-nguyen-van-tu-giu-chuc-truong-tieu-ban-kiem-toan-noi-bo.chn,,0.08592589944601059,0.3808985650539398,0.5331755876541138
2024-05-07 00:00:00,PVD: Ông Lê Hồng Phương thôi giữ chức Trưởng Tiểu ban kiểm toán nội bộ,https://cafef.vn/du-lieu/pvd-1988883/pvd-ong-le-hong-phuong-thoi-giu-chuc-truong-tieu-ban-kiem-toan-noi-bo.chn,,0.7058901190757751,0.0011414814507588744,0.2929684817790985
2024-05-04 00:00:00,PVD: Nghị quyết HĐQT về việc chấp thuận Phụ lục 04 Hợp đồng số 54/2022/HD-PVDtr/Thanh,https://cafef.vn/du-lieu/pvd-2011446/pvd-nghi-quyet-hdqt-ve-viec-chap-thuan-phu-luc-04-hop-dong-so-542022hdpvdtrthanh.chn,,0.0022663171403110027,0.996315062046051,0.0014186942717060447
2024-05-02 00:00:00,PVD: Báo cáo về ngày trở thành cổ đông lớn của nhóm nhà đầu tư nước ngoài,https://cafef.vn/du-lieu/pvd-1987923/pvd-bao-cao-ve-ngay-tro-thanh-co-dong-lon-cua-nhom-nha-dau-tu-nuoc-ngoai.chn,,0.30579590797424316,0.499602347612381,0.19460175931453705
2024-05-02 00:00:00,PVD: Giải trình BCTC quý 1/2024,https://cafef.vn/du-lieu/pvd-2021589/pvd-giai-trinh-bctc-quy-12024.chn,,0.012585616670548916,0.9846674203872681,0.002747043501585722
2024-04-25 00:00:00,PVD: Biên bản họp và Nghị quyết ĐHĐCĐ thường niên năm 2024,https://cafef.vn/du-lieu/pvd-1983124/pvd-bien-ban-hop-va-nghi-quyet-dhdcd-thuong-nien-nam-2024.chn,,0.050787102431058884,0.9479506611824036,0.0012622151989489794
2024-04-25 00:00:00,PVD: Bổ nhiệm ông Lê Hồng Phương giữ chức Trưởng BKS nhiệm kỳ 2024-2026,https://cafef.vn/du-lieu/pvd-1985470/pvd-bo-nhiem-ong-le-hong-phuong-giu-chuc-truong-bks-nhiem-ky-20242026.chn,,0.6599748134613037,0.3077405095100403,0.03228466957807541
2024-04-23 00:00:00,PVD: Bổ nhiệm lại ông Nguyễn Xuân Cường giữ chức Tổng giám đốc,https://cafef.vn/du-lieu/pvd-1995249/pvd-bo-nhiem-lai-ong-nguyen-xuan-cuong-giu-chuc-tong-giam-doc.chn,,0.18464063107967377,0.012699408456683159,0.8026598691940308
2024-04-19 00:00:00,PVD: Báo cáo về ngày không còn là cổ đông lớn của nhóm nhà ĐTNN có liên quan,https://cafef.vn/du-lieu/pvd-1980421/pvd-bao-cao-ve-ngay-khong-con-la-co-dong-lon-cua-nhom-nha-dtnn-co-lien-quan.chn,,0.011760777793824673,0.04631492495536804,0.9419243931770325
