Thời gian,Tiêu đề,URL,Nội dung,positive,neutral,negative
2025-10-23 00:00:00,PVD: Nghị quyết và Biên bản kiểm phiếu bằng hình thức lấy ý kiến cổ đông bằng văn bản,https://cafef.vn/du-lieu/PVD-2324310/pvd-nghi-quyet-va-bien-ban-kiem-phieu-bang-hinh-thuc-lay-y-kien-co-dong-bang-van-ban.chn,,0.0038437414914369583,0.9879282116889954,0.00822807289659977
2025-10-23 00:00:00,PVD: Bổ nhiệm ông Đoàn Đắc Tùng làm thành viên HĐQT từ 22.10.2025,https://cafef.vn/du-lieu/PVD-2324311/pvd-bo-nhiem-ong-doan-dac-tung-lam-thanh-vien-hdqt-tu-22102025.chn,,0.7744094729423523,0.19760489463806152,0.02798563614487648
2025-10-07 00:00:00,PVD: Nghị quyết HĐQT chấp thuận hợp đồng về cung cấp dịch vụ đào tạo với PVD Training,https://cafef.vn/du-lieu/PVD-2311848/pvd-nghi-quyet-hdqt-chap-thuan-hop-dong-ve-cung-cap-dich-vu-dao-tao-voi-pvd-training.chn,,0.02906595543026924,0.9659380912780762,0.004996021743863821
2025-09-23 00:00:00,PVD: Nghị quyết HĐQT về việc giao dịch của người có liên quan,https://cafef.vn/du-lieu/PVD-2302625/pvd-nghi-quyet-hdqt-ve-viec-giao-dich-cua-nguoi-co-lien-quan.chn,,0.003951873630285263,0.990009069442749,0.006039056461304426
2025-09-22 00:00:00,"PVD: Nghị quyết HĐQT số 01, 02 ngày 19/09/2025",https://cafef.vn/du-lieu/PVD-2301762/pvd-nghi-quyet-hdqt-so-01-02-ngay-19092025.chn,,0.0035927966237068176,0.994950532913208,0.0014566341415047646
2025-09-12 00:00:00,"PVD: 30.9.2025, ngày GDKHQ trả cổ tức năm 2024 bằng tiền mặt (500 đ/cp), lấy ý kiến cổ đông bằng văn bản lần 1 năm 2025",https://cafef.vn/du-lieu/PVD-2295324/pvd-3092025-ngay-gdkhq-tra-co-tuc-nam-2024-bang-tien-mat-500-dcp-lay-y-kien-co-dong-bang-van-ban-lan-1-nam-2025.chn,,0.003538771066814661,0.9842067956924438,0.012254410423338413
2025-09-11 10:59:00,Một doanh nghiệp dầu khí dự chi gần 300 tỷ trả cổ tức ngay trong tháng 10,https://cafef.vn/mot-doanh-nghiep-dau-khi-du-chi-gan-300-ty-tra-co-tuc-ngay-trong-thang-10-188250911105840875.chn,"Tổng Công ty Cổ phần Khoan và Dịch vụ Khoan Dầu khí (PV Drilling, mã: PVD) thông báo ngày 1/10/2025 sẽ là ngày đăng ký cuối cùng để trả cổ tức năm 2024 bằng tiền mặt và lấy ý kiến cổ đông bằng văn bản lần 1 năm 2025.
Cụ thể, PV Drilling dự kiến trả cổ tức 2024 bằng tiền mặt với tỷ lệ 5%, tương đương 500 đồng/cp, ngày thanh toán dự kiến vào 17/10 tới. Với gần 556 triệu cổ phiếu đang lưu hành, PV Drilling dự kiến chi khoảng 278 tỷ đồng để thanh toán cổ tức đợt này. Nguồn chi trả được lấy từ lợi nhuận sau thuế chưa phân phối.
Ngoài ra, PV Drilling sẽ lấy ý kiến cổ đông bằng văn bản trong tháng 10, với nội dung bao gồm miễn nhiệm và bầu bổ sung thành viên Hội đồng quản trị cùng các vấn đề khác thuộc thẩm quyền của Đại hội đồng cổ đông.
Về tình hình kinh doanh luỹ kế nửa đầu năm 2025, doanh thu thuần của PVD đạt 3.950 tỷ đồng, giảm nhẹ 2,2% so với cùng kỳ năm trước. Tuy nhiên, nhờ chi phí tài chính giảm mạnh 31,5% và thu nhập khác tăng, lợi nhuận sau thuế doanh nghiệp vẫn đạt 394 tỷ đồng, tăng 40% so với cùng kỳ.
Năm 2025, PVD đặt mục tiêu tổng doanh thu hợp nhất đạt 7.200 tỷ đồng và lợi nhuận sau thuế hợp nhất đạt 530 tỷ đồng, giảm 25% về doanh thu và giảm 24% về lợi nhuận so với thực hiện năm 2024. Như vậy, công ty đã hoàn thành 74% mục tiêu lợi nhuận năm.
Trên thị trường chứng khoán, trong bối cảnh VN-Index xuất hiện nhịp chỉnh khá mạnh phiên sáng 11/9, PVD ﻿là một trong số ít cổ phiếu giữ được ""sắc xanh"". Thị giá PVD có thời điểm bật tăng 3% lên 23.400 đồng trước khi thu hẹp về vùng 22.800 đồng/cp (tại thời điểm 10h21p sáng 11/9).",0.4180876611538893,0.579814606488328,0.0020977809252471
2025-09-09 00:00:00,PVD: Quyết định của HĐQT về việc chốt danh sách cổ đông để trả cổ tức năm 2024 và lấy ý kiến cổ đông bằng văn bản,https://cafef.vn/du-lieu/PVD-2292507/pvd-quyet-dinh-cua-hdqt-ve-viec-chot-danh-sach-co-dong-de-tra-co-tuc-nam-2024-va-lay-y-kien-co-dong-bang-van-ban.chn,,0.0025474221911281347,0.9968864321708679,0.0005661553586833179
2025-09-03 13:17:00,PVD: Giải trình biến động LNST trên BCTC quý 2/2025 so với cùng kỳ năm trước,https://cafef.vn/du-lieu/PVD-2287050/pvd-giai-trinh-bien-dong-lnst-tren-bctc-quy-22025-so-voi-cung-ky-nam-truoc.chn,,0.014509626664221287,0.5081449747085571,0.47734540700912476
2025-09-03 13:17:00,PVD: Giải trình biến động LNST trên BCTC bán niên soát xét 2025 so với cùng kỳ năm trước,https://cafef.vn/du-lieu/PVD-2287295/pvd-giai-trinh-bien-dong-lnst-tren-bctc-ban-nien-soat-xet-2025-so-voi-cung-ky-nam-truoc.chn,,0.002455739537253976,0.8966144919395447,0.10092970728874207
2025-08-29 00:00:00,PVD: Nghị quyết HĐQT về việc chấp thuận hợp đồng mua bán xăng dầu với người có liên quan,https://cafef.vn/du-lieu/PVD-2288969/pvd-nghi-quyet-hdqt-ve-viec-chap-thuan-hop-dong-mua-ban-xang-dau-voi-nguoi-co-lien-quan.chn,,0.002486261073499918,0.9968484044075012,0.0006653309101238847
2025-08-29 00:00:00,PVD: Nghị quyết HĐQT chấp thuận hợp đồng mau bán xăng dầu với người có liên quan,https://cafef.vn/du-lieu/PVD-2288976/pvd-nghi-quyet-hdqt-chap-thuan-hop-dong-mau-ban-xang-dau-voi-nguoi-co-lien-quan.chn,,0.05358118191361427,0.9369339942932129,0.009484836831688881
2025-08-21 00:00:00,PVD: Nghị quyết HĐQT về việc chấp thuận Hợp đồng thuê giàn khoan PV Drilling VIII,https://cafef.vn/du-lieu/PVD-2279882/pvd-nghi-quyet-hdqt-ve-viec-chap-thuan-hop-dong-thue-gian-khoan-pv-drilling-viii.chn,,0.0013530767755582929,0.9980751276016235,0.0005717386375181377
2025-08-12 00:00:00,PVD: Nghị quyết HĐQT về việc thay đổi mẫu con dấu tổng công ty,https://cafef.vn/du-lieu/PVD-2269630/pvd-nghi-quyet-hdqt-ve-viec-thay-doi-mau-con-dau-tong-cong-ty.chn,,0.1538556069135666,0.8170658946037292,0.02907853201031685
2025-08-12 00:00:00,"PVD: Nghị quyết HĐQT chấp thuận các hợp đồng mua sắm vật tư, thiết bị, phụ tùng và dịch vụ cho DA tái khởi động giàn khoan PV DRILLING VIII",https://cafef.vn/du-lieu/PVD-2269636/pvd-nghi-quyet-hdqt-chap-thuan-cac-hop-dong-mua-sam-vat-tu-thiet-bi-phu-tung-va-dich-vu-cho-da-tai-khoi-dong-gian-khoan-pv-drilling-viii.chn,,0.016277024522423744,0.9710788130760193,0.01264413446187973
2025-08-07 00:00:00,PVD: Nghị quyết HĐQT số 01/08/2025 ngày 06/08/2025,https://cafef.vn/du-lieu/PVD-2268570/pvd-nghi-quyet-hdqt-so-01082025-ngay-06082025.chn,,0.0010447872336953878,0.9984453320503235,0.0005098467227071524
2025-07-31 16:44:00,PVD: Bổ sung giải trình BCTC HN và Cty mẹ quý 2/2025 so với cùng kỳ năm trước,https://cafef.vn/du-lieu/PVD-2259988/pvd-bo-sung-giai-trinh-bctc-hn-va-cty-me-quy-22025-so-voi-cung-ky-nam-truoc.chn,,0.016309959813952446,0.9780644178390503,0.005625642370432615
2025-07-31 00:00:00,PVD: Báo cáo tình hình quản trị 6 tháng đầu năm 2025,https://cafef.vn/du-lieu/PVD-2294757/pvd-bao-cao-tinh-hinh-quan-tri-6-thang-dau-nam-2025.chn,,0.00916037056595087,0.9697251915931702,0.02111443318426609
2025-07-23 00:00:00,PVD: Thông báo về việc hủy ngày đăng ký cuối cùng,https://cafef.vn/du-lieu/PVD-2253448/pvd-thong-bao-ve-viec-huy-ngay-dang-ky-cuoi-cung.chn,,0.014855505898594856,0.6505676507949829,0.33457690477371216
2025-07-18 00:00:00,PVD: Tái bổ nhiệm ông Nguyễn Ngọc Trường giữ chức Kế toán trưởng kiêm Trưởng Ban Tài chính Kế toán,https://cafef.vn/du-lieu/PVD-2250861/pvd-tai-bo-nhiem-ong-nguyen-ngoc-truong-giu-chuc-ke-toan-truong-kiem-truong-ban-tai-chinh-ke-toan.chn,,0.3844996392726898,0.08106798678636551,0.5344324111938477
2025-07-18 00:00:00,PVD: Thông báo hủy chốt danh sách người sở hữu chứng khoán để lấy ý kiến cổ đông bằng văn bản,https://cafef.vn/du-lieu/PVD-2250942/pvd-thong-bao-huy-chot-danh-sach-nguoi-so-huu-chung-khoan-de-lay-y-kien-co-dong-bang-van-ban.chn,,0.004499155096709728,0.8389104008674622,0.15659047663211823
2025-07-14 00:00:00,PVD: Thông báo ký kết hợp đồng kiểm toán BCTC 2025,https://cafef.vn/du-lieu/PVD-2245561/pvd-thong-bao-ky-ket-hop-dong-kiem-toan-bctc-2025.chn,,0.001307930564507842,0.9981784820556641,0.0005136594409123063
2025-07-06 15:58:00,PV Drilling lấy ý kiến cổ đông về thay đổi nhân sự,https://cafef.vn/pv-drilling-lay-y-kien-co-dong-ve-thay-doi-nhan-su-188250706160025222.chn,"Sở Giao dịch Chứng khoán TP.HCM (HoSE) vừa có văn bản thông báo về ngày 21/7/2025 là ngày đăng ký cuối cùng để thực hiện quyền lấy ý kiến cổ đông bằng văn bản lần 1 năm 2025 của Tổng Công ty Cổ phần Khoan và Dịch vụ khoan Dầu khí (PV Drilling, MCK: PVD, sàn HoSE), ngày giao dịch không hưởng quyền 18/7/2025.
Nội dung lấy ý kiến nhằm thông qua việc miễn nhiệm Thành viên Hội đồng quản trị và bầu Thành viên Hội đồng quản trị nhiệm kỳ năm 2025 - 2030 và các vấn đề khác thuộc thẩm quyền của Đại hội đồng cổ đông. Thời gian dự kiến thực hiện lấy ý kiến cổ đông vào tháng 8/2025.
Trước đó, PV Drilling đã nhận được xin đơn từ nhiệm chức vụ Thành viên độc lập Hội đồng quản trị của ông Hoàng Xuân Quốc, thời điểm từ nhiệm kể từ ngày 1/7/2025.
Ảnh minh họa
Theo tìm hiểu, ông Quốc sinh năm 1957, trình độ chuyên môn Tiến sĩ Cơ khí năng lượng và Cử nhân Kinh tế và đã được bổ nhiệm vào vị trí Thành viên HĐQT độc lập tại PV Drilling từ ngày 4/8/2021. Ngoài ra, ông Quốc đang là Thành viên HĐQT độc lập tại Tổng Công ty cổ phần Dịch vụ Kỹ thuật Dầu khí Việt Nam (MCK: PVS, sàn HNX).
Về tình hình kinh doanh, theo báo cáo tài chính hợp nhất quý I/2025, PV Drilling ghi nhận doanh thu thuần gần 1.503 tỷ đồng, giảm 14,4% so với cùng kỳ năm ngoái. Sau khấu trừ các khoản thuế phí, doanh nghiệp báo lãi ròng 142,9 tỷ đồng, giảm 3,8%.
Năm 2025, PV Drilling lên kế hoạch kinh doanh với doanh thu hợp nhất dự kiến đạt 7.200 tỷ đồng và lợi nhuận sau thuế ước đạt 790 tỷ đồng. Như vậy, kết thúc quý đầu năm, doanh nghiệp đã thực hiện được 20,9% kế hoạch doanh thu và 18,1% kế hoạch lợi nhuận sau thuế đã đề ra.
Tính đến ngày 31/3/2025, tổng tài sản của PV Drilling giảm 382,7 tỷ đồng so với đầu năm, xuống còn gần 22.231,9 tỷ đồng. Trong đó, chiếm 54,7% tổng tài sản là tài sản cố định, ở mức 12.713,6 tỷ đồng; hàng tồn kho gần 1.147,9 tỷ đồng và tài sản dở dang dài hạn hơn 1.306,8 tỷ đồng.
Bên kia bảng cân đối kế toán, tổng nợ phải trả đang ở mức 6.978,6 tỷ đồng, giảm 7,7% so với đầu năm. Trong đó, vay và nợ thuê tài chính gần 3.028,4 tỷ đồng, chiếm 43,4% tổng nợ.",0.4482986897485435,0.507545594346604,0.0441556929156827
2025-07-04 10:09:00,"Dự án trọng điểm Lô B – Ô Môn, Sư Tử Trắng 2B…. đang tạo ra 'khối lượng công việc khổng lồ' lên đến hàng tỷ USD cho PVD, PVS",https://cafef.vn/du-an-trong-diem-lo-b-o-mon-su-tu-trang-2b-dang-tao-ra-khoi-luong-cong-viec-khong-lo-len-den-hang-ty-usd-cho-pvd-pvs-18825070410061419.chn,"Giá dầu toàn cầu tiếp tục chịu áp lực do tăng trưởng nhu cầu chậm lại trong khi nguồn cung ngày càng gia tăng. Trong báo cáo phân tích mới công bố, SSI Research cho biết giữ nguyên giả định giá dầu Brent ở mức 65 USD/thùng cho năm 2025, tương đương mức giảm 7% so với trung bình năm 2024.
Theo dự báo tháng 6 của Cơ quan Năng lượng Quốc tế (IEA), nhu cầu dầu toàn cầu dự kiến chỉ tăng khoảng 720.000 thùng/ngày trong năm 2025 – mức điều chỉnh giảm nhẹ so với các ước tính trước đó và chậm hơn đáng kể so với mức tăng gần 1 triệu thùng/ngày trong năm 2024. Dự báo này phản ánh xu hướng suy yếu chung của kinh tế toàn cầu.
Ở chiều ngược lại, nguồn cung toàn cầu được dự báo tăng khoảng 1,8 triệu thùng/ngày, chủ yếu nhờ việc nới lỏng cắt giảm sản lượng của OPEC+ và sản lượng gia tăng từ các quốc gia ngoài OPEC+, đặc biệt là Mỹ và Canada.
Hiện, căng thẳng địa chính trị, như xung đột Iran-Israel, có thể gây biến động ngắn hạn nhưng khó có tác động đáng kể đến xu hướng giá dầu trung và dài hạn.
Theo SSI Research, việc giá dầu giảm có thế ảnh hưởng đến kết quả kinh doanh của các doanh nghiệp trung nguồn, nhưng vẫn ở mức đủ hấp dẫn để duy trì các hoạt động khai thác và thăm dò ở mảng thượng nguồn.
Giá dầu Brent (USD/thùng)
Nhóm thượng nguồn hưởng lợi từ hoạt động E&P
Hoạt động thăm dò và khai thác (E&P) vẫn duy trì tích cực trong nửa đầu năm 2025 và được kỳ vọng tiếp tục đà tăng trong nửa cuối năm 2025, nhờ sự suy giảm trữ lượng tự nhiên và yêu cầu chiến lược về an ninh năng lượng quốc gia.
Theo đó, các doanh nghiệp thượng nguồn như Tổng CTCP Khoan và Dịch vụ Khoan Dầu khí (mã chứng khoán PVD) và Tổng CTCP Dịch vụ Kỹ thuật Dầu khí Việt Nam (PVS) được kỳ vọng sẽ duy trì đà tăng trưởng tích cực, nhờ vào hoạt động E&P sôi động.
Đây cũng là những doanh nghiệp hưởng lợi trực tiếp từ dự án Lô B. Một số dự án trọng điểm đang triển khai bao gồm: (1) Lô B – Ô Môn, (2) Sư Tử Trắng 2B, (3) Nam Du – U Minh. Theo SSI Research, những dự án này đang tạo ra khối lượng công việc lớn cho các nhà cung cấp dịch vụ thượng nguồn như PVS và PVD.
Trong đó, PVD được kỳ vọng sẽ duy trì tốc độ tăng trưởng lợi nhuận khoảng 14% so với cùng kỳ, nhờ tỷ lệ sử dụng giàn khoan duy trì ở mức cao và đơn giá thuê ngày đối với giàn khoan tự nâng tăng 10% so với cùng kỳ.
Còn PVS dự kiến sẽ đạt tăng trưởng lợi nhuận 25% trong năm 2025, nhờ doanh thu mạnh từ các hợp đồng EPC cho phần thượng nguồn của dự án Lô B, với giá trị hợp đồng ước tính lên tới 1 tỷ USD.
Ngoài ra, việc mở rộng công suất lọc dầu của BSR cũng là diễn biến đáng chú ý.
Sản lượng từ các bồn khí chính (triệu m3/năm)
Các nhà phân phối xăng dầu như PLX và OIL bị ảnh hưởng bởi giá dầu yếu
Ngược lại, ở nhóm trung nguồn, các doanh nghiệp như Petrolimex (mã chứng khoán PLX), PV OIL (mã chứng khoán OIL) và Lọc hoá dầu Bình Sơn (mã chứng khoán BSR) có khả năng chịu tác động rõ rệt hơn từ xu hướng giá dầu yếu, dẫn đến mức tăng trưởng lợi nhuận đi ngang hoặc âm so với năm trước.
Riêng BSR được kỳ vọng ghi nhận mức tăng trưởng lợi nhuận ấn tượng, khoảng 300% nhờ mức lợi nhuận thấp trong năm 2024 và sản lượng tiêu thụ dự kiến phục hồi 15% sau giai đoạn bảo dưỡng.
Tuy nhiên, lợi nhuận năm 2025 của BSR có thể vẫn thấp hơn 70–80% so với giai đoạn 2021–2023, do ảnh hưởng từ xu hướng giá dầu giảm.
Đối với các nhà phân phối xăng dầu như PLX và OIL, thị trường đang chờ đợi nghị định mới về kinh doanh xăng dầu. Theo dự thảo lần thứ 6 mới nhất, các doanh nghiệp đầu mối sẽ có thêm quyền tự chủ trong việc thiết lập giá bán lẻ dựa trên chi phí đầu vào, qua đó hỗ trợ ổn định biên lợi nhuận của các nhà phân phối.
Tuy nhiên, Chính phủ hiện vẫn đang lấy ý kiến các bên liên quan, do đó cần chờ thêm thời gian để có quyết định chính thức.
Một trong những vấn đề được quan tâm hiện nay liên quan đến phát triển năng lượng từ LNG. Mảng LNG đang có vai trò chiến lược ngày càng rõ nét, đặc biệt với việc triển khai các nhà máy điện khí LNG Nhơn Trạch 3 & 4. Điều này dự kiến sẽ thúc đẩy hoạt động nhập khẩu LNG.
Về phía doanh nghiệp, mặc dù có thể xuất hiện nhiều nhà cung cấp trong tương lai, PV GAS (mã chứng khoán GAS) theo SSI Research vẫn là đơn vị tiên phong và giữ vai trò chủ đạo trong trung hạn. Tuy nhiên, sản lượng LNG hiện tại vẫn chưa đủ bù đắp cho xu hướng suy giảm sản lượng khí tự nhiên nội địa, dự kiến sẽ tiếp diễn cho đến khi Lô B bắt đầu khai thác khí vào cuối năm 2027.",0.4667436100012641,0.5300062468088684,0.0032501754398543
2025-07-04 00:00:00,"PVD: 18.7.2025, ngày GDKHQ lấy ý kiến cổ đông bằng văn bản",https://cafef.vn/du-lieu/PVD-2239590/pvd-1872025-ngay-gdkhq-lay-y-kien-co-dong-bang-van-ban.chn,,0.9764111638069153,0.01112760417163372,0.012461261823773384
2025-07-03 00:00:00,PVD: Nghị quyết HĐQT về việc giao dịch của người có liên quan,https://cafef.vn/du-lieu/PVD-2237766/pvd-nghi-quyet-hdqt-ve-viec-giao-dich-cua-nguoi-co-lien-quan.chn,,0.003951873630285263,0.990009069442749,0.006039056461304426
2025-07-02 07:03:00,"Cuộc đua vốn hóa 25 năm: Một công ty thủy điện từng giữ ngôi vua trước khi những 'gã khổng lồ' FPT, Vinamilk, Vietcombank 'tràn' lên sàn",https://cafef.vn/cuoc-dua-von-hoa-25-nam-mot-cong-ty-thuy-dien-tung-giu-ngoi-vua-truoc-khi-nhung-ga-khong-lo-fpt-vinamilk-vietcombank-tran-len-san-188250702070405395.chn,"Tháng 7 năm 2025 đánh dấu một phần tư thế kỷ kể từ khi thị trường chứng khoán Việt Nam chính thức đi vào hoạt động.
Cụ thể, ngày 28/7/2000 thị trường chứng khoán Việt Nam chính thức giao dịch với chỉ 2 cổ phiếu - SAM của CTCP Đầu tư và Phát triển  Sacom (giờ đổi tên thành CTCP SAM Holdings) và REE của CTCP Cơ điện lạnh. Cho đến hết năm 2000 thị trường chứng khoán Việt Nam cũng chỉ có thêm 3 cổ phiếu khác giao dịch.
Năm 2005, Sở Giao dịch chứng khoán Hà Nội (HNX) ra đời, tiếp đó UPCoM được triển khai, mở rộng kênh giao dịch cho doanh nghiệp ngoài sàn HoSE.
Trong giai đoạn từ năm 2001 đến đầu năm 2006 này, thị trường chứng khoán Việt Nam không nhiều biến chuyển, có thêm nhiều doanh nghiệp lớn bắt đầu giao dịch như CTCP Gemadept - GMD (tháng 4/2002), CTCP Thủy điện Vĩnh Sơn - Sông Hinh - VSH (tháng 7/2005), Tập đoàn KIDO - KDC (tháng 12/2005), Sacombank - STB (tháng 7/2006)...
Vĩnh Sơn Sông Hinh (VSH) vào năm 2005 chính là doanh nghiệp lớn nhất sàn chứng khoán với vốn hóa 16.000 tỷ. Doanh nghiệp thủy điện này lên sàn vào ngày 14/7/2005 với khối lượng cổ phiếu ""khổng lồ"" khi đó là 125 triệu đơn vị. Chốt phiên giao dịch cuối năm tại giá 48.500 đồng/cp (giá chưa điều chỉnh).
Đặc biệt là vào tháng 1/2006, cổ phiếu của Vinamilk - VNM lên sàn khiến giá trị vốn hóa của của HOSE tăng gấp đôi trong ngày, nhiều năm sau đó, Vinamilk vẫn luôn nằm trong nhóm có vốn hóa cao.
Bước ngoặt quan trọng đến với thị trường chứng khoán diễn ra vào ngày 7/11/2006 khi Việt Nam chính thức gia nhập tổ chức Tổ chức Thương mại Thế giới (WTO). Sau cột mốc này, thị trường chứng khoán Việt Nam bùng nổ doanh nghiệp lên sàn niêm yết vào tháng 11 và tháng 12/2006 như ACB, SSI, PVD (PV Drilling)...
Trong đó, ngày 13/12/2006, FPT lên sàn với giá đóng cửa phiên đầu tiên lên tới 400.000 đồng/cp, trong hơn nửa tháng giao dịch, tới cuối năm 2006, FPT đã trở thành doanh nghiệp lớn nhất sàn với vốn hóa 28.000 tỷ đồng. ﻿Tại ngày 30/6, FPT là doanh nghiệp có vốn hóa lớn thứ 9 toàn thị trường với 175.000 tỷ đồng.
Top TTCK 4
Vingroup lên sàn tháng 9/2007 và đã nhanh chóng trở thành một trong những doanh nghiệp có quy mô vốn hóa lớn nhất trên thị trường. Trong giai đoạn 6 năm liền, từ 2015-2022, Vinamilk và Vingroup đã thay nhau đứng vị trí số 1 về vốn hóa. Hiện nay, Vingroup đang là doanh nghiệp có vốn hóa lớn thứ 2 thị trường với hơn 365.000 tỷ đồng.
Năm 2009, thị trường chứng khoán Việt Nam đón nhận thêm loạt tổ chức tài chính lớn lên sàn như Vietcombank - VCB (tháng 6/2009), Tập đoàn Bảo Việt - BVH (tháng 6/2009), VietinBank - CTG (tháng 7/2009), Eximbank - EIB (tháng 10/2009)... Masan Group cũng lên sàn vào tháng 11/2009. Ngân hàng còn lại trong 3 trong số 4 Big 4 ngân hàng đã lên sàn là BIDV chính thức giao dịch vào tháng 1/2014 với mã cổ phiếu BID.
Các ngân hàng liên tục nắm giữ nhiều vị trí trong top 10 trong nhiều năm liền. Đặc biệt, Vietcombank đã nắm giữ vị trí top 1 vốn hóa kể từ năm 2021 đến bây giờ. Tại ngày 30/6/2025, giá trị vốn hóa của Vietcombank hơn 476.000 tỷ đồng.
Trong top 10 doanh nghiệp có vốn hóa lớn nhất thị trường tại ngày 30/6, ngoài top 2 của Vingroup, vị trí thứ 3 và thứ 10 thuộc về ﻿2 doanh nghiệp khác thuộc họ Vin là Vinhomes (315.000 tỷ) và Vinpearl (gần 170.000 tỷ).
Vị trí 4,5,6 lần lượt thuộc về 3 ngân hàng là BIDV (255.000 tỷ), Techcombank (243.000 tỷ), và VietinBank (225.000 tỷ). Sau đó là Viettel Global ở vị trí thứ 7 và ACV ở vị trí thứ 8.
Tính đến hiện nay, có hơn 50 doanh nghiệp có vốn hóa thị trường trên 1 tỷ USD.﻿ Một số cái tên nổi bật trong đó có thể kể đến như Masan Group vốn hóa hơn 108.000 tỷ đồng, Eximbank vốn hóa 42.000 tỷ đồng, SSI vốn hóa hơn 48.000 tỷ đồng, Gelex với vốn hóa hiện tại hơn 33.000 tỷ đồng...
Dự kiến từ quý3/2025 đến quý 1/2026, thị trường đón 'bom tấn' mới khi Công ty Cổ phần Chứng khoán Kỹ Thương (Techcom Securities - TCBS) chào bán 231 triệu cổ phiếu lần đầu ra công chúng (IPO), tương đương 11,1% vốn. Vốn điều lệ sẽ tăng từ 20.801 tỷ đồng lên 23.113 tỷ đồng.
25 năm – Thời điểm vươn mình là hành trình ghi dấu những bước ngoặt lịch sử của thị trường chứng khoán Việt Nam. Trong dòng chảy phát triển ấy, không thể không nhắc đến sự đồng hành và đóng góp quan trọng của các tổ chức, doanh nghiệp tiêu biểu như: Eximbank, Gelex, HDBank, Masan, Nhất Việt, Pinetree, SSI, TCBS và VNDIRECT…",0.8404942866596282,0.1587862290617334,0.0007195225296513
2025-07-02 00:00:00,PVD: Quyết định của HĐQT về việc chốt danh sách cổ đông lấy ý kiến cổ đông bằng văn bản,https://cafef.vn/du-lieu/PVD-2236038/pvd-quyet-dinh-cua-hdqt-ve-viec-chot-danh-sach-co-dong-lay-y-kien-co-dong-bang-van-ban.chn,,0.010151374153792858,0.9885813593864441,0.001267275190912187
2025-06-26 00:00:00,PVD: Nghị quyết HĐQT về việc chấp thuận Phụ lục 1 hợp đồng thầu phụ số PVD-SONGDOC-2024-001,https://cafef.vn/du-lieu/PVD-2231619/pvd-nghi-quyet-hdqt-ve-viec-chap-thuan-phu-luc-1-hop-dong-thau-phu-so-pvdsongdoc2024001.chn,,0.0005898596136830747,0.9992226362228394,0.00018752762116491795
2025-06-26 00:00:00,PVD: Thông báo nhận được đơn từ nhiệm của ông Hoàng Xuân Quốc - Thành viên HĐQT,https://cafef.vn/du-lieu/PVD-2231648/pvd-thong-bao-nhan-duoc-don-tu-nhiem-cua-ong-hoang-xuan-quoc-thanh-vien-hdqt.chn,,0.9928504228591919,0.006246943958103657,0.0009025533217936754
