Thời gian,Tiêu đề,URL,Nội dung,positive,neutral,negative
2024-04-17 11:13:00,"Dự báo thiên thời địa lợi hội tụ, PVD vẫn lên kế hoạch lợi nhuận 2024 đi lùi 30%",https://cafef.vn/du-lieu/pvd-1978260/du-bao-thien-thoi-dia-loi-hoi-tu-pvd-van-len-ke-hoach-loi-nhuan-2024-di-lui-30.chn,"Theo tài liệu đại hội cổ đông thường niên năm 2024 của Tổng CTCP Khoan và Dịch vụ Khoan Dầu khí (PV Drilling - mã PVD), năm 2024, dự báo kinh tế toàn cầu còn nhiều khó khăn, thách thức sẽ tác động trực tiếp đến ngành năng lượng nói chung và nền kinh tế Việt Nam nói riêng.
Hiện giá dầu giữ ở mức cao và ổn định, thị trường khoan khởi sắc với nhu cầu giàn khoan và giá thuê giàn khoan tăng sẽ là động lực mới cho tăng trưởng của PV Drilling trong năm 2024 và các năm tới.
Năm 2024, PV Drilling đặt kế hoạch tổng doanh thu 6.200 tỷ đồng, tăng nhẹ so với thực hiện năm 2023 nhưng kế hoạch lợi nhuận sau thuế 380 tỷ đồng, giảm 30% so với năm 2023.
Kế hoạch SXKD năm 2024 được xây dựng trên một số giả định chính như: 4 giàn khoan tự nâng hoạt động với đơn giá bình quân tăng khoảng 10% - 15% so với năm 2023; 1 giàn khoan nửa nổi nửa chìm TAD hoạt động xuyên suốt trong năm tại Brunei; Giàn khoan đất liền PV DRILLING 11 có việc 04 tháng; 0,5 giàn khoan tự nâng thuê.
Với dự báo giá dầu sẽ tiếp tục ổn định ở mức cao, các chương trình khoan thăm dò, khai thác cũng như hủy giếng, sửa giếng trong nước và khu vực sẽ tăng, kéo theo nhu cầu giàn khoan, giá thuê giàn khoan và các dịch vụ khác liên quan đến khoan cũng sẽ được
cải thiện.
PV Drilling có kế hoạch đầu tư trong năm 2024 khoảng 2.661 tỷ đồng (bao gồm 2.405 tỷ đồng tại Công ty Mẹ và 256 tỷ đồng tại các đơn vị thành viên), trong đó chủ yếu PV Drilling thực hiện các dự án chuyển tiếp từ năm 2023 như cụm thiết bị sửa giếng HWU, xây dựng nhà xưởng,... và đầu tư thêm giàn khoan tự nâng, thiết bị MPD, CRTi để đáp ứng nhu cầu thị trường.
PV Drilling cho biết, để hoàn thành kế hoạch kinh doanh, năm 2024, Công ty sẽ tăng cường nghiên cứu thị trường để kịp thời nắm bắt cơ hội thực hiện đầu tư, đáp ứng nhu cầu thị trường, đồng thời tiếp tục thực hiện công tác vận hành an toàn – hiệu quả các giàn khoan và máy móc thiết bị; tăng cường đào tạo nhân lực; nâng cao công tác quản trị doanh nghiệp như quản trị chặt chẽ tài chính, kiểm soát chi phí; tăng cường chuyển đổi số, ...",0.5612009443066738,0.4358782063341803,0.0029209180657441
2024-04-14 21:09:00,"PV Drilling (PVD) tăng 230% lợi nhuận trước thuế trong quý 1/2024, ước đạt 200 tỷ đồng",https://cafef.vn/du-lieu/pvd-1976678/pv-drilling-pvd-tang-230-loi-nhuan-truoc-thue-trong-quy-12024-uoc-dat-200-ty-dong.chn,"Theo thông tin từ Tổng công ty cổ phần Khoan và Dịch vụ Khoan Dầu khí (PV Drilling, mã chứng khoán PVD), tổng kết hoạt động sản xuất kinh doanh quý 1/2024, công ty ước đạt gần 1.700 tỷ đồng doanh thu và trên 200 tỷ đồng lợi nhuận trước thuế, lần lượt tăng trên 35% và trên 230% so với cùng kỳ.
So với quý 4/2023, lợi nhuận trước thuế của công ty giảm 20 tỷ, tương đương 10%.
Kết quả này là nhờ các giàn khoan sở hữu hoạt động toàn thời gian trong suốt quý 1/2024 với đơn giá cho thuê giàn khoan tăng khoảng 34% so với cùng kỳ. Hiện tất cả các giàn khoan của PV Drilling đang cung cấp dịch vụ tại thị trường nước ngoài, cụ thể giàn tự nâng PV DRILLING I, PV DRILLING III và PV DRILLING VI hoạt động tại Malaysia; giàn tự nâng PV DRILLING II cung cấp dịch vụ tại Indonesia; giàn khoan nước sâu TAD - PV DRILLING V khoan tại Brunei và giàn khoan đất liền PV DRILLING 11 hoạt động tại Algeria.
PVD cho biết, thị trường dầu khí thế giới tiếp tục được đánh giá lạc quan trong thời gian tới. Báo cáo của Cơ quan Thông tin năng lượng Hoa Kỳ (EIA) tháng 4/2024 đưa ra mức giá trung bình của dầu thô Brent cho cả năm 2024 đạt 89USD/thùng. Về ngắn hạn, EIA dự báo giá dầu Brent sẽ duy trì ở mức 90USD/thùng trong quý 2/2024 với ước tính lượng dầu tồn kho sẽ giảm mạnh. Giá dầu duy trì ở mức cao là động lực lớn cho hoạt động khoan thăm dò khai thác diễn ra sôi nổi và đẩy nhu cầu giàn khoan tăng cao.
Thị trường khoan trong nước cũng đang ấm dần lên khi nhiều chương trình khoan được lên kế hoạch triển khai như chương trình khoan dài hạn của Vietsovpetro ở mỏ Cá Tầm, các giếng Lạc Đà Vàng của Murphy Oil, chương trình khoan PTM STT-2B, khoan thẩm lượng và phát triển mỏ DHN và các chương trình khoan ngắn hạn của Hoàng Long - Hoàn Vũ JOC, JVPC, SK Earthon, ENI...
Đặc biệt các hoạt động liên quan đến Lô B - Ô Môn đang được Tập đoàn Dầu khí Việt Nam tích cực triển khai. Lô B - Ô Môn là dự án có quy mô lớn với tổng đầu tư lên đến gần 12 tỷ đô la Mỹ. Dự kiến, các chương trình khoan thuộc dự án Lô B - Ô Môn sẽ được triển khai từ năm 2025.
Sơ đồ chuỗi dự án khí Lô B - Ô Môn
Xét riêng về giàn khoan tự nâng đa năng, tại khu vực Đông Nam Á, S&P Petrodata dự báo nhu cầu giàn tự nâng trung bình sẽ ở mức 37 giàn vào năm 2024 và dự kiến tăng lên 38,6 giàn vào năm 2025. Số lượng đơn khảo sát tìm giàn khoan cho năm 2024 và 2025 tại Malaysia, Indonesia, Thái Lan và Việt Nam đều liên tục tăng.
Trong khi đó, số lượng các giàn khoan tự nâng trong khu vực khá hạn chế và thị trường không ghi nhận nhiều giàn khoan đóng mới được đưa vào hoạt động. Tình trạng này sẽ thúc đẩy hiệu suất sử dụng giàn khoan cũng như nâng đơn giá thuê giàn lên một mặt bằng mới cao hơn.
PVD đánh giá đây là cơ hội việc làm lớn cho các nhà thầu khoan  và cũng là thời điểm tốt để PV Drilling quyết định việc đầu tư hoặc hợp tác với các đối tác để thuê thêm giàn khoan và các thiết bị cần thiết phục vụ các chương trình khoan của khách hàng.
Ngày 28/3/2024, Tập đoàn Dầu khí Việt Nam cùng các đối tác đã ký kết một số thỏa thuận thương mại cho chuỗi dự án khí điện Lô B – Ô Môn, góp phần đảm bảo tiến độ chung cho toàn chuỗi dự án và tiến tới Quyết định Đầu tư cuối cùng (FID). Bên cạnh các hợp đồng cơ bản như Hợp đồng Mua bán khí (GSPA), Hợp đồng Vận chuyển khí (GTA), Hợp đồng đấu nối, vận hành và dịch vụ (TOSA), dự án cũng đã có Hợp đồng bán khí Lô B (GSA) giữa bên bán là Tập đoàn Dầu khí Việt Nam (PVN) với bên mua là Tổng Công ty Phát điện 2 (EVNGENCO2, chủ đầu tư dự án Nhà máy điện Ô Môn I).
Theo đánh giá của CTCK MBS, PVD có thể tham gia vào giai đoạn đầu của dự án từ năm 2025 và khoan các giếng khai thác bổ sung vào giai đoạn sau của dự án.",0.4550664859710939,0.5429361705514593,0.0019973383876902
2024-04-11 00:00:00,PVD: Nghị quyết HĐQT thông qua giao dịch với bên có liên quan,https://cafef.vn/du-lieu/pvd-1975708/pvd-nghi-quyet-hdqt-thong-qua-giao-dich-voi-ben-co-lien-quan.chn,,0.0011508503230288625,0.9972178936004639,0.001631291932426393
2024-04-03 00:00:00,PVD: Thư mời và tài liệu họp ĐHĐCĐ thường niên năm 2024,https://cafef.vn/du-lieu/pvd-1971179/pvd-thu-moi-va-tai-lieu-hop-dhdcd-thuong-nien-nam-2024.chn,,0.349469393491745,0.6420513987541199,0.008479144424200058
2024-04-01 00:00:00,PVD: Giải trình chênh lệch lợi nhuận sau thuế năm 2023 kiểm toán so với năm 2022,https://cafef.vn/du-lieu/pvd-1970050/pvd-giai-trinh-chenh-lech-loi-nhuan-sau-thue-nam-2023-kiem-toan-so-voi-nam-2022.chn,,0.0007525131804868579,0.9967930912971497,0.002454343717545271
2024-03-27 00:00:00,PVD: Thông báo chấm dứt hoạt động của PVD Invest,https://cafef.vn/du-lieu/pvd-1966528/pvd-thong-bao-cham-dut-hoat-dong-cua-pvd-invest.chn,,0.3243713676929474,0.03285635635256767,0.642772376537323
2024-03-27 00:00:00,PVD: Nghị quyết HĐQT về việc sửa đổi đề án cơ cấu lại Công ty,https://cafef.vn/du-lieu/pvd-1966529/pvd-nghi-quyet-hdqt-ve-viec-sua-doi-de-an-co-cau-lai-cong-ty.chn,,0.08628632873296738,0.9030507206916809,0.010662920773029327
2024-03-05 00:00:00,PVD: Nghị quyết HĐQT chấp thuận hợp đồng đào tạo về việc cung cấp dịch vụ đào tạo,https://cafef.vn/du-lieu/pvd-1954765/pvd-nghi-quyet-hdqt-chap-thuan-hop-dong-dao-tao-ve-viec-cung-cap-dich-vu-dao-tao.chn,,0.15459680557250977,0.8357021808624268,0.009701001457870007
2024-02-28 13:20:00,"Đại gia Trung Đông Saudi Aramco hoãn mở rộng khai thác dầu, công ty ngành dầu khí Việt Nam ảnh hưởng ra sao?",https://cafef.vn/du-lieu/pvd-1951141/dai-gia-trung-dong-saudi-aramco-hoan-mo-rong-khai-thac-dau-cong-ty-nganh-dau-khi-viet-nam-anh-huong-ra-sao.chn,"Theo Vietcap, kế hoạch mở rộng bị trì hoãn của Saudi Aramco là do công suất dự phòng hiện tại, vì hiện tại chỉ sản xuất 9 triệu thùng/ngày, do đó không cần đầu tư mới trong ngắn hạn. Vietcap cũng lưu ý rằng nếu không tiếp tục đầu tư, công suất sản xuất dầu hiện tại là 12 triệu thùng/ngày sẽ giảm xuống còn khoảng 10,5 triệu thùng/ngày trong năm 2027, qua đó cho thấy tầm quan trọng của các dự án mở rộng. Vì vậy, Vietcap cho rằng việc đầu tư này vẫn cần thiết trong dài hạn và có thể được Saudi Aramco xem xét lại.
Bên cạnh đó, Saudi Aramco cho biết chi phí vốn ban đầu được phân bổ để tăng năng lực sản xuất sẽ được chuyển sang lĩnh vực khí, chất lỏng và hóa chất. Saudi Aramco cho biết công ty sẽ cập nhật hướng dẫn về vốn đầu tư vào tháng 3 năm 2024.
Trong 1 báo cáo của SSI Research, các chuyên gia chứng khoán lưu ý rằng chu kỳ tăng trưởng hiện tại của ngành khoan chủ yếu được thúc đẩy nhờ công suất sản xuất dầu tăng mạnh từ Trung Đông, do đó, bất kỳ sự thay đổi nào trong chiến lược này đều có thể dẫn đến sự thay đổi chu kỳ tăng trưởng hiện tại của ngành khoan.
Trong khi chờ đợi chiến lược mới của Saudi Aramco, Vietcap vẫn giữ đánh giá tích cực về chi tiêu thượng nguồn toàn cầu do Trung Đông và Saudi Aramco dẫn đầu và đánh giá khả quan cho cổ phiếu của 2 doanh nghiệp dầu khí thượng nguồn Tổng Công ty Cổ phần Dịch vụ Kỹ thuật Dầu khí Việt Nam (PVS) và Tổng Công ty Cổ phần Khoan và Dịch vụ Khoan Dầu khí (PVD).
Theo S&P Global, chi tiêu cho các hoạt động thăm dò và sản xuất toàn cầu sẽ tăng trưởng với tốc độ tăng trưởng kép (CAGR) là 4% trong giai đoạn 2023-2027.
Ngoài dầu mỏ, Saudi Aramco đang theo đuổi các cơ hội trong tất cả các ngành năng lượng, bao gồm cả hydro và năng lượng mặt trời. Aramco tuyên bố vào tháng 1 rằng công ty đã tăng hơn gấp đôi mức chi cho các quỹ đầu tư mạo hiểm lên 7,5 tỷ USD như một phần trong khoản đầu tư vào năng lượng mới.
Thị trường chứng khoán phiên 28/2 bất ngờ chứng kiến giao dịch bùng nổ trên nhóm cổ phiếu dầu khí. Các cổ phiếu như BSR, PVS, PVB, PVT, PVC, PLX, OIL,… đồng loạt tăng mạnh với mức tăng phổ biến trên 2%. Đáng chú ý nhất là PVD khi cổ phiếu này nhanh chóng tăng kịch trần ""trắng bên bán"" chỉ ít phút sau khi mở phiên qua đó leo lên mức cao nhất trong vòng 9 năm.",0.1866842740617169,0.8095967030046776,0.0037190437343759
2024-02-27 00:00:00,"PVD: 18.3.2024, ngày GDKHQ tham dự ĐHCĐ thường niên năm 2024",https://cafef.vn/du-lieu/pvd-1950984/pvd-1832024-ngay-gdkhq-tham-du-dhcd-thuong-nien-nam-2024.chn,,0.7309954166412354,0.2531362771987915,0.01586836390197277
2024-02-22 00:00:00,PVD: CBTT ngày ĐKCC để thực hiện quyền tham dự ĐHCĐ thường niên năm 2024,https://cafef.vn/du-lieu/pvd-1948568/pvd-cbtt-ngay-dkcc-de-thuc-hien-quyen-tham-du-dhcd-thuong-nien-nam-2024.chn,,0.3878139853477478,0.436397522687912,0.1757885366678238
2024-02-15 00:00:00,PVD: Nghị quyết HĐQT thông qua giao dịch với bên có liên quan,https://cafef.vn/du-lieu/pvd-1945097/pvd-nghi-quyet-hdqt-thong-qua-giao-dich-voi-ben-co-lien-quan.chn,,0.0011508503230288625,0.9972178936004639,0.001631291932426393
2024-01-31 00:00:00,PVD: Bổ sung giải trình chênh lệch LNST Q4/2023 so với cùng kỳ năm trước,https://cafef.vn/du-lieu/pvd-1946437/pvd-bo-sung-giai-trinh-chenh-lech-lnst-q42023-so-voi-cung-ky-nam-truoc.chn,,0.005405122879892588,0.2852849066257477,0.709309995174408
2024-01-30 00:00:00,PVD: Giải trình biến động kết quả kinh doanh quý 4/2023 so với quý 4/2022,https://cafef.vn/du-lieu/pvd-1945224/pvd-giai-trinh-bien-dong-ket-qua-kinh-doanh-quy-42023-so-voi-quy-42022.chn,,0.015178968198597431,0.18653102219104767,0.7982900142669678
2024-01-24 00:00:00,PVD: Báo cáo tình hình quản trị Công ty năm 2023,https://cafef.vn/du-lieu/pvd-1935861/pvd-bao-cao-tinh-hinh-quan-tri-cong-ty-nam-2023.chn,,0.009205297566950321,0.9892716407775879,0.001523045008070767
2024-01-20 13:00:00,Một doanh nghiệp xăng dầu bị truy thu thuế hàng tỉ đồng,https://cafef.vn/du-lieu/pvd-1933288/mot-doanh-nghiep-xang-dau-bi-truy-thu-thue-hang-ti-dong.chn,"Tổng Công ty CP Khoan và Dịch vụ Khoan Dầu khí (PV Drilling - mã chứng khoán PVD) vừa công bố quyết định việc bị xử phạt vi phạm hành chính về thuế với tổng số tiền thuế truy thu, tiền phạt và tiền chậm nộp gần 4,2 tỉ đồng.
Trong đó, PV Drilling bị phạt hành chính với số tiền 691 triệu đồng do có hành vi khai sai dẫn đến thiếu số tiền thuế phải nộp (theo tỉ lệ 20%) và hành vi khai sai nhưng không dẫn đến thiếu số thuế phải nộp.
PV Drilling bị buộc nộp đủ số tiền thuế vào ngân sách nhà nước với số tiền 3,12 tỉ đồng; tiền chậm nộp tiền thuế 370 triệu đồng.
Biến động cổ phiếu PVD 3 tháng trở lại đây Nguồn: Fireant
Quyết định cho biết PV Drilling sẽ được giảm lỗ số tiền gần 178 triệu đồng và giảm thuế giá trị gia tăng còn được khấu trừ chuyển kỳ sau là 438 triệu đồng.
Liên quan hoạt động kinh doanh, trong 9 tháng đầu năm 2023, PV Drilling ghi nhận doanh thu 4.033 tỉ đồng, tăng 2,8% so với cùng kỳ. Lợi nhuận sau thuế ghi nhận đạt 343 tỉ đồng, trong khi cùng kỳ lỗ 201 tỉ đồng.
Trong năm 2023, mục tiêu tổng doanh thu của doanh nghiệp này ở mức 5.400 tỉ đồng và lợi nhuận sau thuế 100 tỉ đồng. Như vậy, kết quả trên đã hoàn thành tới 343% so với kế hoạch.
Trên thị trường chứng khoán, cổ phiếu PVD đang có giá 27.350 đồng/cổ phiếu. Tính từ đầu quý III/2023 trở lại đây, cổ phiếu này chỉ tăng nhẹ khoảng 6%.",0.0254638179124486,0.0262767053600557,0.948259520263565
2024-01-19 09:49:00,PV Drilling (PVD) bị phạt và truy thu thuế hơn 4 tỷ đồng,https://cafef.vn/du-lieu/pvd-1932718/pv-drilling-pvd-bi-phat-va-truy-thu-thue-hon-4-ty-dong.chn,"PVD: Tổng Công ty Cổ phần Khoan và Dịch vụ Khoan Dầu khí
Tổng CTCP Khoan và Dịch vụ khoan Dầu khí (PV Drilling - mã PVD) vừa công bố nhận được quyết định ngày 29/12/2023 về việc xử phạt vi phạm hành chính về thuế của Cục thuế doanh nghiệp lớn - Tổng cục Thuế. Tổng số thuế truy thu, tiền phạt và số tiền chậm nộp gần 4,2 tỷ đồng.
Cụ thể, PV Drilling đã có các hành vi vi phạm hành chính, gồm khai sai căn cứ tính thuế hoặc số tền thuế được khấu trừ dẫn đến thiếu số tiền thuế phải nộp nhưng các nghiệp vụ kinh tế đã được phản ảnh đầy đủ trên hệ thống sổ kế toán; khai sai số tiền thuế được khấu trừ nhưng không dẫn đến thiếu số thuế phải nộp.
Do đó, PV Drilling bị phạt hành chính số tiền hơn 691 triệu đồng, và phải khắc phục hậu quả là buộc nộp đủ số tiền thuế thiếu vào Ngân sách Nhà nước hơn 3,1 tỷ đồng; tiền chậm nộp tiền thuế hơn 370 triệu đồng. Cục thuế doanh nghiệp lớn yêu cầu PV Drilling phải nghiêm chỉnh chấp hành quyết định xử phạt này. Quyết định có hiệu lực kể từ ngày 29/12/2023.
Ngoài ra, quyết định cũng nêu rõ PV Drilling sẽ được giảm lỗ số tiền gần 178 tỷ đồng và giảm thuế giá trị gia tăng còn được khấu trừ chuyển kỳ sau gần 439 triệu đồng.
Mới đây, PV Drilling đã công bố sơ bộ kết quả kinh doanh năm 2023 với doanh thu ước đạt 5.900 tỷ đồng, vượt 10% kế hoạch. Lợi nhuận sau thuế ước đạt 400 tỷ đồng, gấp 4 lần mục tiêu cả năm đề ra và khả quan hơn nhiều mức lỗ 155 tỷ đồng năm 2022. Ước tính trong quý 4/2023, PV Drilling lãi ròng 56 tỷ đồng.",0.004439683914714,0.3579666900547779,0.6375935935984994
2024-01-18 00:00:00,PVD: Quyết định về việc xử phạt vi phạm hành chính về thuế,https://cafef.vn/du-lieu/pvd-1932754/pvd-quyet-dinh-ve-viec-xu-phat-vi-pham-hanh-chinh-ve-thue.chn,,0.0042187669314444065,0.9897038340568542,0.006077408324927092
2024-01-18 00:00:00,"PVD: CTBC Vietnam Equity Fund - CĐL đã bán 800.000 cp, không còn là CĐL từ 15.1.2024",https://cafef.vn/du-lieu/pvd-1932939/pvd-ctbc-vietnam-equity-fund-cdl-da-ban-800000-cp-khong-con-la-cdl-tu-1512024.chn,,0.14544038474559784,0.011601719073951244,0.8429579138755798
2024-01-17 14:05:00,"PVD với mô hình ""cốc tay cầm"" dang dở",https://cafef.vn/du-lieu/pvd-1931621/pvd-voi-mo-hinh-coc-tay-cam-dang-do.chn,"Mô hình ""Cốc tay cầm"" còn dang dở của PVD
Từ đầu năm 2024, mã cổ phiếu của Tổng công ty cổ phần Khoan và Dịch vụ Khoan Dầu khí (PV Drilling - HOSE: PVD) đã giảm 3,53% (tính đến hết phiên giao dịch ngày 15/1). So với đà tăng của chỉ số VN-Index là 2,14%, PVD đang nằm trong nhóm đi sau thị trường.
Tuy nhiên, thực tế, PVD cũng chỉ là một trong các ""nạn nhân"" của một thị trường phân hóa mạnh khi sự tập trung của dòng tiền đã hướng về các cổ phiếu Ngân hàng.
Về mặt xu hướng tăng dài hạn, kể từ tháng 1/2023 cho đến nay, PVD vẫn đang có trạng thái tích cực với thị giá luôn duy trì cao hơn đường MA200.
Hiện tại, trên cả HOSE, chỉ có khoảng 46% số mã đang giữ được xu hướng ngắn hạn.
Tuy nhiên, nhịp giảm vừa đã đưa PVD vào trong nhóm 54% các cổ phiếu mất xu hướng ngắn hạn.
Điều này đang khiến cho mô hình ""cốc tay cầm"" của PVD vẫn còn có sự dang dở khi phần ""tay cầm"" vẫn chưa hoàn thiện. Với những dấu hiệu này, dòng tiền hiện cũng chỉ mang tính chất thăm dò trong khi những nhà đầu tư đã có sẵn cổ phiếu cũng ưu tiên giao dịch trong biên độ từ 27.000-29.000 đồng/cổ phiếu. Sự tích lũy về giá sẽ cần được siết lại chặt chẽ hơn trước khi xuất hiện sự bứt phá mạnh mẽ.
Lợi nhuận cả năm 2023 có thể gấp 4 lần kế hoạch đề ra
Giữa tháng 12/2023, PVD đã công bố kết quả ước tính sơ bộ lợi nhuận sau thuế (LNST) năm 2023 khoảng 400 tỷ đồng, gấp 4 lần kế hoạch đề ra trong khi năm 2022 lỗ 155 tỷ đồng. Tính riêng quý IV/2023, PVD ước lãi sau thuế 56 tỷ đồng.
Tuy nhiên, theo CTCK Mirae Asset Vietnam (MAS), do thời điểm ước tính chưa kết thúc năm nên LNST năm 2023 có thể sẽ khả quan hơn, vào khoảng 481 tỷ đồng.
MAS cũng cập nhật giá cho thuê giàn khoan tự nâng tại khu vực Đông Nam Á hiện ở mức 110.000 – 130.000 USD/ngày và được kỳ vọng sẽ tiếp tục duy trì mức cao trong năm 2024 khi nhu cầu thuê giàn khoan tại khu vực Trung Đông đang ở mức cao. S&P Global dự báo nhu cầu sẽ dần quay về mức bình thường trong năm 2025. Đây là yếu tố quan trọng hỗ trợ hoạt động kinh doanh của công ty trong năm 2024 – 2025.
Trong khi đó, PVD hiện đang sở hữu 6 giàn khoan (PV Drilling I, II, III, VI, PV Drilling 11 và TAD Drilling V). Công ty cho biết các giàn khoan vận hành xuyên suốt đến hết năm 2024, một số giàn có công việc đến năm 2025. Việc ký được các hợp đồng cho thuê giàn với mức giá vượt trên 100.000 USD/ ngày sẽ giúp PVD ghi nhận những mức lợi nhuận đột phá.
Với dự báo nhu cầu giàn khoan tăng cao cho đến năm 2025, đại diện PVD cho biết dự kiến sẽ đầu tư thêm giàn khoan theo hình thức mua một giàn khoan đang có sẵn trên thị trường với chi phí ước tính vào khoảng hơn 200 triệu USD. PVD dự kiến sẽ dùng 30% vốn tự có và vay thêm 70%. Mức giá trên tương đương với mức PVD đầu tư giàn PVDrilling VI giai đoạn 2014 – 2015.
MAS dự báo doanh thu PVD năm 2024 sẽ đạt 6.720 tỷ đồng, và LNST ước đạt 788 tỷ đồng với giả định chưa bao gồm việc đầu tư thêm của công ty trong năm. Qua đó, EPS và giá trị sổ sách năm 2024 của PVD lần lượt 1.417 đồng/cổ phiếu và 28.000 đồng/cổ phiếu.",0.0551839143696493,0.920200830401026,0.0246152279309095
2024-01-16 00:00:00,PVD: Báo cáo thay đổi sở hữu ngưỡng 1% của nhóm nhà đầu tư nước ngoài,https://cafef.vn/du-lieu/pvd-1931454/pvd-bao-cao-thay-doi-so-huu-nguong-1-cua-nhom-nha-dau-tu-nuoc-ngoai.chn,,0.011248628608882427,0.018443740904331207,0.9703075885772705
2024-01-09 00:00:00,PVD: Bổ nhiệm ông Nguyễn Văn Tứ giữ chức Thư ký công ty từ 8.1.2024,https://cafef.vn/du-lieu/pvd-1928141/pvd-bo-nhiem-ong-nguyen-van-tu-giu-chuc-thu-ky-cong-ty-tu-812024.chn,,0.04770855978131294,0.10553745925426483,0.8467540144920349
2023-12-22 00:00:00,PVD: Nghị quyết HĐQT v/v chấp thuận hợp đồng thuê giàn khoan số 02 PVD - PVD Overseas - PVD VI,https://cafef.vn/du-lieu/pvd-1919237/pvd-nghi-quyet-hdqt-vv-chap-thuan-hop-dong-thue-gian-khoan-so-02-pvd-pvd-overseas-pvd-vi.chn,,,,
2023-12-08 00:07:00,"Giá cho thuê giàn khoan neo cao kỷ lục, PVD được dự báo lãi nghìn tỷ trong năm 2024, cổ phiếu ""lầm lũi"" lên đỉnh",https://cafef.vn/du-lieu/pvd-1911214/gia-cho-thue-gian-khoan-neo-cao-ky-luc-pvd-duoc-du-bao-lai-nghin-ty-trong-nam-2024-co-phieu-lam-lui-len-dinh.chn,,,,
2023-12-06 00:00:00,PVD: Nghị quyết HĐQT về việc chấp thuận hợp đồng đào tạo số 310/2023/HD-PVDTr,https://cafef.vn/du-lieu/pvd-1910794/pvd-nghi-quyet-hdqt-ve-viec-chap-thuan-hop-dong-dao-tao-so-3102023hdpvdtr.chn,,,,
2023-11-24 00:00:00,PVD: Nghị quyết HĐQT về việc phê duyệt dự án đầu tư và kế hoạch lực chọn nhà thầu,https://cafef.vn/du-lieu/pvd-1896760/pvd-nghi-quyet-hdqt-ve-viec-phe-duyet-du-an-dau-tu-va-ke-hoach-luc-chon-nha-thau.chn,,,,
2023-11-21 00:00:00,PVD: Nghị quyết HĐQT chấp thuận Tu chỉnh số 01 của Hợp đồng thầu phụ số C-NGP/2023/001/PVD-PVDL,https://cafef.vn/du-lieu/pvd-1891519/pvd-nghi-quyet-hdqt-chap-thuan-tu-chinh-so-01-cua-hop-dong-thau-phu-so-cngp2023001pvdpvdl.chn,,,,
2023-11-14 14:49:00,"Cổ phiếu PVD tăng mạnh, nhóm VinaCapital không mua đủ số lượng đăng ký",https://cafef.vn/du-lieu/pvd-1884882/co-phieu-pvd-tang-manh-nhom-vinacapital-khong-mua-du-so-luong-dang-ky.chn,,,,
2023-11-14 00:00:00,"PVD: Báo cáo kết quả giao dịch cổ phiếu của tổ chức có liên quan đến Người nội bộ Quỹ đầu tư Cân bằng Tuệ sáng VinaCapital, Quỹ đầu tư cổ phiếu Hưng Thịnh VinaCapital",https://cafef.vn/du-lieu/pvd-1885272/pvd-bao-cao-ket-qua-giao-dich-co-phieu-cua-to-chuc-co-lien-quan-den-nguoi-noi-bo-quy-dau-tu-can-bang-tue-sang-vinacapital-quy-dau-tu-co-phieu-hung-thinh-vinacapital.chn,,,,
2023-10-31 00:00:00,PVD: Nghị quyết HĐQT phê duyệt Dự án đầu tư vào kế hoạch SXKD năm 2023,https://cafef.vn/du-lieu/pvd-1869847/pvd-nghi-quyet-hdqt-phe-duyet-du-an-dau-tu-vao-ke-hoach-sxkd-nam-2023.chn,,,,
