Thời gian,Tiêu đề,URL,Nội dung,positive,neutral,negative
2025-03-25 00:00:00,PVD: Nghị quyết HĐQT về việc chấp thuận thỏa thuận chuyển giao các hợp đồng dịch vụ,https://cafef.vn/du-lieu/pvd-2157624/pvd-nghi-quyet-hdqt-ve-viec-chap-thuan-thoa-thuan-chuyen-giao-cac-hop-dong-dich-vu.chn,,0.002843366703018546,0.9964993000030518,0.0006572709535248578
2025-03-21 00:00:00,PVD: Bổ sung giải trình BCTC HN và Cty mẹ kiểm toán năm 2024,https://cafef.vn/du-lieu/pvd-2154918/pvd-bo-sung-giai-trinh-bctc-hn-va-cty-me-kiem-toan-nam-2024.chn,,0.003477544756606221,0.983220100402832,0.013302318751811981
2025-03-17 00:00:00,"PVD: Nghị quyết HĐQT số 06, 07 về việc chấp thuận giao dịch với các bên liên quan",https://cafef.vn/du-lieu/pvd-2151659/pvd-nghi-quyet-hdqt-so-06-07-ve-viec-chap-thuan-giao-dich-voi-cac-ben-lien-quan.chn,,0.00043459859443828464,0.9986664056777954,0.0008990315836854279
2025-03-17 00:00:00,PVD: Giải trình BCTC kiểm toán năm 2024 so với cùng kỳ năm trước,https://cafef.vn/du-lieu/pvd-2152060/pvd-giai-trinh-bctc-kiem-toan-nam-2024-so-voi-cung-ky-nam-truoc.chn,,0.0038960021920502186,0.9899330139160156,0.006171064451336861
2025-03-17 00:00:00,PVD: Nghị quyết HĐQT số 08/03/2025 và 09/03/2025 ngày 17/03/2025,https://cafef.vn/du-lieu/pvd-2152062/pvd-nghi-quyet-hdqt-so-08032025-va-09032025-ngay-17032025.chn,,0.0012164665386080742,0.9983695149421692,0.0004140253586228937
2025-03-12 00:00:00,PVD: Báo cáo về sở hữu của nhóm nhà đầu tư nước ngoài có liên quan là cổ đông lớn,https://cafef.vn/du-lieu/pvd-2147887/pvd-bao-cao-ve-so-huu-cua-nhom-nha-dau-tu-nuoc-ngoai-co-lien-quan-la-co-dong-lon.chn,,0.01849118247628212,0.31417104601860046,0.6673377752304077
2025-03-11 00:00:00,PVD: Nghị quyết HĐQT về việc chấp thuận thỏa thuận chuyển giao hợp đồng số CN4123006,https://cafef.vn/du-lieu/pvd-2147414/pvd-nghi-quyet-hdqt-ve-viec-chap-thuan-thoa-thuan-chuyen-giao-hop-dong-so-cn4123006.chn,,0.0012775656068697572,0.9983410835266113,0.00038130301982164383
2025-03-06 00:00:00,PVD: Nghị quyết HĐQT về giao dịch của người có liên quan,https://cafef.vn/du-lieu/pvd-2144309/pvd-nghi-quyet-hdqt-ve-giao-dich-cua-nguoi-co-lien-quan.chn,,0.0028354977257549763,0.9882043600082397,0.008960102684795856
2025-03-04 00:00:00,"PVD: 18.3.2025, ngày GDKHQ tham dự ĐHCĐ thường niên năm 2025",https://cafef.vn/du-lieu/pvd-2142275/pvd-1832025-ngay-gdkhq-tham-du-dhcd-thuong-nien-nam-2025.chn,,0.4430648386478424,0.5357688069343567,0.021166374906897545
2025-02-26 00:00:00,PVD: Báo cáo thay đổi về sở hữu của nhóm nhà đầu tư nước ngoài có liên quan là cổ đông lớn,https://cafef.vn/du-lieu/pvd-2138506/pvd-bao-cao-thay-doi-ve-so-huu-cua-nhom-nha-dau-tu-nuoc-ngoai-co-lien-quan-la-co-dong-lon.chn,,0.009911026805639267,0.019148483872413635,0.9709404706954956
2025-02-26 00:00:00,PVD: Thông báo về ngày ĐKCC để thực hiện quyền tham dự ĐHĐCĐ thường niên năm 2025,https://cafef.vn/du-lieu/pvd-2138555/pvd-thong-bao-ve-ngay-dkcc-de-thuc-hien-quyen-tham-du-dhdcd-thuong-nien-nam-2025.chn,,0.1303764283657074,0.855233907699585,0.014389666728675365
2025-02-20 00:00:00,PVD: Nghị quyết HĐQT số 04/02/2025 và 05/02/2025 về việc chấp thuận giao dịch các bên liên quan,https://cafef.vn/du-lieu/pvd-2134629/pvd-nghi-quyet-hdqt-so-04022025-va-05022025-ve-viec-chap-thuan-giao-dich-cac-ben-lien-quan.chn,,0.0004658208054024726,0.998816728591919,0.0007174928905442357
2025-02-20 00:00:00,PVD: Báo cáo về sở hữu của nhóm nhà đầu tư nước ngoài có liên quan là cổ đông lớn,https://cafef.vn/du-lieu/pvd-2134745/pvd-bao-cao-ve-so-huu-cua-nhom-nha-dau-tu-nuoc-ngoai-co-lien-quan-la-co-dong-lon.chn,,0.01849118247628212,0.31417104601860046,0.6673377752304077
2025-02-18 00:00:00,PVD: Báo cáo về sở hữu của nhóm nhà đầu tư nước ngoài có liên quan là cổ đông lớn,https://cafef.vn/du-lieu/pvd-2132970/pvd-bao-cao-ve-so-huu-cua-nhom-nha-dau-tu-nuoc-ngoai-co-lien-quan-la-co-dong-lon.chn,,0.01849118247628212,0.31417104601860046,0.6673377752304077
2025-02-18 00:00:00,PVD: Quỹ đầu tư Cổ phiếu Hưng Thịnh VinaCapital đã bán 768.800 cp,https://cafef.vn/du-lieu/pvd-2133102/pvd-quy-dau-tu-co-phieu-hung-thinh-vinacapital-da-ban-768800-cp.chn,,0.002618317259475589,0.9960618615150452,0.0013198165688663721
2025-02-13 00:00:00,PVD: Các Nghị quyết HĐQT về việc chấp thuận giao dịch với các bên có liên quan,https://cafef.vn/du-lieu/pvd-2130276/pvd-cac-nghi-quyet-hdqt-ve-viec-chap-thuan-giao-dich-voi-cac-ben-co-lien-quan.chn,,0.002469742437824607,0.9966641068458557,0.0008661173633299768
2025-02-10 00:00:00,PVD: Công ty TNHH Bảo hiểm Nhân thọ Generali Việt Nam đã bán 127.800 cp,https://cafef.vn/du-lieu/pvd-2128011/pvd-cong-ty-tnhh-bao-hiem-nhan-tho-generali-viet-nam-da-ban-127800-cp.chn,,0.0021228508558124304,0.9938454031944275,0.004031745251268148
2025-02-03 00:00:00,PVD: Báo cáo tình hình quản trị Công ty năm 2024,https://cafef.vn/du-lieu/pvd-2151492/pvd-bao-cao-tinh-hinh-quan-tri-cong-ty-nam-2024.chn,,0.023631539195775986,0.9721857905387878,0.0041826749220490456
2025-01-24 00:00:00,PVD: Bổ sung giải trình BCTC HN và Công ty mẹ quý 4/2024 so với cùng kỳ năm trước,https://cafef.vn/du-lieu/pvd-2133408/pvd-bo-sung-giai-trinh-bctc-hn-va-cong-ty-me-quy-42024-so-voi-cung-ky-nam-truoc.chn,,0.0180867500603199,0.9465412497520447,0.0353720486164093
2025-01-22 00:00:00,PVD: Nghị quyết HĐQT về việc chấp thuận phụ lục số 06 Hợp đồng số 01/2013 với PVD-Expro,https://cafef.vn/du-lieu/pvd-2120484/pvd-nghi-quyet-hdqt-ve-viec-chap-thuan-phu-luc-so-06-hop-dong-so-012013-voi-pvdexpro.chn,,0.0005698318709619343,0.9988465309143066,0.0005836404743604362
2025-01-21 00:00:00,PVD: Qũy Đầu tư Cổ phiếu Hưng Thịnh Vinacapital chưa bán cp,https://cafef.vn/du-lieu/pvd-2118656/pvd-quy-dau-tu-co-phieu-hung-thinh-vinacapital-chua-ban-cp.chn,,0.00048755676834844053,0.9800169467926025,0.019495483487844467
2025-01-21 00:00:00,PVD: Qũy Đầu tư Cổ phiếu Hưng Thịnh Vinacapital đăng ký bán 768.800 cp,https://cafef.vn/du-lieu/pvd-2118658/pvd-quy-dau-tu-co-phieu-hung-thinh-vinacapital-dang-ky-ban-768800-cp.chn,,0.003648044541478157,0.9919871091842651,0.004364832304418087
2025-01-21 00:00:00,PVD: Công ty TNHH Bảo hiểm Nhân thọ Generali Việt Nam chưa bán cp,https://cafef.vn/du-lieu/pvd-2118660/pvd-cong-ty-tnhh-bao-hiem-nhan-tho-generali-viet-nam-chua-ban-cp.chn,,0.0008075668592937291,0.9917454123497009,0.007447026204317808
2025-01-21 00:00:00,PVD: Công ty TNHH Bảo hiểm Nhân thọ Generali Việt Nam đăng ký bán 127.800 cp,https://cafef.vn/du-lieu/pvd-2118664/pvd-cong-ty-tnhh-bao-hiem-nhan-tho-generali-viet-nam-dang-ky-ban-127800-cp.chn,,0.003108551260083914,0.9940043091773987,0.0028871004469692707
2025-01-16 00:00:00,"PVD: Nghị quyết HĐQT số 12, 13, 14 ngày 16/01/2025",https://cafef.vn/du-lieu/pvd-2117216/pvd-nghi-quyet-hdqt-so-12-13-14-ngay-16012025.chn,,0.061921626329422,0.9337570071220398,0.0043213823810219765
2025-01-09 00:02:00,"Sở hữu công cụ chuyên đào “kho báu” ngoài khơi, doanh nghiệp Việt làm không hết việc, ""siêu dự án"" 12 tỷ USD mở ra triển vọng dài hạn",https://cafef.vn/du-lieu/pvd-2112193/so-huu-cong-cu-chuyen-dao-kho-bau-ngoai-khoi-doanh-nghiep-viet-lam-khong-het-viec-sieu-du-an-12-ty-usd-mo-ra-trien-vong-dai-han.chn,"Các mỏ dầu được ví như những “kho báu” ngoài biển, tuy nhiên để đào được kho báu này cần có công cụ chuyên biệt là những giàn khoan. Tại nhóm doanh nghiệp dầu khí Việt Nam, PV Drilling (PVD) được xem là cái tên nổi bật khi sở hữu ""tổ đội"" giàn khoan cho thuê quy mô hàng đầu trong khu vực Đông Nam Á.
PVD có thị phần lớn trong tất cả các mảng kinh doanh chính như 50% trong mảng dịch vụ khoan và 55%-100% dịch vụ giếng khoan. Đội giàn khoan của PVD bao gồm 4 giàn khoan tự nâng, 1 giàn tiếp trợ khoan và 1 giàn khoan trên đất liền; đều đang cung cấp dịch vụ tại thị trường nước ngoài.
Trong báo cáo vừa cập nhật, Chứng khoán Bảo Việt (BVSC) đánh giá hiệu suất và giá thuê giàn của PVD có thể được hỗ trợ bởi nhu cầu cao ở khu vực Đông Nam Á trong bối cảnh thiếu hụt nguồn cung giàn khoan. Theo kịch bản cơ sở, BVSC cho rằng giá dầu trong năm 2025 sẽ tiếp tục được duy trì tích cực ở mức trung bình cả năm là 72,5 USD/thùng. Mặc dù nguồn cung dầu thô trong năm sau có thể sẽ gia tăng, song vẫn có những yếu tố hỗ trợ giúp giá dầu không bị giảm giá quá mạnh khi nhu cầu tiêu thụ phục hồi, OPEC có thể sẽ cắt giảm sản lượng.
BVSC cho rằng hoạt động thăm dò và khai thác dầu khí tại khu vực Đông Nam Á sẽ tiếp tục sôi động bởi mức giá dầu hòa vốn của hầu hết các quốc gia trong khu vực đều ở mức khoảng 45–55 USD/thùng - đảm bảo lợi nhuận cho các đơn vị khai thác, hỗ trợ hoạt động thăm dò các mỏ mới. Mức giá dầu hòa vốn tại các thị trường chủ lực của PVD gồm Indonesia, Malaysia, Brunei và Việt Nam đều chỉ khoảng trên dưới 50 USD/thùng. Vì vậy, rủi ro giảm giá dầu có thể khiến các hợp đồng khoan của PVD bị hủy bỏ là ở mức thấp.
Ở khía cạnh khác, nguồn cung giàn khoan hạn chế trong bối cảnh nhu cầu tăng cao được cho là yếu tố thuận lợi giúp các giàn khoan đang hoạt động sẽ tiếp tục đảm bảo được công việc của mình trong những năm tới, đặc biệt là các giàn khoan có tuổi giàn trẻ và độ tin cậy kỹ thuật cao. Trong giai đoạn 2024–2026, hiện ghi nhận 12 giàn mới đang được đóng mới tại khu vực Châu Á, trong đó chỉ có 2 giàn ở Đông Nam Á. Số lượng này là rất hạn chế nếu so sánh với giai đoạn bùng trước đây, do đó nguồn việc cho các giàn khoan hiện tại vẫn sẽ được đảm bảo.
PVD trong giai đoạn 2025–2028 tới đây sẽ tập trung nguồn lực nhằm phục vụ cho các khách hàng ở Malaysia, Indonesia và Việt Nam với các chiến lược khoan dài hạn. Gần nhất, PVD đã công bố kế hoạch thành lập liên doanh hoạt động tại thị trường tiềm năng này với tên quốc tế là PT PetroVietnam Drilling Indonesia nhằm đánh dấu sự hiện diện thường xuyên của PVD tại Indonesia, qua đó, khai thác tiềm năng lớn đến từ quốc gia này. Tại Việt Nam, các dự án dầu khí mới trong nước đang được khởi động trong thời gian gần đây, đặc biệt là đại dự án Lô B – Ô Môn - dự án điện khí quy mô lớn với tổng đầu tư khoảng 12 tỷ USD – cũng sẽ tạo nguồn việc dồi dào trong dài hạn cho các doanh nghiệp xây lắp và khoan giếng trong nước như PVD.
Giàn khoan tự nâng của PVD được đảm bảo công việc ít nhất tới 2028 với giá thuê tăng dần, mạnh tay đầu tư giàn khoan mới
Theo thông tin doanh nghiệp chia sẻ trong buổi Analyst Meeting, hiện nay 3/4 giàn khoan đều đã sở hữu các hợp đồng khoan dài hạn. Thời hạn của các hợp đồng này sẽ kéo dài ít nhất tới năm 2028 và có thêm tùy chọn gia hạn thêm 2 năm tới 2030. Giàn PVD VI đang phục vụ khách hàng Petronas tại Malaysia và sẽ hết hợp đồng vào cuối năm nay và khả năng cao sẽ tái ký do PVD sẽ không phải mất chi phí kéo dàn từ Malaysia về nước.
BVSC cũng cho rằng với việc tuổi giàn của PVD ở mức khá thấp, nhân lực có kinh nghiệm, độ tin cậy kỹ thuật cao và giá cho thuê giàn thấp hơn tương đối các đối thủ các trong khu vực sẽ là yếu tố giúp PVD duy trì nguồn việc hiện tại với các đối tác nước ngoài.
Về giá thuê của các giàn tự nâng, BVSC ước tính giá thuê giàn trung bình trong năm 2024 là 97.500 USD/ngày và sẽ tiếp tục tăng dần qua các năm. BVSC kỳ vọng giá thuê giàn sẽ đi ngang trong năm 2025 và tăng nhẹ 5% trong năm 2026.
Mặt khác, PVD cũng hé lộ kế hoạch mua từ 1 đến 2 giàn khoan tự nâng nhằm phục vụ cho nhu cầu khoan trong nước . Trong đó, doanh nghiệp dự kiến sẽ tiếp nhận một giàn khoan đã qua sử dụng trị giá 90 triệu USD trong quý 1 năm sau. Bên cạnh đó, để phục vụ cho nhu cầu khoan dài hạn của mỏ khí Lô B, PVD cũng đang có kế hoạch sẽ tiếp tục đầu tư một giàn mới trong năm 2026. Với kịch bản thận trọng, BVSC ước tính PVD sẽ vận hành 2 giàn khoan nêu trên lần lượt trong khoảng quý 3/2025 và quý 2/2027, mức giá thuê ước tính ở mức khoảng 90.000 USD/ngày, thấp hơn tương đối so với mức giá thuê hiện tại của PVD. Ngoài ra, PVD cũng đầu tư mới 1 giàn HWU trị giá 8 triệu USD nhằm thực hiện công tác sửa giếng, hủy giếng.
Nhiều dự án dầu khí lớn trong nước đang trong giai đoạn bản lề để bước vào giai đoạn thăm dò và khai thác bao gồm: Lô B, Sư Tử Trắng 2B, Lạc Đà Vàng, Nam Du U Minh, v.v sẽ là nguồn công việc dồi dào cho các giàn mua mới của PVD. BVSC kỳ vọng rằng khi các dự án khoan trong nước ngày càng nhiều, nhu cầu sửa và hủy giếng trong nước cũng sẽ tăng cao. Doanh thu mảng dịch vụ kỹ thuật giếng khoan kỳ vọng sẽ tăng trưởng mạnh mẽ trong các năm tới, biên lợi nhuận được cải thiện do trước đây PVD phải đi thuê giàn từ các đối tác.
Về kết quả kinh doanh, BVSC ước tính doanh thu 2024có thể đạt hơn 8.800 tỷ, gấp rưỡi cùng kỳ sau đó giảm xuống mức 7.400 tỷ trong năm 2025. LNST 2024-2025 lần lượt được dự phóng đạt mức 642 tỷ và 677 tỷ đồng.",0.4391621089697283,0.5601493569433563,0.0006885518534809
2025-01-03 00:00:00,PVD: Nghị quyết HĐQT số 01/01/2025 & 02/01/2025 ngày 03/01/2025,https://cafef.vn/du-lieu/pvd-2109873/pvd-nghi-quyet-hdqt-so-01012025--02012025-ngay-03012025.chn,,0.0029160131234675646,0.9966437816619873,0.0004401805636007339
2024-12-23 00:00:00,PVD: Nghị quyết HĐQT số 06/12/2024 về việc chấp thuận giao dịch các bên liên quan,https://cafef.vn/du-lieu/pvd-2103726/pvd-nghi-quyet-hdqt-so-06122024-ve-viec-chap-thuan-giao-dich-cac-ben-lien-quan.chn,,0.0008899798849597573,0.9983571171760559,0.000752859516069293
2024-12-23 00:00:00,PVD: Nghị quyết HĐQT số 05/12/2024 về việc chấp thuận giao dịch các bên liên quan,https://cafef.vn/du-lieu/pvd-2103728/pvd-nghi-quyet-hdqt-so-05122024-ve-viec-chap-thuan-giao-dich-cac-ben-lien-quan.chn,,0.000847641727887094,0.998389482498169,0.0007629346800968051
2024-12-20 00:00:00,PVD: Nghị quyết HĐQT về việc phê duyệt ký quỹ tại ngân hàng để mở bảo lãnh,https://cafef.vn/du-lieu/pvd-2102407/pvd-nghi-quyet-hdqt-ve-viec-phe-duyet-ky-quy-tai-ngan-hang-de-mo-bao-lanh.chn,,0.02118668146431446,0.9171961545944214,0.06161712855100632
2024-12-18 00:00:00,PVD: Nghị quyết HĐQT về việc chấp thuận giao dịch các bên liên quan,https://cafef.vn/du-lieu/pvd-2100867/pvd-nghi-quyet-hdqt-ve-viec-chap-thuan-giao-dich-cac-ben-lien-quan.chn,,0.0035899628419429064,0.995518684387207,0.0008913747151382267
2024-12-17 00:00:00,PVD: CTCP Quản lý Quỹ Vinacapital đăng ký bán 18.200 cp,https://cafef.vn/du-lieu/pvd-2100795/pvd-ctcp-quan-ly-quy-vinacapital-dang-ky-ban-18200-cp.chn,,0.0030334806069731712,0.9616081714630127,0.03535838425159454
2024-12-17 00:00:00,PVD: Công ty TNHH Bảo hiểm Nhân thọ Generali Việt Nam đăng ký bán 127.800 cp,https://cafef.vn/du-lieu/pvd-2100812/pvd-cong-ty-tnhh-bao-hiem-nhan-tho-generali-viet-nam-dang-ky-ban-127800-cp.chn,,0.003108551260083914,0.9940043091773987,0.0028871004469692707
2024-12-17 00:00:00,PVD: Quỹ đầu tư Cổ phiếu Hưng Thịnh VinaCapital đăng ký bán 768.800 cp,https://cafef.vn/du-lieu/pvd-2100813/pvd-quy-dau-tu-co-phieu-hung-thinh-vinacapital-dang-ky-ban-768800-cp.chn,,0.0020155813544988632,0.9957172274589539,0.002267181873321533
2024-12-09 00:00:00,PVD: Nghị quyết HĐQT v/v chấp thuận hợp đồng thầu phụ số PVD-SONGDOC - 2024 - 001 và hợp đồng thầu phụ số PVD-SONGDOC - 2024 - 003,https://cafef.vn/du-lieu/pvd-2096699/pvd-nghi-quyet-hdqt-vv-chap-thuan-hop-dong-thau-phu-so-pvdsongdoc-2024-001-va-hop-dong-thau-phu-so-pvdsongdoc-2024-003.chn,,0.0008028215961530805,0.9990662932395935,0.0001309600775130093
2024-11-20 00:00:00,PVD: Nghị quyết HĐQT số 09/11/2024 và 10/11/2024 ngày 19/11/2024 về việc chấp thuận giao dịch các bên liên quan,https://cafef.vn/du-lieu/pvd-2087036/pvd-nghi-quyet-hdqt-so-09112024-va-10112024-ngay-19112024-ve-viec-chap-thuan-giao-dich-cac-ben-lien-quan.chn,,0.0010694849770516157,0.998599112033844,0.000331401388393715
2024-11-19 00:00:00,PVD: Nghị quyết HĐQT về việc phê duyệt hồ phương án thành lập Công ty liên doanh tại Indonesia,https://cafef.vn/du-lieu/pvd-2086510/pvd-nghi-quyet-hdqt-ve-viec-phe-duyet-ho-phuong-an-thanh-lap-cong-ty-lien-doanh-tai-indonesia.chn,,0.012086615897715092,0.9866699576377869,0.0012433916563168168
2024-11-19 00:00:00,PVD: Nghị quyết HĐQT về việc phê duyệt phương án thành lập Công ty liên doanh tại Indonesia,https://cafef.vn/du-lieu/pvd-2086527/pvd-nghi-quyet-hdqt-ve-viec-phe-duyet-phuong-an-thanh-lap-cong-ty-lien-doanh-tai-indonesia.chn,,0.015068667009472847,0.983721911907196,0.001209392212331295
2024-11-11 00:00:00,PVD: Nghị quyết HĐQT số 03/11/2024 và 04/11/2024 ngày 11/11/2024,https://cafef.vn/du-lieu/pvd-2082968/pvd-nghi-quyet-hdqt-so-03112024-va-04112024-ngay-11112024.chn,,0.007855626754462719,0.9919169545173645,0.00022742954024579376
2024-11-08 00:00:00,PVD: Báo cáo về sở hữu của nhóm nhà đầu tư nước ngoài có liên quan là cổ đông lớn,https://cafef.vn/du-lieu/pvd-2081755/pvd-bao-cao-ve-so-huu-cua-nhom-nha-dau-tu-nuoc-ngoai-co-lien-quan-la-co-dong-lon.chn,,0.01849118247628212,0.31417104601860046,0.6673377752304077
2024-11-01 08:02:00,"PSI: Dự báo giá dầu giảm trong năm 2025, các DN dầu khí ra sao?",https://cafef.vn/du-lieu/pvd-2077590/psi-du-bao-gia-dau-giam-trong-nam-2025-cac-dn-dau-khi-ra-sao.chn,"Nguồn cung dầu dự kiến gia tăng trong năm 2025
Theo IEA, tổng nhu cầu dầu thế giới được dự báo sẽ chỉ tăng khoảng hơn 0,9 triệu thùng/ngày, đạt mức 102,8 triệu thùng/ngày (+1,2% YoY) trong năm 2024. Giảm 0,4 triệu thùng/ngày so với dự báo đầu năm. Nguyên nhân chính của sự suy giảm này đến từ việc tăng trưởng tiêu thụ dầu ở Trung Quốc đang chậm lại nhanh chóng.
Năm 2025, IEA dự báo nhu cầu dầu toàn cầu sẽ tăng nhẹ 0,95 triệu thùng/ngày, tổng mức tiêu thụ dầu đạt mức 103,8 triệu thùng/ngày. Nguyên nhân do kinh tế toàn cầu được dự báo sẽ phục hồi chậm và sự phát triển mạnh mẽ của năng lượng tái tạo.
Nguồn: IEA, PSI tổng hợp
Mặt khác, IEA dự báo nguồn cung dầu toàn cầu năm 2024 tăng 0,66 triệu thùng/ngày lên mức 101,8 triệu thùng/ngày. Sản lượng dầu từ các nước bên ngoài OPEC+ có thể tăng thêm 1,5 triệu thùng/ngày. Trong khi đó, sản lượng của OPEC+ dự báo giảm khoảng 0,81 triệu thùng/ngày.
Năm 2025, tổ chức này đánh giá nguồn cung dầu được dự báo tiếp tục gia tăng do nhóm OPEC+ có thể tiến hành nới lỏng sản lượng cắt giảm. Theo đó, nguồn cung dầu có thể tăng thêm 2,1 triệu thùng/ngày, riêng nhóm OPEC+ tăng thêm 0,51 triệu thùng/ngày. Điều này có thể khiến cho thị trường ở trạng thái dư cung trong năm 2025.
PSI kỳ vọng giá dầu sẽ quanh mức 70-80 USD/thùng trong năm 2025 trong với giả định căng thẳng tại Trung Đông không tiếp tục leo thang. Mức giá này vẫn mang lại lợi nhuận đối với các doanh nghiệp khai thác và có thể hỗ trợ phần nào sự phục hồi chung của nền kinh tế thế giới.
Các doanh nghiệp Dầu khí sẽ bị ảnh hưởng ra sao?
Theo PSI, các hoạt động thăm dò, khai thác và vận tải dầu khí vẫn đang được triển khai trong bối cảnh các mỏ cũ đã đi vào giai đoạn suy giảm. Các dự án nổi bật như Lô B, Sư Tử Trắng 2B và Lạc Đà Vàng. Trong số đó, dự án Lô B được chú ý hơn cả và là động lực chính của ngành dầu khí.
Nguồn: PSI tổng hợp
Vẫn còn những trở ngại trong việc giải quyết FID, đặc biệt là việc ký kết GSPA/GSA với cả sản lượng cam kết, giá khí và quyết định đầu tư cuối cùng cho dự án nhà máy điện Ô Môn 3 & 4.
Tuy nhiên, với việc vào ngày 18/09/2024, PVN thông báo dự án Lô B - Ô Môn đã chính thức khởi công xây dựng, các gói thầu EPCI 1 và EPCI 2 thuộc khâu thượng nguồn được triển khai, PSI cho rằng FID đối với đại dự án sắp được chính thức thông qua. Tin tức cập nhật về dự án sẽ tiếp tục hỗ trợ giá cổ phiếu ngành dầu khí, đặc biệt là các công ty thượng nguồn.
Nguồn: PSI tổng hợp
Với việc các hoạt động thăm dò, khai thác và vận tải dầu khí vẫn đang được triển khai, PSI dự báo một số doanh nghiệp liên quan hưởng lợi và có triển vọng tốt trong năm 2024 – 2025.
Cụ thể như, với Tổng công ty CP Khoan và Dịch vụ Khoan Dầu khí – PV Drilling (HSX: PVD), các giàn khoan của PVD đã ký hợp đồng năm 2025 với các đối tác trong khu vực với giá thuê giàn cao. PVD cũng có tiềm năng thuê 2 giàn khoan và có các hợp đồng dịch vụ giếng khoan cho dự án Lô B (tổng giá trị hợp đồng ước tính đạt 2 tỷ USD).
Với Tổng công ty CP Dịch vụ Kỹ thuật Dầu khí Việt Nam – PTSC (HSX: PVS), dự án Lô B có thể đem về cho PVS 5,8 tỷ USD từ các hợp đồng M&C bắt đầu từ năm 2024 và 1 hợp đồng cho thuê kho nổi chứa dầu bắt đầu từ năm 2028. Bắt đầu từ khoảng cuối năm 2024, PVS có thể bắt đầu ghi nhận doanh thu từ các hợp đồng EPCI 1,2,3. Ngoài ra, PVS cũng có mảng kinh doanh tiềm năng từ việc phát triển thị trường năng lượng tái tạo điện gió ngoài khơi với vai trò là nhà thầu và chủ đầu tư.
Ở lĩnh vực trung nguồn, Tổng công ty CP Vận tải Dầu khí (HSX: PVT) có triển vọng tích cực năm 2025 bao gồm mảng tàu chở dầu thô, tàu chở LPG và tàu chở hàng rời. Công ty chủ yếu tham gia thị trường thuê tàu định hạn trên thị trường quốc tế nên sự biến động trên thị trường giao ngay sẽ không ảnh hưởng đến lợi nhuận của công ty.
Trong khi đó, triển vọng cho Tổng Công ty Khí Việt Nam (HSX: GAS) là giá khí khô và LPG hồi phục trong năm 2024 nhờ giá dầu duy trì trong khoảng 70-80 USD/thùng, trong khi nhu cầu khí khô tiếp tục tăng trưởng đạt mức 2,6% trong năm 2024.
Ở hạ nguồn, đã có dấu hiệu cho thấy crack spread của các sản phẩm đang hồi phục đáng kể từ khi chạm đáy vào tháng 6/2024. PSI kỳ vọng xu hướng này sẽ tiếp diễn cho tới cuối năm, khi nhu cầu tiêu thụ của các sản phẩm này trên thế giới sẽ được cải thiện, theo đó, tạo thuận lợi cho hoạt động của Công ty CP Lọc hóa dầu Bình Sơn (UPCoM: BSR).
Ngoài ra, ngày 27/5, TAND tỉnh Quảng Ngãi đã mở thủ tục phá sản đối với CTCP Nhiên liệu sinh học Dầu khí Miền Trung (BSR-BF). Do đó, công ty này không còn là công ty con của BSR. Điều này sẽ khiến cho tiến trình chuyển sàn niêm yết của BSR diễn ra thuận lợi hơn.",0.544858521027031,0.4449361549659735,0.0102053523006591
2024-10-31 00:00:00,PVD: Bổ sung giải trình BCTC Hợp nhất và Công ty mẹ quý 3/2024 so với cùng kỳ năm trước,https://cafef.vn/du-lieu/pvd-2078670/pvd-bo-sung-giai-trinh-bctc-hop-nhat-va-cong-ty-me-quy-32024-so-voi-cung-ky-nam-truoc.chn,,0.029358765110373497,0.6492821574211121,0.3213590979576111
2024-10-21 00:00:00,"PVD: Nghị quyết HĐQT chấp thuận các sửa đổi, bổ sung hợp đồng thầu phụ cung cấp dịch vụ nhân lực với PVD Training",https://cafef.vn/du-lieu/pvd-2072542/pvd-nghi-quyet-hdqt-chap-thuan-cac-sua-doi-bo-sung-hop-dong-thau-phu-cung-cap-dich-vu-nhan-luc-voi-pvd-training.chn,,0.001841062679886818,0.997860848903656,0.00029805453959852457
