Thời gian,Tiêu đề,URL,Nội dung,positive,neutral,negative
2025-10-27 16:46:00,PVS: Báo cáo tài chính quý 3/2025,https://cafef.vn/du-lieu/PVS-2326407/pvs-bao-cao-tai-chinh-quy-32025.chn,,0.00646520871669054,0.9873462319374084,0.006188543979078531
2025-10-27 16:46:00,PVS: Báo cáo tài chính quý 3/2025 (công ty mẹ),https://cafef.vn/du-lieu/PVS-2326408/pvs-bao-cao-tai-chinh-quy-32025-cong-ty-me.chn,,0.01274663582444191,0.9447550773620605,0.04249822720885277
2025-10-27 08:47:00,PVS: Trần Hồ Bắc - Tổng Giám đốc - đăng ký mua 200.000 CP,https://cafef.vn/du-lieu/PVS-2325724/pvs-tran-ho-bac-tong-giam-doc-dang-ky-mua-200000-cp.chn,,0.8924206495285034,0.008630496449768543,0.09894884377717972
2025-10-20 00:00:00,PVS: Ông Nguyễn Tuấn Hùng làm Phó TGĐ từ 16.10.2025,https://cafef.vn/du-lieu/PVS-2321029/pvs-ong-nguyen-tuan-hung-lam-pho-tgd-tu-16102025.chn,,0.5060116052627563,0.36948728561401367,0.12450110167264938
2025-10-15 00:00:00,PVS: Nghị quyết HĐQT không gia hạn giấy ĐKKD tại UAE,https://cafef.vn/du-lieu/PVS-2317142/pvs-nghi-quyet-hdqt-khong-gia-han-giay-dkkd-tai-uae.chn,,0.017682021483778954,0.9071516394615173,0.07516630738973618
2025-10-09 00:00:00,"PVS: 29.10.2025, tổ chức ĐHCĐ bất thường năm 2025",https://cafef.vn/du-lieu/PVS-2313451/pvs-29102025-to-chuc-dhcd-bat-thuong-nam-2025.chn,,0.035712555050849915,0.9554862976074219,0.008801184594631195
2025-09-22 00:00:00,PVS: Chi cục Thuế Doanh nghiệp lớn xử phạt vi phạm hành chính về thuế,https://cafef.vn/du-lieu/PVS-2300795/pvs-chi-cuc-thue-doanh-nghiep-lon-xu-phat-vi-pham-hanh-chinh-ve-thue.chn,,0.04491513594985008,0.02936207875609398,0.9257227778434753
2025-09-21 08:14:00,Ông lớn dầu khí Việt Nam hoàn thành sớm ‘siêu phẩm’ 245 triệu USD cho đối tác Mỹ,https://cafef.vn/ong-lon-dau-khi-viet-nam-hoan-thanh-som-sieu-pham-245-trieu-usd-cho-doi-tac-my-188250921081500662.chn,"Vào ngày 15/9/2025, PTSC M&C (một công ty con do Tổng Công ty cổ phần Dịch vụ Kỹ thuật Dầu khí Việt Nam – PVS – sở hữu 100%) đã tổ chức buổi lễ hạ thủy phần thân chân đế giàn Lạc Đà Vàng-A, thuộc hợp đồng tổng thầu EPCI với Murphy Cửu Long Bạc (MCB, một công ty con của Murphy Oil Corporation, Mỹ).

Giàn Lạc Đà Vàng-A là một phần của Dự án Lạc Đà Vàng, dự án phát triển dầu khí ngoài khơi của Việt Nam.
Công ty kỳ vọng sẽ hoàn thành việc lắp đặt vào cuối tháng 9/2025 và hoàn thành toàn bộ dự án Lạc Đà Vàng giai đoạn A (bao gồm cả đường ống dẫn khí) vào cuối năm 2026.

Cột mốc này cũng củng cố năng lực thực hiện của PVS trong các dự án EPCI, tăng cường khả năng ghi nhận backlog.
Công ty Chứng khoán Vietcap đã tính đến giá trị của dự án Lạc Đà Vàng-A (backlog 245 triệu USD) có thể đóng góp 39 triệu/98 triệu/108 triệu USD doanh thu trong ba năm 2024/2025/2026, tương ứng với đóng góp LNST sau lợi ích CĐTS của PVS là 7/13/17 triệu USD, tương ứng đóng góp 2,8%/7,3%/7% LNST sau lợi ích CĐTS của PVS trong giai đoạn 2024–2026.
Với việc tiến độ sớm hơn kỳ vọng, Vietcap cho rằng PVS sẽ có khả năng ghi nhận thêm doanh thu và lợi nhuận sớm hơn, cải thiện lợi nhuận các năm tới.
Chủ tịch HĐTV Petrovietnam Lê Mạnh Hùng tiếp Đại sứ đặc mệnh toàn quyền Singapore tại Việt Nam.
Ngoài ra, vào ngày 18/9/2025, Chủ tịch HĐQT thành viên PetroVietnam ông Lê Mạnh Hùng đã gặp Đại sứ Singapore để bàn thảo phương án hợp tác điện gió ngoài khơi nhằm thúc đẩy xuất khẩu điện gió từ Việt Nam sang Singapore. Các doanh nghiệp liên quan là Tập đoàn Sembcorp có trụ sở tại Singapore và đối tác Việt Nam.
Tại ĐHĐCĐ tháng 5, Tổng Giám đốc của PVS đã tuyên bố rằng dự án xuất khẩu điện gió ngoài khơi của Việt Nam hướng đến các mục tiêu như sau:
(1) đạt 5–10 GW công suất điện gió ngoài khơi để xuất khẩu sang Singapore
(2) tận dụng được vị trí địa lý gần kề giữa Việt Nam và Singapore, với đường truyền tải điện dự kiến dài 500 km
(3) thời gian đàm phán hợp đồng mua bán điện (PPA) có thể kéo dài 5–10 năm, đồng thời thời gian hoạt động của dự án có thể kéo dài 30–50 năm, đảm bảo tính ổn định lâu dài.

Theo kế hoạch ban đầu, mục tiêu dự án nhằm cung cấp điện cho Singapore. Tuy nhiên, từ tháng 5/2025, đã có bàn mở rộng để cấp điện thêm cho Malaysia.

Các rào cản chính để phát triển các dự án xuất khẩu điện gió ngoài khơi của Việt Nam ước tính hiện tại là:
(1) giá điện bán sang Singapore phải cạnh tranh được với các dự án điện khí hóa lỏng (LNG) nhập khẩu, từ Mỹ và Việt Nam
(2) quy mô dự án phải đạt mức tối thiểu để việc nối lưới vào Malaysia và Singapore là khả thi
(3) cấp phép ngoài khơi tại Việt Nam vẫn cần được làm rõ, bao gồm thủ tục phê duyệt quyết định đầu tư cuối cùng (FID) vào năm 2027.

Hiện tại, dự án đặt mục tiêu hoàn thành (COD) vào khoảng năm 2033, với các quyết định đầu tư cuối cùng dự kiến được thực hiện dần theo tiến độ, bắt đầu từ năm 2026, sau đó là duyệt quyết định đầu tư cuối cùng (FID) vào năm 2027.
Về kết quả kinh doanh, 6 tháng đầu năm 2025, PVS ghi nhận doanh thu thuần đạt 13.373 tỷ đồng, tăng 44% so với cùng kỳ năm ngoái. Lợi nhuận sau thuế là 614 tỷ đồng, tăng 19% so với cùng kỳ.
Công ty đã hoàn thành 59,4% kế hoạch doanh thu và 78,8% kế hoạch LNST của năm﻿ 2025.",0.7015742703769984,0.2975237446638306,0.000901962361322
2025-09-12 00:00:00,PVS: Thay đổi giấy ĐKKD theo địa giới hành chính mới,https://cafef.vn/du-lieu/PVS-2294850/pvs-thay-doi-giay-dkkd-theo-dia-gioi-hanh-chinh-moi.chn,,0.005161424167454243,0.021169252693653107,0.9736692905426025
2025-09-12 00:00:00,"PVS: 29.9.2025, ngày GDKHQ tổ chức ĐHCĐ bất thường năm 2025",https://cafef.vn/du-lieu/PVS-2313453/pvs-2992025-ngay-gdkhq-to-chuc-dhcd-bat-thuong-nam-2025.chn,,0.04782436788082123,0.8763410449028015,0.07583459466695786
2025-09-11 00:00:00,PVS: Nghị quyết HĐQT tổ chức ĐHCĐ bất thường năm 2025,https://cafef.vn/du-lieu/PVS-2293992/pvs-nghi-quyet-hdqt-to-chuc-dhcd-bat-thuong-nam-2025.chn,,0.016888998448848724,0.9759545922279358,0.007156399544328451
2025-09-11 00:00:00,"PVS: 30.9.2025, chốt DS tổ chức ĐHCĐ bất thường năm 2025",https://cafef.vn/du-lieu/PVS-2294449/pvs-3092025-chot-ds-to-chuc-dhcd-bat-thuong-nam-2025.chn,,0.021009599789977074,0.9695314168930054,0.009458974003791809
2025-08-27 14:32:00,PVS: Báo cáo tài chính bán niên năm 2025,https://cafef.vn/du-lieu/PVS-2283415/pvs-bao-cao-tai-chinh-ban-nien-nam-2025.chn,,0.016014086082577705,0.9733912348747253,0.01059460174292326
2025-08-27 14:31:00,PVS: Báo cáo tài chính bán niên năm 2025 (công ty mẹ),https://cafef.vn/du-lieu/PVS-2283414/pvs-bao-cao-tai-chinh-ban-nien-nam-2025-cong-ty-me.chn,,0.02031633071601391,0.9186043739318848,0.06107927858829498
2025-08-13 08:23:00,"'Ông lớn' dầu khí Việt Nam kích hoạt bước đầu tiên cho siêu dự án 10 tỷ USD xuất khẩu điện sang Singapore, Malaysia",https://cafef.vn/ong-lon-dau-khi-viet-nam-kich-hoat-buoc-dau-tien-cho-sieu-du-an-10-ty-usd-xuat-khau-dien-sang-singapore-malaysia-188250813082321644.chn,"Ngày 11/08/2025, Tổng công ty Cổ phần Dịch vụ Kỹ thuật Dầu khí Việt Nam (PVS) và LS Eco Energy Ltd. (LSEE) đã ký kết Thỏa thuận Hợp tác Phát triển Chung (JDA) nhằm hợp tác đầu tư, xây dựng, phát triển và vận hành nhà máy sản xuất cáp ngầm cao thế tại Việt Nam.
LSEE là thành viên của LS Cable & System (Hàn Quốc) – một trong những nhà sản xuất cáp điện cao thế hàng đầu thế giới. Nhà máy sẽ sản xuất các sản phẩm đạt tiêu chuẩn quốc tế, phục vụ trực tiếp cho các dự án năng lượng tái tạo trong nước, khu vực và thị trường toàn cầu.
PVS dự kiến vốn đầu tư XDCB cho dự án này sẽ ở mức 40 triệu USD; tỷ lệ sở hữu tiềm năng của PVS hiện chưa được công bố.
Theo CTCK Vietcap, đây là bước đi then chốt để triển khai dự án xuất khẩu điện gió ngoài khơi trị giá 10 tỷ USD của Việt Nam, bởi cáp ngầm là một trong những hạng mục kỹ thuật phức tạp nhất của dự án quy mô lớn này.
PVS là thành viên của Tập đoàn Dầu khí Việt Nam (PVN) và là công ty trong nước duy nhất cung cấp tất cả các dịch vụ kỹ thuật dầu khí (trừ dịch vụ khoan). PVS chiếm thị phần áp đảo ở các ngành liên quan, như thị phần dịch vụ tàu kỹ thuật dầu khí, cơ khí dầu khí, dịch vụ căn cứ cảng và dịch vụ kho nổi.
Tại ĐHCĐ tháng 5, Tổng Giám đốc PVS cho biết dự án xuất khẩu điện gió ngoài khơi sang Singapore có thể trở thành động lực tăng trưởng trong nhiều thập kỷ cho PVS, với tiềm năng lớn gấp đôi dự án Lô B.
PVS nhấn mạnh nếu triển khai thành công, dự án có thể sẽ mang lại doanh thu và lợi nhuận ổn định trong vòng 30–50 năm, đánh dấu một động lực tăng trưởng dài hạn, bền vững và mang tính bước ngoặt.
Ban đầu, dự án chỉ dự kiến cung cấp điện cho Singapore, nhưng nay đã mở rộng sang Malaysia.
PVS cho biết tổng quy mô giai đoạn 1 của dự án xuất khẩu điện gió ngoài khơi của Việt Nam được ước tính ở mức tối thiểu 10 tỷ USD (giai đoạn 1), bao gồm 3 hạng mục chính: (1) Trang trại điện gió ngoài khơi công suất trên 2.000 MW tại Việt Nam; (2) Hệ thống cáp ngầm truyền tải điện nối Việt Nam với Malaysia và Singapore; và (3) Các trạm biến áp ngoài khơi tại Việt Nam và Singapore.
Thời điểm vận hành thương mại (COD) dự kiến sẽ rơi vào năm 2033; dự án hiện đang trong giai đoạn thực hiện nghiên cứu khả thi với mục tiêu hoàn tất vào năm 2026, sau đó sẽ đưa ra quyết định đầu tư cuối cùng (FID) vào năm 2027.
Trong vòng 3 tháng qua, cổ phiếu PVS đã tăng 46%, đóng cửa ngày 12/8 tại giá 37.900 đồng, tương đương hơn 18.000 tỷ vốn hóa thị trường.",0.7288960800584378,0.2704887332536906,0.0006151991052542
2025-08-05 00:00:00,PVS: Báo cáo quản trị công ty bán niên 2025,https://cafef.vn/du-lieu/PVS-2263316/pvs-bao-cao-quan-tri-cong-ty-ban-nien-2025.chn,,0.00886467657983303,0.9784372448921204,0.01269805058836937
2025-07-31 16:17:00,PVS: Báo cáo tài chính quý 2/2025,https://cafef.vn/du-lieu/PVS-2260080/pvs-bao-cao-tai-chinh-quy-22025.chn,,0.009595677256584167,0.9857195019721985,0.00468480447307229
2025-07-31 16:16:00,PVS: Báo cáo tài chính quý 2/2025 (công ty mẹ),https://cafef.vn/du-lieu/PVS-2260079/pvs-bao-cao-tai-chinh-quy-22025-cong-ty-me.chn,,0.014840737916529179,0.9559598565101624,0.029199399054050446
2025-07-17 00:00:00,PVS: Ký hợp đồng kiểm toán các BCTC năm 2025,https://cafef.vn/du-lieu/PVS-2247369/pvs-ky-hop-dong-kiem-toan-cac-bctc-nam-2025.chn,,0.0020627977792173624,0.9969504475593567,0.000986777595244348
2025-07-13 10:01:00,Tin vui từ công ty dầu khí Việt: Nhận hợp đồng mới lên tới 10.000 tỷ đồng tại DA Sư Tử Trắng,https://cafef.vn/tin-vui-tu-cong-ty-dau-khi-viet-nhan-hop-dong-moi-len-toi-10000-ty-dong-tai-da-su-tu-trang-188250713100127806.chn,"PVS: Tổng Công ty Cổ phần Dịch vụ Kỹ thuật Dầu khí Việt Nam
Theo thông tin từ Tổng Công ty Cổ phần Dịch vụ Kỹ thuật Dầu khí Việt Nam (PTSC, mã chứng khoán PVS), Công ty Liên doanh Điều hành Cửu Long (CLJOC) đã chính thức phát hành Thư Trao thầu cho Công ty TNHH Dịch vụ Cơ khí Hàng hải PTSC (PTSC M&C) – công ty con do PVS sở hữu 100% - nhằm triển khai thực hiện gói thầu Tổng thầu EPCI cho Dự án Sư Tử Trắng – Giai đoạn 2B thuộc Lô 15-1, ngoài khơi thềm lục địa Việt Nam.
Đây là dự án tiếp theo thuộc cụm mỏ Sư Tử (Lô 15-1) mà CLJOC trao thầu cho PTSC M&C, tiếp nối các dự án trước như Sư Tử Đen, Sư Tử Nâu, Sư Tử Trắng LTPTP, Sư Tử Vàng Tây Nam và Sư Tử Trắng – Giai đoạn 1.
Phạm vi công việc của Dự án Sư Tử Trắng – Giai đoạn 2B bao gồm các hạng mục Thiết kế, Mua sắm, Chế tạo, Vận Chuyển, Lắp đặt, Đấu nối, Chạy thử cho 1 giàn công nghệ trung tâm với khối thượng tầng nặng hơn 6.500 tấn và phần chân đế nặng khoảng 5.000 tấn. Giá trị hợp đồng ước tính có thể lên tới hơn 10.000 tỷ đồng.
CTCK Vietcap thống kê, với hợp đồng mới này, tổng giá trị các hợp đồng đã ký của PVS đạt 3,7 tỷ USD.",0.0586162199450219,0.9358151385813585,0.0055686621454236
2025-07-04 10:09:00,"Dự án trọng điểm Lô B – Ô Môn, Sư Tử Trắng 2B…. đang tạo ra 'khối lượng công việc khổng lồ' lên đến hàng tỷ USD cho PVD, PVS",https://cafef.vn/du-an-trong-diem-lo-b-o-mon-su-tu-trang-2b-dang-tao-ra-khoi-luong-cong-viec-khong-lo-len-den-hang-ty-usd-cho-pvd-pvs-18825070410061419.chn,"Giá dầu toàn cầu tiếp tục chịu áp lực do tăng trưởng nhu cầu chậm lại trong khi nguồn cung ngày càng gia tăng. Trong báo cáo phân tích mới công bố, SSI Research cho biết giữ nguyên giả định giá dầu Brent ở mức 65 USD/thùng cho năm 2025, tương đương mức giảm 7% so với trung bình năm 2024.
Theo dự báo tháng 6 của Cơ quan Năng lượng Quốc tế (IEA), nhu cầu dầu toàn cầu dự kiến chỉ tăng khoảng 720.000 thùng/ngày trong năm 2025 – mức điều chỉnh giảm nhẹ so với các ước tính trước đó và chậm hơn đáng kể so với mức tăng gần 1 triệu thùng/ngày trong năm 2024. Dự báo này phản ánh xu hướng suy yếu chung của kinh tế toàn cầu.
Ở chiều ngược lại, nguồn cung toàn cầu được dự báo tăng khoảng 1,8 triệu thùng/ngày, chủ yếu nhờ việc nới lỏng cắt giảm sản lượng của OPEC+ và sản lượng gia tăng từ các quốc gia ngoài OPEC+, đặc biệt là Mỹ và Canada.
Hiện, căng thẳng địa chính trị, như xung đột Iran-Israel, có thể gây biến động ngắn hạn nhưng khó có tác động đáng kể đến xu hướng giá dầu trung và dài hạn.
Theo SSI Research, việc giá dầu giảm có thế ảnh hưởng đến kết quả kinh doanh của các doanh nghiệp trung nguồn, nhưng vẫn ở mức đủ hấp dẫn để duy trì các hoạt động khai thác và thăm dò ở mảng thượng nguồn.
Giá dầu Brent (USD/thùng)
Nhóm thượng nguồn hưởng lợi từ hoạt động E&P
Hoạt động thăm dò và khai thác (E&P) vẫn duy trì tích cực trong nửa đầu năm 2025 và được kỳ vọng tiếp tục đà tăng trong nửa cuối năm 2025, nhờ sự suy giảm trữ lượng tự nhiên và yêu cầu chiến lược về an ninh năng lượng quốc gia.
Theo đó, các doanh nghiệp thượng nguồn như Tổng CTCP Khoan và Dịch vụ Khoan Dầu khí (mã chứng khoán PVD) và Tổng CTCP Dịch vụ Kỹ thuật Dầu khí Việt Nam (PVS) được kỳ vọng sẽ duy trì đà tăng trưởng tích cực, nhờ vào hoạt động E&P sôi động.
Đây cũng là những doanh nghiệp hưởng lợi trực tiếp từ dự án Lô B. Một số dự án trọng điểm đang triển khai bao gồm: (1) Lô B – Ô Môn, (2) Sư Tử Trắng 2B, (3) Nam Du – U Minh. Theo SSI Research, những dự án này đang tạo ra khối lượng công việc lớn cho các nhà cung cấp dịch vụ thượng nguồn như PVS và PVD.
Trong đó, PVD được kỳ vọng sẽ duy trì tốc độ tăng trưởng lợi nhuận khoảng 14% so với cùng kỳ, nhờ tỷ lệ sử dụng giàn khoan duy trì ở mức cao và đơn giá thuê ngày đối với giàn khoan tự nâng tăng 10% so với cùng kỳ.
Còn PVS dự kiến sẽ đạt tăng trưởng lợi nhuận 25% trong năm 2025, nhờ doanh thu mạnh từ các hợp đồng EPC cho phần thượng nguồn của dự án Lô B, với giá trị hợp đồng ước tính lên tới 1 tỷ USD.
Ngoài ra, việc mở rộng công suất lọc dầu của BSR cũng là diễn biến đáng chú ý.
Sản lượng từ các bồn khí chính (triệu m3/năm)
Các nhà phân phối xăng dầu như PLX và OIL bị ảnh hưởng bởi giá dầu yếu
Ngược lại, ở nhóm trung nguồn, các doanh nghiệp như Petrolimex (mã chứng khoán PLX), PV OIL (mã chứng khoán OIL) và Lọc hoá dầu Bình Sơn (mã chứng khoán BSR) có khả năng chịu tác động rõ rệt hơn từ xu hướng giá dầu yếu, dẫn đến mức tăng trưởng lợi nhuận đi ngang hoặc âm so với năm trước.
Riêng BSR được kỳ vọng ghi nhận mức tăng trưởng lợi nhuận ấn tượng, khoảng 300% nhờ mức lợi nhuận thấp trong năm 2024 và sản lượng tiêu thụ dự kiến phục hồi 15% sau giai đoạn bảo dưỡng.
Tuy nhiên, lợi nhuận năm 2025 của BSR có thể vẫn thấp hơn 70–80% so với giai đoạn 2021–2023, do ảnh hưởng từ xu hướng giá dầu giảm.
Đối với các nhà phân phối xăng dầu như PLX và OIL, thị trường đang chờ đợi nghị định mới về kinh doanh xăng dầu. Theo dự thảo lần thứ 6 mới nhất, các doanh nghiệp đầu mối sẽ có thêm quyền tự chủ trong việc thiết lập giá bán lẻ dựa trên chi phí đầu vào, qua đó hỗ trợ ổn định biên lợi nhuận của các nhà phân phối.
Tuy nhiên, Chính phủ hiện vẫn đang lấy ý kiến các bên liên quan, do đó cần chờ thêm thời gian để có quyết định chính thức.
Một trong những vấn đề được quan tâm hiện nay liên quan đến phát triển năng lượng từ LNG. Mảng LNG đang có vai trò chiến lược ngày càng rõ nét, đặc biệt với việc triển khai các nhà máy điện khí LNG Nhơn Trạch 3 & 4. Điều này dự kiến sẽ thúc đẩy hoạt động nhập khẩu LNG.
Về phía doanh nghiệp, mặc dù có thể xuất hiện nhiều nhà cung cấp trong tương lai, PV GAS (mã chứng khoán GAS) theo SSI Research vẫn là đơn vị tiên phong và giữ vai trò chủ đạo trong trung hạn. Tuy nhiên, sản lượng LNG hiện tại vẫn chưa đủ bù đắp cho xu hướng suy giảm sản lượng khí tự nhiên nội địa, dự kiến sẽ tiếp diễn cho đến khi Lô B bắt đầu khai thác khí vào cuối năm 2027.",0.4667436100012641,0.5300062468088684,0.0032501754398543
2025-06-23 10:05:00,"Giá dầu tăng nóng sau diễn biến mới tại Trung Đông, cổ phiếu dầu khí đồng loạt “bốc đầu”",https://cafef.vn/gia-dau-tang-nong-sau-dien-bien-moi-tai-trung-dong-co-phieu-dau-khi-dong-loat-boc-dau-188250623093139531.chn,"Thị trường chứng khoán Việt Nam khởi đầu tuần mới chìm trong sắc đỏ trước lo ngại căng thẳng leo thang tại Trung Đông. Đi ngược xu hướng của thị trường chung, nhóm cổ phiếu dầu khí với các đại diện tiêu biểu như GAS, PLX, PVS, PVD, BSR,… lại đồng loạt tăng mạnh, thậm chí chạm trần với hiệu ứng từ giá dầu “bốc đầu”.
Giá dầu Brent tương lai có thời điểm tăng hơn 2% lên trên 79 USD/thùng vào thứ Hai, dao động ở mức cao nhất kể từ tháng 1. Sau động thái từ Hoa Kỳ, Iran đe doạ trả đũa bằng cách làm gián đoạn dòng chảy dầu thô toàn cầu từ Trung Đông. Tính từ đầu tháng 6, giá dầu Brent tương lai đã tăng gần 30%.
Trong báo cáo phân tích mới đây, SSI Research kỳ vọng giá dầu trung bình sẽ dao động từ 70-75 USD/thùng trong năm 2025. Yếu tố hỗ trợ cho giá dầu bao gồm việc OPEC trì hoãn cắt giảm sản lượng dầu, thị trường Trung Quốc phục hồi tốt hơn dự kiến, và/hoặc việc cắt giảm lãi suất nhanh hơn dự kiến.
Về kết quả kinh doanh quý 2, báo cáo mới nhất của Vietcombank Securities (VCBS) dự báo nhóm thượng nguồn và trung nguồn (PVS, PVD, GAS) có thể tăng trưởng lợi nhuận cao trong khi nhóm hạ nguồn (PLX, BSR) sụt giảm.
Cụ thể, PVS được dự báo doanh thu đạt 5.986 tỷ đồng, tăng 7% so với cùng kỳ; lợi nhuận sau thuế 239 tỷ đồng, tăng 14%. Động lực chính từ mảng Cơ khí và Xây lắp (M&C) đóng góp khoảng 60% tổng doanh thu. Tháng 4/2025, hợp đồng EPC cung cấp 33 chân đế cho dự án điện gió ngoài khơi Greater Changhua (CHW2204) cũng đã được chủ đầu tư trao chứng nhận “hoàn thành nghiệm thu kỹ thuật”. Ngoài ra, các dự án lớn như Hải Long OSS, Baltica 02, điện gió ngoài khơi Feng Miao, chuỗi dự án khí - điện Lô B và Lạc Đà Vàng vẫn đang được PVS bám sát tiến độ....
Tương tự, PVD có thể đạt doanh thu 2.425 tỷ đồng, tăng 6%; lợi nhuận sau thuế 236 tỷ đồng, tăng 79%. Động lực đến từ đơn giá cho thuê bình quân các giàn tăng nhẹ; giàn PVD VI đã hoạt động trở lại từ 18/4/2025 sau bảo trì bảo dưỡng. Ngoài ra, PVD cũng ghi nhận doanh thu di dời giàn PVD III từ Malaysia sang Indonesia để thực hiện chương trình khoan cho Pertamina.
GAS cũng được dự báo tăng trưởng, với doanh thu quý 2 là 32.415 tỷ đồng, tăng 8% và lợi nhuận sau thuế đạt 3.996 tỷ đồng, tăng 17% so với quý 2/2024. Kết quả tích cực đến từ sản lượng khí tiếp nhận và tiêu thụ của GAS trong 5 tháng đầu năm ước tính đạt 45% kế hoạch cả năm. Ngoài ra, sản lượng LPG kinh doanh của PV GAS đạt gần 1,4 triệu tấn, tăng 22% so với cùng kỳ năm trước.
Trong khi đó, PVB ước đạt 244 tỷ doanh thu, tăng tới 282% so với cùng kỳ; lợi nhuận sau thuế đạt 17 tỷ đồng, tăng đến 168%. Tăng trưởng đến từ việc thực hiện các dự án đã ký và đang triển khai như dự án bọc ống dẫn khí tuyến bờ Lô B, bọc đường ống dẫn tuyến nội mỏ lô B và bọc đường ống dự án Lạc Đà Vàng.
Mặt khác, BSR được dự kiến doanh thu quý 2/2025 là 32.295 tỷ đồng, tăng 32% so với cùng kỳ, nhưng lợi nhuận sau thuế chỉ đạt 72 tỷ đồng, giảm mạnh tới 91%. Còn PLX ước đạt doanh thu 79.264 tỷ đồng, tăng 8% so với cùng kỳ nhưng lợi nhuận sau thuế đạt 836 tỷ đồng, giảm 35% so với cùng kỳ năm ngoái.",0.7556122956608831,0.2371291831760245,0.0072585324938674
