Thời gian,Tiêu đề,URL,Nội dung,positive,neutral,negative
2024-06-18 00:00:00,PVS: Nghị quyết HĐQT thông qua tài liệu tổ chức ĐHCĐ thường niên năm 2024,https://cafef.vn/du-lieu/pvs-2009604/pvs-nghi-quyet-hdqt-thong-qua-tai-lieu-to-chuc-dhcd-thuong-nien-nam-2024.chn,,0.022733138874173164,0.9711625576019287,0.006104256026446819
2024-06-04 00:00:00,PVS: Thay đổi giấy ĐKKD do đổi CCCD của người đại diện pháp luật,https://cafef.vn/du-lieu/pvs-2002293/pvs-thay-doi-giay-dkkd-do-doi-cccd-cua-nguoi-dai-dien-phap-luat.chn,,0.02125145122408867,0.05581459403038025,0.9229338765144348
2024-05-29 00:00:00,PVS: Quỹ Đầu tư Cổ phiếu Kinh tế Hiện đại VinaCapital đã mua 4.800 cổ phiếu,https://cafef.vn/du-lieu/pvs-1998929/pvs-quy-dau-tu-co-phieu-kinh-te-hien-dai-vinacapital-da-mua-4800-co-phieu.chn,,0.014286920428276062,0.9711460471153259,0.014567079022526741
2024-05-22 08:40:00,"PSI: Giá dầu năm 2024 giữ quanh mốc 85 USD/thùng, chỉ ra mức ảnh hưởng với DN trong chuỗi sản xuất, phân phối dầu khí",https://cafef.vn/du-lieu/pvs-1995766/psi-gia-dau-nam-2024-giu-quanh-moc-85-usdthung-chi-ra-muc-anh-huong-voi-dn-trong-chuoi-san-xuat-phan-phoi-dau-khi.chn,"Theo báo cáo phân tích giá dầu và ngành Dầu khí của Công ty Cổ phần Chứng khoán Dầu khí (PSI), nhu cầu dầu thô thế giới trong năm 2024 sẽ tăng nhẹ do tình hình kinh tế tại các nước phục hồi chậm, sản lượng khai thác tại các nước ngoài OPEC lại tăng nhanh hơn ước tính, qua đó giúp cho thị trường chỉ ở trạng thái thâm hụt nhẹ.
Ngoài ra, việc tồn kho dầu tại các khu vực gần mức trung bình nhiều năm, công suất dự phòng vẫn khá dồi dào cho thấy thị trường dường như không ở trong giai đoạn của một đợt tăng giá lớn và kéo dài. Trong năm 2024, PSI dự báo giá dầu bình quân cả năm sẽ neo trên mức 85 USD/thùng, mức giá này sẽ tạo điều kiện thuận lợi để thúc đẩy hoạt động E&P (Exploration & Production - thăm dò và khai thác) trên toàn thế giới khi đã vượt xa điểm hòa vốn đối với các doanh nghiệp khai thác.
Các Chuyên gia Dầu khí và PSI đánh giá, trên thị trường chứng khoán Việt Nam, cổ phiếu dầu khí rất nhạy cảm với giá dầu Brent. Sau khi tiến hành phân tích hồi quy tuyến tính giữa giá cổ phiếu dầu khí và giá dầu Brent, PSI nhận thấy giá cổ phiếu Dầu khí như: GAS, BSR, PVD, PVT, PVS,… có mức độ tương quan với giá dầu cao, biến động thuận chiều với giá dầu Brent.
Nguồn Bloomberg, PSI tổng hợp
Tuy nhiên, mỗi doanh nghiệp đều có những mảng hoạt động khác nhau (sản xuất, vận chuyển, dịch vụ, khai thác,…) và sản phẩm khác nhau (khí đốt, dầu, xăng,…). Do đó, mức độ chịu ảnh hưởng, độ trễ sẽ phụ thuộc vào vị trí của doanh nghiệp trong chuỗi sản xuất, phân phối dầu khí. Việc giá dầu thô neo cao sẽ tiếp tục thúc đẩy nhu cầu thăm dò, khai thác và vận tải dầu khí, giúp các doanh nghiệp liên quan hưởng lợi và có triển vọng tương sáng trong năm 2024.
Nguồn: PSI
Ở thượng nguồn, giá dầu neo cao thúc đẩy các hoạt động thăm dò, khai thác dầu khí; qua đó các doanh nghiệp dịch vụ dầu khí như: PVD, PVS sẽ hưởng lợi.
Cụ thể, với Tổng công ty CP Khoan và Dịch vụ Khoan Dầu khí – PV Drilling (HOSE: PVD), các giàn khoan của PVD đã ký hợp đồng năm 2024 với các đối tác trong khu vực với giá thuê giàn cao.
Các giàn I, II, III, V, VI có việc làm liên tục trong năm nay. Giàn 11 cũng đã được đối tác tại GBRS tại Algeria gia hạn hợp đồng tới giữa năm 2024. Cùng với đó, các dự án đầu tư thượng nguồn trong nước sẽ là nguồn công việc cho PVD trong trung và dài hạn; đặc biệt là việc khởi động dự án khí Lô B sẽ tác động tích cực đến ngành E&P Việt Nam và thúc đẩy kết quả kinh doanh của doanh nghiệp.
Với Tổng công ty CP Dịch vụ Kỹ thuật Dầu khí Việt Nam – PTSC (HOSE: PVS): mảng M&C tiếp tục là mảng kinh doanh chiến lược, tập trung vào các dự án EPCI ngoài khơi, EPC cho các nhà máy công nghiệp và gần đây là các tuabin gió năng lượng tái tạo. Ngoài việc nhận được FID từ Murphy Oil của Mỹ vào tháng 11/2023 cho dự án Lạc Đà Vàng, PVS còn được trao thư mời thầu có giới hạn (LLOA) cho dự án thượng nguồn khí phát điện Lô B – Ô Môn.
Bên cạnh đó, trong mảng FPSO/FSO: với kỳ vọng giá dầu cao của năm 2024, sự hồi sinh của các hoạt động kinh doanh dầu khí thượng nguồn trong nước và tỷ lệ sử dụng tàu cao, PSI nhận định mảng FPSO/FSO sẽ tiếp tục tạo ra nguồn doanh thu và lợi nhuận ổn định cho PVS.
Ở lĩnh vực trung nguồn, Tổng công ty Khí Việt Nam - PV GAS (HOSE: GAS), giá khí khô và LPG phục hồi trong năm 2024 nhờ giá dầu neo cao khi nhu cầu gia tăng và nguồn cung thắt chặt. Nhu cầu khí khô tiếp tục tăng trưởng đạt mức 2,6% trong năm 2024. Chuỗi dự án khí Lô B – Ô Môn được xúc tiến mạnh.
EVN đã trao lại dự án Nhà máy điện Ô Môn 3 và 4 cho Petrovietnam trong tháng 5/2023, gỡ bỏ một trong những nút thắt quan trọng là đảm bảo đầu ra cho nguồn khí từ Lô B.
Ở lĩnh vực hạ nguồn, biên lợi nhuận lọc dầu vẫn duy trì ở mức cao, tiếp tục tạo thuận lợi cho hoạt động của Công ty CP Lọc hóa dầu Bình Sơn (UPCoM: BSR). Bên cạnh đó, biên lợi nhuận của BSR sẽ có sự cải thiện do nhu cầu tiêu thụ nhiên liệu máy bay tăng trưởng; Crack Spread các sản phẩm dầu Diesel, nhiên liệu máy bay tại khu vực Châu Á đang ở mức cao, theo đà tăng của các loại dầu thành phẩm.
Ngoài ra, Dự án nâng cấp, mở rộng Nhà máy lọc dầu Dung Quất dự kiến sẽ hoàn thành và đưa vào vận hành trong Quý 1 năm 2028 sẽ mang lại lợi thế trong dài hạn cho BSR.",0.5963756380845671,0.4025702939992365,0.0010540797954182
2024-05-22 00:00:00,"PVS: 17.6.2024, tổ chức ĐHCĐ thường niên năm 2024",https://cafef.vn/du-lieu/pvs-1996046/pvs-1762024-to-chuc-dhcd-thuong-nien-nam-2024.chn,,0.416930615901947,0.5788028240203857,0.00426648510619998
2024-05-17 00:00:00,PVS: Nghị quyết HĐQT thống nhất tổ chức ĐHCĐ thường niên năm 2024,https://cafef.vn/du-lieu/pvs-1993830/pvs-nghi-quyet-hdqt-thong-nhat-to-chuc-dhcd-thuong-nien-nam-2024.chn,,0.5363665819168091,0.4493845999240875,0.014248894527554512
2024-04-23 00:00:00,PVS: Quỹ Đầu tư Cổ phiếu Kinh tế Hiện đại VinaCapital đăng ký mua 50.000 cổ phiếu,https://cafef.vn/du-lieu/pvs-1981686/pvs-quy-dau-tu-co-phieu-kinh-te-hien-dai-vinacapital-dang-ky-mua-50000-co-phieu.chn,,0.00234454614110291,0.9816488027572632,0.01600661687552929
2024-04-16 00:00:00,"PVS: 26.4.2024, ngày GDKHQ tổ chức ĐHCĐ thường niên năm 2024",https://cafef.vn/du-lieu/pvs-1996048/pvs-2642024-ngay-gdkhq-to-chuc-dhcd-thuong-nien-nam-2024.chn,,0.38506072759628296,0.5873766541481018,0.027562638744711876
2024-04-09 00:00:00,"PVS: 2.5.2024, chốt DS tổ chức ĐHCĐ thường niên năm 2024",https://cafef.vn/du-lieu/pvs-1973994/pvs-252024-chot-ds-to-chuc-dhcd-thuong-nien-nam-2024.chn,,0.08624007552862167,0.9095017313957214,0.00425820192322135
2024-04-05 00:00:00,PVS: Báo cáo thường niên 2023,https://cafef.vn/du-lieu/pvs-1971660/pvs-bao-cao-thuong-nien-2023.chn,,0.18106357753276825,0.8068055510520935,0.012130907736718655
2024-04-05 00:00:00,PVS: Nghị quyết HĐQT thông qua tổ chức ĐHCĐ thường niên năm 2024,https://cafef.vn/du-lieu/pvs-1972987/pvs-nghi-quyet-hdqt-thong-qua-to-chuc-dhcd-thuong-nien-nam-2024.chn,,0.29230061173439026,0.6964136958122253,0.011285715736448765
2024-04-02 00:06:00,"“Đại gia” dầu khí hưởng lợi lớn từ “siêu dự án” Lô B – Ô Môn: Lợi nhuận cao nhất 8 năm, tiền mặt hơn vạn tỷ, cổ phiếu vừa vượt đỉnh lịch sử",https://cafef.vn/du-lieu/pvs-1969075/dai-gia-dau-khi-huong-loi-lon-tu-sieu-du-an-lo-b-o-mon-loi-nhuan-cao-nhat-8-nam-tien-mat-hon-van-ty-co-phieu-vua-vuot-dinh-lich-su.chn,"Thị trường chứng khoán gặp khó ở vùng đỉnh 19 tháng, cổ phiếu PVS của Tổng CTCP Dịch vụ Kỹ thuật Dầu khí Việt Nam lại vượt đỉnh ngoạn mục. Phiên tăng 3,8% ngay đầu tháng 4 đẩy thị giá PVS lên 40.700 đồng/cp, cao nhất kể từ khi lên sàn chứng khoán (đã điều chỉnh). Vốn hóa thị trường cũng theo đó lập kỷ lục gần 19.500 tỷ đồng, tăng 63% sau một năm, qua đó đưa PVS trở thành cái tên giá trị nhất sàn HNX.
Một trong những động lực thúc đẩy cổ phiếu PVS đi lên là kết quả kinh doanh khởi sắc năm vừa qua. Theo BCTC hợp nhất kiểm toán năm 2023, lợi nhuận sau thuế của PVS đã tăng thêm 160 tỷ so với báo cáo tự lập trước đó. Phần tăng thêm chủ yếu đến từ việc điều chỉnh giảm giá vốn bán hàng và chi phí quản lý doanh nghiệp.
Như vậy, kết thúc năm 2023, PVS ghi nhận doanh thu thuần đạt 19.374 tỷ đồng, tăng 18% so với năm trước. Lãi ròng cũng tăng 12% so với năm 2022, lên mức 1.060 tỷ đồng, cao nhất trong vòng 8 năm qua, kể từ năm 2016. Đây cũng là lần đầu tiên lợi nhuận của PVS trở lại trên mức nghìn tỷ kể từ giai đoạn 2014-2015 khi giá dầu cao ""chót vót"".
Tại thời điểm cuối năm 2023, tổng tài sản của PVS đạt hơn 26.400 tỷ đồng, tăng khoảng 500 tỷ so với đầu năm. Đáng chú ý, ""đại gia"" ngành dầu khí hiện có đến hơn 10.000 tỷ tiền mặt (tiền, tương đương tiền và tiền gửi ngắn hạn), chiếm gần 40% tổng tài sản. Khoản tiền gửi lớn mang về cho PVS hàng trăm tỷ đồng tiền lãi mỗi năm, đóng góp đáng kể vào lợi nhuận của doanh nghiệp này.
Tiền mặt ""rủng rỉnh"" giúp PVS chủ động với các kế hoạch chi tiêu tài chính trong đó có hoạt động chia cổ tức. Từ khi lên sàn năm 2007, chưa năm nào doanh nghiệp này quên chia cổ tức bằng tiền cho cổ đông. Tuy nhiên, mức tỷ lệ cổ tức không quá cao thường dưới 15%, thậm chí 3 năm qua ở mức dưới 10%.
Cú huých từ siêu dự án Lô B – Ô Môn
Về dài hạn, câu chuyện xoay quanh siêu dự án Lô B – Ô Môn (quy mô 12 tỷ USD) đang được kỳ vọng sẽ trở thành cú huých với ngành dầu khí nói chung và PVS cũng không ngoại lệ. Ngày 28/3, Tập đoàn Dầu khí quốc gia Việt Nam (PVN) đã ký kết với đối tác các thỏa thuận thương mại, đánh dấu bước ngoặt quan trọng trong quá trình triển khai chuỗi dự án khí điện Lô B - Ô Môn.
PVS hiện đang tham gia đấu thầu hợp đồng thứ 4 của dự án Lô B với giá trị khoảng 400 triệu USD và hợp đồng cho thuê tàu FSO. Bên cạnh đó, công ty đã nhận được Thư thỏa thuận giới hạn của ba hợp đồng đầu tiên EPCI#1, 2, 3 của dự án phát triển mỏ Lô B, tổng giá trị 1,2 tỷ USD. Ban lãnh đạo PVS thông tin sẽ nhận được Quyết định đầu tư cuối cùng (FID) vào đầu quý 2/2024.
KBSV kỳ vọng FID của dự án sẽ chính thức được trao sẽ giúp PVS có thể tăng tốc thi công và ghi nhận doanh thu trong năm 2024. Các dự án quy mô lớn khác như Lạc Đà Vàng (đã nhận FID); Nam Du U Minh (ký kết thỏa thuận khung mua bán khí) và Sư Tử Trắng 2B (đàm phán Hợp đồng chia sản phẩm dầu khí mới) cũng sẽ tạo ra khối lượng công việc lớn cho PVS giai đoạn 2024-2028.
Bên cạnh đó, PVS còn có lợi thế cạnh tranh lớn trong mảng xây lắp điện gió ngoài khơi tại khu vực Đông Á và Đông Nam Á. Trong tháng 2/2024, lãnh đạo PVS cũng cho biết công ty đã ký mới các hợp đồng và được trao thầu khoảng 1,5 tỷ USD cho các dự án điện gió ngoài khơi. KBSV tạm thời giả định tổng backlog cho các dự án điện gió ngoài khơi quốc tế tiềm năng của PVS đạt khoảng 1 tỷ USD trong giai đoạn 2024-2028.
Theo KBSV, mảng FSO/FPSO thời gian tới được kỳ vọng sẽ được hưởng lợi nhờ sự ấm lên của thị trường E&P nội địa. Hiện PVS đang đấu thầu cho dự án Lạc Đà Vàng. PVS được dự báo sẽ đầu tư một FSO/FPSO trị giá khoảng 300 triệu USD dành riêng cho cả vòng đời dự án (10 năm) dưới hình thức liên kết góp vốn với đối tác. Ngoài ra, PVS cũng đang theo dõi sát sao cơ hội đấu thầu FSO/FPSO cho dự án Lô B Ô Môn.",0.9400030819541892,0.0584739547208755,0.0015229615287994
2024-03-18 00:00:00,PVS: Lindisfarne One Ltd đã mua 50.000 cổ phiếu,https://cafef.vn/du-lieu/pvs-1961934/pvs-lindisfarne-one-ltd-da-mua-50000-co-phieu.chn,,0.09475675970315933,0.3005619943141937,0.6046811938285828
2024-03-14 00:00:00,PVS: Quỹ đầu tư Cổ phiếu tiếp cận thị trường VinaCapital đã mua 400.000 cổ phiếu,https://cafef.vn/du-lieu/pvs-1959469/pvs-quy-dau-tu-co-phieu-tiep-can-thi-truong-vinacapital-da-mua-400000-co-phieu.chn,,0.010536989197134972,0.6086727380752563,0.3807902932167053
2024-03-07 00:00:00,PVS: Quỹ Đầu tư Cổ phiếu Kinh tế Hiện đại VinaCapital đã mua 50.000 cổ phiếu,https://cafef.vn/du-lieu/pvs-1955735/pvs-quy-dau-tu-co-phieu-kinh-te-hien-dai-vinacapital-da-mua-50000-co-phieu.chn,,0.0076500470750033855,0.9462290406227112,0.04612087458372116
2024-03-01 00:00:00,POS: Nghị quyết HĐQT thông qua hợp đồng thuê tàu,https://cafef.vn/du-lieu/pvs-1952192/pos-nghi-quyet-hdqt-thong-qua-hop-dong-thue-tau.chn,,0.03790109604597092,0.9300486445426941,0.032050274312496185
2024-02-28 13:20:00,"Đại gia Trung Đông Saudi Aramco hoãn mở rộng khai thác dầu, công ty ngành dầu khí Việt Nam ảnh hưởng ra sao?",https://cafef.vn/du-lieu/pvs-1951141/dai-gia-trung-dong-saudi-aramco-hoan-mo-rong-khai-thac-dau-cong-ty-nganh-dau-khi-viet-nam-anh-huong-ra-sao.chn,"Theo Vietcap, kế hoạch mở rộng bị trì hoãn của Saudi Aramco là do công suất dự phòng hiện tại, vì hiện tại chỉ sản xuất 9 triệu thùng/ngày, do đó không cần đầu tư mới trong ngắn hạn. Vietcap cũng lưu ý rằng nếu không tiếp tục đầu tư, công suất sản xuất dầu hiện tại là 12 triệu thùng/ngày sẽ giảm xuống còn khoảng 10,5 triệu thùng/ngày trong năm 2027, qua đó cho thấy tầm quan trọng của các dự án mở rộng. Vì vậy, Vietcap cho rằng việc đầu tư này vẫn cần thiết trong dài hạn và có thể được Saudi Aramco xem xét lại.
Bên cạnh đó, Saudi Aramco cho biết chi phí vốn ban đầu được phân bổ để tăng năng lực sản xuất sẽ được chuyển sang lĩnh vực khí, chất lỏng và hóa chất. Saudi Aramco cho biết công ty sẽ cập nhật hướng dẫn về vốn đầu tư vào tháng 3 năm 2024.
Trong 1 báo cáo của SSI Research, các chuyên gia chứng khoán lưu ý rằng chu kỳ tăng trưởng hiện tại của ngành khoan chủ yếu được thúc đẩy nhờ công suất sản xuất dầu tăng mạnh từ Trung Đông, do đó, bất kỳ sự thay đổi nào trong chiến lược này đều có thể dẫn đến sự thay đổi chu kỳ tăng trưởng hiện tại của ngành khoan.
Trong khi chờ đợi chiến lược mới của Saudi Aramco, Vietcap vẫn giữ đánh giá tích cực về chi tiêu thượng nguồn toàn cầu do Trung Đông và Saudi Aramco dẫn đầu và đánh giá khả quan cho cổ phiếu của 2 doanh nghiệp dầu khí thượng nguồn Tổng Công ty Cổ phần Dịch vụ Kỹ thuật Dầu khí Việt Nam (PVS) và Tổng Công ty Cổ phần Khoan và Dịch vụ Khoan Dầu khí (PVD).
Theo S&P Global, chi tiêu cho các hoạt động thăm dò và sản xuất toàn cầu sẽ tăng trưởng với tốc độ tăng trưởng kép (CAGR) là 4% trong giai đoạn 2023-2027.
Ngoài dầu mỏ, Saudi Aramco đang theo đuổi các cơ hội trong tất cả các ngành năng lượng, bao gồm cả hydro và năng lượng mặt trời. Aramco tuyên bố vào tháng 1 rằng công ty đã tăng hơn gấp đôi mức chi cho các quỹ đầu tư mạo hiểm lên 7,5 tỷ USD như một phần trong khoản đầu tư vào năng lượng mới.
Thị trường chứng khoán phiên 28/2 bất ngờ chứng kiến giao dịch bùng nổ trên nhóm cổ phiếu dầu khí. Các cổ phiếu như BSR, PVS, PVB, PVT, PVC, PLX, OIL,… đồng loạt tăng mạnh với mức tăng phổ biến trên 2%. Đáng chú ý nhất là PVD khi cổ phiếu này nhanh chóng tăng kịch trần ""trắng bên bán"" chỉ ít phút sau khi mở phiên qua đó leo lên mức cao nhất trong vòng 9 năm.",0.1866842740617169,0.8095967030046776,0.0037190437343759
2024-02-28 00:00:00,PVS: Đính chính Thông báo Giao dịch cổ phiếu của Người liên quan đến người nội bộ - Lindisfarne One Ltd,https://cafef.vn/du-lieu/pvs-1951101/pvs-dinh-chinh-thong-bao-giao-dich-co-phieu-cua-nguoi-lien-quan-den-nguoi-noi-bo-lindisfarne-one-ltd.chn,,0.05092241242527962,0.2609596252441406,0.688118040561676
2024-02-27 00:00:00,PVS: Công ty cổ phần Quản lý quỹ VinaCapital - đã mua 150.000 CP,https://cafef.vn/du-lieu/pvs-1950688/pvs-cong-ty-co-phan-quan-ly-quy-vinacapital-da-mua-150000-cp.chn,,0.03230699896812439,0.21980781853199005,0.7478852272033691
2024-02-27 00:00:00,PVS: Lindisfarne One Ltd - đăng ký mua 500.000 CP,https://cafef.vn/du-lieu/pvs-1951058/pvs-lindisfarne-one-ltd-dang-ky-mua-500000-cp.chn,,0.06379888951778412,0.7616298794746399,0.17457132041454315
2024-02-27 00:00:00,PVS: Lindisfarne One Ltd - đăng ký mua 50.000 CP,https://cafef.vn/du-lieu/pvs-1951075/pvs-lindisfarne-one-ltd-dang-ky-mua-50000-cp.chn,,0.14010632038116455,0.4740724563598633,0.3858211636543274
2024-02-15 00:00:00,PVS: Quỹ Đầu tư Cổ phiếu Kinh tế Hiện đại VinaCapital - đã mua 20.000 CP,https://cafef.vn/du-lieu/pvs-1944943/pvs-quy-dau-tu-co-phieu-kinh-te-hien-dai-vinacapital-da-mua-20000-cp.chn,,0.262525737285614,0.5797713994979858,0.15770287811756134
2024-02-15 00:00:00,PVS: Quỹ đầu tư Cổ phiếu tiếp cận thị trường VinaCapital - đăng ký mua 400.000 CP,https://cafef.vn/du-lieu/pvs-1944947/pvs-quy-dau-tu-co-phieu-tiep-can-thi-truong-vinacapital-dang-ky-mua-400000-cp.chn,,0.011502244509756565,0.7969861030578613,0.1915116161108017
2024-02-15 00:00:00,PVS: Công ty cổ phần Quản lý quỹ VinaCapital - đăng ký mua 150.000 CP,https://cafef.vn/du-lieu/pvs-1944949/pvs-cong-ty-co-phan-quan-ly-quy-vinacapital-dang-ky-mua-150000-cp.chn,,0.0037466234061867,0.8303433060646057,0.1659100502729416
2024-02-15 00:00:00,PVS: Quỹ Đầu tư Cổ phiếu Kinh tế Hiện đại VinaCapital - đăng ký mua 50.000 CP,https://cafef.vn/du-lieu/pvs-1944966/pvs-quy-dau-tu-co-phieu-kinh-te-hien-dai-vinacapital-dang-ky-mua-50000-cp.chn,,0.013751008547842503,0.9665839672088623,0.019665053114295006
2024-02-06 00:00:00,PVS: Nghị quyết Đại hội đồng cổ đông bất thường năm 2024,https://cafef.vn/du-lieu/pvs-1941721/pvs-nghi-quyet-dai-hoi-dong-co-dong-bat-thuong-nam-2024.chn,,0.038960907608270645,0.9541923999786377,0.006846657954156399
2024-02-01 00:00:00,PVS: Báo cáo quản trị công ty năm 2023,https://cafef.vn/du-lieu/pvs-1941195/pvs-bao-cao-quan-tri-cong-ty-nam-2023.chn,,0.006029075942933559,0.9877707958221436,0.006200100760906935
2024-01-26 00:00:00,PVS: Báo cáo thay đổi sở hữu của nhóm nhà đầu tư nước ngoài nắm giữ từ 5% trở lên,https://cafef.vn/du-lieu/pvs-1936795/pvs-bao-cao-thay-doi-so-huu-cua-nhom-nha-dau-tu-nuoc-ngoai-nam-giu-tu-5-tro-len.chn,,0.004705974366515875,0.012683836743235588,0.9826101660728455
2024-01-24 00:00:00,PVS: Quỹ Đầu tư Cổ phiếu Kinh tế Hiện đại VinaCapital - đăng ký mua 20.000 CP,https://cafef.vn/du-lieu/pvs-1935545/pvs-quy-dau-tu-co-phieu-kinh-te-hien-dai-vinacapital-dang-ky-mua-20000-cp.chn,,0.013795722275972366,0.961884617805481,0.02431967854499817
2024-01-23 00:00:00,PVS: Quỹ Đầu tư Cổ phiếu Kinh tế Hiện đại VinaCapital - đã mua 27.730 CP,https://cafef.vn/du-lieu/pvs-1935113/pvs-quy-dau-tu-co-phieu-kinh-te-hien-dai-vinacapital-da-mua-27730-cp.chn,,0.050960034132003784,0.9125539064407349,0.03648601472377777
2024-01-17 11:35:00,PVS xin ý kiến cổ đông triển khai gói thầu dự án Khí Lô B – Ô Môn trị giá gần nửa tỷ USD,https://cafef.vn/du-lieu/pvs-1931545/pvs-xin-y-kien-co-dong-trien-khai-goi-thau-du-an-khi-lo-b-o-mon-tri-gia-gan-nua-ty-usd.chn,"PVS: Tổng Công ty Cổ phần Dịch vụ Kỹ thuật Dầu khí Việt Nam
Tổng CTCP Dịch vụ Kỹ thuật Dầu khí Việt Nam (PTSC, mã chứng khoán PVS) vừa công bố tài liệu họp ĐHĐCĐ bất thường năm 2024, nhằm xin ý kiến cổ đông chấp thuận cho công ty triển khai một dự án ""Thiết kế, mua sắm, thi công và lắp đặt giàn công nghệ trung tâm, giàn nhà ở và tháp đuốc (EPCI#1)"" thuộc chuỗi dự án Khí Lô B - Ô Môn. Bên trao thầu là công ty Điều hành Dầu khí Phú Quốc (PQPOC) - một chi nhánh của Tập đoàn Dầu khí Việt Nam (PVN), đồng thời PVN cũng là công ty mẹ của PTSC.
Bên nhậu thầu là liên doanh McDermott Asia Pacific Sdn. Bhd. và PTSC.
Gói thầu EPCI#1 có tổng giá trị gần 1,1 tỷ USD. Trong đó, phần việc của PVS có giá trị gần 493 triệu USD, thực hiện trong 38 tháng; bao gồm một số công việc như thiết kế FEED, lắp ráp và hoàn công, mua sắm trang thiết bị, chế tạo cấu kiện, hạ thủy và đấu nối...
Trước đó vào ngày 31/10/2023, HĐQT PVS đã chấp thuận nội dung Thư trao thầu giới hạn (LLOA) cho gói thầu này. Khí Lô B là chuỗi dự án khí lớn nhất từ trước đến nay với nhiều gói thầu quan trọng. Theo ước tính của Công ty, lợi nhuận tạo ra chỉ riêng với hợp đồng EPCI#1 là khoảng 4% trên giá trị hợp đồng, đồng thời nâng cao năng lực quốc tế khi lần đầu tiên chế tạo được khối thượng tầng đến 23.000 tấn.
Chuỗi dự án khí Lô B - Ô Môn bao gồm các 3 dự án thành phần: Dự án phát triển mỏ Lô B (thượng nguồn), Dự án đường ống dẫn khí Lô B - Ô Môn (trung nguồn) và 4 nhà máy điện khí Ô Môn (hạ nguồn) với tổng quy mô đến 12 tỷ USD. Mục tiêu của dự án thành phần này là thu gom nguồn khí với tổng trữ lượng dự kiến 3,78 tỷ bộ khối (khoảng 107 tỷ m3) và 12,65 triệu thùng condensate, sản lượng khí về bờ 5,06 tỷ m3/năm do PQPOC quản lý dự án.",0.1333226978836595,0.8656107843384262,0.001066512957282
2024-01-16 00:00:00,PVS: Tài liệu họp Đại hội đồng cổ đông,https://cafef.vn/du-lieu/pvs-1930896/pvs-tai-lieu-hop-dai-hoi-dong-co-dong.chn,,0.027426084503531456,0.9176129102706909,0.054961059242486954
2024-01-16 00:00:00,PVS: Nghị quyết Hội đồng quản trị v.v triệu tập hợp Đại hội đồng Cổ đông bất thường năm 2024,https://cafef.vn/du-lieu/pvs-1930957/pvs-nghi-quyet-hoi-dong-quan-tri-vv-trieu-tap-hop-dai-hoi-dong-co-dong-bat-thuong-nam-2024.chn,,0.15948829054832458,0.791615903377533,0.04889581352472305
2024-01-15 00:00:00,PVS: Quỹ Đầu tư Cổ phiếu Kinh tế Hiện đại VinaCapital - đăng ký mua 27.730 CP,https://cafef.vn/du-lieu/pvs-1930470/pvs-quy-dau-tu-co-phieu-kinh-te-hien-dai-vinacapital-dang-ky-mua-27730-cp.chn,,0.002063671126961708,0.98723965883255,0.010696621611714363
2024-01-11 00:00:00,PQN: Nghị quyết HĐQT ký hợp đồng với Dịch vụ Dầu khí Đà Nẵng,https://cafef.vn/du-lieu/pvs-1928516/pqn-nghi-quyet-hdqt-ky-hop-dong-voi-dich-vu-dau-khi-da-nang.chn,,0.0034834453836083412,0.9961321353912354,0.00038448013947345316
2023-12-19 00:00:00,"PVS: 22.12.2023, ngày GDKHQ Đại hội đồng cổ đông bất thường năm 2023",https://cafef.vn/du-lieu/pvs-1916779/pvs-22122023-ngay-gdkhq-dai-hoi-dong-co-dong-bat-thuong-nam-2023.chn,,,,
2023-12-14 00:00:00,PVS: Nghị quyết Hội đồng quản trị chấp thuận giao dịch với người có liên quan,https://cafef.vn/du-lieu/pvs-1914613/pvs-nghi-quyet-hoi-dong-quan-tri-chap-thuan-giao-dich-voi-nguoi-co-lien-quan.chn,,,,
2023-12-12 00:00:00,PVS: Ngày ĐKCC để thực hiện quyền tham dự Họp Đại hội đồng Cổ đông bất thường năm 2023,https://cafef.vn/du-lieu/pvs-1913382/pvs-ngay-dkcc-de-thuc-hien-quyen-tham-du-hop-dai-hoi-dong-co-dong-bat-thuong-nam-2023.chn,,,,
