Thời gian,Tiêu đề,URL,Nội dung,positive,neutral,negative
2024-12-03 07:22:00,Việt Nam trúng nhiều gói thầu chế tạo chân giàn dự án điện gió ngoài khơi,https://cafef.vn/du-lieu/pvs-2092887/viet-nam-trung-nhieu-goi-thau-che-tao-chan-gian-du-an-dien-gio-ngoai-khoi.chn,"Theo đó, trước những yêu cầu cấp bách về chống biến đổi khí hậu và các cam kết đạt Net-zero của các quốc gia, điện gió ngoài khơi (ĐGNK) nổi lên như một trong những lĩnh vực có tiềm năng phát triển lớn nhất. Nắm bắt xu hướng này, với sứ mệnh tiên phong trong lĩnh vực năng lượng, ngay từ năm 2019, Petrovietnam và một số đơn vị thành viên, nổi bật là PTSC, đã tập trung đánh giá, nghiên cứu vấn đề dịch chuyển năng lượng để điều chỉnh, bắt kịp các xu hướng, tận dụng tối đa thế mạnh. Trong đó, định hướng xu hướng dịch chuyển sang năng lượng xanh, sạch thông qua nâng cao tỷ trọng khí, sản xuất H2 và đặc biệt là phát triển ĐGNK.
Petrovietnam với vai trò là Công ty Dầu khí quốc gia luôn đặt mục tiêu phát triển gắn liền với mục tiêu chung của đất nước - đã điều chỉnh chiến lược đến năm 2030, tầm nhìn đến năm 2045 với mục tiêu đến năm 2030 phấn đấu nâng tổng công suất đặt đạt 8.000-14.000 MW và tỷ trọng nguồn điện tái tạo chiếm 5%-10% tổng công suất đặt của Petrovietnam. Đến 2045, Petrovietnam phấn đấu nâng công suất đặt chiếm 8%-10% tổng công suất hệ thống điện Việt Nam và tỷ trọng nguồn năng lượng tái tạo chiếm 10%-20% trong tổng công suất nguồn điện Petrovietnam.
Để chuẩn bị nguồn lực sẵn sàng cho cuộc đua năng lượng tái tạo ngoài khơi, Petrovietnam đã và đang chủ động xây dựng chuỗi cung ứng nội địa bao gồm các đơn vị thành viên có nhiều tiềm năng, như PTSC, Vietsovpetro, VPI, PVE, PETROSETCO, PV Drilling, PVC-MS, PV Shipyard… Bên cạnh đó, các đơn vị chủ lực của Petrovietnam về thiết kế, chế tạo, xây lắp và vận hành các công trình dầu khí biển như PTSC, Vietsovpetro, PETROCONs… với năng lực, kinh nghiệm, cơ sở hạ tầng sẵn có, đã được Tập đoàn giao nhiệm vụ nghiên cứu, thành lập tổ hợp phát triển chuỗi giá trị năng lượng tái tạo, tăng cường khả năng hợp tác, phát huy năng lực của nhau, phối hợp tìm kiếm cơ hội tham gia vào các dự án năng lượng tái tạo ngoài khơi (NLTTNK) trong và ngoài nước.
Đặc biệt, những nỗ lực của Petrovietnam trong việc phát triển lĩnh vực ĐGNK đã được minh chứng trong những năm gần đây, khi PTSC- đơn vị thành viên của Tập đoàn, đã chủ động tham gia cung cấp dịch vụ điện gió, ĐGNK cho nhiều nhà thầu trong và ngoài nước và đã đạt được những thành công hiện hữu.
Để chạy đà cho các dự án phát triển ĐGNK, trước đó PTSC đã bổ sung lĩnh vực điện gió vào ngành nghề kinh doanh, công tác marketing, tìm kiếm đối tác thông qua các hội thảo chuyên ngành về lĩnh vực điện gió của các đại sứ quán của các nước có năng lực về ĐGNK như Đan Mạch, Hà Lan, Đức… đến cập nhật thông tin cũng như các xu hướng chiến lược phát triển ĐGNK của Việt Nam và các quốc gia lớn trên thế giới.
PTSC đã có những bước chuyển dịch mạnh mẽ sang lĩnh vực năng lượng tái tạo, điển hình là việc đấu thầu quốc tế, trúng thầu hợp đồng chế tạo và cung cấp 33 chân đế điện gió ngoài khơi, dự án Greater Changhua 2b&4 (CHW2204) cho khách hàng Orsted (Đan Mạch). Đây là lần đầu tiên Việt Nam có được hợp đồng xuất khẩu giá trị lớn trong lĩnh vực rất mới là năng lượng tái tạo ngoài khơi. Việc trúng thầu và thực hiện hợp đồng này, không những tạo ra bước ngoặt lịch sử cho PTSC trong việc phát triển dịch vụ mới, nâng tầm thương hiệu dịch vụ kỹ thuật dầu khí Việt Nam, mà còn lần đầu tiên ghi danh Việt Nam trên bản đồ năng lượng tái tạo ngoài khơi thế giới.
Tiếp theo thành công tại dự án điện gió ngoài khơi CHW2204, PTSC đã tiếp tục đấu thầu và trúng thầu cung cấp chân đế trụ điện gió cho dự án điện gió ngoài khơi (quy mô lớn hơn dự án CHW2204) của khách hàng quốc tế tại thị trường Châu Á - Thái Bình Dương. Bên cạnh đó, PTSC cũng bắt đầu bước vào giai đoạn khởi công chế tạo 4 trạm biến áp ngoài khơi (OSS) cho dự án điện gió ngoài khơi Baltica 02 tại biển Baltic - một trong những dự án điện gió lớn nhất trên thế giới. Đây là lần đầu tiên một doanh nghiệp Việt Nam trúng thầu và xuất khẩu các trạm biến áp ĐGNK sang châu Âu, thị trường hàng đầu thế giới về ĐGNK, bên cạnh 5 trạm biến áp khác đã và đang xuất khẩu sang khu vực châu Á – Thái Bình Dương.
Để đánh dấu các thành tựu đặc biệt ý nghĩa đã đạt được thời gian qua, hướng tới các mục tiêu phát triển trong giai đoạn tới, Petrovietnam phối hợp với PTSC và các đối tác quốc tế tổ chức chuỗi sự kiện bao gồm: lễ hạ thủy và bàn giao chân đế ĐGNK dự án CHW2204; lễ ký hợp đồng chế tạo và cung cấp chân đế ĐGNK; lễ khởi công các trạm biến áp - dự án Baltica 02; lễ khởi công giàn CPP - dự án lô B; lễ ký hợp đồng FSO Lạc Đà Vàng.
Việc trúng thầu và thực hiện hàng loạt các hợp đồng lớn trong lĩnh vực NLTTNK trong thời gian vừa qua đã trở thành những bước khởi đầu vững chắc, giúp Petrovietnam - PTSC góp phần hiện thực hóa Quy hoạch phát triển điện lực quốc gia thời kỳ 2021-2030, tầm nhìn đến 2050 (Quy hoạch Điện 8); từng bước hình thành nên Trung tâm công nghiệp NLTTNK tại Bà Rịa Vũng Tàu và khu vực Đông Nam bộ, tạo lập hệ sinh thái công nghiệp NLTTNK hoàn chỉnh với nhiều doanh nghiệp trong nước tham gia vào chuỗi cung ứng, nâng cao năng lực thiết kế, chế tạo, nâng cao tỷ lệ nội địa hóa, chủ động trong việc thực hiện các dự NLTTNK tại Việt Nam trong tương lai.",0.97599204705865,0.0235573034447421,0.0004506548373213
2024-12-03 00:00:00,"PVS: Amersham Industries Limited, Norges Bank đã mua 1.400.000 cp, 20.000 cp",https://cafef.vn/du-lieu/pvs-2093644/pvs-amersham-industries-limited-norges-bank-da-mua-1400000-cp-20000-cp.chn,,0.09022549539804459,0.8828439116477966,0.02693057805299759
2024-11-29 00:00:00,PVS: Vietnam Investment Property Holding Limited đăng ký bán 8.000.000 cổ phiếu,https://cafef.vn/du-lieu/pvs-2091734/pvs-vietnam-investment-property-holding-limited-dang-ky-ban-8000000-co-phieu.chn,,0.019893068820238113,0.8959811925888062,0.08412574976682663
2024-11-26 00:00:00,PVS: Quỹ Đầu tư Cổ phiếu Kinh tế Hiện đại VinaCapital đã mua 400.000 cổ phiếu,https://cafef.vn/du-lieu/pvs-2090122/pvs-quy-dau-tu-co-phieu-kinh-te-hien-dai-vinacapital-da-mua-400000-co-phieu.chn,,0.011150192469358444,0.8783032894134521,0.11054656654596329
2024-11-26 00:00:00,PVS: Quỹ đầu tư Cổ phiếu tiếp cận thị trường VinaCapital đã mua 300.000 cổ phiếu,https://cafef.vn/du-lieu/pvs-2090123/pvs-quy-dau-tu-co-phieu-tiep-can-thi-truong-vinacapital-da-mua-300000-co-phieu.chn,,0.010922635905444622,0.6989967226982117,0.29008060693740845
2024-11-15 00:00:00,"PVS: Ông Lê Chiến Thắng làm Phó TGĐ, ông Tạ Đức Tiến không làm Phó TGĐ từ 12.11.2024",https://cafef.vn/du-lieu/pvs-2084809/pvs-ong-le-chien-thang-lam-pho-tgd-ong-ta-duc-tien-khong-lam-pho-tgd-tu-12112024.chn,,0.12954646348953247,0.008912843652069569,0.861540675163269
2024-11-06 00:00:00,"PVS: 13.11.2024, ngày GDKHQ trả cổ tức năm 2023 (700 đ/cp)",https://cafef.vn/du-lieu/pvs-2080249/pvs-13112024-ngay-gdkhq-tra-co-tuc-nam-2023-700-dcp.chn,,0.014708612114191055,0.9690595865249634,0.016231756657361984
2024-11-05 00:00:00,PVS: Quỹ Đầu tư Cổ phiếu Kinh tế Hiện đại VinaCapital đăng ký mua 400.000 cổ phiếu,https://cafef.vn/du-lieu/pvs-2079839/pvs-quy-dau-tu-co-phieu-kinh-te-hien-dai-vinacapital-dang-ky-mua-400000-co-phieu.chn,,0.0023348380345851183,0.9780615568161011,0.019603660330176353
2024-11-05 00:00:00,PVS: Quỹ đầu tư Cổ phiếu tiếp cận thị trường VinaCapital đăng ký mua 300.000 cổ phiếu,https://cafef.vn/du-lieu/pvs-2079840/pvs-quy-dau-tu-co-phieu-tiep-can-thi-truong-vinacapital-dang-ky-mua-300000-co-phieu.chn,,0.005015847273170948,0.7969356179237366,0.19804853200912476
2024-11-01 08:02:00,"PSI: Dự báo giá dầu giảm trong năm 2025, các DN dầu khí ra sao?",https://cafef.vn/du-lieu/pvs-2077590/psi-du-bao-gia-dau-giam-trong-nam-2025-cac-dn-dau-khi-ra-sao.chn,"Nguồn cung dầu dự kiến gia tăng trong năm 2025
Theo IEA, tổng nhu cầu dầu thế giới được dự báo sẽ chỉ tăng khoảng hơn 0,9 triệu thùng/ngày, đạt mức 102,8 triệu thùng/ngày (+1,2% YoY) trong năm 2024. Giảm 0,4 triệu thùng/ngày so với dự báo đầu năm. Nguyên nhân chính của sự suy giảm này đến từ việc tăng trưởng tiêu thụ dầu ở Trung Quốc đang chậm lại nhanh chóng.
Năm 2025, IEA dự báo nhu cầu dầu toàn cầu sẽ tăng nhẹ 0,95 triệu thùng/ngày, tổng mức tiêu thụ dầu đạt mức 103,8 triệu thùng/ngày. Nguyên nhân do kinh tế toàn cầu được dự báo sẽ phục hồi chậm và sự phát triển mạnh mẽ của năng lượng tái tạo.
Nguồn: IEA, PSI tổng hợp
Mặt khác, IEA dự báo nguồn cung dầu toàn cầu năm 2024 tăng 0,66 triệu thùng/ngày lên mức 101,8 triệu thùng/ngày. Sản lượng dầu từ các nước bên ngoài OPEC+ có thể tăng thêm 1,5 triệu thùng/ngày. Trong khi đó, sản lượng của OPEC+ dự báo giảm khoảng 0,81 triệu thùng/ngày.
Năm 2025, tổ chức này đánh giá nguồn cung dầu được dự báo tiếp tục gia tăng do nhóm OPEC+ có thể tiến hành nới lỏng sản lượng cắt giảm. Theo đó, nguồn cung dầu có thể tăng thêm 2,1 triệu thùng/ngày, riêng nhóm OPEC+ tăng thêm 0,51 triệu thùng/ngày. Điều này có thể khiến cho thị trường ở trạng thái dư cung trong năm 2025.
PSI kỳ vọng giá dầu sẽ quanh mức 70-80 USD/thùng trong năm 2025 trong với giả định căng thẳng tại Trung Đông không tiếp tục leo thang. Mức giá này vẫn mang lại lợi nhuận đối với các doanh nghiệp khai thác và có thể hỗ trợ phần nào sự phục hồi chung của nền kinh tế thế giới.
Các doanh nghiệp Dầu khí sẽ bị ảnh hưởng ra sao?
Theo PSI, các hoạt động thăm dò, khai thác và vận tải dầu khí vẫn đang được triển khai trong bối cảnh các mỏ cũ đã đi vào giai đoạn suy giảm. Các dự án nổi bật như Lô B, Sư Tử Trắng 2B và Lạc Đà Vàng. Trong số đó, dự án Lô B được chú ý hơn cả và là động lực chính của ngành dầu khí.
Nguồn: PSI tổng hợp
Vẫn còn những trở ngại trong việc giải quyết FID, đặc biệt là việc ký kết GSPA/GSA với cả sản lượng cam kết, giá khí và quyết định đầu tư cuối cùng cho dự án nhà máy điện Ô Môn 3 & 4.
Tuy nhiên, với việc vào ngày 18/09/2024, PVN thông báo dự án Lô B - Ô Môn đã chính thức khởi công xây dựng, các gói thầu EPCI 1 và EPCI 2 thuộc khâu thượng nguồn được triển khai, PSI cho rằng FID đối với đại dự án sắp được chính thức thông qua. Tin tức cập nhật về dự án sẽ tiếp tục hỗ trợ giá cổ phiếu ngành dầu khí, đặc biệt là các công ty thượng nguồn.
Nguồn: PSI tổng hợp
Với việc các hoạt động thăm dò, khai thác và vận tải dầu khí vẫn đang được triển khai, PSI dự báo một số doanh nghiệp liên quan hưởng lợi và có triển vọng tốt trong năm 2024 – 2025.
Cụ thể như, với Tổng công ty CP Khoan và Dịch vụ Khoan Dầu khí – PV Drilling (HSX: PVD), các giàn khoan của PVD đã ký hợp đồng năm 2025 với các đối tác trong khu vực với giá thuê giàn cao. PVD cũng có tiềm năng thuê 2 giàn khoan và có các hợp đồng dịch vụ giếng khoan cho dự án Lô B (tổng giá trị hợp đồng ước tính đạt 2 tỷ USD).
Với Tổng công ty CP Dịch vụ Kỹ thuật Dầu khí Việt Nam – PTSC (HSX: PVS), dự án Lô B có thể đem về cho PVS 5,8 tỷ USD từ các hợp đồng M&C bắt đầu từ năm 2024 và 1 hợp đồng cho thuê kho nổi chứa dầu bắt đầu từ năm 2028. Bắt đầu từ khoảng cuối năm 2024, PVS có thể bắt đầu ghi nhận doanh thu từ các hợp đồng EPCI 1,2,3. Ngoài ra, PVS cũng có mảng kinh doanh tiềm năng từ việc phát triển thị trường năng lượng tái tạo điện gió ngoài khơi với vai trò là nhà thầu và chủ đầu tư.
Ở lĩnh vực trung nguồn, Tổng công ty CP Vận tải Dầu khí (HSX: PVT) có triển vọng tích cực năm 2025 bao gồm mảng tàu chở dầu thô, tàu chở LPG và tàu chở hàng rời. Công ty chủ yếu tham gia thị trường thuê tàu định hạn trên thị trường quốc tế nên sự biến động trên thị trường giao ngay sẽ không ảnh hưởng đến lợi nhuận của công ty.
Trong khi đó, triển vọng cho Tổng Công ty Khí Việt Nam (HSX: GAS) là giá khí khô và LPG hồi phục trong năm 2024 nhờ giá dầu duy trì trong khoảng 70-80 USD/thùng, trong khi nhu cầu khí khô tiếp tục tăng trưởng đạt mức 2,6% trong năm 2024.
Ở hạ nguồn, đã có dấu hiệu cho thấy crack spread của các sản phẩm đang hồi phục đáng kể từ khi chạm đáy vào tháng 6/2024. PSI kỳ vọng xu hướng này sẽ tiếp diễn cho tới cuối năm, khi nhu cầu tiêu thụ của các sản phẩm này trên thế giới sẽ được cải thiện, theo đó, tạo thuận lợi cho hoạt động của Công ty CP Lọc hóa dầu Bình Sơn (UPCoM: BSR).
Ngoài ra, ngày 27/5, TAND tỉnh Quảng Ngãi đã mở thủ tục phá sản đối với CTCP Nhiên liệu sinh học Dầu khí Miền Trung (BSR-BF). Do đó, công ty này không còn là công ty con của BSR. Điều này sẽ khiến cho tiến trình chuyển sàn niêm yết của BSR diễn ra thuận lợi hơn.",0.544858521027031,0.4449361549659735,0.0102053523006591
2024-11-01 00:00:00,"PVS: 14.11.2024, chốt DS trả cổ tức năm 2023 (700 đ/cp)",https://cafef.vn/du-lieu/pvs-2078098/pvs-14112024-chot-ds-tra-co-tuc-nam-2023-700-dcp.chn,,0.0023282410111278296,0.9844713807106018,0.013200336135923862
2024-10-31 00:00:00,PVS: Nghị quyết HĐQT trả cổ tức năm 2023 (700 đ/cp),https://cafef.vn/du-lieu/pvs-2077624/pvs-nghi-quyet-hdqt-tra-co-tuc-nam-2023-700-dcp.chn,,0.0006270663579925895,0.998660683631897,0.0007122646202333272
2024-09-26 00:00:00,PVS: Nghị quyết HĐQT thông qua hợp đồng thuộc dự án khí lô B Việt Nam,https://cafef.vn/du-lieu/pvs-2059513/pvs-nghi-quyet-hdqt-thong-qua-hop-dong-thuoc-du-an-khi-lo-b-viet-nam.chn,,0.003382770111784339,0.9961220622062683,0.000495111511554569
2024-09-25 00:00:00,PVS: Kiwoom Vietnam Tomorrow Securities Master Fund đã bán toàn bộ 200.000 cổ phiếu,https://cafef.vn/du-lieu/pvs-2059109/pvs-kiwoom-vietnam-tomorrow-securities-master-fund-da-ban-toan-bo-200000-co-phieu.chn,,0.017293192446231842,0.9389234781265259,0.04378333315253258
2024-09-25 00:00:00,PVS: Delta Global Financial Holdings Private Limited đã bán toàn bộ 150.000 cổ phiếu,https://cafef.vn/du-lieu/pvs-2059112/pvs-delta-global-financial-holdings-private-limited-da-ban-toan-bo-150000-co-phieu.chn,,0.02218441851437092,0.49563321471214294,0.4821823239326477
2024-09-25 00:00:00,PVS: Lindisfarne One Ltd đã bán toàn bộ 50.000 cổ phiếu,https://cafef.vn/du-lieu/pvs-2059113/pvs-lindisfarne-one-ltd-da-ban-toan-bo-50000-co-phieu.chn,,0.026130015030503273,0.44972798228263855,0.5241420269012451
2024-09-18 00:00:00,PVS: Ông Nguyễn Trần Toàn không làm Phó TGĐ từ 16.9.2024,https://cafef.vn/du-lieu/pvs-2055517/pvs-ong-nguyen-tran-toan-khong-lam-pho-tgd-tu-1692024.chn,,0.08036482334136963,0.003149579279124737,0.9164855480194092
2024-09-11 00:00:00,PVS: Lindisfarne One Ltd đăng ký bán toàn bộ 50.000 cổ phiếu,https://cafef.vn/du-lieu/pvs-2052329/pvs-lindisfarne-one-ltd-dang-ky-ban-toan-bo-50000-co-phieu.chn,,0.0322926789522171,0.7596445083618164,0.2080628126859665
2024-09-11 00:00:00,PVS: Kiwoom Vietnam Tomorrow Securities Master Fund[Equity] đăng ký bán toàn bộ 200.000 cổ phiếu,https://cafef.vn/du-lieu/pvs-2052331/pvs-kiwoom-vietnam-tomorrow-securities-master-fundequity-dang-ky-ban-toan-bo-200000-co-phieu.chn,,0.030387675389647484,0.9619286060333252,0.007683782838284969
2024-09-11 00:00:00,PVS: Delta Global Financial Holdings Private Limited đăng ký bán toàn bộ 150.000 cổ phiếu,https://cafef.vn/du-lieu/pvs-2052332/pvs-delta-global-financial-holdings-private-limited-dang-ky-ban-toan-bo-150000-co-phieu.chn,,0.029928147792816162,0.8362603783607483,0.13381150364875793
2024-09-11 00:00:00,PVS: Quỹ Đầu tư Cổ phiếu Kinh tế Hiện đại VinaCapital đã mua 200.000 cổ phiếu,https://cafef.vn/du-lieu/pvs-2052337/pvs-quy-dau-tu-co-phieu-kinh-te-hien-dai-vinacapital-da-mua-200000-co-phieu.chn,,0.010520822368562222,0.9052579402923584,0.08422119915485382
2024-08-20 00:00:00,"PVS: Thay đổi sở hữu của nhóm cổ đông Amersham Industries Limited, Norges Bank, Saigon Investments Limited",https://cafef.vn/du-lieu/pvs-2041779/pvs-thay-doi-so-huu-cua-nhom-co-dong-amersham-industries-limited-norges-bank-saigon-investments-limited.chn,,0.2166997492313385,0.05542217567563057,0.7278780937194824
2024-08-15 00:00:00,PVS: CTCP Quản lý quỹ VinaCapital đã bán toàn bộ 267.000 cổ phiếu,https://cafef.vn/du-lieu/pvs-2039239/pvs-ctcp-quan-ly-quy-vinacapital-da-ban-toan-bo-267000-co-phieu.chn,,0.003991089295595884,0.895097553730011,0.10091136395931244
2024-08-15 00:00:00,PVS: Quỹ Đầu tư Cổ phiếu Kinh tế Hiện đại VinaCapital đăng ký mua 200.000 cổ phiếu,https://cafef.vn/du-lieu/pvs-2039241/pvs-quy-dau-tu-co-phieu-kinh-te-hien-dai-vinacapital-dang-ky-mua-200000-co-phieu.chn,,0.0021971084643155336,0.986697256565094,0.011105653829872608
2024-07-31 00:00:00,PVS: Báo cáo quản trị công ty bán niên 2024,https://cafef.vn/du-lieu/pvs-2031844/pvs-bao-cao-quan-tri-cong-ty-ban-nien-2024.chn,,0.022725559771060944,0.9511212706565857,0.026153165847063065
2024-07-24 00:00:00,PVS: Amersham Industries Limited đã mua 200.000 cổ phiếu,https://cafef.vn/du-lieu/pvs-2027976/pvs-amersham-industries-limited-da-mua-200000-co-phieu.chn,,0.013509010896086693,0.10627639293670654,0.8802146315574646
2024-07-11 00:00:00,PVS: Ký hợp đồng kiểm toán các BCTC năm 2024,https://cafef.vn/du-lieu/pvs-2021621/pvs-ky-hop-dong-kiem-toan-cac-bctc-nam-2024.chn,,0.0024987661745399237,0.9958609938621521,0.001640263944864273
2024-07-05 00:00:00,PVS: CTCP Quản lý quỹ VinaCapital đăng ký bán toàn bộ 267.000 cổ phiếu,https://cafef.vn/du-lieu/pvs-2018700/pvs-ctcp-quan-ly-quy-vinacapital-dang-ky-ban-toan-bo-267000-co-phieu.chn,,0.007017860654741526,0.9087860584259033,0.08419601619243622
2024-07-04 00:00:00,PVS: Quỹ Đầu tư Cổ phiếu Kinh tế Hiện đại VinaCapital đã mua 200.000 cổ phiếu,https://cafef.vn/du-lieu/pvs-2018137/pvs-quy-dau-tu-co-phieu-kinh-te-hien-dai-vinacapital-da-mua-200000-co-phieu.chn,,0.010520822368562222,0.9052579402923584,0.08422119915485382
2024-06-20 00:05:00,"Nhu cầu vốn “khổng lồ” cho các dự án ngoài khơi của Việt Nam, một “đại gia” dầu khí có thể phát hành thêm 1,2 tỷ cổ phiếu",https://cafef.vn/du-lieu/pvs-2010447/nhu-cau-von-khong-lo-cho-cac-du-an-ngoai-khoi-cua-viet-nam-mot-dai-gia-dau-khi-co-the-phat-hanh-them-12-ty-co-phieu.chn,"Theo thông tin cập nhật từ cuộc họp gặp gỡ nhà đầu tư của Tổng CTCP Dịch vụ Kỹ thuật Dầu khí Việt Nam (PTSC – mã PVS) ngày 14/6 và ĐHĐCĐ thường niên ngày 17/6, ban lãnh đạo công ty đã hé lộ KQKD sơ bộ 5 tháng đầu năm với doanh thu hợp nhất đạt 6.800 tỷ đồng và lợi nhuận trước thuế hợp nhất đạt 573 tỷ đồng, lần lượt tăng 11% và 50% so với cùng kỳ 2023.
Theo Vietcap, mức tăng trưởng của PVS chủ yếu được thúc đẩy bởi mảng M&C, sau khi hoàn thành 4 trong số 33 chân đế điện gió ngoài khơi cho dự án Greater Changhua 2a & 4 (Đài Loan, Orsted Client).
Năm 2024, PVS lên kế hoạch kinh doanh với mục tiêu doanh thu 15.500 tỷ đồng và lợi nhuận sau thuế 660 tỷ đồng, lần lượt giảm 29% và 38% so với thực hiện năm 2023. Chỉ tiêu lợi nhuận thấp nhất kể từ năm 2019 cho thấy sự thận trọng của ban lãnh đạo công ty bởi trong giai đoạn 2022-23, LNST thuộc về cổ đông công ty mẹ của PVS thường cao hơn gấp 2 lần dự kiến ban đầu.
Thêm vào đó, kết quả kinh doanh của doanh nghiệp M&C thường được ghi nhận vào quý 4. Vì thế, Vietcap dự phóng doanh thu và lợi nhuận sau thuế năm nay của PVS có thể đạt lần lượt 28.856 tỷ và 1.216 tỷ đồng. Con số này cao hơn 86% so với chỉ tiêu doanh thu và gấp đôi mục tiêu lợi nhuận mà PVS đề ra.
Xa hơn trong năm 2025, PVS kỳ vọng doanh thu và lợi nhuận sẽ tăng đáng kể nhờ vào backlog M&C lớn (1,5 tỷ USD cho mảng điện gió bao gồm các hợp đồng đã ký và công bố công khai, các hợp đồng đã ký & NDA, các hợp đồng tiềm năng cao và 1,0 tỷ USD cho Lô B).
Hơn nữa, ban lãnh đạo PVS cũng rất tin tưởng vào mảng điện gió ngoài khơi, với nhu cầu lớn từ Đài Loan (Trung Quốc), và Nhật Bản. Điều này giúp khối lượng công việc cho PVS gần như được đảm bảo cho đến ít nhất là năm 2030.
Về siêu dự án Lô B Ô Môn quy mô 12 tỷ USD, PVS kỳ vọng không có sự chậm trễ đáng kể trong Quyết định Đầu tư Cuối cùng (FID) của Tập đoàn Dầu khí Việt Nam (PVN) và nhấn mạnh rằng với tư cách nhà thầu thì công việc vẫn tiếp tục bình thường, với các khoản giải ngân kịp thời và thanh toán đầy đủ từ các nhà điều hành.
Có thể tăng vốn điều lệ lên đến 17.000 tỷ đồng
Theo báo cáo của Vietcap, trong giai đoạn 2024-30, PVS yêu cầu vốn XDCB lớn trị giá 70.600 tỷ đồng, bao gồm chi tiêu cho M&C, mở rộng công suất hệ thống căn cứ cảng, đầu tư kho dầu nổi cho các dự án Lạc Đà Vàng và Lô B (~10.000 tỷ đồng) cũng như trang trại gió ngoài khơi (~60.000 tỷ đồng).
Để đáp ứng nhu cầu trên, Vietcap cho rằng PVS có thể tăng vốn cổ phần thêm 12.200 tỷ đồng bằng cách phát hành cổ phiếu mới thông qua phát hành quyền mua và chia cổ tức bằng cổ phiếu. PVS dự kiến không chia cổ tức bằng tiền mặt trong giai đoạn 2025 - 2030 để giữ lại lợi nhuận, đáp ứng yêu cầu về vốn chủ sở hữu.
Tuy nhiên, Vietcap cũng nhấn mạnh kế hoạch này vẫn đang ở giai đoạn đầu vì PVS cần có sự chấp thuận từ nhiều cấp khác nhau, trong đó có PVN và Ủy ban Quản lý vốn Nhà nước trước khi tiến hành. Do đó, vẫn chưa có thông tin chi tiết cụ thể.
PVS hiện đang có vốn điều lệ gần 4.800 tỷ đồng. Nếu triển khai các kế hoạch tăng vốn kể trên, vốn điều lệ của công ty sẽ tăng lên 17.000 tỷ đồng. PVS hiện cũng là công ty có vốn hóa lớn nhất sàn HNX với giá trị gần 21.000 tỷ đồng, tăng 15% so với đầu năm.",0.5485582382480303,0.4464997012830443,0.0049420254245503
2024-06-20 00:00:00,PVS: Nghị quyết ĐHCĐ thường niên năm 2024,https://cafef.vn/du-lieu/pvs-2010883/pvs-nghi-quyet-dhcd-thuong-nien-nam-2024.chn,,0.14231792092323303,0.8519290685653687,0.005752989090979099
2024-06-19 00:00:00,PVS: Quỹ Đầu tư cổ phiếu Kinh tế hiện đại VinaCapital đăng ký mua 200.000 cổ phiếu,https://cafef.vn/du-lieu/pvs-2010677/pvs-quy-dau-tu-co-phieu-kinh-te-hien-dai-vinacapital-dang-ky-mua-200000-co-phieu.chn,,0.0028929428663104773,0.9699733853340149,0.027133753523230553
