Thời gian,Tiêu đề,URL,Nội dung,positive,neutral,negative
2025-06-07 07:47:00,"Công ty điện 2.000 tỷ vừa thành lập của ông Phạm Nhật Vượng cùng loạt DN dầu khí, năng lượng tái tạo được dự báo hưởng lợi từ Quy hoạch Điện VIII sửa đổi",https://cafef.vn/cong-ty-dien-2000-ty-vua-thanh-lap-cua-ong-pham-nhat-vuong-cung-loat-dn-dau-khi-nang-luong-tai-tao-duoc-du-bao-huong-loi-tu-quy-hoach-dien-viii-sua-doi-188250607074758222.chn,"PVS&GAS&POW&GEX&REE&HDG&PC1&TV2: Tổng Công ty Cổ phần Dịch vụ Kỹ thuật Dầu khí Việt Nam
Theo Quyết định số 1509/QĐ-TTg, được ban hành vào ngày 30/5/2025, Chính phủ đã công bố kế hoạch thực hiện chi tiết Quy hoạch Điện VIII sửa đổi.
So với quy hoạch tổng thể ban đầu chỉ đặt ra các mục tiêu công suất chung, lộ trình thực hiện này đưa ra mốc thời gian rõ ràng hơn, các cột mốc cụ thể cho từng dự án và các giải pháp kết nối lưới điện. Kế hoạch cũng chi tiết hơn về việc tư nhân hóa, với dự kiến 70% vốn đầu tư XDCB của ngành sẽ đến từ các nhà đầu tư tư nhân.
Tổng vốn đầu tư cần thiết cho việc phát triển nguồn điện và hệ thống lưới điện đến năm 2030 được ước tính khoảng 136 tỷ USD. Đối với các dự án phát điện, phần lớn vốn đầu tư—khoảng 118,2 tỷ USD—dự kiến sẽ đến chủ yếu từ các nguồn vốn ngoài nhà nước.
Kế hoạch đặt mục tiêu huy động khoảng 91 tỷ USD (khoảng 76%) trong số này thông qua nguồn vốn tư nhân, trong khi 24% còn lại sẽ đến từ đầu tư nhà nước. Ngược lại, việc mở rộng hạ tầng lưới điện, yêu cầu khoảng 18,1 tỷ USD, sẽ phụ thuộc nhiều hơn vào nguồn vốn công. Khoảng 13 tỷ USD (khoảng 71%) trong số này được dự phóng sẽ đến từ đầu tư nhà nước.
Vietcap kỳ vọng kế hoạch này sẽ mang lại lợi ích cho các doanh nghiệp dầu khí (PVS, GAS), năng lượng tái tạo (HDG, REE, PC1, GEX, TV2) và nhiệt điện (POW) với các dự án ngắn hạn. Điều này cũng hỗ trợ VIN Energo - công ty điện có vốn điều lệ 2.000 tỷ do ông Phạm Nhật Vượng nắm 71%.
Trong đó, theo Vietcap, PVS có vị thế để hưởng lợi từ chiến lược xuất khẩu điện gió ngoài khơi của Việt Nam. Việt Nam đang đẩy mạnh hơn 22.000 MW công suất điện gió ngoài khơi, trong đó 5.000–10.000 MW được chỉ định để xuất khẩu điện. PVS dự kiến hưởng lợi trực tiếp từ hơn 2.000 MW với tư cách là tổng thầu EPC trong một dự án xuất khẩu, đã ký thỏa thuận phát triển chung với Sembcorp để cấp điện cho Singapore và Malaysia.
Với các dự án điện gió ngoài khơi khác, PVS có vị thế tốt để nắm bắt các hợp đồng tồn đọng này vì là nhà thầu EPC trong nước duy nhất có chuyên môn đã được chứng minh trong điện gió ngoài khơi.
PVS hưởng lợi gián tiếp từ kế hoạch phát triển bốn nhà máy điện khí sử dụng nguồn khí từ dự án Lô B (Ô Môn I, II, III, IV), hỗ trợ tiến độ phát triển thượng nguồn Lô B, nơi PVS đang cung cấp các dịch vụ Cơ khí & Xây dựng (M&C).﻿ Tương tự, PVS sẵn sàng cung cấp dịch vụ M&C cho dự án thượng nguồn Cá Voi Xanh, hưởng lợi từ kế hoạch xây dựng năm nhà máy điện tuabin khí chu trình hỗn hợp ) sử dụng khí từ dự án này.
PVS được cho là sẽ hưởng lợi trực tiếp từ việc cung cấp dịch vụ kỹ thuật cho dự án Nhà máy điện hạt nhân Ninh Thuận 2.﻿ PVS cũng có thể hưởng lợi từ việc thành lập các trung tâm công nghiệp và dịch vụ năng lượng tái tạo.
GAS hưởng lợi từ việc mở rộng công suất điện khí LNG, sử dụng LNG và hưởng lợi từ sự phát triển của Lô B, Cá Voi Xanh. Vietcap dự báo tiêu thụ LNG sẽ tăng gấp 11 lần trong 5 năm tới.
HDG có công suất bổ sung ngắn hạn được phê duyệt cao nhất trong QHĐ VIII sửa đổi (khoảng 210MW), tiếp theo là GEX/REE với 129/80MW.
REE hưởng lợi từ việc tăng gấp 3 lần công suất điện mặt trời với điện mặt trời nổi cũng như việc triển khai DPPA (với tối đa 25% nhu cầu điện quốc gia đủ điều kiện tham gia). Công ty cũng hưởng lợi sớm nhất từ cơ chế điện gió mới với dự án điện gió Duyên Hải (48MW) dự kiến đi vào hoạt động cuối năm nay.
PC1 là đơn vị hưởng lợi đầu tiên và lớn nhất từ việc tăng đầu tư vào hạ tầng truyền tải (18 tỷ USD, tăng 74% so với QHĐ VIII cũ) cũng như mở rộng công suất điện gió.
GEX hưởng lợi từ trang trại điện gió gần bờ (Sóc Trăng).
TV2 hưởng lợi từ hợp đồng tư vấn điện hạt nhân﻿.
POW có thể hưởng lợi từ việc  phê duyệt tư cho các nhà máy điện khí LNG tiềm năng của công ty bao gồm LNG Quảng Ninh (1.500 MW, 30% cổ phần, đang giải phóng mặt bằng), LNG Vũng Áng III (1.500 MW, POWđang tiến hành nghiên cứu tiền khả thi), và LNG Quỳnh Lập (1.500 MW, đang xin phê duyệt đầu tư).",0.4984647220158504,0.5007963677579781,0.0007389268012359
2025-06-04 00:05:00,"“Đại gia” dầu khí có backlog khổng lồ hơn 100.000 tỷ, cổ phiếu tăng mạnh, vốn hóa chưa bằng tiền mặt đang nắm giữ",https://cafef.vn/du-lieu/pvs-2225257/dai-gia-dau-khi-co-backlog-khong-lo-hon-100000-ty-co-phieu-tang-manh-von-hoa-chua-bang-tien-mat-dang-nam-giu.chn,"Theo báo cáo phân tích mới công bố của ACBS, giai đoạn từ nay đến 2027, Tổng CTCP Dịch vụ và Kỹ thuật Dầu khí Việt Nam (PTSC – mã PVS) dự kiến sẽ có khối lượng công việc (backlog) khổng lồ, lên đến hơn 100.000 tỷ đồng (4 tỷ USD). Con số này gấp hơn 4 lần doanh thu năm 2024 của “đại gia” dầu khí này.
Trong mảng Xây lắp đầu khí, ACBS ước tính backlog của PVS đạt 2 tỷ USD . Trong đó, lớn nhất là tổng giá trị hợp đồng xây lắp dự án Lô B – Ô Môn, liên danh PVS cùng các công ty khác trúng 3 gói thầu xây lắp với giá trị 1,2 tỷ USD và đang tham gia gói thầu EPC#4 trị giá 400 triệu USD. Bên cạnh đó là hợp đồng xây lắp dự án Lạc Đà Vàng trị giá 400 triệu USD. Ngoài ra, PVS còn tham gia các dự án tiềm năng khác như Cẩm Tấu, Sư Tử trắng giai đoạn 2B…
Với mảng Điện gió ngoài khơi, backlog ước tính khoảng 800 triệu USD . Năm 2025, PVS dự kiến bàn giao tổng bộ 33 chân đế tuabin gió dự án CHW2204, giá trị hợp đồng (theo ước tính của ACBS) vào khoảng 250 – 300 triệu USD. PVS cũng đã ký kết 2 dự án mới là Baltica 2 và Feng Miao, trong khuôn khổ 2 dự án PVS sẽ cung cấp lần lượt 4 trạm biến áp ngoài khơi (OSS) và 2 OSS tổng trị giá khoảng 300 triệu USD. Ngoài ra, khả năng PVS cũng sẽ trung thầu cung cấp 35 chân đế tuabin cho dự án điện gió ngoài khơi Formosa, tổng giá trị ước tính 300 triệu USD.
Về mảng Xây lắp công trình trên cạn , năm 2025, dự án nhiệt điện Long Phú 1 với tổng mức đầu tư khoảng 30.000 tỷ đồng (1,2 tỷ USD) đã được PVN ra kế hoạch tái khởi động và hoàn thành trước năm 2027, PVS có vai trò tổng thầu EPC của dự án. Ngoài ra PVS cũng với liên doanh cùng có cơ hội trung các dự án nhiệt điện khác như: Nhơn Trạch 3&4, Nhà máy nhiệt điện khí Ô Môn 3 trị giá 417.800 tỷ đồng…
Trong hoạt động cho thuê kho nổi , tháng 12/2024, liên doanh PVS và Yinson (Malaysia) đã nhận thầu dự án cung cấp kho nổi FSO cho dự án Lạc Đà Vàng với giá trị 416 triệu USD có thời hạn 10 năm và điều khoản gia hạn thêm 5 năm bắt đầu từ Q4/2026. Tại ĐHĐCĐ thường niên 2025, PVS cũng cho biết về hợp đồng cung cấp kho nổi cho dự án Lô B – Ô Môn có giá trị 480 triệu USD với thời hạn 14 năm kèm 9 năm lựa chọn gia hạn, bắt đầu từ cuối năm 2027. Hoàn thành kế hoạch đầu tư và triển khai, PVS sẽ sở hữu đội tàu cung cấp dịch vụ kho nổi từ lên 8 chiếc.
ACBS kỳ vọng hoạt động xây lắp của PVS sẽ cải thiện biên lãi gộp trong thời gian tới. Theo bộ phận phân tích này, trong năm 2025 biên lãi gộp sẽ có sự phục tốt đến từ việc các hợp đồng xây lắp đầu khí lớn sẽ ghi nhận doanh thu. Ngoài ra, PVS cũng cho biết biên lãi gộp mạng điện gió ngoài khơi cũng tương đương mảng dầu khí tuy nhiên giai đoạn hiện nay PVS đang ghi nhận khá hao hụt các khoản đầu tư để phục vụ cho các dự án này (xuống cơ khí, xưởng sơn…).
Tiền mặt “rủng rỉnh”, cổ tức “đều như vắt tranh”
Cũng theo ACBS, PVS là doanh nghiệp có tỷ lệ tiền mặt/vốn hóa thuộc nhóm cao nhất sàn. Tính đến cuối quý 1/2025, PVS có hơn 16.500 tỷ đồng tiền mặt (tiền, tương đương tiền và tiền gửi ngắn hạn) trong khi nợ vay tài chính chưa đến 1.700 tỷ vào cuối quý 1/2025. Lượng tiền ròng khoảng 14.800 tỷ, lớn hơn so với vốn hóa của PVS (14.500 tỷ đồng). Cần lưu ý rằng cổ phiếu này đã tăng mạnh thời gian gần đây.
Tiền mặt “rủng rỉnh” giúp PVS thoải mái trong việc chia cổ tức cho cổ đông. ĐHĐCĐ thường niên 2025 mới đây đã thông qua kế hoạch chia cổ tức bằng tiền với tỷ lệ 7% (01 cổ phiếu nhận 700 đồng). Với gần 478 triệu cổ phiếu đang lưu hành, PVS dự chi khoảng 335 tỷ đồng để chia cổ tức năm 2024. Như vậy, từ năm 2013 đến nay, chưa năm nào doanh nghiệp quên chia tiền mặt cho cổ đông, tỷ lệ thường dao động trong khoảng 5-12%.
Về kế hoạch kinh doanh 2025 với mục tiêu doanh thu hợp nhất đạt 22.500 tỷ đồng và lợi nhuận sau thuế 780 tỷ đồng, lần lượt giảm 10% và 38% so với thực hiện năm 2024. Tuy nhiên, cần lưu ý rằng PVS thường xuyên có “thói quen” đặt mục tiêu thấp nhưng kết quả thực tế lại vượt xa kế hoạch.
Ngay trong quý đầu năm 2025, PVS ghi nhận doanh thu thuần đạt gần 6.014 tỷ đồng, tăng 62% so với cùng kỳ năm ngoái. Sau khi trừ các chi phí, doanh nghiệp lãi sau thuế gần 300 tỷ đồng, giảm nhẹ so với cùng kỳ 2024. Với kết quả đạt được, PVS đã thực hiện 27% kế hoạch doanh thu và 38% mục tiêu lợi nhuận cả năm.",0.8441037199551001,0.1328537885594487,0.0230424708584455
2025-05-29 00:05:00,"“Ôm” lượng tiền mặt lớn hơn vốn hóa, doanh nghiệp Nhà nước muốn chi hơn 300 tỷ chia cổ tức",https://cafef.vn/du-lieu/pvs-2208386/om-luong-tien-mat-lon-hon-von-hoa-doanh-nghiep-nha-nuoc-muon-chi-hon-300-ty-chia-co-tuc.chn,"Tổng CTCP Dịch vụ Kỹ thuật Dầu khí Việt Nam (PTSC – mã PVS) vừa công bố tài liệu Đại hội đồng cổ đông thường niên 2025 dự kiến diễn ra ngày 29/5.
Theo đó, HĐQT PVS dự kiến trình cổ đông thông qua kế hoạch kinh doanh 2025 với mục tiêu doanh thu hợp nhất đạt 22.500 tỷ đồng và lợi nhuận sau thuế 780 tỷ đồng, lần lượt giảm 10% và 38% so với thực hiện năm 2024.
Tuy nhiên, cần lưu ý rằng PVS thường xuyên có “thói quen” đặt mục tiêu thấp nhưng kết quả thực tế lại vượt xa kế hoạch. Năm 2024 trước đó, doanh nghiệp này ghi nhận doanh thu hợp nhất đạt gần 25.000 tỷ và lợi nhuận sau thuế 1.255 tỷ đồng, tương ứng đạt 161% và 190% kế hoạch đề ra.
Ngay trong quý đầu năm 2025, PVS ghi nhận doanh thu thuần đạt gần 6.014 tỷ đồng, tăng 62% so với cùng kỳ năm ngoái. Sau khi trừ các chi phí, doanh nghiệp lãi sau thuế gần 300 tỷ đồng, giảm nhẹ so với cùng kỳ 2024. Với kết quả đạt được, PVS đã thực hiện 27% kế hoạch doanh thu và 38% mục tiêu lợi nhuận cả năm.
Theo tài liệu họp công bố, HĐQT PVS đề xuất chia cổ tức năm 2024 bằng tiền mặt tỷ lệ 7% (01 cổ phiếu nhận 700 đồng). Với gần 478 triệu cổ phiếu đang lưu hành, PVS dự chi khoảng 335 tỷ đồng để chia cổ tức năm 2024.
PVS được biết đến là doanh nghiệp có truyền thống chia cổ tức đều đặn hàng năm. Từ năm 2013 đến nay, chưa năm nào doanh nghiệp quên chia tiền mặt cho cổ đông. Tỷ lệ cổ tức thường dao động trong khoảng 5-12%.
Chính sách cổ tức được duy trì trên nền tảng kết quả kinh doanh ổn định và tình hình tài chính lành mạnh. Tính đến cuối quý 1/2025, PVS có hơn 16.500 tỷ đồng tiền mặt (tiền, tương đương tiền và tiền gửi ngắn hạn), tăng hơn 1.200 tỷ so với đầu năm và chiếm gần một nửa tổng tài sản (35.200 tỷ đồng). Trong khi đó, nợ vay tài chính rất thấp, chỉ chưa đến 1.700 tỷ vào cuối quý 1/2025.
Như vậy, số dư tiền mặt của PVS thậm chí còn lớn hơn cả vốn hóa của doanh nghiệp này. Dù cổ phiếu vừa tăng vọt gần 7% trong phiên 28/5 nhưng vốn hóa thị trường của PVS hiện mới chỉ ở mức gần 14.000 tỷ đồng. Hiện tại, Tập đoàn Công nghiệp – Năng lượng Quốc gia Việt Nam vẫn là công ty mẹ chi phối hơn 51% vốn của PVS.
Trong một diễn biến khác, PVS mới đây đã nhận thư trao thầu gói FSO Lô B trị giá 600 triệu USD, bao gồm 14 năm thuê chính thức (480 triệu USD) và 9 năm tùy chọn gia hạn (120 triệu USD). FSO này dự kiến hoạt động từ quý IV/2027. Cùng với FSO mỏ Lạc Đà Vàng đã nhận thầu trước đó, đội tàu FSO của PVS sẽ nâng lên 8 chiếc trong vòng hai năm.
Gần nhất, trong khuôn khổ Hội nghị Cấp cao ASEAN lần thứ 46 tại Kuala Lumpur, Liên danh Năng lượng Malaysia (gồm Tenaga Nasional Berhad và Petronas), PVS và Sembcorp Utilities (Singapore) đã ký thoả thuận hợp tác nghiên cứu xuất khẩu điện gió ngoài khơi từ Việt Nam sang Malaysia qua tuyến cáp ngầm kết nối lưới điện quốc gia. Các bên cũng xem xét bổ sung thêm nguồn điện và hệ thống lưu trữ để đảm bảo nguồn cung ổn định.",0.5484213928187334,0.4476508526166479,0.0039277117115413
2025-05-27 00:00:00,PVS: Nghị quyết HĐQT thông qua tài liệu tổ chức ĐHCĐ thường niên năm 2025,https://cafef.vn/du-lieu/pvs-2207109/pvs-nghi-quyet-hdqt-thong-qua-tai-lieu-to-chuc-dhcd-thuong-nien-nam-2025.chn,,0.013449177145957947,0.983607292175293,0.002943589584901929
2025-05-19 00:00:00,PVS: Quỹ đầu tư Cổ phiếu tiếp cận thị trường VinaCapital đã mua 680.200 cổ phiếu,https://cafef.vn/du-lieu/pvs-2201228/pvs-quy-dau-tu-co-phieu-tiep-can-thi-truong-vinacapital-da-mua-680200-co-phieu.chn,,0.027162723243236542,0.7051694393157959,0.26766785979270935
2025-05-16 16:44:00,Quỹ ngoại Dragon Capital ‘rời ghế’ cổ đông lớn tại PVS,https://cafef.vn/du-lieu/pvs-2198618/quy-ngoai-dragon-capital-roi-ghe-co-dong-lon-tai-pvs.chn,"Tổng Công ty Cổ phần Dịch vụ Kỹ thuật Dầu khí Việt Nam (MCK: PVS, sàn HNX) vừa công bố báo cáo về sở hữu của nhóm nhà đầu tư nước ngoài có liên quan là cổ đông lớn, nhà đầu tư nắm giữ 5% trở lên cổ phiếu của công ty.
Theo đó, trong phiên giao dịch ngày 9/5/2025, quỹ ngoại Dragon Capital đã thông qua 2 quỹ thành viên để bán ra tổng cộng 650.000 cổ phiếu PVS. Cụ thể, quỹ Amersham Industries Limited bán ra 500.000 cổ phiếu, quỹ Norges Bank bán ra 150.000 cổ phiếu.
Sau giao dịch này, Dragon Capital giảm sở hữu cổ phiếu PVS từ gần 24,03 triệu cổ phiếu xuống còn gần gần 23,38 triệu cổ phiếu, tương đương tỷ lệ sở hữu giảm từ 5,0265% xuống còn 4,8906%.
Ảnh minh họa
Tạm tính giá cổ phiếu PVS theo phiên giao dịch đóng cửa ngày 9/5/2025 là 26.600 đồng/cổ phiếu, ước tính Dragon Capital đã thu về khoảng 17,29 tỷ đồng từ giao dịch bán ra cổ phiếu nêu trên.
Trong một diễn biến khác, PVS dự kiến sẽ tổ chức Đại hội đồng cổ đông (ĐHĐCĐ) thường niên năm 2025 vào ngày 29/5/2025 bằng hình thức họp trực tuyến, cổ đông tham dự và biểu quyết bằng hình thức bỏ phiếu điện tử. Địa điểm họp tại phòng họp trụ sở công ty, số 1-5 Lê Duẩn, phường Bến Nghé, Quận 1, TP.HCM.
Tại đại hội, PVS dự kiến trình cổ đông thông qua các tờ trình về báo cáo kết quả sản xuất kinh doanh năm 2024 và kế hoạch năm 2025; phương án phân phối lợi nhuận năm 2024 và kế hoạch tài chính năm 2025; phương án tăng vốn điều lệ thông qua phát hành cổ phiếu để trả cổ tức năm 2024,...
Về tình hình kinh doanh, theo báo cáo tài chính hợp nhất quý I/2025, PVS ghi nhận doanh thu thuần đạt gần 6.013,7 tỷ đồng, tăng 62,1% so với cùng kỳ năm ngoái. Sau khấu trừ đi các khoản thuế phí, doanh nghiệp báo lãi ròng hơn 299,6 tỷ đồng, giảm nhẹ gần 5,1 tỷ đồng.
Tính đến ngày 31/3/2025, tổng tài sản của PVS tăng nhẹ 3,3% so với đầu năm, lên mức gần 35.208,5 tỷ đồng. Trong đó, tiền và các khoản tương đương tiền hơn 12.331,1 tỷ đồng, chiếm 35% tổng tài sản; đầu tư tài chính dài hạn gần 4.733,9 tỷ đồng, chiếm 13,4% tổng tài sản; hàng tồn kho gần 2.045 tỷ đồng.
Bên kia bảng cân đối kế toán, tổng nợ phải trả đang ở mức hơn 20.174 tỷ đồng, tăng 4,3% so với đầu năm. Trong đó, chi phí phải trả ngắn hạn hơn 6.197,3 tỷ đồng, chiếm 30,7% tổng nợ; vay và nợ thuê tài chính hơn 1.669,7 tỷ đồng.",0.2247996003814155,0.7139988489654086,0.061201521083684
2025-05-15 00:00:00,PVS: Báo cáo thay đổi sở hữu của nhóm NĐTNN liên quan bà Trương Ngọc Phượng,https://cafef.vn/du-lieu/pvs-2214353/pvs-bao-cao-thay-doi-so-huu-cua-nhom-ndtnn-lien-quan-ba-truong-ngoc-phuong.chn,,0.9168306589126587,0.016898157075047493,0.06627114862203598
2025-05-12 00:00:00,PVS: Ông Hoàng Xuân Quốc không làm GĐ Dự án năng lượng của VinaCapital từ 9.5.2025,https://cafef.vn/du-lieu/pvs-2199370/pvs-ong-hoang-xuan-quoc-khong-lam-gd-du-an-nang-luong-cua-vinacapital-tu-952025.chn,,0.24994659423828125,0.018903540447354317,0.7311498522758484
2025-05-08 00:00:00,"PVS: 29.5.2025, tổ chức ĐHCĐ thường niên năm 2025",https://cafef.vn/du-lieu/pvs-2199716/pvs-2952025-to-chuc-dhcd-thuong-nien-nam-2025.chn,,0.1882992684841156,0.8066543340682983,0.005046435631811619
2025-05-08 00:00:00,PVS: Quỹ Đầu tư Cổ phiếu Kinh tế Hiện đại VinaCapital đã mua 500.000 cổ phiếu,https://cafef.vn/du-lieu/pvs-2199727/pvs-quy-dau-tu-co-phieu-kinh-te-hien-dai-vinacapital-da-mua-500000-co-phieu.chn,,0.01056575309485197,0.9183463454246521,0.07108786702156067
2025-05-06 00:00:00,PVS: Nghị quyết HĐQT tổ chức ĐHCĐ thường niên năm 2025,https://cafef.vn/du-lieu/pvs-2201559/pvs-nghi-quyet-hdqt-to-chuc-dhcd-thuong-nien-nam-2025.chn,,0.1782235950231552,0.8184740543365479,0.0033023201394826174
2025-05-05 14:02:00,PVS: Báo cáo tài chính quý 1/2025,https://cafef.vn/du-lieu/pvs-2190210/pvs-bao-cao-tai-chinh-quy-12025.chn,,0.013826943933963776,0.9787105917930603,0.0074624777771532536
2025-05-05 14:01:00,PVS: Báo cáo tài chính quý 1/2025 (công ty mẹ),https://cafef.vn/du-lieu/pvs-2190209/pvs-bao-cao-tai-chinh-quy-12025-cong-ty-me.chn,,0.01680379919707775,0.9499654173851013,0.0332307443022728
2025-04-24 00:00:00,PVS: Báo cáo thay đổi sở hữu của nhóm NĐTNN liên quan bà Trương Ngọc Phượng,https://cafef.vn/du-lieu/pvs-2214351/pvs-bao-cao-thay-doi-so-huu-cua-nhom-ndtnn-lien-quan-ba-truong-ngoc-phuong.chn,,0.9168306589126587,0.016898157075047493,0.06627114862203598
2025-04-18 14:50:00,PVS: Báo cáo thường niên 2024,https://cafef.vn/du-lieu/pvs-2176565/pvs-bao-cao-thuong-nien-2024.chn,,0.5021107196807861,0.45580556988716125,0.04208367317914963
2025-04-11 00:00:00,PVS: Quỹ Đầu tư Cổ phiếu Kinh tế Hiện đại VinaCapital đăng ký mua 500.000 cổ phiếu,https://cafef.vn/du-lieu/pvs-2215921/pvs-quy-dau-tu-co-phieu-kinh-te-hien-dai-vinacapital-dang-ky-mua-500000-co-phieu.chn,,0.0022265086881816387,0.9848929643630981,0.012880558148026466
2025-04-11 00:00:00,PVS: Quỹ đầu tư Cổ phiếu tiếp cận thị trường VinaCapital đăng ký mua 1.000.000 cổ phiếu,https://cafef.vn/du-lieu/pvs-2215922/pvs-quy-dau-tu-co-phieu-tiep-can-thi-truong-vinacapital-dang-ky-mua-1000000-co-phieu.chn,,0.004598962143063545,0.8214823603630066,0.1739187389612198
2025-04-10 00:00:00,PVS: Báo cáo thay đổi sở hữu của nhóm NĐT liên quan bà Trương Ngọc Phượng,https://cafef.vn/du-lieu/pvs-2215923/pvs-bao-cao-thay-doi-so-huu-cua-nhom-ndt-lien-quan-ba-truong-ngoc-phuong.chn,,0.9940052628517151,0.0008159236749634147,0.005178853403776884
