Thời gian,Tiêu đề,URL
23/07/2018 21:01,Người của ThaiBev chính thức ngồi ghế Tổng giám đốc Sabeco,https://cafef.vn/du-lieu/sab-1042999/nguoi-cua-thaibev-chinh-thuc-ngoi-ghe-tong-giam-doc-sabeco.chn
23/07/2018 09:26,SAB: Nghị quyết và Biên bản họp ĐHĐCĐ thường niên năm 2018,https://cafef.vn/du-lieu/sab-1025017/sab-nghi-quyet-va-bien-ban-hop-dhdcd-thuong-nien-nam-2018.chn
22/07/2018 17:56,Sabeco từng lập các công ty con chuyên bán bia và thực hiện hành vi chuyển giá như thế nào?,https://cafef.vn/du-lieu/sab-1238275/sabeco-tung-lap-cac-cong-ty-con-chuyen-ban-bia-va-thuc-hien-hanh-vi-chuyen-gia-nhu-the-nao.chn
21/07/2018 09:18,ĐHĐCĐ Sabeco: Các khoản vay của ThaiBev để mua cổ phần sẽ không chuyển sang Sabeco,https://cafef.vn/du-lieu/sab-1243885/dhdcd-sabeco-cac-khoan-vay-cua-thaibev-de-mua-co-phan-se-khong-chuyen-sang-sabeco.chn
20/07/2018 10:31,"Sabeco lập công ty mới, vốn chỉ 10 triệu đồng để bán bia",https://cafef.vn/du-lieu/sab-1111372/sabeco-lap-cong-ty-moi-von-chi-10-trieu-dong-de-ban-bia.chn
19/07/2018 14:27,"Tổng Kiểm toán Nhà nước: “Sabeco là vụ việc tiêu biểu cho hành vi chuyển giá của doanh nghiệp nội địa, làm thất thu ngân sách nhà nước”",https://cafef.vn/du-lieu/sab-1241851/tong-kiem-toan-nha-nuoc-sabeco-la-vu-viec-tieu-bieu-cho-hanh-vi-chuyen-gia-cua-doanh-nghiep-noi-dia-lam-that-thu-ngan-sach-nha-nuoc.chn
19/07/2018 13:26,SAB: Ông Teo Hong Keng được ủy quyền CBTT từ 20.7.2018,https://cafef.vn/du-lieu/sab-1245694/sab-ong-teo-hong-keng-duoc-uy-quyen-cbtt-tu-2072018.chn
18/07/2018 17:11,SAB: Giấy chứng nhận đăng ký doanh nghiệp công ty con,https://cafef.vn/du-lieu/sab-1240408/sab-giay-chung-nhan-dang-ky-doanh-nghiep-cong-ty-con.chn
18/07/2018 08:48,Tại sao đại diện của Bộ Công thương không có trong danh sách ứng viên HĐQT của Sabeco?,https://cafef.vn/du-lieu/sab-1093462/tai-sao-dai-dien-cua-bo-cong-thuong-khong-co-trong-danh-sach-ung-vien-hdqt-cua-sabeco.chn
17/07/2018 11:42,Đại diện Bộ Công Thương không có trong danh sách ứng viên HĐQT Sabeco,https://cafef.vn/du-lieu/sab-1037467/dai-dien-bo-cong-thuong-khong-co-trong-danh-sach-ung-vien-hdqt-sabeco.chn
16/07/2018 17:13,SAB: Tài liệu bổ sung họp ĐHĐCĐ thường niên năm 2018 lần 2,https://cafef.vn/du-lieu/sab-1238302/sab-tai-lieu-bo-sung-hop-dhdcd-thuong-nien-nam-2018-lan-2.chn
16/07/2018 17:00,SAB: Giải trình v/v chậm tổ chức ĐHĐCĐ thường niên năm 2018,https://cafef.vn/du-lieu/sab-1095070/sab-giai-trinh-vv-cham-to-chuc-dhdcd-thuong-nien-nam-2018.chn
13/07/2018 11:18,SAB: Link báo cáo thường niên năm 2017 và giải trình chậm CBTT,https://cafef.vn/du-lieu/sab-995614/sab-link-bao-cao-thuong-nien-nam-2017-va-giai-trinh-cham-cbtt.chn
12/07/2018 17:37,SAB: Tài liệu họp ĐHĐCĐ thường niên năm 2018 bổ sung lần 1,https://cafef.vn/du-lieu/sab-981124/sab-tai-lieu-hop-dhdcd-thuong-nien-nam-2018-bo-sung-lan-1.chn
12/07/2018 17:35,SAB: Tài liệu họp ĐHĐCĐ thường niên năm 2018,https://cafef.vn/du-lieu/sab-1103398/sab-tai-lieu-hop-dhdcd-thuong-nien-nam-2018.chn
12/07/2018 13:21,"Về tay Thaibev, Sabeco đặt kế hoạch lãi ròng 2018 giảm 19% chỉ còn 4.007 tỷ, cổ tức đi ngang",https://cafef.vn/du-lieu/sab-1127860/ve-tay-thaibev-sabeco-dat-ke-hoach-lai-rong-2018-giam-19-chi-con-4007-ty-co-tuc-di-ngang.chn
06/07/2018 16:54,SAB: Nhắc nhở chậm nộp Báo cáo thường niên năm 2017,https://cafef.vn/du-lieu/sab-1163593/sab-nhac-nho-cham-nop-bao-cao-thuong-nien-nam-2017.chn
06/07/2018 16:47,SAB: Thư mời tham dự ĐHĐCĐ thường niên năm 2018,https://cafef.vn/du-lieu/sab-1030780/sab-thu-moi-tham-du-dhdcd-thuong-nien-nam-2018.chn
19/06/2018 00:00,"SAB: 29.6.2018, ngày GDKHQ tổ chức ĐHĐCĐ thường niên năm 2018",https://cafef.vn/du-lieu/sab-1142839/sab-2962018-ngay-gdkhq-to-chuc-dhdcd-thuong-nien-nam-2018.chn
13/06/2018 15:18,Dragon Capital VEIL - quỹ đầu tư quyền lực nhất TTCK đã mua bán gì trong nửa đầu năm 2018?,https://cafef.vn/du-lieu/sab-1154959/dragon-capital-veil-quy-dau-tu-quyen-luc-nhat-ttck-da-mua-ban-gi-trong-nua-dau-nam-2018.chn
12/06/2018 17:14,SAB: Nghị quyết HĐQT v/v tổ chức ĐHĐCĐ thường niên năm 2018,https://cafef.vn/du-lieu/sab-1209643/sab-nghi-quyet-hdqt-vv-to-chuc-dhdcd-thuong-nien-nam-2018.chn
03/06/2018 18:37,Phó tổng giám đốc Sabeco xin nghỉ việc,https://cafef.vn/du-lieu/sab-1158742/pho-tong-giam-doc-sabeco-xin-nghi-viec.chn
21/05/2018 17:02,SAB: Giấy chứng nhận đăng ký doanh nghiệp thay đổi lần thứ 8,https://cafef.vn/du-lieu/sab-1149916/sab-giay-chung-nhan-dang-ky-doanh-nghiep-thay-doi-lan-thu-8.chn
21/05/2018 15:15,Sabeco tiếp tục bị đốc thúc khoản thuế gần 4.000 tỷ đồng,https://cafef.vn/du-lieu/sab-991495/sabeco-tiep-tuc-bi-doc-thuc-khoan-thue-gan-4000-ty-dong.chn
19/05/2018 08:14,"Không chỉ nhà đầu tư nhỏ lẻ, ngay cả Dragon Capital cũng ""lao đao"" với nhịp điều chỉnh mạnh của TTCK Việt Nam",https://cafef.vn/du-lieu/sab-968572/khong-chi-nha-dau-tu-nho-le-ngay-ca-dragon-capital-cung-lao-dao-voi-nhip-dieu-chinh-manh-cua-ttck-viet-nam.chn
15/05/2018 14:07,SAB: Công văn của Sở KHĐT về đồng ý gia hạn tổ chức ĐHĐCĐ thường niên 2018,https://cafef.vn/du-lieu/sab-1000570/sab-cong-van-cua-so-khdt-ve-dong-y-gia-han-to-chuc-dhdcd-thuong-nien-2018.chn
14/05/2018 14:46,SAB: Bổ nhiệm bà Trần Kim Nga làm TV.HĐQT tạm thời từ 9.5.2018,https://cafef.vn/du-lieu/sab-1022158/sab-bo-nhiem-ba-tran-kim-nga-lam-tvhdqt-tam-thoi-tu-952018.chn
12/05/2018 08:43,VCSC: Thaibev có thể giúp Sabeco cải thiện lợi nhuận biên,https://cafef.vn/du-lieu/sab-1014553/vcsc-thaibev-co-the-giup-sabeco-cai-thien-loi-nhuan-bien.chn
11/05/2018 10:36,SAB: Bổ nhiệm ông Neo Gim Siong Bennett làm Phó TGĐ từ 9.5.2018,https://cafef.vn/du-lieu/sab-1025911/sab-bo-nhiem-ong-neo-gim-siong-bennett-lam-pho-tgd-tu-952018.chn
10/05/2018 17:32,Người Thái đưa thêm người vào Ban Giám đốc của Sabeco,https://cafef.vn/du-lieu/sab-990739/nguoi-thai-dua-them-nguoi-vao-ban-giam-doc-cua-sabeco.chn
07/05/2018 17:29,SAB: Điều chỉnh BCTCHN kiểm toán năm 2017 phần thuyết minh nợ,https://cafef.vn/du-lieu/sab-1168573/sab-dieu-chinh-bctchn-kiem-toan-nam-2017-phan-thuyet-minh-no.chn
04/05/2018 14:55,SAB: Giấy chứng nhận đăng ký doanh nghiệp thay đổi lần thứ 07,https://cafef.vn/du-lieu/sab-988771/sab-giay-chung-nhan-dang-ky-doanh-nghiep-thay-doi-lan-thu-07.chn
04/05/2018 13:54,SAB: Nhắc nhở chậm công bố Báo cáo thường niên năm 2017,https://cafef.vn/du-lieu/sab-1048246/sab-nhac-nho-cham-cong-bo-bao-cao-thuong-nien-nam-2017.chn
03/05/2018 17:41,Sabeco báo lãi sụt giảm ngay trong quý đầu tiên về tay người Thái,https://cafef.vn/du-lieu/sab-1235314/sabeco-bao-lai-sut-giam-ngay-trong-quy-dau-tien-ve-tay-nguoi-thai.chn
02/05/2018 15:28,SAB: Xin gia hạn thời gian tổ chức ĐHĐCĐ thường niên 2018,https://cafef.vn/du-lieu/sab-1122697/sab-xin-gia-han-thoi-gian-to-chuc-dhdcd-thuong-nien-2018.chn
24/04/2018 14:52,SAB: Nghị quyết HĐQT hoãn thời gian tổ chức họp ĐHĐCĐ thường niên 2018,https://cafef.vn/du-lieu/sab-1010998/sab-nghi-quyet-hdqt-hoan-thoi-gian-to-chuc-hop-dhdcd-thuong-nien-2018.chn
24/04/2018 08:54,SAB: Nghị quyết và Biên bản họp ĐHĐCĐ bất thường lần 1 năm 2018,https://cafef.vn/du-lieu/sab-1227748/sab-nghi-quyet-va-bien-ban-hop-dhdcd-bat-thuong-lan-1-nam-2018.chn
23/04/2018 14:50,SAB: Nghị quyết HĐQT điều chỉnh nội dung thuyết minh nợ tiềm tàng trên BCTCHN năm 2017,https://cafef.vn/du-lieu/sab-1122073/sab-nghi-quyet-hdqt-dieu-chinh-noi-dung-thuyet-minh-no-tiem-tang-tren-bctchn-nam-2017.chn
23/04/2018 11:24,"Lời hứa của Thaibev ngày đầu làm sếp Sabeco: Sẽ đưa thương hiệu Sabeco, bia 333 ra nước ngoài",https://cafef.vn/du-lieu/sab-1194559/loi-hua-cua-thaibev-ngay-dau-lam-sep-sabeco-se-dua-thuong-hieu-sabeco-bia-333-ra-nuoc-ngoai.chn
23/04/2018 10:46,ĐHĐCĐ Sabeco: Thaibev chính thức được đưa người vào HĐQT,https://cafef.vn/du-lieu/sab-1098043/dhdcd-sabeco-thaibev-chinh-thuc-duoc-dua-nguoi-vao-hdqt.chn
23/04/2018 08:44,SAB: Bổ sung tài liệu họp ĐHĐCĐ bất thường lần 1/2018,https://cafef.vn/du-lieu/sab-1226911/sab-bo-sung-tai-lieu-hop-dhdcd-bat-thuong-lan-12018.chn
17/04/2018 16:21,SAB: Thư mời tham dự ĐHĐCĐ bất thường lần 1 năm 2018,https://cafef.vn/du-lieu/sab-1230646/sab-thu-moi-tham-du-dhdcd-bat-thuong-lan-1-nam-2018.chn
14/04/2018 15:15,"Sabeco: Đề nghị miễn nhiệm Chủ tịch Võ Thanh Hà, bầu bổ sung 3 đại diện của Thaibev vào HĐQT",https://cafef.vn/du-lieu/sab-1179841/sabeco-de-nghi-mien-nhiem-chu-tich-vo-thanh-ha-bau-bo-sung-3-dai-dien-cua-thaibev-vao-hdqt.chn
13/04/2018 17:37,SAB: Nghị quyết HĐQT v/v tổ chức họp ĐHĐCĐ bất thường năm 2018 lần 1,https://cafef.vn/du-lieu/sab-1175923/sab-nghi-quyet-hdqt-vv-to-chuc-hop-dhdcd-bat-thuong-nam-2018-lan-1.chn
12/04/2018 08:36,"Hàng loạt ""ông lớn"" giảm lãi mạnh sau kiểm toán",https://cafef.vn/du-lieu/sab-1172248/hang-loat-ong-lon-giam-lai-manh-sau-kiem-toan.chn
11/04/2018 13:46,Sabeco giảm 238 tỷ lợi nhuận sau kiểm toán,https://cafef.vn/du-lieu/sab-1187908/sabeco-giam-238-ty-loi-nhuan-sau-kiem-toan.chn
09/04/2018 10:22,"Bia Sài Gòn chưa nộp 2.500 tỉ, ai chịu trách nhiệm?",https://cafef.vn/du-lieu/sab-1183168/bia-sai-gon-chua-nop-2500-ti-ai-chiu-trach-nhiem.chn
03/04/2018 11:00,SAB: Anh ông Nguyễn Văn Minh - Trưởng BKS đã bán 3.000 cp,https://cafef.vn/du-lieu/sab-1166506/sab-anh-ong-nguyen-van-minh-truong-bks-da-ban-3000-cp.chn
30/03/2018 16:44,SAB: Anh ông Nguyễn Văn Minh - Trưởng BKS đã mua 3.000 cp,https://cafef.vn/du-lieu/sab-1172857/sab-anh-ong-nguyen-van-minh-truong-bks-da-mua-3000-cp.chn
22/03/2018 00:00,"SAB: 5.4.2018, ngày GDKHQ tổ chức ĐHĐCĐ bất thường năm 2018",https://cafef.vn/du-lieu/sab-1012549/sab-542018-ngay-gdkhq-to-chuc-dhdcd-bat-thuong-nam-2018.chn
20/03/2018 09:44,Chuyển động quỹ đầu tư tuần 12-18/3,https://cafef.vn/du-lieu/sab-1041928/chuyen-dong-quy-dau-tu-tuan-12183.chn
19/03/2018 09:35,"Kiểm toán nhà nước nói gì về việc Sabeco thoái vốn tại dự án “đất vàng” 2-4-6 Hai Bà Trưng, Quận 1, Tp.HCM?",https://cafef.vn/du-lieu/sab-1013443/kiem-toan-nha-nuoc-noi-gi-ve-viec-sabeco-thoai-von-tai-du-an-dat-vang-246-hai-ba-trung-quan-1-tphcm.chn
19/03/2018 06:56,"VN-Index sắp phá đỉnh 11 năm, nhưng cuộc vui không dành cho tất cả khi nhiều cổ phiếu lớn đã giảm giá không ngừng",https://cafef.vn/du-lieu/sab-977251/vnindex-sap-pha-dinh-11-nam-nhung-cuoc-vui-khong-danh-cho-tat-ca-khi-nhieu-co-phieu-lon-da-giam-gia-khong-ngung.chn
18/03/2018 21:19,Sabeco chính thức lên tiếng về kết luận kiểm toán Nhà nước,https://cafef.vn/du-lieu/sab-965761/sabeco-chinh-thuc-len-tieng-ve-ket-luan-kiem-toan-nha-nuoc.chn
17/03/2018 08:41,Bộ Công Thương nói gì về kết quả kiểm toán Nhà nước tại Sabeco?,https://cafef.vn/du-lieu/sab-1129819/bo-cong-thuong-noi-gi-ve-ket-qua-kiem-toan-nha-nuoc-tai-sabeco.chn
16/03/2018 17:09,SAB: Nghị quyết HĐQT v/v tổ chức họp ĐHĐCĐ bất thường năm 2018,https://cafef.vn/du-lieu/sab-990265/sab-nghi-quyet-hdqt-vv-to-chuc-hop-dhdcd-bat-thuong-nam-2018.chn
16/03/2018 11:17,"Bất ngờ rót thêm 150 triệu USD trong lúc cổ phiếu giảm mạnh, Dragon Capital đang đặt cược lớn vào Sabeco?",https://cafef.vn/du-lieu/sab-998143/bat-ngo-rot-them-150-trieu-usd-trong-luc-co-phieu-giam-manh-dragon-capital-dang-dat-cuoc-lon-vao-sabeco.chn
16/03/2018 08:24,SAB: Công văn của UBCKNN về chấp thuận gia hạn thời gian công bố BCTC cho SAB,https://cafef.vn/du-lieu/sab-1139455/sab-cong-van-cua-ubcknn-ve-chap-thuan-gia-han-thoi-gian-cong-bo-bctc-cho-sab.chn
16/03/2018 08:24,SAB: Công văn của UBCKNN về chấp thuận gia hạn thời gian công bố BCTC cho SAB,https://cafef.vn/du-lieu/sab-1216993/sab-cong-van-cua-ubcknn-ve-chap-thuan-gia-han-thoi-gian-cong-bo-bctc-cho-sab.chn
16/03/2018 07:30,Sabeco chuẩn bị họp ĐHCĐ bất thường để bầu đại diện của ThaiBev vào Hội đồng quản trị,https://cafef.vn/du-lieu/sab-971506/sabeco-chuan-bi-hop-dhcd-bat-thuong-de-bau-dai-dien-cua-thaibev-vao-hoi-dong-quan-tri.chn
15/03/2018 18:42,Dragon Capital mua 15 triệu cổ phiếu của Sabeco,https://cafef.vn/du-lieu/sab-963994/dragon-capital-mua-15-trieu-co-phieu-cua-sabeco.chn
15/03/2018 16:44,SAB: Nghị quyết HĐQT v/v tổ chức họp ĐHĐCĐ bất thường năm 2018,https://cafef.vn/du-lieu/sab-965893/sab-nghi-quyet-hdqt-vv-to-chuc-hop-dhdcd-bat-thuong-nam-2018.chn
15/03/2018 11:52,Sabeco chưa nộp ngân sách 2.400 tỷ đồng: Ai chịu trách nhiệm?,https://cafef.vn/du-lieu/sab-998137/sabeco-chua-nop-ngan-sach-2400-ty-dong-ai-chiu-trach-nhiem.chn
12/03/2018 17:22,"SAB: Gian công bố BCTC quý, BCTC bán niên và BCTC KT năm 2018",https://cafef.vn/du-lieu/sab-1224286/sab-gian-cong-bo-bctc-quy-bctc-ban-nien-va-bctc-kt-nam-2018.chn
20/02/2018 13:13,Có thêm khoảng 40 doanh nghiệp báo lãi vượt xa kế hoạch năm 2017,https://cafef.vn/du-lieu/sab-1215310/co-them-khoang-40-doanh-nghiep-bao-lai-vuot-xa-ke-hoach-nam-2017.chn
18/02/2018 08:39,Điểm mặt doanh nghiệp tỷ đô: 26 cái tên chiếm tới 69% vốn hóa TTCK Việt Nam,https://cafef.vn/du-lieu/sab-1215076/diem-mat-doanh-nghiep-ty-do-26-cai-ten-chiem-toi-69-von-hoa-ttck-viet-nam.chn
08/02/2018 08:17,Có hơn 30 doanh nghiệp đạt lãi trên nghìn tỷ năm 2017,https://cafef.vn/du-lieu/sab-1194742/co-hon-30-doanh-nghiep-dat-lai-tren-nghin-ty-nam-2017.chn
02/02/2018 11:25,"Giảm chi cho quảng cáo, lợi nhuận hợp nhất của Sabeco tăng 10% so với năm 2016",https://cafef.vn/du-lieu/sab-1169092/giam-chi-cho-quang-cao-loi-nhuan-hop-nhat-cua-sabeco-tang-10-so-voi-nam-2016.chn
26/01/2018 14:26,"Nhận cổ tức đột biến, Sabeco (mẹ) báo lãi hơn 4.600 tỷ đồng trong năm 2017",https://cafef.vn/du-lieu/sab-1229566/nhan-co-tuc-dot-bien-sabeco-me-bao-lai-hon-4600-ty-dong-trong-nam-2017.chn
18/01/2018 11:01,SAB: Báo cáo tình hình quản trị công ty năm 2017,https://cafef.vn/du-lieu/sab-1189246/sab-bao-cao-tinh-hinh-quan-tri-cong-ty-nam-2017.chn
15/01/2018 07:42,Thương hiệu Bia Sài Gòn sẽ thay đổi ra sao sau khi tỷ phú Thái Lan mua Sabeco?,https://cafef.vn/du-lieu/sab-1091290/thuong-hieu-bia-sai-gon-se-thay-doi-ra-sao-sau-khi-ty-phu-thai-lan-mua-sabeco.chn
13/01/2018 10:50,Sabeco muốn tăng thị phần tại Việt Nam lên 50% nhờ mạng lưới bán lẻ của Thaibev,https://cafef.vn/du-lieu/sab-1129945/sabeco-muon-tang-thi-phan-tai-viet-nam-len-50-nho-mang-luoi-ban-le-cua-thaibev.chn
10/01/2018 14:31,SAB: Ông Nguyễn Văn Minh - Trưởng BKS chưa bán 1.600 cp,https://cafef.vn/du-lieu/sab-1071763/sab-ong-nguyen-van-minh-truong-bks-chua-ban-1600-cp.chn
07/01/2018 15:57,CLB 'ba chữ số' 2018: Nhiều cổ phiếu đột phá,https://cafef.vn/du-lieu/sab-1106347/clb-ba-chu-so-2018-nhieu-co-phieu-dot-pha.chn
05/01/2018 14:15,SAB: Công ty TNHH Vietnam Beverage đã mua 343.642.587 cp,https://cafef.vn/du-lieu/sab-1062121/sab-cong-ty-tnhh-vietnam-beverage-da-mua-343642587-cp.chn
05/01/2018 09:03,"SAB: 15.1.2018, ngày GDKHQ tạm ứng cổ tức năm 2017 (3.500 đ/cp)",https://cafef.vn/du-lieu/sab-1034671/sab-1512018-ngay-gdkhq-tam-ung-co-tuc-nam-2017-3500-dcp.chn
04/01/2018 14:28,SAB: Bộ Công Thương đã bán 343.642.587 cp,https://cafef.vn/du-lieu/sab-1117135/sab-bo-cong-thuong-da-ban-343642587-cp.chn
04/01/2018 10:55,Lịch chốt quyền nhận cổ tức bằng tiền của 15 doanh nghiệp,https://cafef.vn/du-lieu/sab-1126609/lich-chot-quyen-nhan-co-tuc-bang-tien-cua-15-doanh-nghiep.chn
04/01/2018 10:19,Sabeco chốt danh sách cổ đông tạm ứng 35% cổ tức bằng tiền,https://cafef.vn/du-lieu/sab-1037059/sabeco-chot-danh-sach-co-dong-tam-ung-35-co-tuc-bang-tien.chn
02/01/2018 22:38,5 tỷ USD bán vốn ở Sabeco: Tiền đã về “kho”,https://cafef.vn/du-lieu/sab-1172200/5-ty-usd-ban-von-o-sabeco-tien-da-ve-kho.chn
31/12/2017 07:57,Vietcombank nắm trọn giao dịch gần 5 tỷ USD thương vụ Sabeco,https://cafef.vn/du-lieu/sab-1055146/vietcombank-nam-tron-giao-dich-gan-5-ty-usd-thuong-vu-sabeco.chn
30/12/2017 16:25,Sabeco thông qua chủ trương tạm ứng 35% cổ tức bằng tiền,https://cafef.vn/du-lieu/sab-1099741/sabeco-thong-qua-chu-truong-tam-ung-35-co-tuc-bang-tien.chn
30/12/2017 09:11,"""Câu lạc bộ 100.000 đồng"": Thêm hàng loạt gương mặt mới nhờ quá trình tăng giá xuất sắc, SAB mất vị trí cổ phiếu có thị giá cao nhất TTCK",https://cafef.vn/du-lieu/sab-1145272/cau-lac-bo-100000-dong-them-hang-loat-guong-mat-moi-nho-qua-trinh-tang-gia-xuat-sac-sab-mat-vi-tri-co-phieu-co-thi-gia-cao-nhat-ttck.chn
29/12/2017 17:35,SAB: Nghị quyết HĐQT v/v tạm ứng cổ tức năm 2017,https://cafef.vn/du-lieu/sab-1018216/sab-nghi-quyet-hdqt-vv-tam-ung-co-tuc-nam-2017.chn
29/12/2017 16:05,SAB: Ông Bùi Ngọc Hạnh - TV.HĐQT đã bán 3.000 cp,https://cafef.vn/du-lieu/sab-1012123/sab-ong-bui-ngoc-hanh-tvhdqt-da-ban-3000-cp.chn
29/12/2017 15:51,‘Thầy cúng’ Ngô Vinh Hiển đã chấp nhận bỏ cọc 641 triệu tiền mua cổ phiếu Sabeco vì giá SAB giảm mạnh?,https://cafef.vn/du-lieu/sab-1140547/thay-cung-ngo-vinh-hien-da-chap-nhan-bo-coc-641-trieu-tien-mua-co-phieu-sabeco-vi-gia-sab-giam-manh.chn
29/12/2017 13:05,ThaiBev đi vay toàn bộ 5 tỷ USD để thanh toán tiền mua cổ phần Sabeco,https://cafef.vn/du-lieu/sab-1063951/thaibev-di-vay-toan-bo-5-ty-usd-de-thanh-toan-tien-mua-co-phan-sabeco.chn
24/12/2017 19:33,"Sau thương vụ Sabeco: Không lo mất thương hiệu, lo dùng vốn hiệu quả",https://cafef.vn/du-lieu/sab-1142482/sau-thuong-vu-sabeco-khong-lo-mat-thuong-hieu-lo-dung-von-hieu-qua.chn
22/12/2017 16:32,ThaiBev chính thức lên tiếng thương vụ mua Sabeco,https://cafef.vn/du-lieu/sab-1027810/thaibev-chinh-thuc-len-tieng-thuong-vu-mua-sabeco.chn
22/12/2017 11:03,"Chân dung những ""siêu anh hùng"" mang về 1 triệu tỷ đồng cho thị trường chứng khoán năm 2017",https://cafef.vn/du-lieu/sab-1156297/chan-dung-nhung-sieu-anh-hung-mang-ve-1-trieu-ty-dong-cho-thi-truong-chung-khoan-nam-2017.chn
20/12/2017 08:01,"Hoàn tất sứ mệnh lịch sử 5 tỷ USD, cổ phiếu Sabeco sẽ “lạc trôi” về đâu?",https://cafef.vn/du-lieu/sab-1080058/hoan-tat-su-menh-lich-su-5-ty-usd-co-phieu-sabeco-se-lac-troi-ve-dau.chn
19/12/2017 17:36,"Tỷ phú Thái thâu tóm xong 53,59% vốn Sabeco, nhưng Sabeco vẫn là bia Việt!",https://cafef.vn/du-lieu/sab-1045798/ty-phu-thai-thau-tom-xong-5359-von-sabeco-nhung-sabeco-van-la-bia-viet.chn
18/12/2017 17:13,"Vì sao một cá nhân phải ""lặn lội"" để đi đấu giá Sabeco trong khi có thể dễ dàng mua trên sàn với giá rẻ hơn?",https://cafef.vn/du-lieu/sab-1208746/vi-sao-mot-ca-nhan-phai-lan-loi-de-di-dau-gia-sabeco-trong-khi-co-the-de-dang-mua-tren-san-voi-gia-re-hon.chn
18/12/2017 16:58,SAB: Kết quả tổ chức chào bán cạnh tranh cổ phần Nhà nước tại SABECO,https://cafef.vn/du-lieu/sab-1209313/sab-ket-qua-to-chuc-chao-ban-canh-tranh-co-phan-nha-nuoc-tai-sabeco.chn
18/12/2017 15:09,"Bán thành công 53,59% cổ phần Sabeco, Nhà nước thu về 110.000 tỷ đồng",https://cafef.vn/du-lieu/sab-1111162/ban-thanh-cong-5359-co-phan-sabeco-nha-nuoc-thu-ve-110000-ty-dong.chn
17/12/2017 18:46,SABECO: Thông tin đăng ký mua chào mua CP,https://cafef.vn/du-lieu/sab-1137328/sabeco-thong-tin-dang-ky-mua-chao-mua-cp.chn
17/12/2017 18:39,HOSE : Giá chào bán dự kiến cố phần nhà nước tại TCT cổ phần Bia - Rượu - Nước giải khát Sài Gòn (Sabeco),https://cafef.vn/du-lieu/sab-1125808/hose--gia-chao-ban-du-kien-co-phan-nha-nuoc-tai-tct-co-phan-bia-ruou-nuoc-giai-khat-sai-gon-sabeco.chn
17/12/2017 18:37,"Chốt sổ đăng ký mua cổ phần Sabeco: 1 cá nhân và 1 tổ chức sẽ mua toàn bộ lượng cổ phiếu trị giá 4,8 tỷ USD",https://cafef.vn/du-lieu/sab-1212463/chot-so-dang-ky-mua-co-phan-sabeco-1-ca-nhan-va-1-to-chuc-se-mua-toan-bo-luong-co-phieu-tri-gia-48-ty-usd.chn
15/12/2017 17:01,"Reuters: ThaiBev đã có kế hoạch mua cổ phần của Sabeco từ lâu, họ dường như chấp nhận mọi yêu cầu được đưa ra",https://cafef.vn/du-lieu/sab-1212088/reuters-thaibev-da-co-ke-hoach-mua-co-phan-cua-sabeco-tu-lau-ho-duong-nhu-chap-nhan-moi-yeu-cau-duoc-dua-ra.chn
14/12/2017 10:31,"Vì sao tập đoàn lớn nước ngoài chê cổ phiếu Sabeco đắt hơn cả Heineken, Asahi nhưng vẫn thích mua?",https://cafef.vn/du-lieu/sab-1211089/vi-sao-tap-doan-lon-nuoc-ngoai-che-co-phieu-sabeco-dat-hon-ca-heineken-asahi-nhung-van-thich-mua.chn
13/12/2017 14:26,"Không chỉ dừng lại ở 25%, Vietnam Beverage chính thức đăng ký mua tới 51% cổ phần Sabeco",https://cafef.vn/du-lieu/sab-1040521/khong-chi-dung-lai-o-25-vietnam-beverage-chinh-thuc-dang-ky-mua-toi-51-co-phan-sabeco.chn
13/12/2017 14:08,"Trước thương vụ Sabeco, tỷ phú Thái đã có ""bộ sưu tập"" các khoản đầu tư tại Việt Nam trị giá hơn 3 tỷ USD",https://cafef.vn/du-lieu/sab-1005451/truoc-thuong-vu-sabeco-ty-phu-thai-da-co-bo-suu-tap-cac-khoan-dau-tu-tai-viet-nam-tri-gia-hon-3-ty-usd.chn
13/12/2017 11:10,ThaiBev khẳng định Vietnam Beverage chưa chính thức đăng ký đấu giá Sabeco,https://cafef.vn/du-lieu/sab-984103/thaibev-khang-dinh-vietnam-beverage-chua-chinh-thuc-dang-ky-dau-gia-sabeco.chn
12/12/2017 16:47,SAB: Ông Bùi Ngọc Hạnh - TV.HĐQT đăng ký bán 3.000 cp,https://cafef.vn/du-lieu/sab-968977/sab-ong-bui-ngoc-hanh-tvhdqt-dang-ky-ban-3000-cp.chn
12/12/2017 11:09,SAB: Quyết định điều chỉnh nội dung Quyết định số 4444/QĐ-BCT ngày 27/11/2017,https://cafef.vn/du-lieu/sab-1211290/sab-quyet-dinh-dieu-chinh-noi-dung-quyet-dinh-so-4444qdbct-ngay-27112017.chn
12/12/2017 09:53,SAB: Bộ Công Thương đăng ký bán 343.662.587 cp,https://cafef.vn/du-lieu/sab-1212034/sab-bo-cong-thuong-dang-ky-ban-343662587-cp.chn
12/12/2017 07:41,SAB: Nhà đầu tư chào mua cạnh tranh công khai cổ phần thuộc sở hữu nhà nước tại SABECO,https://cafef.vn/du-lieu/sab-963817/sab-nha-dau-tu-chao-mua-canh-tranh-cong-khai-co-phan-thuoc-so-huu-nha-nuoc-tai-sabeco.chn
12/12/2017 00:43,"Sở hữu 19% Vinamilk, thâu tóm Metro, tỷ phú Thái Lan tiếp tục là ứng cử viên duy nhất sẽ ""thâu tóm"" Sabeco",https://cafef.vn/du-lieu/sab-1244458/so-huu-19-vinamilk-thau-tom-metro-ty-phu-thai-lan-tiep-tuc-la-ung-cu-vien-duy-nhat-se-thau-tom-sabeco.chn
12/12/2017 00:03,1 doanh nghiệp vốn 682 tỷ đã đăng ký mua tối thiểu 25% cổ phần của Sabeco,https://cafef.vn/du-lieu/sab-1180039/1-doanh-nghiep-von-682-ty-da-dang-ky-mua-toi-thieu-25-co-phan-cua-sabeco.chn
10/12/2017 08:01,Cổ phần Sabeco và cuộc quyết chiến giữa “Cáo” và “Voi”,https://cafef.vn/du-lieu/sab-1064167/co-phan-sabeco-va-cuoc-quyet-chien-giua-cao-va-voi.chn
08/12/2017 17:26,SAB: Ông Nguyễn Văn Minh - Trưởng BKS đăng ký bán 1.600 cp,https://cafef.vn/du-lieu/sab-1014973/sab-ong-nguyen-van-minh-truong-bks-dang-ky-ban-1600-cp.chn
04/12/2017 10:43,"""Đánh bại"" Sabeco cả về doanh thu lẫn lợi nhuận dù thị phần kém xa, Heineken mới thực sự là công ty thống trị thị trường bia Việt",https://cafef.vn/du-lieu/sab-1088125/danh-bai-sabeco-ca-ve-doanh-thu-lan-loi-nhuan-du-thi-phan-kem-xa-heineken-moi-thuc-su-la-cong-ty-thong-tri-thi-truong-bia-viet.chn
04/12/2017 10:35,"Tăng vù vù, cổ phiếu Vinamilk lọt top 5 cổ phiếu đắt giá nhất thị trường chứng khoán Việt",https://cafef.vn/du-lieu/sab-1075678/tang-vu-vu-co-phieu-vinamilk-lot-top-5-co-phieu-dat-gia-nhat-thi-truong-chung-khoan-viet.chn
04/12/2017 09:43,Dòng vốn tỷ “đô” của tỷ phú Thái tại thị trường Việt Nam,https://cafef.vn/du-lieu/sab-1005595/dong-von-ty-do-cua-ty-phu-thai-tai-thi-truong-viet-nam.chn
30/11/2017 10:03,Đối thoại trước thềm bán vốn: Sabeco chưa có kế hoạch mở room cho NĐT ngoại,https://cafef.vn/du-lieu/sab-1199632/doi-thoai-truoc-them-ban-von-sabeco-chua-co-ke-hoach-mo-room-cho-ndt-ngoai.chn
30/11/2017 07:47,"Nhận nhiều ý kiến trái chiều về mức giá “trên trời” cho Sabeco, nhưng Bộ Công thương vẫn có lý do để tự tin cho quyết định này",https://cafef.vn/du-lieu/sab-1201063/nhan-nhieu-y-kien-trai-chieu-ve-muc-gia-tren-troi-cho-sabeco-nhung-bo-cong-thuong-van-co-ly-do-de-tu-tin-cho-quyet-dinh-nay.chn
29/11/2017 11:43,Ai sẽ mua cổ phần Sabeco với giá trên 320.000 đồng/cp?,https://cafef.vn/du-lieu/sab-1207930/ai-se-mua-co-phan-sabeco-voi-gia-tren-320000-dongcp.chn
29/11/2017 11:29,Cổ phiếu ngành bia đồng loạt bứt phá mạnh sau khi Bộ Công thương công bố giá khởi điểm chào bán Sabeco,https://cafef.vn/du-lieu/sab-1208629/co-phieu-nganh-bia-dong-loat-but-pha-manh-sau-khi-bo-cong-thuong-cong-bo-gia-khoi-diem-chao-ban-sabeco.chn
28/11/2017 16:43,"Sáng 29/11, Bộ Công Thương công bố thông tin chi tiết về chào bán cổ phần tại Sabeco",https://cafef.vn/du-lieu/sab-964363/sang-2911-bo-cong-thuong-cong-bo-thong-tin-chi-tiet-ve-chao-ban-co-phan-tai-sabeco.chn
