Thời gian,Tiêu đề,URL
06/04/2020 11:43,"Gặp khó khăn kép, Sabeco vẫn rộng tay gom gạo, nước đóng chai, nước rửa tay...hỗ trợ chống dịch COVID-19",https://cafef.vn/du-lieu/sab-1349098/gap-kho-khan-kep-sabeco-van-rong-tay-gom-gao-nuoc-dong-chai-nuoc-rua-tayho-tro-chong-dich-covid19.chn
29/03/2020 09:20,Doanh nghiệp bia đặt kế hoạch lãi giảm 30-70% trước tác động kép từ Covid-19 và Nghị định 100,https://cafef.vn/du-lieu/sab-1281847/doanh-nghiep-bia-dat-ke-hoach-lai-giam-3070-truoc-tac-dong-kep-tu-covid19-va-nghi-dinh-100.chn
22/03/2020 10:04,"Không riêng Sabeco, cổ đông chiến lược của hàng loạt doanh nghiệp lớn cũng bị ""bốc hơi"" 40-50% giá trị chỉ sau thời gian ngắn",https://cafef.vn/du-lieu/sab-1621735/khong-rieng-sabeco-co-dong-chien-luoc-cua-hang-loat-doanh-nghiep-lon-cung-bi-boc-hoi-4050-gia-tri-chi-sau-thoi-gian-ngan.chn
20/03/2020 18:02,SAB: Hủy ngày ĐKCC để tham dự ĐHĐCĐ thường niên năm 2020,https://cafef.vn/du-lieu/sab-1725679/sab-huy-ngay-dkcc-de-tham-du-dhdcd-thuong-nien-nam-2020.chn
18/03/2020 14:46,SAB: HĐQT thông qua việc hoãn ngày tổ chức họp ĐHĐCĐ thường niên 2020,https://cafef.vn/du-lieu/sab-1720795/sab-hdqt-thong-qua-viec-hoan-ngay-to-chuc-hop-dhdcd-thuong-nien-2020.chn
13/03/2020 17:36,SAB: Thông qua giao dịch với bên liên quan,https://cafef.vn/du-lieu/sab-1721221/sab-thong-qua-giao-dich-voi-ben-lien-quan.chn
10/03/2020 10:56,"Tỷ phú Thái từng chi gần 5 tỷ USD để mua 53% cổ phần, nhưng giá trị của cả Sabeco hiện chỉ còn hơn 4 tỷ USD",https://cafef.vn/du-lieu/sab-1717165/ty-phu-thai-tung-chi-gan-5-ty-usd-de-mua-53-co-phan-nhung-gia-tri-cua-ca-sabeco-hien-chi-con-hon-4-ty-usd.chn
27/02/2020 13:13,SAB: Công văn của UBCKNN về chấp thuận gia hạn thời gian công bố BCTC năm 2020,https://cafef.vn/du-lieu/sab-1640131/sab-cong-van-cua-ubcknn-ve-chap-thuan-gia-han-thoi-gian-cong-bo-bctc-nam-2020.chn
25/02/2020 11:00,Có hơn 50 doanh nghiệp lãi nghìn tỷ năm 2019,https://cafef.vn/du-lieu/sab-1626811/co-hon-50-doanh-nghiep-lai-nghin-ty-nam-2019.chn
21/02/2020 16:37,SAB: Công văn của UBCKNN về chấp thuận gia hạn thời gian công bố BCTC năm 2020,https://cafef.vn/du-lieu/sab-1641169/sab-cong-van-cua-ubcknn-ve-chap-thuan-gia-han-thoi-gian-cong-bo-bctc-nam-2020.chn
20/02/2020 10:35,"BVSC: “2020 là năm đầy thử thách cho Sabeco, doanh thu nhiều khả năng sẽ sụt giảm”",https://cafef.vn/du-lieu/sab-1640833/bvsc-2020-la-nam-day-thu-thach-cho-sabeco-doanh-thu-nhieu-kha-nang-se-sut-giam.chn
17/02/2020 08:56,Đi tìm ý tưởng đầu tư giai đoạn Corona: Soi những doanh nghiệp có lượng tiền tươi thóc thật hàng chục nghìn tỷ đồng,https://cafef.vn/du-lieu/sab-1716217/di-tim-y-tuong-dau-tu-giai-doan-corona-soi-nhung-doanh-nghiep-co-luong-tien-tuoi-thoc-that-hang-chuc-nghin-ty-dong.chn
14/02/2020 09:25,"Sabeco: Vừa lên kế hoạch thích nghi Nghị định 100 lại phải ứng phó dịch nCoV, mục tiêu 2020 sẽ ưu tiên tiết kiệm chi phí",https://cafef.vn/du-lieu/sab-1524916/sabeco-vua-len-ke-hoach-thich-nghi-nghi-dinh-100-lai-phai-ung-pho-dich-ncov-muc-tieu-2020-se-uu-tien-tiet-kiem-chi-phi.chn
12/02/2020 08:52,"Sabeco: Tin đồn kéo lùi doanh thu quý cuối năm, đang lên ý tưởng thích nghi với quy định uống rượu bia thì không lái xe",https://cafef.vn/du-lieu/sab-1715392/sabeco-tin-don-keo-lui-doanh-thu-quy-cuoi-nam-dang-len-y-tuong-thich-nghi-voi-quy-dinh-uong-ruou-bia-thi-khong-lai-xe.chn
10/02/2020 09:13,"Điểm danh những doanh nghiệp chốt quyền nhận cổ tức bằng tiền, bằng cổ phiếu và cổ phiếu thưởng tuần này",https://cafef.vn/du-lieu/sab-1580206/diem-danh-nhung-doanh-nghiep-chot-quyen-nhan-co-tuc-bang-tien-bang-co-phieu-va-co-phieu-thuong-tuan-nay.chn
31/01/2020 17:38,"SAB: 13.2.2020, ngày GDKHQ tạm ứng cổ tức năm 2019 (3.500 đ/cp)",https://cafef.vn/du-lieu/sab-1527547/sab-1322020-ngay-gdkhq-tam-ung-co-tuc-nam-2019-3500-dcp.chn
31/01/2020 17:38,"SAB: 20.3.2020, ngày GDKHQ thực hiện quyền tham dự ĐHCĐ thường niên năm 2020",https://cafef.vn/du-lieu/sab-1531222/sab-2032020-ngay-gdkhq-thuc-hien-quyen-tham-du-dhcd-thuong-nien-nam-2020.chn
29/01/2020 08:57,Lịch chốt quyền nhận cổ tức bằng tiền của 9 doanh nghiệp,https://cafef.vn/du-lieu/sab-1633741/lich-chot-quyen-nhan-co-tuc-bang-tien-cua-9-doanh-nghiep.chn
25/01/2020 20:02,"Lãi kỷ lục hơn 5.370 tỷ đồng năm 2019, Sabeco quyết định tạm ứng cổ tức bằng tiền tỷ lệ 35%",https://cafef.vn/du-lieu/sab-1480240/lai-ky-luc-hon-5370-ty-dong-nam-2019-sabeco-quyet-dinh-tam-ung-co-tuc-bang-tien-ty-le-35.chn
21/01/2020 17:07,SAB: Báo cáo tình hình quản trị công ty năm 2019,https://cafef.vn/du-lieu/sab-1542037/sab-bao-cao-tinh-hinh-quan-tri-cong-ty-nam-2019.chn
21/01/2020 16:51,SAB: Ngày ĐKCC để tạm ứng cổ tức năm 2019 bằng tiền mặt,https://cafef.vn/du-lieu/sab-1532323/sab-ngay-dkcc-de-tam-ung-co-tuc-nam-2019-bang-tien-mat.chn
21/01/2020 16:51,SAB: Ngày ĐKCC để thực hiện quyền tham dự ĐHCĐ thường niên năm 2020,https://cafef.vn/du-lieu/sab-1542424/sab-ngay-dkcc-de-thuc-hien-quyen-tham-du-dhcd-thuong-nien-nam-2020.chn
21/01/2020 15:10,SAB: Giải trình chênh lệch lợi nhuận quý 4/2019 so với quý 4/2018,https://cafef.vn/du-lieu/sab-1477123/sab-giai-trinh-chenh-lech-loi-nhuan-quy-42019-so-voi-quy-42018.chn
21/01/2020 14:26,"Chi nghìn tỷ cho quảng cáo, Sabeco báo lãi kỷ lục gần 5.400 tỷ đồng trong năm 2019",https://cafef.vn/du-lieu/sab-1429246/chi-nghin-ty-cho-quang-cao-sabeco-bao-lai-ky-luc-gan-5400-ty-dong-trong-nam-2019.chn
08/01/2020 11:12,"SSI Research: Sabeco sẽ khó duy trì tăng trưởng cao trước quy định ""uống rượu bia thì không lái xe""",https://cafef.vn/du-lieu/sab-1584118/ssi-research-sabeco-se-kho-duy-tri-tang-truong-cao-truoc-quy-dinh-uong-ruou-bia-thi-khong-lai-xe.chn
01/01/2020 23:01,Kiểm toán bỏ kiến nghị Sabeco phải nộp 2.495 tỷ đồng vào NSNN,https://cafef.vn/du-lieu/sab-1465780/kiem-toan-bo-kien-nghi-sabeco-phai-nop-2495-ty-dong-vao-nsnn.chn
31/12/2019 17:05,SAB: Nộp ngân sách nhà nước,https://cafef.vn/du-lieu/sab-1503325/sab-nop-ngan-sach-nha-nuoc.chn
19/12/2019 16:59,Thaibev phủ nhận thông tin bán Sabeco,https://cafef.vn/du-lieu/sab-1711033/thaibev-phu-nhan-thong-tin-ban-sabeco.chn
16/12/2019 10:40,Financial Times: Người Thái đang tìm cách bán lại Sabeco cho Budweiser?,https://cafef.vn/du-lieu/sab-1272706/financial-times-nguoi-thai-dang-tim-cach-ban-lai-sabeco-cho-budweiser.chn
01/12/2019 10:31,"Chuẩn bị niêm yết mảng bia lên sàn Singapore, ThaiBev đang ráo riết cải tổ Sabeco?",https://cafef.vn/du-lieu/sab-1712671/chuan-bi-niem-yet-mang-bia-len-san-singapore-thaibev-dang-rao-riet-cai-to-sabeco.chn
29/11/2019 15:19,Thaibev sẽ niêm yết mảng bia tại Thái Lan và Việt Nam lên sàn Singapore với mức định giá 10 tỷ USD,https://cafef.vn/du-lieu/sab-1708597/thaibev-se-niem-yet-mang-bia-tai-thai-lan-va-viet-nam-len-san-singapore-voi-muc-dinh-gia-10-ty-usd.chn
15/11/2019 16:21,"Heineken bán 5,2 triệu cổ phiếu Sabeco, không còn là cổ đông lớn sau hơn 1 thập kỷ nắm giữ",https://cafef.vn/du-lieu/sab-1707232/heineken-ban-52-trieu-co-phieu-sabeco-khong-con-la-co-dong-lon-sau-hon-1-thap-ky-nam-giu.chn
15/11/2019 14:27,SAB: Heineken Asia Pacific PTE.LTD đã chuyển nhượng 5.199.200 cp,https://cafef.vn/du-lieu/sab-1679554/sab-heineken-asia-pacific-pteltd-da-chuyen-nhuong-5199200-cp.chn
25/10/2019 17:32,SAB: Giải trình chênh lệch lợi nhuận quý 3/2019 so với quý 3/2018,https://cafef.vn/du-lieu/sab-1708864/sab-giai-trinh-chenh-lech-loi-nhuan-quy-32019-so-voi-quy-32018.chn
25/10/2019 08:46,"Hiệu quả kinh doanh của Sabeco tiếp tục cải thiện dưới tay người Thái, lãi ròng 9 tháng tăng 23%",https://cafef.vn/du-lieu/sab-1605781/hieu-qua-kinh-doanh-cua-sabeco-tiep-tuc-cai-thien-duoi-tay-nguoi-thai-lai-rong-9-thang-tang-23.chn
07/10/2019 15:43,SAB: Thay đổi người có liên quan của người nội bộ,https://cafef.vn/du-lieu/sab-1626613/sab-thay-doi-nguoi-co-lien-quan-cua-nguoi-noi-bo.chn
03/09/2019 10:20,"Điểm danh những doanh nghiệp chốt quyền nhận cổ tức bằng tiền, bằng cổ phiếu và cổ phiếu thưởng tuần này",https://cafef.vn/du-lieu/sab-1489756/diem-danh-nhung-doanh-nghiep-chot-quyen-nhan-co-tuc-bang-tien-bang-co-phieu-va-co-phieu-thuong-tuan-nay.chn
29/08/2019 17:40,SAB: Giải trình chênh lệch KQKD 6 tháng đầu năm 2019 so với 6 tháng đầu năm 2018,https://cafef.vn/du-lieu/sab-1463284/sab-giai-trinh-chenh-lech-kqkd-6-thang-dau-nam-2019-so-voi-6-thang-dau-nam-2018.chn
29/08/2019 17:38,"Vingroup, Vinamilk, Vietjet...lọt top 200 công ty có doanh thu trên 1 tỉ USD tốt nhất tại khu vực châu Á - Thái Bình Dương",https://cafef.vn/du-lieu/sab-1439761/vingroup-vinamilk-vietjetlot-top-200-cong-ty-co-doanh-thu-tren-1-ti-usd-tot-nhat-tai-khu-vuc-chau-a-thai-binh-duong.chn
27/08/2019 17:47,"SAB: 5.9.2019, ngày GDKHQ trả cổ tức bổ sung năm 2018 (1.500 đ/cp)",https://cafef.vn/du-lieu/sab-1378147/sab-592019-ngay-gdkhq-tra-co-tuc-bo-sung-nam-2018-1500-dcp.chn
23/08/2019 14:04,Lịch chốt quyền nhận cổ tức bằng tiền của 10 doanh nghiệp,https://cafef.vn/du-lieu/sab-1426393/lich-chot-quyen-nhan-co-tuc-bang-tien-cua-10-doanh-nghiep.chn
22/08/2019 11:10,Sabeco chi thêm nghìn tỷ trả cổ tức bổ sung cho năm 2018,https://cafef.vn/du-lieu/sab-1462087/sabeco-chi-them-nghin-ty-tra-co-tuc-bo-sung-cho-nam-2018.chn
22/08/2019 08:45,SAB: Ngày ĐKCC để chi trả cổ tức bổ sung năm 2018 bằng tiền mặt,https://cafef.vn/du-lieu/sab-1455289/sab-ngay-dkcc-de-chi-tra-co-tuc-bo-sung-nam-2018-bang-tien-mat.chn
20/08/2019 17:24,SAB: Giao dịch với bên có liên quan,https://cafef.vn/du-lieu/sab-1444990/sab-giao-dich-voi-ben-co-lien-quan.chn
06/08/2019 08:54,Câu lạc bộ lãi nghìn tỷ đã gọi tên 31 doanh nghiệp,https://cafef.vn/du-lieu/sab-1540096/cau-lac-bo-lai-nghin-ty-da-goi-ten-31-doanh-nghiep.chn
06/08/2019 07:40,Sabeco tăng giá bán bia Saigon Special – sản phẩm cạnh tranh trực tiếp với Heineken,https://cafef.vn/du-lieu/sab-1356463/sabeco-tang-gia-ban-bia-saigon-special-san-pham-canh-tranh-truc-tiep-voi-heineken.chn
29/07/2019 17:39,SAB: Giải trình BCTC HN và riêng quý 2.2019 so với quý 2.2018,https://cafef.vn/du-lieu/sab-1310359/sab-giai-trinh-bctc-hn-va-rieng-quy-22019-so-voi-quy-22018.chn
29/07/2019 16:49,Sabeco lãi ròng 1.430 tỷ đồng - thiết lập kỷ lục mới sau khi về tay người Thái,https://cafef.vn/du-lieu/sab-1702420/sabeco-lai-rong-1430-ty-dong-thiet-lap-ky-luc-moi-sau-khi-ve-tay-nguoi-thai.chn
26/07/2019 17:12,Câu lạc bộ lãi nghìn tỷ đã gọi tên hơn hai chục doanh nghiệp,https://cafef.vn/du-lieu/sab-1356922/cau-lac-bo-lai-nghin-ty-da-goi-ten-hon-hai-chuc-doanh-nghiep.chn
11/07/2019 17:16,SAB: Đính chính về việc ký hợp đồng kiểm toán BCTC 2019,https://cafef.vn/du-lieu/sab-1699573/sab-dinh-chinh-ve-viec-ky-hop-dong-kiem-toan-bctc-2019.chn
11/07/2019 14:12,SAB: Ký hợp đồng kiểm toán BCTC 2019,https://cafef.vn/du-lieu/sab-1696591/sab-ky-hop-dong-kiem-toan-bctc-2019.chn
01/06/2019 09:25,"Đầu tư mạnh vào Sabeco và Vinamilk, khối tài sản của tỷ phú Thái Lan tăng thêm 2,5 tỷ USD từ đầu năm",https://cafef.vn/du-lieu/sab-1600120/dau-tu-manh-vao-sabeco-va-vinamilk-khoi-tai-san-cua-ty-phu-thai-lan-tang-them-25-ty-usd-tu-dau-nam.chn
18/05/2019 11:19,"Tư duy marketing của Thaibev tại Sabeco: Chỉ ""đầu tư"" chứ không ""tiêu tiền"" và chiến lược bắn 1 mũi tên trúng 2 đích",https://cafef.vn/du-lieu/sab-1440694/tu-duy-marketing-cua-thaibev-tai-sabeco-chi-dau-tu-chu-khong-tieu-tien-va-chien-luoc-ban-1-mui-ten-trung-2-dich.chn
16/05/2019 10:14,Doanh nghiệp trong “rổ VN30” lãi ra sao trong quý 1/2019,https://cafef.vn/du-lieu/sab-1424410/doanh-nghiep-trong-ro-vn30-lai-ra-sao-trong-quy-12019.chn
07/05/2019 17:23,SAB: Tăng vốn tại CTCP Bia Sài Gòn - Lâm Đồng,https://cafef.vn/du-lieu/sab-1420978/sab-tang-von-tai-ctcp-bia-sai-gon-lam-dong.chn
03/05/2019 17:33,SAB: Giải trình biến động KQKD HN và Cty mẹ quý 1.2019 so với cùng kỳ năm trước,https://cafef.vn/du-lieu/sab-1355272/sab-giai-trinh-bien-dong-kqkd-hn-va-cty-me-quy-12019-so-voi-cung-ky-nam-truoc.chn
02/05/2019 10:28,"Mạnh tay chi tiền quảng cáo, Sabeco lập kỷ lục về doanh thu trong quý 1",https://cafef.vn/du-lieu/sab-1388656/manh-tay-chi-tien-quang-cao-sabeco-lap-ky-luc-ve-doanh-thu-trong-quy-1.chn
28/04/2019 19:09,"Đổi rổ VN30: SAB vẫn có khả năng “làm loạn”, cơ cấu thay đổi rất nhỏ",https://cafef.vn/du-lieu/sab-1330213/doi-ro-vn30-sab-van-co-kha-nang-lam-loan-co-cau-thay-doi-rat-nho.chn
24/04/2019 11:34,"VCSC: ThaiBev sẽ khai thác nhiều giá trị cho Sabeco, tốc độ tăng trưởng kép đạt 20% trong 3 năm tới",https://cafef.vn/du-lieu/sab-1310392/vcsc-thaibev-se-khai-thac-nhieu-gia-tri-cho-sabeco-toc-do-tang-truong-kep-dat-20-trong-3-nam-toi.chn
23/04/2019 13:35,SAB: Điều lệ công ty và Quy chế quản trị công ty,https://cafef.vn/du-lieu/sab-1313686/sab-dieu-le-cong-ty-va-quy-che-quan-tri-cong-ty.chn
19/04/2019 11:32,"Vì đâu chứng khoán Việt Nam “một mình một chợ” trong khi Trung Quốc tăng 30%, Dow Jones tiến về đỉnh cũ?",https://cafef.vn/du-lieu/sab-1368472/vi-dau-chung-khoan-viet-nam-mot-minh-mot-cho-trong-khi-trung-quoc-tang-30-dow-jones-tien-ve-dinh-cu.chn
12/04/2019 18:35,SAB: Công văn của UBCKNN về chấp thuận gia hạn thời gian công bố BCTC năm 2019,https://cafef.vn/du-lieu/sab-1686013/sab-cong-van-cua-ubcknn-ve-chap-thuan-gia-han-thoi-gian-cong-bo-bctc-nam-2019.chn
12/04/2019 18:34,SAB: Điều chỉnh tài liệu họp ĐHĐCĐ thường niên năm 2019,https://cafef.vn/du-lieu/sab-1686739/sab-dieu-chinh-tai-lieu-hop-dhdcd-thuong-nien-nam-2019.chn
12/04/2019 18:33,SAB: Link báo cáo thường niên năm 2018,https://cafef.vn/du-lieu/sab-1687135/sab-link-bao-cao-thuong-nien-nam-2018.chn
12/04/2019 13:34,ĐHĐCĐ Sabeco: Đâu là những điểm cần cải thiện trong chiến lược kinh doanh?,https://cafef.vn/du-lieu/sab-1689235/dhdcd-sabeco-dau-la-nhung-diem-can-cai-thien-trong-chien-luoc-kinh-doanh.chn
10/04/2019 17:47,SAB: Công văn của UBCKNN về chấp thuận gia hạn thời gian công bố BCTC năm tài chính 2019,https://cafef.vn/du-lieu/sab-1674154/sab-cong-van-cua-ubcknn-ve-chap-thuan-gia-han-thoi-gian-cong-bo-bctc-nam-tai-chinh-2019.chn
10/04/2019 08:43,ĐHĐCĐ Chương Dương (SCD): Thaibev hỗ trợ đưa thương hiệu Xá xị Chương Dương trở lại,https://cafef.vn/du-lieu/sab-1681987/dhdcd-chuong-duong-scd-thaibev-ho-tro-dua-thuong-hieu-xa-xi-chuong-duong-tro-lai.chn
04/04/2019 11:10,SAB: Điều chỉnh tài liệu họp ĐHĐCĐ thường niên năm 2019,https://cafef.vn/du-lieu/sab-1629430/sab-dieu-chinh-tai-lieu-hop-dhdcd-thuong-nien-nam-2019.chn
03/04/2019 07:15,"Sabeco giảm 11% lãi ròng song vẫn vượt kế hoạch, Thaibev muốn tăng cổ tức thêm ngàn tỷ: Liệu có xứng đáng?",https://cafef.vn/du-lieu/sab-1680922/sabeco-giam-11-lai-rong-song-van-vuot-ke-hoach-thaibev-muon-tang-co-tuc-them-ngan-ty-lieu-co-xung-dang.chn
02/04/2019 16:30,SAB: Tài liệu họp ĐHĐCĐ thường niên năm 2019,https://cafef.vn/du-lieu/sab-1674934/sab-tai-lieu-hop-dhdcd-thuong-nien-nam-2019.chn
02/04/2019 13:33,SAB: Giải trình BCTC HN và riêng năm 2018 đã được kiểm toán,https://cafef.vn/du-lieu/sab-1678657/sab-giai-trinh-bctc-hn-va-rieng-nam-2018-da-duoc-kiem-toan.chn
30/03/2019 00:01,"Sabeco đặt kế hoạch lãi 4.717 tỷ đồng năm 2019, dự kiến chia cổ tức năm 2018 tỷ lệ 50%",https://cafef.vn/du-lieu/sab-1643617/sabeco-dat-ke-hoach-lai-4717-ty-dong-nam-2019-du-kien-chia-co-tuc-nam-2018-ty-le-50.chn
13/03/2019 17:31,SAB: Thông qua giao dịch với bên liên quan,https://cafef.vn/du-lieu/sab-1517695/sab-thong-qua-giao-dich-voi-ben-lien-quan.chn
05/03/2019 13:17,"SAB: Đề nghị gia hạn thời gian công bố BCTC quý, BCTC bán niên và BCTC KT năm 2019",https://cafef.vn/du-lieu/sab-1484233/sab-de-nghi-gia-han-thoi-gian-cong-bo-bctc-quy-bctc-ban-nien-va-bctc-kt-nam-2019.chn
28/02/2019 17:41,SAB: Giao dịch với bên liên quan,https://cafef.vn/du-lieu/sab-1463944/sab-giao-dich-voi-ben-lien-quan.chn
13/02/2019 08:22,Vượt kế hoạch kinh doanh: Dễ như ăn kẹo?,https://cafef.vn/du-lieu/sab-1382338/vuot-ke-hoach-kinh-doanh-de-nhu-an-keo.chn
01/02/2019 10:16,"SAB: 19.3.2019, ngày GDKHQ tổ chức Đại hội đồng cổ đông thường niên năm 2019",https://cafef.vn/du-lieu/sab-1344616/sab-1932019-ngay-gdkhq-to-chuc-dai-hoi-dong-co-dong-thuong-nien-nam-2019.chn
31/01/2019 17:10,SAB: Báo cáo tình hình quản trị công ty năm 2018,https://cafef.vn/du-lieu/sab-1349251/sab-bao-cao-tinh-hinh-quan-tri-cong-ty-nam-2018.chn
28/01/2019 16:11,SAB: Nghị quyết HĐQT v/v tổ chức ĐHĐCĐ thường niên năm 2019,https://cafef.vn/du-lieu/sab-1331608/sab-nghi-quyet-hdqt-vv-to-chuc-dhdcd-thuong-nien-nam-2019.chn
25/01/2019 22:47,"Lãi ròng của Sabeco giảm 11% trong năm đầu về tay người Thái, nắm giữ 12.000 tỷ đồng tiền mặt và tiền gửi",https://cafef.vn/du-lieu/sab-1307119/lai-rong-cua-sabeco-giam-11-trong-nam-dau-ve-tay-nguoi-thai-nam-giu-12000-ty-dong-tien-mat-va-tien-gui.chn
11/01/2019 14:10,SAB: Tỷ lệ nước ngoài tại công ty,https://cafef.vn/du-lieu/sab-1667644/sab-ty-le-nuoc-ngoai-tai-cong-ty.chn
08/01/2019 11:26,Sabeco – Khi thương hiệu Việt trong tay ông chủ ngoại,https://cafef.vn/du-lieu/sab-1668430/sabeco-khi-thuong-hieu-viet-trong-tay-ong-chu-ngoai.chn
05/01/2019 09:35,"Tăng vốn lên 111.890 tỷ đồng, Vietnam Beverage ""sau một đêm"" trở thành một trong những công ty lớn nhất cả nước",https://cafef.vn/du-lieu/sab-1668658/tang-von-len-111890-ty-dong-vietnam-beverage-sau-mot-dem-tro-thanh-mot-trong-nhung-cong-ty-lon-nhat-ca-nuoc.chn
03/01/2019 16:21,SAB: Đính chính về nội dung nhận được quyết định của cơ quan thuế,https://cafef.vn/du-lieu/sab-1666432/sab-dinh-chinh-ve-noi-dung-nhan-duoc-quyet-dinh-cua-co-quan-thue.chn
03/01/2019 16:19,SAB: Nghị quyết HĐQT thông qua giao dịch liên quan với Công ty TNHH MM Mega Market,https://cafef.vn/du-lieu/sab-1662034/sab-nghi-quyet-hdqt-thong-qua-giao-dich-lien-quan-voi-cong-ty-tnhh-mm-mega-market.chn
03/01/2019 16:17,SAB: Nhận được quyết định dừng cưỡng chế của Cục thuế TP.HCM,https://cafef.vn/du-lieu/sab-1663987/sab-nhan-duoc-quyet-dinh-dung-cuong-che-cua-cuc-thue-tphcm.chn
02/01/2019 17:25,SAB: Quyết định xử phạt về thuế,https://cafef.vn/du-lieu/sab-1664938/sab-quyet-dinh-xu-phat-ve-thue.chn
02/01/2019 10:57,SAB: Nghị quyết ĐHĐCĐ bất thường năm 2018 v/v lấy ý kiến cổ đông bằng văn bản,https://cafef.vn/du-lieu/sab-1661335/sab-nghi-quyet-dhdcd-bat-thuong-nam-2018-vv-lay-y-kien-co-dong-bang-van-ban.chn
26/12/2018 07:17,"Việt Nam thuộc Top tiêu thụ bia thế giới, song thương hiệu bia Việt đang thất thế trên sân nhà!",https://cafef.vn/du-lieu/sab-1658464/viet-nam-thuoc-top-tieu-thu-bia-the-gioi-song-thuong-hieu-bia-viet-dang-that-the-tren-san-nha.chn
11/12/2018 15:28,SAB: Điều chỉnh tỷ lệ sở hữu của nhà đầu tư nước ngoài tại SAB lên 100%,https://cafef.vn/du-lieu/sab-1069195/sab-dieu-chinh-ty-le-so-huu-cua-nha-dau-tu-nuoc-ngoai-tai-sab-len-100.chn
04/12/2018 13:30,SAB: Công văn của UBCKNN xác nhận không hạn chế tỷ lệ sở hữu nhà đầu tư nước ngoài,https://cafef.vn/du-lieu/sab-1240705/sab-cong-van-cua-ubcknn-xac-nhan-khong-han-che-ty-le-so-huu-nha-dau-tu-nuoc-ngoai.chn
01/12/2018 10:01,Sabeco lấy ý kiến cổ đông về việc trích thêm 30 tỷ đồng vào Quỹ phát triển Khoa học,https://cafef.vn/du-lieu/sab-1136590/sabeco-lay-y-kien-co-dong-ve-viec-trich-them-30-ty-dong-vao-quy-phat-trien-khoa-hoc.chn
26/11/2018 07:12,"Điểm danh những doanh nghiệp trả cổ tức bằng tiền, cổ phiếu và cổ phiếu thưởng tuần này",https://cafef.vn/du-lieu/sab-1244170/diem-danh-nhung-doanh-nghiep-tra-co-tuc-bang-tien-co-phieu-va-co-phieu-thuong-tuan-nay.chn
16/11/2018 16:19,SAB: Giải thể Văn phòng đại diện tại Hà Nội,https://cafef.vn/du-lieu/sab-1011292/sab-giai-the-van-phong-dai-dien-tai-ha-noi.chn
13/11/2018 15:23,SAB: Nghị quyết HĐQT v/v không hạn chế tỉ lệ nhà đầu tư nước ngoài tại SABECO,https://cafef.vn/du-lieu/sab-1070557/sab-nghi-quyet-hdqt-vv-khong-han-che-ti-le-nha-dau-tu-nuoc-ngoai-tai-sabeco.chn
05/11/2018 07:12,"Trước thềm cải tổ Sabeco, người Thái sắp nhận hơn 1.200 tỷ tiền tươi cổ tức!",https://cafef.vn/du-lieu/sab-1020067/truoc-them-cai-to-sabeco-nguoi-thai-sap-nhan-hon-1200-ty-tien-tuoi-co-tuc.chn
02/11/2018 07:47,Lịch chốt quyền nhận cổ tức bằng tiền của 5 doanh nghiệp,https://cafef.vn/du-lieu/sab-1096888/lich-chot-quyen-nhan-co-tuc-bang-tien-cua-5-doanh-nghiep.chn
01/11/2018 13:45,Sabeco tạm ứng tiếp 20% cổ tức bằng tiền đợt 2/2018,https://cafef.vn/du-lieu/sab-1175641/sabeco-tam-ung-tiep-20-co-tuc-bang-tien-dot-22018.chn
01/11/2018 09:41,SAB: Nội dung Nghị quyết HĐQT v/vc tạm ứng cổ tức năm 2018,https://cafef.vn/du-lieu/sab-1042495/sab-noi-dung-nghi-quyet-hdqt-vvc-tam-ung-co-tuc-nam-2018.chn
30/10/2018 20:50,Sabeco: Lãi ròng quý 3 lần đầu xuống dưới ngưỡng 1.000 tỷ kể từ đầu năm 2017,https://cafef.vn/du-lieu/sab-1007503/sabeco-lai-rong-quy-3-lan-dau-xuong-duoi-nguong-1000-ty-ke-tu-dau-nam-2017.chn
15/10/2018 07:49,"Điểm danh những doanh nghiệp trả cổ tức bằng tiền, cổ phiếu và cổ phiếu thưởng tuần này",https://cafef.vn/du-lieu/sab-1214125/diem-danh-nhung-doanh-nghiep-tra-co-tuc-bang-tien-co-phieu-va-co-phieu-thuong-tuan-nay.chn
08/10/2018 17:29,"SAB: 16.10.2018, tạm ứng cổ tức đợt 1 năm 2018 (1.500 đ/cp)",https://cafef.vn/du-lieu/sab-1167166/sab-16102018-tam-ung-co-tuc-dot-1-nam-2018-1500-dcp.chn
29/09/2018 09:47,Người Thái sắp cải tổ toàn diện Sabeco,https://cafef.vn/du-lieu/sab-1245562/nguoi-thai-sap-cai-to-toan-dien-sabeco.chn
26/09/2018 11:35,Sabeco dự chi gần nghìn tỷ đồng tạm ứng cổ tức bằng tiền tỷ lệ 15%,https://cafef.vn/du-lieu/sab-1069198/sabeco-du-chi-gan-nghin-ty-dong-tam-ung-co-tuc-bang-tien-ty-le-15.chn
26/09/2018 08:11,SAB: Nội dung Nghị quyết HĐQT v/v tạm ứng cổ tức năm 2018 bằng tiền mặt lần thứ 1,https://cafef.vn/du-lieu/sab-1156963/sab-noi-dung-nghi-quyet-hdqt-vv-tam-ung-co-tuc-nam-2018-bang-tien-mat-lan-thu-1.chn
20/09/2018 09:27,SAB: Bổ nhiệm ông Hoàng Đạo Hiệp làm Phó TGĐ phụ trách Marketing từ 1.10.2018,https://cafef.vn/du-lieu/sab-1023328/sab-bo-nhiem-ong-hoang-dao-hiep-lam-pho-tgd-phu-trach-marketing-tu-1102018.chn
20/09/2018 09:08,Sabeco bổ nhiệm 2 lãnh đạo người Việt Nam,https://cafef.vn/du-lieu/sab-1214470/sabeco-bo-nhiem-2-lanh-dao-nguoi-viet-nam.chn
10/09/2018 10:00,SAB: Thay đổi giấy chứng nhận đăng ký doanh nghiệp lần 1,https://cafef.vn/du-lieu/sab-1166410/sab-thay-doi-giay-chung-nhan-dang-ky-doanh-nghiep-lan-1.chn
06/09/2018 10:51,SAB: Bổ nhiệm ông Trần Nguyễn Trung làm KT trưởng từ 1.9.2018,https://cafef.vn/du-lieu/sab-1106710/sab-bo-nhiem-ong-tran-nguyen-trung-lam-kt-truong-tu-192018.chn
04/09/2018 00:00,SAB: Bổ nhiệm ông Trần Nguyên Trung làm KT trưởng từ 1.9.2018,https://cafef.vn/du-lieu/sab-1103419/sab-bo-nhiem-ong-tran-nguyen-trung-lam-kt-truong-tu-192018.chn
13/08/2018 09:30,"Sabeco, Habeco đang tăng trưởng chậm lại – có cần quá bi quan?",https://cafef.vn/du-lieu/sab-1136794/sabeco-habeco-dang-tang-truong-cham-lai-co-can-qua-bi-quan.chn
10/08/2018 09:01,SAB: Giấy chứng nhận đăng ký doanh nghiệp thay đổi lần thứ 9 và điều lệ công ty,https://cafef.vn/du-lieu/sab-1033024/sab-giay-chung-nhan-dang-ky-doanh-nghiep-thay-doi-lan-thu-9-va-dieu-le-cong-ty.chn
07/08/2018 15:32,"Bất chấp mùa hè Worldcup sôi động, cổ phiếu Bia Sài Gòn, Bia Hà Nội vẫn liên tục “dò đáy”",https://cafef.vn/du-lieu/sab-1235938/bat-chap-mua-he-worldcup-soi-dong-co-phieu-bia-sai-gon-bia-ha-noi-van-lien-tuc-do-day.chn
02/08/2018 08:26,"Thêm nhiều doanh nghiệp lãi lớn, Câu lạc bộ lãi nghìn tỷ đã điền tên 30 doanh nghiệp",https://cafef.vn/du-lieu/sab-1141063/them-nhieu-doanh-nghiep-lai-lon-cau-lac-bo-lai-nghin-ty-da-dien-ten-30-doanh-nghiep.chn
31/07/2018 10:15,SAB: Báo cáo tình hình quản trị công ty 6 tháng đầu năm 2018,https://cafef.vn/du-lieu/sab-1011415/sab-bao-cao-tinh-hinh-quan-tri-cong-ty-6-thang-dau-nam-2018.chn
30/07/2018 21:43,"Bất chấp mùa Worldcup, lợi nhuận quý 2 của Sabeco vẫn sụt giảm 7% so với cùng kỳ năm trước",https://cafef.vn/du-lieu/sab-978940/bat-chap-mua-worldcup-loi-nhuan-quy-2-cua-sabeco-van-sut-giam-7-so-voi-cung-ky-nam-truoc.chn
25/07/2018 09:45,SAB: Bổ nhiệm ông Koh Poh Tiong làm CT.HĐQT từ 21.7.2018,https://cafef.vn/du-lieu/sab-1011847/sab-bo-nhiem-ong-koh-poh-tiong-lam-cthdqt-tu-2172018.chn
