Thời gian,Tiêu đề,URL
19/09/2025 00:00,SAB: Giấy chứng nhận đăng ký doanh nghiệp thay đổi lần thứ 14,https://cafef.vn/du-lieu/SAB-2301547/sab-giay-chung-nhan-dang-ky-doanh-nghiep-thay-doi-lan-thu-14.chn
04/09/2025 00:00,SAB: Nghị quyết HĐQT thông qua giao dịch với SATRACO và SBCO,https://cafef.vn/du-lieu/SAB-2290811/sab-nghi-quyet-hdqt-thong-qua-giao-dich-voi-satraco-va-sbco.chn
03/09/2025 09:46,SAB: Giải trình biến động KQKD 6 tháng đầu năm 2025 đã soát xét so với cùng kỳ năm trước,https://cafef.vn/du-lieu/SAB-2286801/sab-giai-trinh-bien-dong-kqkd-6-thang-dau-nam-2025-da-soat-xet-so-voi-cung-ky-nam-truoc.chn
03/09/2025 09:44,SAB: CBTT gia hạn các khoản vay nội bộ của CTCP Nước giải khát Chương Dương với SABECO,https://cafef.vn/du-lieu/SAB-2286800/sab-cbtt-gia-han-cac-khoan-vay-noi-bo-cua-ctcp-nuoc-giai-khat-chuong-duong-voi-sabeco.chn
31/08/2025 13:39,Cuộc đua lợi nhuận giữa hai “ông lớn” ngành bia Sabeco và Habeco,https://cafef.vn/cuoc-dua-loi-nhuan-giua-hai-ong-lon-nganh-bia-sabeco-va-habeco-188250831133928612.chn
29/08/2025 18:10,SAB: Giải trình BCTC Riêng soát xét bán niên năm 2025 so với cùng kỳ năm trước,https://cafef.vn/du-lieu/SAB-2285327/sab-giai-trinh-bctc-rieng-soat-xet-ban-nien-nam-2025-so-voi-cung-ky-nam-truoc.chn
25/08/2025 08:08,"Công bố 200 doanh nghiệp nộp ngân sách lớn nhất Việt Nam: Tổng nộp 794.000 tỷ đồng, Vingroup thu hẹp khoảng cách với vị trí số 1 của PetroVietnam",https://cafef.vn/cong-bo-200-doanh-nghiep-nop-ngan-sach-lon-nhat-viet-nam-tong-nop-794000-ty-dong-vingroup-thu-hep-khoang-cach-voi-vi-tri-so-1-cua-petrovietnam-188250824225436112.chn
21/08/2025 08:52,Sabeco vẫn quyết tâm tăng 32% công suất nhà máy bia Củ Chi lên 350 triệu lít/năm sau nhiều lần bị từ chối từ 2019,https://cafef.vn/sabeco-van-quyet-tam-tang-32-cong-suat-nha-may-bia-cu-chi-len-350-trieu-litnam-sau-nhieu-lan-bi-tu-choi-tu-2019-188250821085231616.chn
19/08/2025 07:15,Những ‘đại gia’ đem tiền mặt đi trả hết nợ vẫn còn hơn chục nghìn tỷ,https://cafef.vn/nhung-dai-gia-dem-tien-mat-di-tra-het-no-van-con-hon-chuc-nghin-ty-188250819071520593.chn
31/07/2025 00:00,SAB: Báo cáo tình hình quản trị 6 tháng đầu năm 2025,https://cafef.vn/du-lieu/SAB-2294590/sab-bao-cao-tinh-hinh-quan-tri-6-thang-dau-nam-2025.chn
28/07/2025 09:34,"Sabeco báo lãi ròng quý II/2025 ‘sụt giảm’, tiền gửi ngân hàng vượt 22.000 tỷ đồng",https://cafef.vn/sabeco-bao-lai-rong-quy-ii2025-sut-giam-tien-gui-ngan-hang-vuot-22000-ty-dong-188250728083450489.chn
25/07/2025 00:00,SAB: Giải trình BCTC quý 2/2025,https://cafef.vn/du-lieu/SAB-2257197/sab-giai-trinh-bctc-quy-22025.chn
26/06/2025 00:00,SAB: Nghị quyết HĐQT thông qua phụ lục hợp đồng tư vấn với Công ty TNHH Trung tâm Mê Linh,https://cafef.vn/du-lieu/SAB-2231640/sab-nghi-quyet-hdqt-thong-qua-phu-luc-hop-dong-tu-van-voi-cong-ty-tnhh-trung-tam-me-linh.chn
26/06/2025 00:00,SAB: Nghị quyết HĐQT thông qua hợp đồng mua bán với TBC - Ball,https://cafef.vn/du-lieu/SAB-2231641/sab-nghi-quyet-hdqt-thong-qua-hop-dong-mua-ban-voi-tbc-ball.chn
26/06/2025 00:00,SAB: Thông báo ký kết hợp đồng kiểm toán BCTC 2025,https://cafef.vn/du-lieu/SAB-2231643/sab-thong-bao-ky-ket-hop-dong-kiem-toan-bctc-2025.chn
08/05/2025 08:32,SAB: Thông báo về ngày đăng ký cuối cùng chi trả cổ tức năm 2024 còn lại bằng tiền mặt,https://cafef.vn/du-lieu/SAB-2227301/sab-thong-bao-ve-ngay-dang-ky-cuoi-cung-chi-tra-co-tuc-nam-2024-con-lai-bang-tien-mat.chn
08/05/2025 00:00,"SAB: 30.6.2025, ngày GDKHQ chi trả cổ tức năm 2024 còn lại bằng tiền mặt (3.000 đ/cp)",https://cafef.vn/du-lieu/SAB-2197099/sab-3062025-ngay-gdkhq-chi-tra-co-tuc-nam-2024-con-lai-bang-tien-mat-3000-dcp.chn
07/05/2025 16:03,Sabeco sắp chi gần 3.848 tỷ đồng trả cổ tức còn lại năm 2024,https://cafef.vn/sabeco-sap-chi-gan-3848-ty-dong-tra-co-tuc-con-lai-nam-2024-188250507155440493.chn
07/05/2025 06:09,"“Rủng rỉnh” nghìn tỷ tiền mặt, hãng bia lớn nhất Việt Nam sắp chi cổ tức ""khủng"", tỷ phú Thái Lan bỏ túi 2.100 tỷ",https://cafef.vn/rung-rinh-nghin-ty-tien-mat-hang-bia-lon-nhat-viet-nam-sap-chi-co-tuc-khung-ty-phu-thai-lan-bo-tui-2100-ty-188250506231010321.chn
29/04/2025 07:57,Sabeco báo doanh thu và lợi nhuận quý 1/2025 thấp nhất từ thời Covid,https://cafef.vn/sabeco-bao-doanh-thu-va-loi-nhuan-quy-12025-thap-nhat-tu-thoi-covid-188250429075755172.chn
28/04/2025 00:00,SAB: Giải trình BCTC HN và riêng quý 1/2025 so với cùng kỳ năm trước,https://cafef.vn/du-lieu/SAB-2195396/sab-giai-trinh-bctc-hn-va-rieng-quy-12025-so-voi-cung-ky-nam-truoc.chn
26/04/2025 00:00,SAB: Thông báo chốt danh sách cổ đông để chi trả cổ tức còn lại năm 2024 bằng tiền mặt,https://cafef.vn/du-lieu/SAB-2213126/sab-thong-bao-chot-danh-sach-co-dong-de-chi-tra-co-tuc-con-lai-nam-2024-bang-tien-mat.chn
26/04/2025 00:00,"SAB: Nghị quyết, Biên bản họp và tài liệu họp ĐHĐCĐ thường niên năm 2025",https://cafef.vn/du-lieu/SAB-2213188/sab-nghi-quyet-bien-ban-hop-va-tai-lieu-hop-dhdcd-thuong-nien-nam-2025.chn
24/04/2025 18:09,"Tổng Giám đốc Lester Tan: Sabeco là công ty bia nội địa thuần túy, chỉ bán ở Việt Nam và chưa có kế hoạch niêm yết quốc tế",https://cafef.vn/tong-giam-doc-lester-tan-sabeco-la-cong-ty-bia-noi-dia-thuan-tuy-chi-ban-o-viet-nam-va-chua-co-ke-hoach-niem-yet-quoc-te-188250424172320135.chn
17/04/2025 16:34,SAB: Link công bố báo cáo thường niên năm 2024,https://cafef.vn/du-lieu/SAB-2175406/sab-link-cong-bo-bao-cao-thuong-nien-nam-2024.chn
17/04/2025 00:00,SAB: Link công bố báo cáo phát triển bền vững năm 2024,https://cafef.vn/du-lieu/SAB-2181662/sab-link-cong-bo-bao-cao-phat-trien-ben-vung-nam-2024.chn
08/04/2025 11:15,"Cổ phiếu hiếm hoi tăng giá giữa lúc VN-Index ""rơi"" hơn 70 điểm, doanh nghiệp muốn chi thêm hàng nghìn tỷ tiền cổ tức cho cổ đông",https://cafef.vn/co-phieu-hiem-hoi-tang-gia-giua-luc-vnindex-roi-hon-70-diem-doanh-nghiep-muon-chi-them-hang-nghin-ty-tien-co-tuc-cho-co-dong-188250408111520659.chn
07/04/2025 00:05,"Công ty bia lớn nhất Việt Nam muốn nâng cổ tức tiền mặt lên 50%, cổ phiếu bất ngờ ""lùi"" về đáy lịch sử",https://cafef.vn/cong-ty-bia-lon-nhat-viet-nam-muon-nang-co-tuc-tien-mat-len-50-co-phieu-bat-ngo-lui-ve-day-lich-su-188250406225353425.chn
04/04/2025 18:53,Sabeco trình cổ đông kế hoạch nâng tỷ lệ cổ tức năm 2024 lên 50%,https://cafef.vn/sabeco-trinh-co-dong-ke-hoach-nang-ty-le-co-tuc-nam-2024-len-50-188250404184131529.chn
02/04/2025 00:00,SAB: Thông báo tài liệu họp ĐHĐCĐ thường niên năm 2025,https://cafef.vn/du-lieu/SAB-2164075/sab-thong-bao-tai-lieu-hop-dhdcd-thuong-nien-nam-2025.chn
02/04/2025 00:00,SAB: Thông báo mời họp ĐHĐCĐ thường niên năm 2025,https://cafef.vn/du-lieu/sab-2164129/sab-thong-bao-moi-hop-dhdcd-thuong-nien-nam-2025.chn
18/02/2025 16:07,"Doanh thu Sabeco lên cao nhất 2 năm, 'cơn bão' thổi nồng độ cồn đã ở phía sau?",https://cafef.vn/du-lieu/sab-2132609/doanh-thu-sabeco-len-cao-nhat-2-nam-con-bao-thoi-nong-do-con-da-o-phia-sau.chn
16/02/2025 08:50,"Giá nhôm tăng vùn vụt, 'đe dọa' công ty bia lớn nhất Việt Nam",https://cafef.vn/du-lieu/sab-2131371/gia-nhom-tang-vun-vut-de-doa-cong-ty-bia-lon-nhat-viet-nam.chn
05/02/2025 00:00,"SAB: 21.3.2025, ngày GDKHQ tham dự ĐHCĐ thường niên năm 2025",https://cafef.vn/du-lieu/sab-2124926/sab-2132025-ngay-gdkhq-tham-du-dhcd-thuong-nien-nam-2025.chn
24/01/2025 00:00,SAB: CBTT tổ chức ĐHCĐ thường niên năm 2025,https://cafef.vn/du-lieu/sab-2123588/sab-cbtt-to-chuc-dhcd-thuong-nien-nam-2025.chn
24/01/2025 00:00,SAB: Giải trình BCTC HN quý 4/2024 so với cùng kỳ năm trước,https://cafef.vn/du-lieu/sab-2129222/sab-giai-trinh-bctc-hn-quy-42024-so-voi-cung-ky-nam-truoc.chn
24/01/2025 00:00,SAB: Báo cáo tình hình quản trị Công ty năm 2024,https://cafef.vn/du-lieu/sab-2130566/sab-bao-cao-tinh-hinh-quan-tri-cong-ty-nam-2024.chn
22/01/2025 00:03,"Masan chi 1.600 tỷ mua 5 tầng lầu Quận 1 của Techcombank làm 'phi thuyền vũ trụ', ACV và Vietjet lập ‘quận hàng không’ tại Tân Bình",https://cafef.vn/du-lieu/sab-2135310/masan-chi-1600-ty-mua-5-tang-lau-quan-1-cua-techcombank-lam-phi-thuyen-vu-tru-acv-va-vietjet-lap-quan-hang-khong-tai-tan-binh.chn
10/01/2025 08:57,"Từng chi gần 5 tỷ USD để thâu tóm Sabeco, tỷ phú Thái Lan đã nhận lại gần 500 triệu USD tiền cổ tức sau 8 năm",https://cafef.vn/du-lieu/sab-2112856/tung-chi-gan-5-ty-usd-de-thau-tom-sabeco-ty-phu-thai-lan-da-nhan-lai-gan-500-trieu-usd-tien-co-tuc-sau-8-nam.chn
28/12/2024 09:53,"Sabeco hoàn tất thương vụ thâu tóm gần nghìn tỷ, lớn nhất từ khi về tay người Thái",https://cafef.vn/du-lieu/sab-2106244/sabeco-hoan-tat-thuong-vu-thau-tom-gan-nghin-ty-lon-nhat-tu-khi-ve-tay-nguoi-thai.chn
27/12/2024 15:47,Sabeco hoàn tất thương vụ hơn 800 tỷ đồng 'thâu tóm' Bia Sài Gòn Bình Tây,https://cafef.vn/du-lieu/sab-2105951/sabeco-hoan-tat-thuong-vu-hon-800-ty-dong-thau-tom-bia-sai-gon-binh-tay.chn
27/12/2024 00:00,SAB: Tổng CTCP Bia - Rượu - Nước giải khát Sài Gòn đã mua 37.814.900 cp SBB,https://cafef.vn/du-lieu/sab-2107067/sab-tong-ctcp-bia-ruou-nuoc-giai-khat-sai-gon-da-mua-37814900-cp-sbb.chn
27/12/2024 00:00,SAB: Báo cáo kết quả chào mua công khai cổ phiếu Công ty Cổ phần Tập đoàn Bia Sài Gòn Bình Tây,https://cafef.vn/du-lieu/sab-2115612/sab-bao-cao-ket-qua-chao-mua-cong-khai-co-phieu-cong-ty-co-phan-tap-doan-bia-sai-gon-binh-tay.chn
11/12/2024 00:00,SAB: Nghị quyết HĐQT về việc thoái vốn tại CTCP Kinh doanh Lương thực - Thực phẩm Trường Sa,https://cafef.vn/du-lieu/sab-2099302/sab-nghi-quyet-hdqt-ve-viec-thoai-von-tai-ctcp-kinh-doanh-luong-thuc-thuc-pham-truong-sa.chn
04/12/2024 00:00,SAB: Nghị quyết HĐQT số 84/2024 ngày 04/12/2024,https://cafef.vn/du-lieu/sab-2094331/sab-nghi-quyet-hdqt-so-842024-ngay-04122024.chn
16/11/2024 10:24,Sabeco nâng tỷ lệ sở hữu tại Bia Sài Gòn - Miền Tây lên gần 85% vốn,https://cafef.vn/du-lieu/sab-2085108/sabeco-nang-ty-le-so-huu-tai-bia-sai-gon-mien-tay-len-gan-85-von.chn
06/11/2024 00:00,"SAB: 26.12.2024, ngày GDKHQ tạm ứng cổ tức năm 2024 bằng tiền mặt (2.000 đ/cp)",https://cafef.vn/du-lieu/sab-2079976/sab-26122024-ngay-gdkhq-tam-ung-co-tuc-nam-2024-bang-tien-mat-2000-dcp.chn
01/11/2024 15:06,"“Rủng rỉnh” tiền mặt, đại gia ngành bia Sabeco sắp chia cổ tức khủng, tỷ phú Thái Lan bỏ túi 1.400 tỷ",https://cafef.vn/du-lieu/sab-2077855/rung-rinh-tien-mat-dai-gia-nganh-bia-sabeco-sap-chia-co-tuc-khung-ty-phu-thai-lan-bo-tui-1400-ty.chn
31/10/2024 00:00,SAB: CBTT ngày ĐKCC để tạm ứng cổ tức bằng tiền mặt năm 2024,https://cafef.vn/du-lieu/sab-2077812/sab-cbtt-ngay-dkcc-de-tam-ung-co-tuc-bang-tien-mat-nam-2024.chn
31/10/2024 00:00,"SAB: Bà Teoh Jia Ee, ông Trần Nguyên thôi giữ chức Người Phụ trách Quản trị từ 1.10.2024",https://cafef.vn/du-lieu/sab-2077907/sab-ba-teoh-jia-ee-ong-tran-nguyen-thoi-giu-chuc-nguoi-phu-trach-quan-tri-tu-1102024.chn
30/10/2024 00:00,SAB: Giải trình BCTC riêng quý 3/2024 so với cùng kỳ năm trước,https://cafef.vn/du-lieu/sab-2077401/sab-giai-trinh-bctc-rieng-quy-32024-so-voi-cung-ky-nam-truoc.chn
30/10/2024 00:00,SAB: Giải trình BCTC HN quý 3/2024 so với cùng kỳ năm trước,https://cafef.vn/du-lieu/sab-2077420/sab-giai-trinh-bctc-hn-quy-32024-so-voi-cung-ky-nam-truoc.chn
25/10/2024 00:00,SBB: Tổng Công ty Cổ phần Bia - Rượu - Nước Giải Khát Sài Gòn (SABECO) đăng ký mua 37.814.900 CP,https://cafef.vn/du-lieu/sab-2074851/sbb-tong-cong-ty-co-phan-bia-ruou-nuoc-giai-khat-sai-gon-sabeco-dang-ky-mua-37814900-cp.chn
24/10/2024 00:00,SAB: Thông báo chào mua công khai cổ phiếu SBB,https://cafef.vn/du-lieu/sab-2074263/sab-thong-bao-chao-mua-cong-khai-co-phieu-sbb.chn
24/10/2024 00:00,WSB: Tổng Công ty Cổ phần Bia - Rượu - Nước giải khát Sài Gòn đăng ký mua 2.016.800 cp,https://cafef.vn/du-lieu/sab-2074421/wsb-tong-cong-ty-co-phan-bia-ruou-nuoc-giai-khat-sai-gon-dang-ky-mua-2016800-cp.chn
15/10/2024 00:00,SAB: HĐQT thông qua gia hạn khoản vay của CTCP Nước giải khát Chương Dương với SABECO,https://cafef.vn/du-lieu/sab-2069563/sab-hdqt-thong-qua-gia-han-khoan-vay-cua-ctcp-nuoc-giai-khat-chuong-duong-voi-sabeco.chn
20/09/2024 00:00,SAB: Quyết định của HĐQT về việc chấp thuận hợp đồng thí nghiệm thiết bị tổ máy H1 NMTĐ Khe Diên sau đại tu với Thí nghiệm điện Miền Trung,https://cafef.vn/du-lieu/sab-2056563/sab-quyet-dinh-cua-hdqt-ve-viec-chap-thuan-hop-dong-thi-nghiem-thiet-bi-to-may-h1-nmtd-khe-dien-sau-dai-tu-voi-thi-nghiem-dien-mien-trung.chn
09/09/2024 07:55,Điều gì xảy ra sau khi Sabeco mua thành công gần 38 triệu cổ phiếu Sabibeco?,https://cafef.vn/du-lieu/sab-2050518/dieu-gi-xay-ra-sau-khi-sabeco-mua-thanh-cong-gan-38-trieu-co-phieu-sabibeco.chn
08/09/2024 00:01,Sabeco muốn chi hơn 800 tỷ thâu tóm công ty gia công bia Sài Gòn lớn nhất chưa nắm quyền kiểm soát,https://cafef.vn/du-lieu/sab-2049874/sabeco-muon-chi-hon-800-ty-thau-tom-cong-ty-gia-cong-bia-sai-gon-lon-nhat-chua-nam-quyen-kiem-soat.chn
06/09/2024 00:00,SAB: Nghị quyết HĐQT thông qua phương án chào mua công khai cổ phiếu SBB,https://cafef.vn/du-lieu/sab-2049653/sab-nghi-quyet-hdqt-thong-qua-phuong-an-chao-mua-cong-khai-co-phieu-sbb.chn
03/09/2024 00:03,"Người Việt chán bia rẻ, thích bia 'sang', Heineken áp đảo chiếm 33,7% tổng sản lượng bia cao cấp được tiêu thụ tại Việt Nam",https://cafef.vn/du-lieu/sab-2047612/nguoi-viet-chan-bia-re-thich-bia-sang-heineken-ap-dao-chiem-337-tong-san-luong-bia-cao-cap-duoc-tieu-thu-tai-viet-nam.chn
02/09/2024 09:39,"Sabeco đánh mất thị phần: Danh mục cũ kỹ, tăng giá trong lúc đối thủ trỗi dậy quá mạnh, chạy đua quảng cáo vẫn không đấu lại Heineken?",https://cafef.vn/du-lieu/sab-2047412/sabeco-danh-mat-thi-phan-danh-muc-cu-ky-tang-gia-trong-luc-doi-thu-troi-day-qua-manh-chay-dua-quang-cao-van-khong-dau-lai-heineken.chn
30/08/2024 00:00,SAB: CBTT thông qua giao dịch với Mê Linh Point,https://cafef.vn/du-lieu/sab-2048308/sab-cbtt-thong-qua-giao-dich-voi-me-linh-point.chn
29/08/2024 00:00,SAB: Giải trình BCTC HN và riêng soát xét bán niên năm 2024,https://cafef.vn/du-lieu/sab-2058521/sab-giai-trinh-bctc-hn-va-rieng-soat-xet-ban-nien-nam-2024.chn
12/08/2024 00:01,"Công ty bất động sản vốn 60 tỷ vừa chi 2.000 tỷ đồng trả cổ tức, cổ đông nhà nước nhận về 600 tỷ gấp 33 lần vốn đầu tư",https://cafef.vn/du-lieu/sab-2037265/cong-ty-bat-dong-san-von-60-ty-vua-chi-2000-ty-dong-tra-co-tuc-co-dong-nha-nuoc-nhan-ve-600-ty-gap-33-lan-von-dau-tu.chn
29/07/2024 00:00,SAB: Báo cáo tình hình quản trị công ty 6 tháng đầu năm 2024,https://cafef.vn/du-lieu/sab-2082484/sab-bao-cao-tinh-hinh-quan-tri-cong-ty-6-thang-dau-nam-2024.chn
26/07/2024 14:27,"Những nguyên nhân giúp Sabeco lãi hơn 1.200 tỷ trong quý 2/2024, cao nhất 7 quý",https://cafef.vn/du-lieu/sab-2029141/nhung-nguyen-nhan-giup-sabeco-lai-hon-1200-ty-trong-quy-22024-cao-nhat-7-quy.chn
25/07/2024 00:00,SAB: Giải trình biến động kết quả kinh doanh quý 2/2024 so với quý 2/2023,https://cafef.vn/du-lieu/sab-2028924/sab-giai-trinh-bien-dong-ket-qua-kinh-doanh-quy-22024-so-voi-quy-22023.chn
28/06/2024 00:00,SAB: Thông báo ký hợp đồng kiểm toán BCTC 2024,https://cafef.vn/du-lieu/sab-2015895/sab-thong-bao-ky-hop-dong-kiem-toan-bctc-2024.chn
20/06/2024 00:00,"SAB: 5.7.2024, ngày GDKHQ trả cổ tức lần 2 năm 2023 bằng tiền (2.000 đ/cp)",https://cafef.vn/du-lieu/sab-2011079/sab-572024-ngay-gdkhq-tra-co-tuc-lan-2-nam-2023-bang-tien-2000-dcp.chn
16/06/2024 16:54,Người Thái thu về hơn 10.600 tỷ đồng cổ tức sau 7 năm thâu tóm Sabeco,https://cafef.vn/du-lieu/sab-2008398/nguoi-thai-thu-ve-hon-10600-ty-dong-co-tuc-sau-7-nam-thau-tom-sabeco.chn
12/06/2024 07:54,"Vượt qua cú đấm 'thổi nồng độ cồn', lợi nhuận của Sabeco được dự báo tăng trưởng hai chữ số nhờ Euro 2024, Thế vận hội Mùa hè 2024",https://cafef.vn/du-lieu/sab-2006282/vuot-qua-cu-dam-thoi-nong-do-con-loi-nhuan-cua-sabeco-duoc-du-bao-tang-truong-hai-chu-so-nho-euro-2024-the-van-hoi-mua-he-2024.chn
06/06/2024 07:35,"CEO Sabeco: Chúng tôi ủng hộ hoàn toàn Nghị định 100, đã uống thì không lái",https://cafef.vn/du-lieu/sab-2003037/ceo-sabeco-chung-toi-ung-ho-hoan-toan-nghi-dinh-100-da-uong-thi-khong-lai.chn
05/06/2024 10:57,"Mùa ""say"" cùng Euro sắp đến, cổ phiếu ""đại gia"" ngành bia Sabeco (SAB) bất ngờ ""cháy hàng""",https://cafef.vn/du-lieu/sab-2002675/mua-say-cung-euro-sap-den-co-phieu-dai-gia-nganh-bia-sabeco-sab-bat-ngo-chay-hang.chn
31/05/2024 10:12,"Một DN bia đề xuất thay quy định ‘không cho phép có nồng độ cồn khi lái xe’, chỉ thiết lập giới hạn ở một mức hợp lý",https://cafef.vn/du-lieu/sab-2004287/mot-dn-bia-de-xuat-thay-quy-dinh-khong-cho-phep-co-nong-do-con-khi-lai-xe-chi-thiet-lap-gioi-han-o-mot-muc-hop-ly.chn
23/05/2024 00:00,SAB: Thông báo thay đổi nhân sự Phó TGĐ,https://cafef.vn/du-lieu/sab-1996548/sab-thong-bao-thay-doi-nhan-su-pho-tgd.chn
22/05/2024 00:00,"SAB: Bổ nhiệm ông Lee Chio Lim Larry, bà Lim Pei Chi Patsy giữ chức Phó Tổng giám đốc từ 27.6.2024",https://cafef.vn/du-lieu/sab-1996533/sab-bo-nhiem-ong-lee-chio-lim-larry-ba-lim-pei-chi-patsy-giu-chuc-pho-tong-giam-doc-tu-2762024.chn
12/05/2024 00:05,"“Đại gia” ngành bia Sabeco vừa gượng dậy sau cú đấm “thổi nồng độ cồn”: Doanh số tăng gần nghìn tỷ, chuyên gia đánh giá còn quá sớm để khẳng định đã qua đáy",https://cafef.vn/du-lieu/sab-1990632/dai-gia-nganh-bia-sabeco-vua-guong-day-sau-cu-dam-thoi-nong-do-con-doanh-so-tang-gan-nghin-ty-chuyen-gia-danh-gia-con-qua-som-de-khang-dinh-da-qua-day.chn
02/05/2024 00:00,SAB: Nghị quyết và Biên bản họp ĐHĐCĐ thường niên năm 2024,https://cafef.vn/du-lieu/sab-1986555/sab-nghi-quyet-va-bien-ban-hop-dhdcd-thuong-nien-nam-2024.chn
26/04/2024 00:00,SAB: Thông báo nhận được quyết định của cơ quan thuế,https://cafef.vn/du-lieu/sab-1986031/sab-thong-bao-nhan-duoc-quyet-dinh-cua-co-quan-thue.chn
25/04/2024 10:03,"Vùng dậy sau cú đấm “thổi nồng độ cồn”: Doanh thu của “gã khổng lồ” ngành bia Sabeco tăng nghìn tỷ, lợi nhuận chấm dứt chuỗi 5 quý đi lùi",https://cafef.vn/du-lieu/sab-1982591/vung-day-sau-cu-dam-thoi-nong-do-con-doanh-thu-cua-ga-khong-lo-nganh-bia-sabeco-tang-nghin-ty-loi-nhuan-cham-dut-chuoi-5-quy-di-lui.chn
25/04/2024 10:00,"ĐHĐCĐ Sabeco (SAB): Sabeco ủng hộ quy định nồng độ cồn, không muốn chia sẻ mà muốn chiếm lĩnh thị phần bia Việt Nam",https://cafef.vn/du-lieu/sab-1982925/dhdcd-sabeco-sab-sabeco-ung-ho-quy-dinh-nong-do-con-khong-muon-chia-se-ma-muon-chiem-linh-thi-phan-bia-viet-nam.chn
25/04/2024 00:00,SAB: Giải trình chênh lệch lợi nhuận sau thuế quý 1/2024 so với quý 1/2023,https://cafef.vn/du-lieu/sab-1995283/sab-giai-trinh-chenh-lech-loi-nhuan-sau-thue-quy-12024-so-voi-quy-12023.chn
22/04/2024 16:55,"Sau một năm 'liêu xiêu' vì cú đấm nồng độ cồn, Sabeco lạc quan: 2024 mang đến các cơ hội vàng cho ngành bia Việt Nam",https://cafef.vn/du-lieu/sab-1980867/sau-mot-nam-lieu-xieu-vi-cu-dam-nong-do-con-sabeco-lac-quan-2024-mang-den-cac-co-hoi-vang-cho-nganh-bia-viet-nam.chn
22/04/2024 00:00,SAB: Link công bố báo cáo thường niên năm 2023,https://cafef.vn/du-lieu/sab-1980741/sab-link-cong-bo-bao-cao-thuong-nien-nam-2023.chn
04/04/2024 10:31,"""Ngụm bia"" của người Thái bớt đắng: Sabeco tự tin với ""cơ hội vàng"" đưa doanh thu và lợi nhuận 2024 tăng trưởng, tiếp tục ""dốc hầu bao"" trả cổ tức tỷ lệ 35%",https://cafef.vn/du-lieu/sab-1970797/ngum-bia-cua-nguoi-thai-bot-dang-sabeco-tu-tin-voi-co-hoi-vang-dua-doanh-thu-va-loi-nhuan-2024-tang-truong-tiep-tuc-doc-hau-bao-tra-co-tuc-ty-le-35.chn
03/04/2024 00:00,SAB: Thông báo mời họp ĐHĐCĐ thường niên năm 2024,https://cafef.vn/du-lieu/sab-1971113/sab-thong-bao-moi-hop-dhdcd-thuong-nien-nam-2024.chn
03/04/2024 00:00,SAB: Tài liệu họp ĐHĐCĐ thường niên năm 2024,https://cafef.vn/du-lieu/sab-1971114/sab-tai-lieu-hop-dhdcd-thuong-nien-nam-2024.chn
01/04/2024 00:00,SAB: Bà Venus Teoh Kim Wei thôi giữ chức Phó Tổng giám đốc từ 1.4.2024,https://cafef.vn/du-lieu/sab-1970686/sab-ba-venus-teoh-kim-wei-thoi-giu-chuc-pho-tong-giam-doc-tu-142024.chn
29/03/2024 00:00,SAB: Giải trình BCTC năm 2023 kiểm toán,https://cafef.vn/du-lieu/sab-1969458/sab-giai-trinh-bctc-nam-2023-kiem-toan.chn
29/03/2024 00:00,SAB: Giải trình BCTC năm 2023 kiểm toán,https://cafef.vn/du-lieu/sab-1969459/sab-giai-trinh-bctc-nam-2023-kiem-toan.chn
06/03/2024 14:58,"Kỷ lục vừa xác lập giúp “ngụm bia” Sabeco bớt đắng, Thaibev “gỡ” được 3.400 tỷ sau hơn một tuần",https://cafef.vn/du-lieu/sab-1954835/ky-luc-vua-xac-lap-giup-ngum-bia-sabeco-bot-dang-thaibev-go-duoc-3400-ty-sau-hon-mot-tuan.chn
28/02/2024 00:17,"Cổ phiếu Sabeco về gần đáy lịch sử, khoản đầu tư ""bay"" 3,5 tỷ USD kể từ khi thâu tóm, nhưng Sabeco có thực sự là ""ngụm bia đắng"" của tỷ phú Thái Lan?",https://cafef.vn/du-lieu/sab-1950923/co-phieu-sabeco-ve-gan-day-lich-su-khoan-dau-tu-bay-35-ty-usd-ke-tu-khi-thau-tom-nhung-sabeco-co-thuc-su-la-ngum-bia-dang-cua-ty-phu-thai-lan.chn
19/02/2024 00:11,"Sabeco rơi vào chuỗi ngày buồn thảm, tài sản của tỷ phú Thái Lan đứng sau hiện ra sao?",https://cafef.vn/du-lieu/sab-1945973/sabeco-roi-vao-chuoi-ngay-buon-tham-tai-san-cua-ty-phu-thai-lan-dung-sau-hien-ra-sao.chn
17/02/2024 13:48,"Sabeco bán bia: Chuyển từ 'dùng tại chỗ' sang 'mua về', bắt đầu 'rải' trên sàn thương mại điện tử",https://cafef.vn/du-lieu/sab-1945617/sabeco-ban-bia-chuyen-tu-dung-tai-cho-sang-mua-ve-bat-dau-rai-tren-san-thuong-mai-dien-tu.chn
09/02/2024 00:08,"Ngành bia ngậm ngùi đón Tết buồn: Kinh doanh ảm đạm, lợi nhuận sụt giảm hàng nghìn tỷ đồng giữa ""cơn bão kép""",https://cafef.vn/du-lieu/sab-1942917/nganh-bia-ngam-ngui-don-tet-buon-kinh-doanh-am-dam-loi-nhuan-sut-giam-hang-nghin-ty-dong-giua-con-bao-kep.chn
07/02/2024 00:00,SAB: Nghị quyết HĐQT v/v bà Teoh Jia Ee thôi giữ chức Phó tổng giám đốc từ 1.4.2024,https://cafef.vn/du-lieu/sab-1942535/sab-nghi-quyet-hdqt-vv-ba-teoh-jia-ee-thoi-giu-chuc-pho-tong-giam-doc-tu-142024.chn
06/02/2024 00:00,"SAB: 22.3.2024, ngày GDKHQ tham dự ĐHCĐ thường niên năm 2024",https://cafef.vn/du-lieu/sab-1942073/sab-2232024-ngay-gdkhq-tham-du-dhcd-thuong-nien-nam-2024.chn
01/02/2024 00:00,SAB: Thông báo ngày ĐKCC để thực hiện quyền tham dự ĐHCĐ thường niên năm 2024,https://cafef.vn/du-lieu/sab-1944709/sab-thong-bao-ngay-dkcc-de-thuc-hien-quyen-tham-du-dhcd-thuong-nien-nam-2024.chn
26/01/2024 00:00,SAB: Báo cáo tình hình quản trị Công ty năm 2023,https://cafef.vn/du-lieu/sab-1937361/sab-bao-cao-tinh-hinh-quan-tri-cong-ty-nam-2023.chn
16/01/2024 00:00,SAB: HĐQT thông qua giao dịch với SATRACO,https://cafef.vn/du-lieu/sab-1931377/sab-hdqt-thong-qua-giao-dich-voi-satraco.chn
28/12/2023 00:00,SAB: Giấy chứng nhận đăng ký doanh nghiệp thay đổi lần thứ 13,https://cafef.vn/du-lieu/sab-1922460/sab-giay-chung-nhan-dang-ky-doanh-nghiep-thay-doi-lan-thu-13.chn
27/12/2023 08:27,"Đại gia Thái Thaibev “ngậm ngùi” khi nhu cầu uống bia giảm mạnh, lợi nhuận mảng bia giảm đến 38%",https://cafef.vn/du-lieu/sab-1920508/dai-gia-thai-thaibev-ngam-ngui-khi-nhu-cau-uong-bia-giam-manh-loi-nhuan-mang-bia-giam-den-38.chn
11/12/2023 00:01,Đại gia Thái Lan “vớ bẫm” cổ tức sau khi thâu tóm các doanh nghiệp sản xuất đầu ngành của Việt Nam,https://cafef.vn/du-lieu/sab-1912445/dai-gia-thai-lan-vo-bam-co-tuc-sau-khi-thau-tom-cac-doanh-nghiep-san-xuat-dau-nganh-cua-viet-nam.chn
11/12/2023 00:00,SAB: Giấy chứng nhận đăng ký doanh nghiệp thay đổi lần thứ 12,https://cafef.vn/du-lieu/sab-1913112/sab-giay-chung-nhan-dang-ky-doanh-nghiep-thay-doi-lan-thu-12.chn
08/12/2023 00:00,"SAB: 4.1.2024, ngày GDKHQ tạm ứng cổ tức năm 2023 bằng tiền (1.500 đ/cp)",https://cafef.vn/du-lieu/sab-1911978/sab-412024-ngay-gdkhq-tam-ung-co-tuc-nam-2023-bang-tien-1500-dcp.chn
07/12/2023 00:05,"Tỷ phú người Thái ""bỏ túi"" gần 9.300 tỷ đồng tiền cổ tức sau 6 năm thâu tóm Sabeco",https://cafef.vn/du-lieu/sab-1910775/ty-phu-nguoi-thai-bo-tui-gan-9300-ty-dong-tien-co-tuc-sau-6-nam-thau-tom-sabeco.chn
06/12/2023 16:33,Cổ đông Sabeco sắp nhận gần 2.000 tỷ vào ngày 28 Tết,https://cafef.vn/du-lieu/sab-1910551/co-dong-sabeco-sap-nhan-gan-2000-ty-vao-ngay-28-tet.chn
