Thời gian,Tiêu đề,URL
21/12/2021 10:54,Sabeco (SAB) chi gần 1.300 tỷ đồng tạm ứng cổ tức năm 2021,https://cafef.vn/du-lieu/sab-1270675/sabeco-sab-chi-gan-1300-ty-dong-tam-ung-co-tuc-nam-2021.chn
20/12/2021 17:28,SAB: Nghị quyết HĐQT về ngày ĐKCC để tạm ứng cổ tức năm 2021 bằng tiền mặt,https://cafef.vn/du-lieu/sab-1273609/sab-nghi-quyet-hdqt-ve-ngay-dkcc-de-tam-ung-co-tuc-nam-2021-bang-tien-mat.chn
06/12/2021 05:55,"Một công ty bia sắp trả cổ tức khủng 273,26% bằng tiền mặt dù kinh doanh gặp khó, Sabeco dự ""bỏ túi"" hơn 98 tỷ đồng",https://cafef.vn/du-lieu/sab-1342135/mot-cong-ty-bia-sap-tra-co-tuc-khung-27326-bang-tien-mat-du-kinh-doanh-gap-kho-sabeco-du-bo-tui-hon-98-ty-dong.chn
30/11/2021 23:03,"Những cổ phiếu có thị giá đắt đỏ nhất sàn chứng khoán diễn biến thế nào trong ""tháng VnIndex chạm 1.500 điểm""",https://cafef.vn/du-lieu/sab-1326148/nhung-co-phieu-co-thi-gia-dat-do-nhat-san-chung-khoan-dien-bien-the-nao-trong-thang-vnindex-cham-1500-diem.chn
05/11/2021 06:48,Đã có hơn 50 doanh nghiệp trên sàn chứng khoán báo lãi vượt nghìn tỷ sau 3 quý,https://cafef.vn/du-lieu/sab-1413451/da-co-hon-50-doanh-nghiep-tren-san-chung-khoan-bao-lai-vuot-nghin-ty-sau-3-quy.chn
29/10/2021 09:37,Doanh số hai gã khổng lồ ngành bia Việt Sabeco và Heineken sụt giảm mạnh do đại dịch,https://cafef.vn/du-lieu/sab-1475329/doanh-so-hai-ga-khong-lo-nganh-bia-viet-sabeco-va-heineken-sut-giam-manh-do-dai-dich.chn
28/10/2021 15:55,SAB: Giải trình chênh lệch lợi nhuận sau thuế quý 3/2021 so với quý 3/2020,https://cafef.vn/du-lieu/sab-1493461/sab-giai-trinh-chenh-lech-loi-nhuan-sau-thue-quy-32021-so-voi-quy-32020.chn
27/10/2021 21:28,"Sabeco (SAB): Nỗ lực tiết giảm chi phí, lãi ròng quý 3/2021 vẫn giảm mạnh 68% xuống mức thấp nhất nhiều năm",https://cafef.vn/du-lieu/sab-1448017/sabeco-sab-no-luc-tiet-giam-chi-phi-lai-rong-quy-32021-van-giam-manh-68-xuong-muc-thap-nhat-nhieu-nam.chn
04/10/2021 08:16,"Nhà nước dự thu 15.000 - 20.000 tỷ từ thoái vốn Sabeco, FPT, Bảo Minh...",https://cafef.vn/du-lieu/sab-1264570/nha-nuoc-du-thu-15000-20000-ty-tu-thoai-von-sabeco-fpt-bao-minh.chn
01/10/2021 09:33,SAB: Ông Koo Liang Kwee được uỷ quyền thực hiện công bố thông tin từ 1.10.2021,https://cafef.vn/du-lieu/sab-1340785/sab-ong-koo-liang-kwee-duoc-uy-quyen-thuc-hien-cong-bo-thong-tin-tu-1102021.chn
21/09/2021 21:45,"Sabeco thay đổi Phó TGĐ phụ trách kế toán, tài chính",https://cafef.vn/du-lieu/sab-1366033/sabeco-thay-doi-pho-tgd-phu-trach-ke-toan-tai-chinh.chn
20/09/2021 11:56,"SAB: Nghị quyết HĐQT về việc miễn nhiệm và bổ nhiệm chức vụ Phó Tổng Giám đốc phụ trách Kế toán, Tài chính và các phòng, ban hổ trợ khác",https://cafef.vn/du-lieu/sab-1313548/sab-nghi-quyet-hdqt-ve-viec-mien-nhiem-va-bo-nhiem-chuc-vu-pho-tong-giam-doc-phu-trach-ke-toan-tai-chinh-va-cac-phong-ban-ho-tro-khac.chn
04/09/2021 07:28,"Cổ phiếu Sabeco giảm sâu xuống dưới 150.000 đồng/cp, khoản đầu tư 5 tỷ USD để nắm quyền chi phối của tỷ phú Thái đã giảm phân nửa giá trị sau gần 4 năm",https://cafef.vn/du-lieu/sab-1393762/co-phieu-sabeco-giam-sau-xuong-duoi-150000-dongcp-khoan-dau-tu-5-ty-usd-de-nam-quyen-chi-phoi-cua-ty-phu-thai-da-giam-phan-nua-gia-tri-sau-gan-4-nam.chn
27/08/2021 17:41,SAB: Giải trình biến động KQKD bán niên năm 2021 đã soát xét so với cùng kỳ năm 2020,https://cafef.vn/du-lieu/sab-1390621/sab-giai-trinh-bien-dong-kqkd-ban-nien-nam-2021-da-soat-xet-so-voi-cung-ky-nam-2020.chn
14/08/2021 10:51,"Doanh thu Sabeco ngày càng bị Heineken bỏ xa, thị phần lớn hơn nhưng lãi chỉ bằng nửa",https://cafef.vn/du-lieu/sab-1504204/doanh-thu-sabeco-ngay-cang-bi-heineken-bo-xa-thi-phan-lon-hon-nhung-lai-chi-bang-nua.chn
04/08/2021 06:42,Hàng chục doanh nghiệp báo lãi nghìn tỷ chỉ sau nửa đầu năm 2021,https://cafef.vn/du-lieu/sab-1538812/hang-chuc-doanh-nghiep-bao-lai-nghin-ty-chi-sau-nua-dau-nam-2021.chn
30/07/2021 12:45,SAB: Báo cáo tình hình quản trị công ty 6 tháng đầu năm 2021,https://cafef.vn/du-lieu/sab-1550374/sab-bao-cao-tinh-hinh-quan-tri-cong-ty-6-thang-dau-nam-2021.chn
30/07/2021 11:14,SAB: Giải trình chênh lệch lợi nhuận sau thuế quý 2/2021 so với quý 2/2020,https://cafef.vn/du-lieu/sab-1546249/sab-giai-trinh-chenh-lech-loi-nhuan-sau-thue-quy-22021-so-voi-quy-22020.chn
29/07/2021 21:47,"Sabeco (SAB): Nỗ lực tiết giảm chi phí, lợi nhuận sau thuế nửa đầu năm vẫn tăng nhẹ lên 2.057 tỷ đồng bất chấp Covid-19",https://cafef.vn/du-lieu/sab-1546024/sabeco-sab-no-luc-tiet-giam-chi-phi-loi-nhuan-sau-thue-nua-dau-nam-van-tang-nhe-len-2057-ty-dong-bat-chap-covid19.chn
01/07/2021 16:47,SAB: Ký kết hợp đồng kiểm toán BCTC 2021,https://cafef.vn/du-lieu/sab-1398493/sab-ky-ket-hop-dong-kiem-toan-bctc-2021.chn
03/06/2021 12:14,Sabeco tìm kiếm nguồn cung ứng vắc xin phòng chống Covid-19 cho người lao động,https://cafef.vn/du-lieu/sab-1474663/sabeco-tim-kiem-nguon-cung-ung-vac-xin-phong-chong-covid19-cho-nguoi-lao-dong.chn
01/06/2021 07:58,"Những cổ phiếu có thị giá ""đắt đỏ"" nhất sàn chứng khoán biến động thế nào trong tháng 5?",https://cafef.vn/du-lieu/sab-1500181/nhung-co-phieu-co-thi-gia-dat-do-nhat-san-chung-khoan-bien-dong-the-nao-trong-thang-5.chn
28/05/2021 17:18,SAB: Giải trình BCTC HN và riêng quý 1/2021 so với cùng kỳ năm trước,https://cafef.vn/du-lieu/sab-1320274/sab-giai-trinh-bctc-hn-va-rieng-quy-12021-so-voi-cung-ky-nam-truoc.chn
27/05/2021 08:06,"Ngành bia khốn đốn, 1 công ty gia công cho Sabeco lỗ hơn trăm tỷ đồng",https://cafef.vn/du-lieu/sab-1395784/nganh-bia-khon-don-1-cong-ty-gia-cong-cho-sabeco-lo-hon-tram-ty-dong.chn
22/05/2021 08:46,"Soi lợi nhuận quý 1 của các cổ phiếu ""hàng hiệu""",https://cafef.vn/du-lieu/sab-1511554/soi-loi-nhuan-quy-1-cua-cac-co-phieu-hang-hieu.chn
20/05/2021 17:51,SAB: Link công bố điều lệ công ty sửa đổi và các quy chế,https://cafef.vn/du-lieu/sab-1598368/sab-link-cong-bo-dieu-le-cong-ty-sua-doi-va-cac-quy-che.chn
01/05/2021 00:12,"Sabeco đã thoái hết vốn tại OCB, lợi nhuận ròng quý 1 tăng gần 38%",https://cafef.vn/du-lieu/sab-1617841/sabeco-da-thoai-het-von-tai-ocb-loi-nhuan-rong-quy-1-tang-gan-38.chn
29/04/2021 18:45,SAB: Link công bố BCTC quý 1/2021,https://cafef.vn/du-lieu/sab-1617892/sab-link-cong-bo-bctc-quy-12021.chn
29/04/2021 16:21,SAB: Nghị quyết và Biên bản họp ĐHĐCĐ thường niên năm 2021,https://cafef.vn/du-lieu/sab-1620010/sab-nghi-quyet-va-bien-ban-hop-dhdcd-thuong-nien-nam-2021.chn
28/04/2021 14:30,ĐHĐCĐ Sabeco (SAB): Các hoạt động cạnh tranh không lành mạnh hiện đã được đối thủ dừng lại!,https://cafef.vn/du-lieu/sab-1431580/dhdcd-sabeco-sab-cac-hoat-dong-canh-tranh-khong-lanh-manh-hien-da-duoc-doi-thu-dung-lai.chn
22/04/2021 14:39,SAB: Link công bố báo cáo thường niên năm 2020,https://cafef.vn/du-lieu/sab-1329682/sab-link-cong-bo-bao-cao-thuong-nien-nam-2020.chn
05/04/2021 16:50,SAB: Thư mời họp và link chương trình họp ĐHĐCĐ thường niên năm 2021,https://cafef.vn/du-lieu/sab-1642294/sab-thu-moi-hop-va-link-chuong-trinh-hop-dhdcd-thuong-nien-nam-2021.chn
02/04/2021 17:48,SAB: Giải trình chênh lệch lợi nhuận sau thuế năm 2020 kiểm toán so với năm 2019,https://cafef.vn/du-lieu/sab-1604287/sab-giai-trinh-chenh-lech-loi-nhuan-sau-thue-nam-2020-kiem-toan-so-voi-nam-2019.chn
01/04/2021 17:25,SAB: Bổ nhiệm bà Venus Teoh Kim Wei làm Phó TGĐ từ 1.4.2021,https://cafef.vn/du-lieu/sab-1467979/sab-bo-nhiem-ba-venus-teoh-kim-wei-lam-pho-tgd-tu-142021.chn
01/04/2021 17:04,Sabeco bổ nhiệm cựu lãnh đạo Heineken vào vị trí Phó TGĐ Marketing,https://cafef.vn/du-lieu/sab-1637452/sabeco-bo-nhiem-cuu-lanh-dao-heineken-vao-vi-tri-pho-tgd-marketing.chn
19/03/2021 14:12,Sabeco: Cơn bĩ cực đã qua?,https://cafef.vn/du-lieu/sab-1568551/sabeco-con-bi-cuc-da-qua.chn
02/03/2021 16:31,"Sabeco: Ông Hoàng Đạo Hiệp chính thức rời ghế Phó Tổng, ban điều hành chỉ còn 1 người Việt",https://cafef.vn/du-lieu/sab-1273918/sabeco-ong-hoang-dao-hiep-chinh-thuc-roi-ghe-pho-tong-ban-dieu-hanh-chi-con-1-nguoi-viet.chn
01/03/2021 09:36,"Điểm danh những doanh nghiệp chốt quyền nhận cổ tức bằng tiền, bằng cổ phiếu và cổ phiếu thưởng tuần từ 1-5/3",https://cafef.vn/du-lieu/sab-1405396/diem-danh-nhung-doanh-nghiep-chot-quyen-nhan-co-tuc-bang-tien-bang-co-phieu-va-co-phieu-thuong-tuan-tu-153.chn
22/02/2021 07:39,Những cổ phiếu “đắt xắt ra miếng” trên TTCK Việt Nam,https://cafef.vn/du-lieu/sab-1560946/nhung-co-phieu-dat-xat-ra-mieng-tren-ttck-viet-nam.chn
16/02/2021 09:15,50 doanh nghiệp lãi lớn nhất sàn chứng khoán mang về hơn 240.000 tỷ đồng lợi nhuận trong năm 2020,https://cafef.vn/du-lieu/sab-1372348/50-doanh-nghiep-lai-lon-nhat-san-chung-khoan-mang-ve-hon-240000-ty-dong-loi-nhuan-trong-nam-2020.chn
14/02/2021 07:46,Câu lạc bộ lãi nghìn tỷ năm 2020 gọi tên hơn năm chục doanh nghiệp,https://cafef.vn/du-lieu/sab-1271263/cau-lac-bo-lai-nghin-ty-nam-2020-goi-ten-hon-nam-chuc-doanh-nghiep.chn
05/02/2021 13:25,ThaiBev chính thức gom Sabeco và mảng bia tại Thái Lan để tiến hành IPO với định giá lên đến 10 tỷ USD,https://cafef.vn/du-lieu/sab-1322206/thaibev-chinh-thuc-gom-sabeco-va-mang-bia-tai-thai-lan-de-tien-hanh-ipo-voi-dinh-gia-len-den-10-ty-usd.chn
03/02/2021 13:55,"SAB: 26.3.2021, ngày GDKHQ thực hiện quyền tham dự ĐHCĐ thường niên năm 2021",https://cafef.vn/du-lieu/sab-1520467/sab-2632021-ngay-gdkhq-thuc-hien-quyen-tham-du-dhcd-thuong-nien-nam-2021.chn
03/02/2021 13:55,"SAB: 2.3.2021, ngày GDKHQ tạm ứng cổ tức năm 2020 (1.500 đ/cp)",https://cafef.vn/du-lieu/sab-1525342/sab-232021-ngay-gdkhq-tam-ung-co-tuc-nam-2020-1500-dcp.chn
02/02/2021 09:22,SAB: Giải trình BCTC hợp nhất quý 4 năm 2020,https://cafef.vn/du-lieu/sab-1525450/sab-giai-trinh-bctc-hop-nhat-quy-4-nam-2020.chn
01/02/2021 17:41,SAB: Giải trình BCTC HN và riêng quý 4/2020 so với cùng kỳ năm trước,https://cafef.vn/du-lieu/sab-1654483/sab-giai-trinh-bctc-hn-va-rieng-quy-42020-so-voi-cung-ky-nam-truoc.chn
01/02/2021 10:53,SAB: Báo cáo tình hình quản trị công ty năm 2020,https://cafef.vn/du-lieu/sab-1304626/sab-bao-cao-tinh-hinh-quan-tri-cong-ty-nam-2020.chn
01/02/2021 07:32,Lịch chốt quyền nhận cổ tức bằng tiền của 6 doanh nghiệp,https://cafef.vn/du-lieu/sab-1309507/lich-chot-quyen-nhan-co-tuc-bang-tien-cua-6-doanh-nghiep.chn
31/01/2021 21:03,"Vượt 45% kế hoạch năm, Sabeco (SAB) chốt danh sách cổ đông chi gần 1.000 tỷ đồng trả cổ tức",https://cafef.vn/du-lieu/sab-1348330/vuot-45-ke-hoach-nam-sabeco-sab-chot-danh-sach-co-dong-chi-gan-1000-ty-dong-tra-co-tuc.chn
30/01/2021 07:50,"Lợi nhuận Sabeco hồi phục mạnh, ThaiBev dự kiến IPO mảng bia tại Singapore thu về 2 tỷ USD",https://cafef.vn/du-lieu/sab-1333951/loi-nhuan-sabeco-hoi-phuc-manh-thaibev-du-kien-ipo-mang-bia-tai-singapore-thu-ve-2-ty-usd.chn
28/01/2021 07:11,Doanh thu giảm sâu nhưng lãi ròng quý 4 của Sabeco vẫn tăng 45% lên mức kỷ lục mới 1.466 tỷ đồng,https://cafef.vn/du-lieu/sab-1398100/doanh-thu-giam-sau-nhung-lai-rong-quy-4-cua-sabeco-van-tang-45-len-muc-ky-luc-moi-1466-ty-dong.chn
25/01/2021 13:16,"""Soi"" biến động giá những cổ phiếu có thị giá ""đắt đỏ"" nhất sàn chứng khoán",https://cafef.vn/du-lieu/sab-1653667/soi-bien-dong-gia-nhung-co-phieu-co-thi-gia-dat-do-nhat-san-chung-khoan.chn
17/01/2021 08:37,"Những cổ phiếu tăng sốc – giảm sâu năm 2020, để lại nhiều cảm xúc cho nhà đầu tư",https://cafef.vn/du-lieu/sab-1602235/nhung-co-phieu-tang-soc-giam-sau-nam-2020-de-lai-nhieu-cam-xuc-cho-nha-dau-tu.chn
16/01/2021 08:11,"SSI Research: Ngành bia phải đến năm 2022 mới hồi phục hoàn toàn, 2 ""ông lớn"" Sabeco và Heineken vẫn miệt mài ""chạy đua""",https://cafef.vn/du-lieu/sab-1625182/ssi-research-nganh-bia-phai-den-nam-2022-moi-hoi-phuc-hoan-toan-2-ong-lon-sabeco-va-heineken-van-miet-mai-chay-dua.chn
05/01/2021 15:19,SAB: Đơn từ chức của ông Hoàng Đạo Hiệp - Phó Tổng Giám đốc,https://cafef.vn/du-lieu/sab-1442236/sab-don-tu-chuc-cua-ong-hoang-dao-hiep-pho-tong-giam-doc.chn
16/12/2020 08:09,"VCSC: Ngành bia hồi phục và đẩy mạnh ra mắt sản phẩm mới cao cấp, lợi nhuận Sabeco sẽ tăng trưởng 2 chữ số trong năm 2020",https://cafef.vn/du-lieu/sab-992698/vcsc-nganh-bia-hoi-phuc-va-day-manh-ra-mat-san-pham-moi-cao-cap-loi-nhuan-sabeco-se-tang-truong-2-chu-so-trong-nam-2020.chn
30/11/2020 10:20,"Điểm danh những doanh nghiệp chốt quyền nhận cổ tức bằng tiền, cổ phiếu và cổ phiếu thưởng tuần 30/11-04/12",https://cafef.vn/du-lieu/sab-976756/diem-danh-nhung-doanh-nghiep-chot-quyen-nhan-co-tuc-bang-tien-co-phieu-va-co-phieu-thuong-tuan-30110412.chn
22/11/2020 09:12,Xung đột thị trường bia qua sự cố Heineken – Sabeco: Góc nhìn pháp lý từ thực tiễn,https://cafef.vn/du-lieu/sab-1720558/xung-dot-thi-truong-bia-qua-su-co-heineken-sabeco-goc-nhin-phap-ly-tu-thuc-tien.chn
19/11/2020 09:06,"SAB: 30.11.2020, tạm ứng cổ tức bằng tiền 2020 (2.000 đ/cp)",https://cafef.vn/du-lieu/sab-972523/sab-30112020-tam-ung-co-tuc-bang-tien-2020-2000-dcp.chn
18/11/2020 08:45,Lịch chốt quyền nhận cổ tức bằng tiền của 8 doanh nghiệp,https://cafef.vn/du-lieu/sab-1745701/lich-chot-quyen-nhan-co-tuc-bang-tien-cua-8-doanh-nghiep.chn
16/11/2020 11:28,Sabeco sắp chi 1.282 tỷ tạm ứng cổ tức đợt 1/2020 với tỷ lệ 20%,https://cafef.vn/du-lieu/sab-965383/sabeco-sap-chi-1282-ty-tam-ung-co-tuc-dot-12020-voi-ty-le-20.chn
13/11/2020 17:55,Bộ Công Thương hoàn tất chuyển giao 36% vốn Sabeco cho SCIC,https://cafef.vn/du-lieu/sab-995554/bo-cong-thuong-hoan-tat-chuyen-giao-36-von-sabeco-cho-scic.chn
10/11/2020 14:56,SAB: Điều chỉnh thông tin quyền sở hữu chứng khoán,https://cafef.vn/du-lieu/sab-1740940/sab-dieu-chinh-thong-tin-quyen-so-huu-chung-khoan.chn
07/11/2020 07:28,"KQKD ngành Bia rượu quý 3: Chịu tác động kép, 2 ""ông lớn"" vẫn có lợi nhuận tăng trưởng",https://cafef.vn/du-lieu/sab-1744192/kqkd-nganh-bia-ruou-quy-3-chiu-tac-dong-kep-2-ong-lon-van-co-loi-nhuan-tang-truong.chn
04/11/2020 08:42,40 doanh nghiệp trong CLB lãi nghìn tỷ năm 2020 đạt 155.000 tỷ đồng lợi nhuận sau thuế trong 9 tháng,https://cafef.vn/du-lieu/sab-1666909/40-doanh-nghiep-trong-clb-lai-nghin-ty-nam-2020-dat-155000-ty-dong-loi-nhuan-sau-thue-trong-9-thang.chn
02/11/2020 21:57,Câu lạc bộ lãi nghìn tỷ năm 2020 đã gọi tên 40 doanh nghiệp,https://cafef.vn/du-lieu/sab-1735147/cau-lac-bo-lai-nghin-ty-nam-2020-da-goi-ten-40-doanh-nghiep.chn
29/10/2020 18:35,"Bất chấp Nghị định 100 và COVID-19, lợi nhuận ròng quý 3 của Sabeco về sát đỉnh lịch sử",https://cafef.vn/du-lieu/sab-1688989/bat-chap-nghi-dinh-100-va-covid19-loi-nhuan-rong-quy-3-cua-sabeco-ve-sat-dinh-lich-su.chn
29/10/2020 17:50,SAB: Giải trình chênh lệch lợi nhuận sau thuế quý 3/2020 so với quý 3/2019,https://cafef.vn/du-lieu/sab-1742968/sab-giai-trinh-chenh-lech-loi-nhuan-sau-thue-quy-32020-so-voi-quy-32019.chn
14/10/2020 11:45,"Heineken hoàn tất thoái vốn Sabeco, thu về gần 5.000 tỷ đồng trong sáng 14/10?",https://cafef.vn/du-lieu/sab-1635142/heineken-hoan-tat-thoai-von-sabeco-thu-ve-gan-5000-ty-dong-trong-sang-1410.chn
29/09/2020 16:26,SAB: Thông qua giao dịch liên quan với Công ty TNHH Trung tâm Mê Linh,https://cafef.vn/du-lieu/sab-1497406/sab-thong-qua-giao-dich-lien-quan-voi-cong-ty-tnhh-trung-tam-me-linh.chn
31/08/2020 11:17,SAB: Giải trình chênh lệch KQKD 6 tháng đầu năm 2020 so với 6 tháng đầu năm 2019,https://cafef.vn/du-lieu/sab-1269661/sab-giai-trinh-chenh-lech-kqkd-6-thang-dau-nam-2020-so-voi-6-thang-dau-nam-2019.chn
30/08/2020 14:21,"SSI Research: Tiêu thụ bia sẽ hồi phục 20% trong năm 2021, nhưng cần vài năm để trở về mức trước",https://cafef.vn/du-lieu/sab-1274515/ssi-research-tieu-thu-bia-se-hoi-phuc-20-trong-nam-2021-nhung-can-vai-nam-de-tro-ve-muc-truoc.chn
29/08/2020 08:45,Chính thức chuyển 36% cổ phần Sabeco từ Bộ Công thương sang SCIC để thực hiện thoái vốn,https://cafef.vn/du-lieu/sab-1332034/chinh-thuc-chuyen-36-co-phan-sabeco-tu-bo-cong-thuong-sang-scic-de-thuc-hien-thoai-von.chn
19/08/2020 20:49,SAB: Ký kết hợp đồng kiểm toán BCTC 2020,https://cafef.vn/du-lieu/sab-1290619/sab-ky-ket-hop-dong-kiem-toan-bctc-2020.chn
19/08/2020 14:04,Một công ty con của Sabeco trả cổ tức tiền mặt tỷ lệ 348% sau 3 năm duy trì ở mức hơn 200%,https://cafef.vn/du-lieu/sab-1375888/mot-cong-ty-con-cua-sabeco-tra-co-tuc-tien-mat-ty-le-348-sau-3-nam-duy-tri-o-muc-hon-200.chn
05/08/2020 13:14,"Thêm nhiều doanh nghiệp ghi danh, CLB lãi nghìn tỷ năm 2020 đã có 24 thành viên",https://cafef.vn/du-lieu/sab-1668280/them-nhieu-doanh-nghiep-ghi-danh-clb-lai-nghin-ty-nam-2020-da-co-24-thanh-vien.chn
31/07/2020 17:03,SAB: Báo cáo tình hình quản trị công ty 6 tháng đầu năm 2020,https://cafef.vn/du-lieu/sab-1695544/sab-bao-cao-tinh-hinh-quan-tri-cong-ty-6-thang-dau-nam-2020.chn
30/07/2020 09:29,"Sabeco giảm hơn 31% LNST 6 tháng xuống 1.933 tỷ đồng, dịch Covid-19 lại bùng phát đi ngược kỳ vọng nửa cuối năm",https://cafef.vn/du-lieu/sab-1654582/sabeco-giam-hon-31-lnst-6-thang-xuong-1933-ty-dong-dich-covid19-lai-bung-phat-di-nguoc-ky-vong-nua-cuoi-nam.chn
30/07/2020 08:52,Câu lạc bộ lãi nghìn tỷ năm 2020 đã ghi danh 21 doanh nghiệp,https://cafef.vn/du-lieu/sab-1654543/cau-lac-bo-lai-nghin-ty-nam-2020-da-ghi-danh-21-doanh-nghiep.chn
17/07/2020 10:44,SAB: Ký kết hợp đồng kiểm toán BCTC 2020,https://cafef.vn/du-lieu/sab-1732420/sab-ky-ket-hop-dong-kiem-toan-bctc-2020.chn
12/07/2020 09:41,"Rơi vào thế ""gọng kìm"", năm 2020 Sabeco (SAB) sẽ sớm ""xuất ngoại"" thương hiệu bia 333 và Saigon",https://cafef.vn/du-lieu/sab-1566043/roi-vao-the-gong-kim-nam-2020-sabeco-sab-se-som-xuat-ngoai-thuong-hieu-bia-333-va-saigon.chn
02/07/2020 15:38,SAB: Biên bản họp và Nghị quyết ĐHĐCĐ thường niên năm 2020,https://cafef.vn/du-lieu/sab-1433650/sab-bien-ban-hop-va-nghi-quyet-dhdcd-thuong-nien-nam-2020.chn
02/07/2020 15:13,Sabeco (SAB): Sẽ thoái hết 36% vốn Nhà nước,https://cafef.vn/du-lieu/sab-1403947/sabeco-sab-se-thoai-het-36-von-nha-nuoc.chn
30/06/2020 11:23,ĐHĐCĐ Sabeco (SAB): Đặt kế hoạch lợi nhuận giảm mạnh về 3.252 tỷ đồng,https://cafef.vn/du-lieu/sab-1476607/dhdcd-sabeco-sab-dat-ke-hoach-loi-nhuan-giam-manh-ve-3252-ty-dong.chn
29/06/2020 07:34,Tổng Giám đốc Sabeco: Những tin đồn ác ý hướng vào chúng tôi từ quý 4/2019 gây ảnh hưởng rất nặng nề đến việc bán hàng!,https://cafef.vn/du-lieu/sab-1607311/tong-giam-doc-sabeco-nhung-tin-don-ac-y-huong-vao-chung-toi-tu-quy-42019-gay-anh-huong-rat-nang-ne-den-viec-ban-hang.chn
23/06/2020 17:35,"SCD đạt lãi ròng 2019 tăng gấp 3,2 lần: Thương hiệu vang bóng Xá xị Chương Dương dần hồi sinh với sự hậu thuẫn từ Thaibev?",https://cafef.vn/du-lieu/sab-1424323/scd-dat-lai-rong-2019-tang-gap-32-lan-thuong-hieu-vang-bong-xa-xi-chuong-duong-dan-hoi-sinh-voi-su-hau-thuan-tu-thaibev.chn
23/06/2020 15:28,"Sau khi mua Vinamilk và Thế giới di động, quỹ ngoại quy mô 4 tỷ USD tiếp tục đầu tư vào Sabeco",https://cafef.vn/du-lieu/sab-1427224/sau-khi-mua-vinamilk-va-the-gioi-di-dong-quy-ngoai-quy-mo-4-ty-usd-tiep-tuc-dau-tu-vao-sabeco.chn
22/06/2020 15:27,SAB: Điều chỉnh tài liệu họp ĐHĐCĐ thường niên năm 2020 đã công bố,https://cafef.vn/du-lieu/sab-1324360/sab-dieu-chinh-tai-lieu-hop-dhdcd-thuong-nien-nam-2020-da-cong-bo.chn
22/06/2020 15:27,SAB: Link công bố tài liệu họp ĐHĐCĐ thường niên năm 2020,https://cafef.vn/du-lieu/sab-1541203/sab-link-cong-bo-tai-lieu-hop-dhdcd-thuong-nien-nam-2020.chn
21/06/2020 10:29,"Sabeco đặt kế hoạch lãi ròng 2020 giảm 39%, về mức thấp nhất 5 năm với 3.252 tỷ đồng",https://cafef.vn/du-lieu/sab-1314301/sabeco-dat-ke-hoach-lai-rong-2020-giam-39-ve-muc-thap-nhat-5-nam-voi-3252-ty-dong.chn
12/06/2020 19:21,SAB: Thông báo thư mời họp ĐHĐCĐ thường niên 2020,https://cafef.vn/du-lieu/sab-1295983/sab-thong-bao-thu-moi-hop-dhdcd-thuong-nien-2020.chn
07/06/2020 09:47,"Tham vọng IPO mảng bia Việt Nam và Thái Lan lên sàn Singapore với định giá 10 tỷ USD, Thaibev có thể phải lùi kế hoạch lâu dài do dịch Covid-19",https://cafef.vn/du-lieu/sab-1725601/tham-vong-ipo-mang-bia-viet-nam-va-thai-lan-len-san-singapore-voi-dinh-gia-10-ty-usd-thaibev-co-the-phai-lui-ke-hoach-lau-dai-do-dich-covid19.chn
03/06/2020 18:19,Bộ Công thương nói gì về thông tin mua lại cổ phần Sabeco từ Thaibev với giá chỉ 130.000 đồng/cổ phiếu?,https://cafef.vn/du-lieu/sab-1728913/bo-cong-thuong-noi-gi-ve-thong-tin-mua-lai-co-phan-sabeco-tu-thaibev-voi-gia-chi-130000-dongco-phieu.chn
01/06/2020 10:54,"Phủ nhận tin đồn rao bán, chủ tịch Sabeco tuyên bố: ""Chúng tôi đã nhận thấy những dấu hiệu phục hồi tích cực và đang dần lấy lại đà tăng trưởng""",https://cafef.vn/du-lieu/sab-1711222/phu-nhan-tin-don-rao-ban-chu-tich-sabeco-tuyen-bo-chung-toi-da-nhan-thay-nhung-dau-hieu-phuc-hoi-tich-cuc-va-dang-dan-lay-lai-da-tang-truong.chn
30/05/2020 13:27,Thaibev nói gì trước tin đồn sẽ bán lại khoản đầu tư tại Sabeco?,https://cafef.vn/du-lieu/sab-1271764/thaibev-noi-gi-truoc-tin-don-se-ban-lai-khoan-dau-tu-tai-sabeco.chn
26/05/2020 13:57,Sabeco xoay sở thế nào khi quy định hạn chế tác hại rượu bia được tái khởi động sau thời gian tạm hoãn?,https://cafef.vn/du-lieu/sab-1300888/sabeco-xoay-so-the-nao-khi-quy-dinh-han-che-tac-hai-ruou-bia-duoc-tai-khoi-dong-sau-thoi-gian-tam-hoan.chn
25/05/2020 18:11,SAB: Giấy chứng nhận đăng ký doanh nghiệp thay đổi lần thứ 10,https://cafef.vn/du-lieu/sab-1729546/sab-giay-chung-nhan-dang-ky-doanh-nghiep-thay-doi-lan-thu-10.chn
19/05/2020 14:30,"SAB: 9.6.2020, ngày GDKHQ để thực hiện quyền tham dự ĐHCĐ thường niên năm 2020",https://cafef.vn/du-lieu/sab-1664383/sab-962020-ngay-gdkhq-de-thuc-hien-quyen-tham-du-dhcd-thuong-nien-nam-2020.chn
15/05/2020 17:48,SAB: Nghị quyết HĐQT v/v tổ chức họp ĐHĐCĐ thường niên 2020,https://cafef.vn/du-lieu/sab-1649083/sab-nghi-quyet-hdqt-vv-to-chuc-hop-dhdcd-thuong-nien-2020.chn
06/05/2020 08:37,"Soi lợi nhuận quý 1 của các cổ phiếu có thị giá ""đắt đỏ"" nhất sàn chứng khoán",https://cafef.vn/du-lieu/sab-1567570/soi-loi-nhuan-quy-1-cua-cac-co-phieu-co-thi-gia-dat-do-nhat-san-chung-khoan.chn
05/05/2020 08:16,Thông điệp từ Sabeco: Đây là thời điểm chưa từng có tiền lệ và tình hình sẽ tiếp tục trở nên khó khăn hơn!,https://cafef.vn/du-lieu/sab-1499362/thong-diep-tu-sabeco-day-la-thoi-diem-chua-tung-co-tien-le-va-tinh-hinh-se-tiep-tuc-tro-nen-kho-khan-hon.chn
04/05/2020 11:25,SAB: Link công bố báo cáo thường niên năm 2019,https://cafef.vn/du-lieu/sab-1501456/sab-link-cong-bo-bao-cao-thuong-nien-nam-2019.chn
04/05/2020 11:19,SAB: Giải trình chênh lệch KQKD quý 1 năm 2020 so với quý 1 năm 2019,https://cafef.vn/du-lieu/sab-1506871/sab-giai-trinh-chenh-lech-kqkd-quy-1-nam-2020-so-voi-quy-1-nam-2019.chn
29/04/2020 18:40,"Chịu ảnh hưởng kép từ Nghị định 100 và Covid-19, lợi nhuận quý 1 Sabeco thấp nhất trong nhiều năm",https://cafef.vn/du-lieu/sab-1563409/chiu-anh-huong-kep-tu-nghi-dinh-100-va-covid19-loi-nhuan-quy-1-sabeco-thap-nhat-trong-nhieu-nam.chn
22/04/2020 15:36,"Sabeco: Quyết định cưỡng chế 3.140 tỷ tiền thuế không còn hiệu lực, cổ phiếu hồi mạnh 47% chỉ sau 1 tháng",https://cafef.vn/du-lieu/sab-1442497/sabeco-quyet-dinh-cuong-che-3140-ty-tien-thue-khong-con-hieu-luc-co-phieu-hoi-manh-47-chi-sau-1-thang.chn
22/04/2020 11:35,SAB: Thông báo liên quan đến khoản phạt hành chính và lãi chậm nộp thuế,https://cafef.vn/du-lieu/sab-1518319/sab-thong-bao-lien-quan-den-khoan-phat-hanh-chinh-va-lai-cham-nop-thue.chn
22/04/2020 11:31,SAB: Sở Kế hoạch và Đầu tư TP.HCM chấp thuận gia hạn thời gian họp ĐHĐCĐ thường niên năm 2020,https://cafef.vn/du-lieu/sab-1523965/sab-so-ke-hoach-va-dau-tu-tphcm-chap-thuan-gia-han-thoi-gian-hop-dhdcd-thuong-nien-nam-2020.chn
09/04/2020 17:38,SAB: Giải trình BCTC HN và riêng kiểm toán năm 2019,https://cafef.vn/du-lieu/sab-1424971/sab-giai-trinh-bctc-hn-va-rieng-kiem-toan-nam-2019.chn
07/04/2020 11:21,"Vingroup và Bảo Việt tăng gần 40%, nhiều doanh nghiệp lớn khác cũng hồi phục 20% so với đáy",https://cafef.vn/du-lieu/sab-1384546/vingroup-va-bao-viet-tang-gan-40-nhieu-doanh-nghiep-lon-khac-cung-hoi-phuc-20-so-voi-day.chn
