Thời gian,Tiêu đề,URL,Nội dung,positive,neutral,negative
2025-10-26 19:24:00,Chưa từng có: Một doanh nghiệp Việt cùng lúc xác lập 3 kỷ lục quốc gia,https://cafef.vn/chua-tung-co-mot-doanh-nghiep-viet-cung-luc-xac-lap-3-ky-luc-quoc-gia-188251026192430073.chn,,0.3989141583442688,0.46203798055648804,0.13904795050621033
2025-10-17 00:00:00,GAS: Giấy chứng nhận đăng ký doanh nghiệp thay đổi lần thứ 23,https://cafef.vn/du-lieu/GAS-2319721/gas-giay-chung-nhan-dang-ky-doanh-nghiep-thay-doi-lan-thu-23.chn,,0.026227731257677078,0.02081681415438652,0.9529553651809692
2025-10-15 00:00:00,GAS: Nghị quyết HĐQT chấp thuận nội dung sửa đổi Hợp đồng,https://cafef.vn/du-lieu/GAS-2318300/gas-nghi-quyet-hdqt-chap-thuan-noi-dung-sua-doi-hop-dong.chn,,0.0028268457390367985,0.9958310723304749,0.0013421287294477224
2025-10-07 07:52:00,"'Đế chế' của ông Phạm Nhật Vượng chỉ có 37,3% nhân sự nữ nhưng các nữ tướng chiếm 59%, ngân hàng là 'thánh địa' của giới nữ ngoại trừ Sacombank",https://cafef.vn/de-che-cua-ong-pham-nhat-vuong-chi-co-373-nhan-su-nu-nhung-cac-nu-tuong-chiem-59-ngan-hang-la-thanh-dia-cua-gioi-nu-ngoai-tru-sacombank-188251007075236181.chn,"Theo Báo cáo thường niên 2024 của 21 doanh nghiệp có giá trị vốn hoá lớn nhất thị trường chứng khoán Việt Nam tại thời điểm 6/10/2025 (bỏ qua ACV và Viettel Global do không công bố cơ cấu lao động), trên tổng quy mô hơn 576.000 nhân sự, cán cân giới tính vẫn nghiêng về phía nam giới khi có 11/21 doanh nghiệp có tỷ lệ nhân sự nam ‘áp đảo’ so với nhân sự nữ, đặc biệt trong các lĩnh vực công nghiệp nặng và công nghệ.
Điển hình như Tập đoàn Hòa Phát (HPG) chỉ có chưa đầy 12% nhân sự là nữ giới, PV GAS (GAS) có 21% hay Vinamilk cũng chỉ có 24,8% nhân sự là nữ... do đặc thù công việc có yêu cầu về sức khỏe thể chất, điều kiện làm việc khắc nghiệt, môi trường làm việc ngoài trời…
Trong khi đó, khối ngân hàng là nơi có đông nhân sự nữ nhất, với tỷ lệ trên dưới 60%. Ngân hàng duy nhất có tỷ lệ nữ dưới 50% là Sacombank (STB) với 48,28%.
Tuy nhiên, khi đi sâu vào cơ cấu lãnh đạo, một ""nghịch lý"" thú vị đã xuất hiện, đặc biệt tại những tập đoàn đa ngành lớn nhất.
Tại Vingroup (VIC), dù lao động nữ chỉ chiếm 37,3% tổng số nhân sự, nhưng lại có đến 59% các vị trí quản lý tại tập đoàn này do phụ nữ nắm giữ. Câu chuyện ""nữ quyền"" tại Vingroup không chỉ thể hiện qua các con số mà còn là một phần trong triết lý dùng người của nhà sáng lập. Các vị trí lãnh đạo cao cấp nhất quanh Chủ tịch Phạm Nhật Vượng, từ tài chính, kinh doanh đến pháp lý, phần lớn đều là các ""nữ tướng"".
Lý giải về điều này, ông Vượng từng chia sẻ trong một buổi nói chuyện trước đây rằng phụ nữ có những thế mạnh đặc biệt ở vai trò quản trị. Ông cho rằng: ""Ở các cương vị như các cấp phó hay các nhà quản trị thì rõ ràng nữ tốt hơn... Ví dụ tài chính kế toán, pháp lý kinh doanh, là thế mạnh của phụ nữ. Cho nên đương nhiên những vị trí đó bao giờ chúng tôi cũng bổ nhiệm phụ nữ.""
Triết lý này đã biến Vingroup thành một ví dụ điển hình cho việc trao quyền cho các lãnh đạo nữ, bất kể tỷ lệ của họ trong tổng thể lực lượng lao động.
Nhưng điều này không diễn ra tại Vinhomes - công ty con phụ trách mảng bất động sản của Vingroup. Vinhomes có 34,2% lao động là nữ, và cũng chỉ có tỷ lệ nữ quản lý là 28,7%.
Ngược lại với Vingroup, tại Masan Group (MSN), dù tỷ lệ nhân sự nữ tới 62,4% nhưng tỷ lệ nữ quản lý chỉ chiếm 43%. Trong khi đó, tại Masan Consumer chứng kiến ‘nữ quyền’ lớn hơn khi tỷ lệ nhân sự nữ chỉ 35,3% nhưng nữ quản lý chiếm gần 43% số cán bộ quản lý.
Về phía các ngân hàng, Sacombank không chỉ có tỷ lệ nữ nhân sự thấp hơn hẳn các ngân hàng khác (dưới 50%) mà tỷ lệ nữ quản lý tại ngân hàng này cũng thấp nhất: 24,1% - con số này còn thấp hơn tại các công ty như Vinamilk, Vinhomes.
Một số ngân hàng có tỷ lệ nữ nhân sự cao, nhưng nữ quản lý lại thấp dưới 50% là LPBank (32,8%), MB (45%) và HDBank (43%).  Điều này cho thấy mặc dù ngành tài chính - ngân hàng thu hút một lượng lớn nhân sự nữ, con đường tiến tới các vị trí lãnh đạo cao nhất của họ vẫn còn nhiều thách thức hơn so với các đồng nghiệp nam.
Nhìn rộng ra toàn thị trường, trong báo cáo ""Giới và thị trường lao động ở Việt Nam"" của Tổ chức Lao động Quốc tế (ILO) năm 2021 cho biết, Việt Nam có tỷ lệ phụ nữ tham gia lực lượng lao động rất cao so với thế giới (trên 70%).
Tuy nhiên, phụ nữ Việt Nam vẫn phải đối mặt với sự bất bình đẳng về cơ hội và gánh vác ""trách nhiệm kép"" khi phải dành thời gian cho công việc không lương tại nhà nhiều hơn nam giới gấp đôi. Điều này ảnh hưởng trực tiếp đến sự phát triển nghề nghiệp của họ. ILO nhấn mạnh rằng dù phụ nữ chiếm gần một nửa lực lượng lao động, họ chỉ đảm nhận khoảng 1/4 các vị trí lãnh đạo, quản lý chung trên toàn thị trường.",0.11284918888448835,0.8775440391415877,0.009606776797672524
2025-10-07 00:00:00,"GAS: 20.10.2025, giao dịch 70.276.837 cp niêm yết bổ sung",https://cafef.vn/du-lieu/GAS-2312526/gas-20102025-giao-dich-70276837-cp-niem-yet-bo-sung.chn,,0.061047498136758804,0.9383524060249329,0.000600108876824379
2025-10-05 15:02:00,Chế độ phúc lợi nghỉ thai sản cho nhân viên PV Gas ra sao?,https://cafef.vn/che-do-phuc-loi-nghi-thai-san-cho-nhan-vien-pv-gas-ra-sao-188251005150232396.chn,"Theo thông tin từ báo cáo phát triển vững năm 2024 của Tổng Công ty Khí Việt Nam (PV Gas - mã CK: GAS), năm 2024, PV Gas có 41  nhân viên nghỉ thai sản, giảm 33% so với năm 2023. Trong đó, có 34 nhân viên nam và 7 nhân viên nữ.
Tổng số cán bộ công nhân viên tại công ty mẹ và các chi nhánh tại ngày 31/12/2024 là 1.376 người, trong đó, có 1.092 nhân viên nam và 284 nhân viên nữ.
PV GAS khẳng định luôn đảm bảo đầy đủ quyền lợi về chế độ nghỉ thai sản cho tất cả cán bộ công nhân viên theo quy định của pháp luật hiện hành. Bên cạnh đó, công ty cũng cam kết tạo điều kiện thuận lợi để nhân viên quay trở lại làm việc sau khi kết thúc kỳ nghỉ.
Chế độ phúc lợi toàn diện của PV GAS được quy định rõ trong Thỏa ước lao động tập thể và Nội quy lao động, bao gồm các chế độ như bảo hiểm xã hội, bảo hiểm y tế, chăm sóc sức khỏe, và các phúc lợi đời sống khác. Các phúc lợi dành cho nhân viên nữ cũng được chú trọng với quà tặng ngày Quốc tế Phụ nữ, Phụ nữ Việt Nam; trợ cấp thai sản, tính thời gian thi đua khen thưởng trong thời gian nghỉ thai sản, khám sức khỏe chuyên khoa phụ sản…
PV GAS cũng chú trọng đến việc tạo cơ hội phát triển nghề nghiệp cho nữ lao động, đặc biệt trong các lĩnh vực hỗ trợ kỹ thuật, quản lý, an toàn lao động và các công tác văn phòng. Công ty đang triển khai các chiến lược thu hút nhân tài nữ vào các vị trí lãnh đạo và chuyên môn, với cam kết phát triển nguồn nhân lực bền vững, đa dạng và bình đẳng giới.
Tại PV GAS, tỷ lệ nhân sự tập trung nhiều ở độ tuổi từ 30 - 50 tuổi (71,4%), sau đó là độ tuổi trên 50 (18,6%) và thấp nhất là độ tuổi dưới 30 (10%).
Điều này xuất phát từ yêu cầu cao về kinh nghiệm trong ngành dầu khí. Các vị trí chủ chốt đòi hỏi kỹ năng chuyên môn vững vàng, sự hiểu biết sâu sắc về các quy trình phức tạp và khả năng xử lý tình huống trong môi trường khắc nghiệt.
Đây cũng là lí do khiến công ty ưu tiên tuyển dụng và giữ lại những nhân viên có kinh nghiệm lâu năm, đảm bảo hiệu quả công việc và sự ổn định trong hoạt động.
Tuy nhiên, trong chiến lược phát triển nhân sự dài hạn, PV GAS cũng chú trọng tuyển dụng và đào tạo các cán bộ trẻ, với độ tuổi chủ yếu từ 30 tuổi trở xuống, nhằm xây dựng một thế hệ nhân sự kế thừa, trẻ trung, năng động, đồng thời giữ vững tính kế thừa và phát triển bền vững của công ty.",0.8539851718779766,0.1450808963484385,0.0009339212111482767
2025-10-02 00:00:00,PGS: Nghị quyết HĐQT thông qua nội dung hợp đồng mua bán vỏ chai LPG cũ với PVGAS,https://cafef.vn/du-lieu/GAS-2308418/pgs-nghi-quyet-hdqt-thong-qua-noi-dung-hop-dong-mua-ban-vo-chai-lpg-cu-voi-pvgas.chn,,0.0016429841052740812,0.2229619026184082,0.7753950357437134
2025-10-02 00:00:00,GAS: Thông báo thay đổi mẫu dấu công ty,https://cafef.vn/du-lieu/GAS-2309259/gas-thong-bao-thay-doi-mau-dau-cong-ty.chn,,0.11773323267698288,0.039680976420640945,0.8425856828689575
2025-09-30 00:00:00,"GAS: 1.10.2025, niêm yết bổ sung 70.276.837 cp",https://cafef.vn/du-lieu/GAS-2307514/gas-1102025-niem-yet-bo-sung-70276837-cp.chn,,0.048959773033857346,0.9504361152648926,0.0006040809093974531
2025-09-29 00:00:00,GAS: Nghị quyết HĐQT chấp thuận nội dung chính của hợp đồng mua bán khí năm 2025 giữa PV GAS và PVFCCo,https://cafef.vn/du-lieu/GAS-2306519/gas-nghi-quyet-hdqt-chap-thuan-noi-dung-chinh-cua-hop-dong-mua-ban-khi-nam-2025-giua-pv-gas-va-pvfcco.chn,,0.000423639576183632,0.9982051849365234,0.001371124992147088
2025-09-22 13:42:00,PV GAS được chấp thuận đầu tư dự án Kho LNG Bắc Trung bộ 26.700 tỷ đồng tại Hà Tĩnh,https://cafef.vn/pv-gas-duoc-chap-thuan-dau-tu-du-an-kho-lng-bac-trung-bo-26700-ty-dong-tai-ha-tinh-18825092213391668.chn,"UBND tỉnh Hà Tĩnh vừa ban hành Quyết định số 41/QĐ-UBND về việc chấp thuận chủ trương đầu tư, đồng thời chấp thuận nhà đầu tư dự án Kho LNG Bắc Trung bộ (Kho LNG Vũng Áng) tại phường Hoành Sơn, tỉnh Hà Tĩnh. Chủ đầu tư dự án này là Tổng công ty Khí Việt Nam (PV GAS).
Dự án Kho khí thiên nhiên hóa lỏng (LNG) Bắc Trung bộ có mục tiêu cung cấp LNG cho các nhà máy nhiệt điện theo Quy hoạch điện VIII điều chỉnh (Quảng Trạch 2, Vũng Áng 3, Quảng Trạch 3...) và các hộ tiêu thụ công nghiệp khác trong khu vực.
Vị trí đầu tư dự án Kho LNG Bắc Trung Bộ tại KKT Vũng Áng, Hà Tĩnh.
Dự án dự kiến sử dụng khoảng 53ha đất liền và 426ha mặt nước. Tổng vốn đầu tư khoảng hơn 26.700 tỷ đồng , trong đó vốn góp của chủ sở hữu là 8.000 tỷ đồng; vốn vay và huy động khác là 18.700 tỷ đồng.

Dự án chia làm 2 giai đoạn:

Giai đoạn 1 (năm 2029-2030): 1-3 triệu tấn LNG/năm.

Giai đoạn 2 (sau năm 2030): Nghiên cứu mở rộng nâng công suất theo quy hoạch được duyệt và nhu cầu thị trường.

Thời hạn hoạt động dự án là 35 năm (kể từ ngày có quyết định giao đất, cho thuê đất). Còn tiến độ thực hiện là hoàn thành toàn bộ dự án đi vào hoạt động trong quý 4/2029.
Dự án Kho LNG Bắc Trung bộ dự kiến khi đi vào hoạt động sẽ giải quyết số lượng lớn lao động và tăng thu ngân sách cho địa phương, góp phần tăng trưởng, chuyển dịch cơ cấu kinh tế của địa phương theo hướng tăng dần tỷ trọng công nghiệp - dịch vụ và cơ cấu lao động.
Một góc của Khu kinh tế Vũng Áng, Hà Tĩnh.
Kho LNG Vũng Áng được xác định là một mắt xích quan trọng trong chiến lược phát triển hạ tầng LNG trải dài từ Bắc – Trung – Nam của PV Gas.
Trước đó, doanh nghiệp đã vận hành Kho LNG Thị Vải (Bà Rịa – Vũng Tàu) với tổng vốn gần 7.500 tỷ đồng, công suất giai đoạn 1 đạt 1 triệu tấn/năm.
Bên cạnh đó, PV Gas cũng đang phối hợp với AES triển khai Kho LNG Sơn Mỹ (Bình Thuận) có vốn đầu tư hơn 32.000 tỷ đồng, công suất giai đoạn 1 khoảng 3,6 triệu tấn/năm, dự kiến hoạt động sau năm 2027.

Trong bức tranh tổng thể, Thị Vải được xem là cửa ngõ LNG của khu vực Đông Nam Bộ, còn Vũng Áng sẽ đóng vai trò trung tâm cung ứng khí hóa lỏng cho Bắc Trung Bộ và hỗ trợ cân đối nguồn cung cho miền Bắc.
Về kết quả kinh doanh, 6 tháng đầu năm 2025, PV Gas ghi nhận doanh thu thuần đạt gần 55.756 tỷ đồng, tăng hơn 4% so với cùng kỳ và lợi nhuận sau thuế đạt hơn 7.571 tỷ đồng, tăng 27%.
Về kết quả kinh doanh, 6 tháng đầu năm 2025, PV Gas ghi nhận doanh thu thuần đạt gần 55.756 tỷ đồng, tăng hơn 4% so với cùng kỳ và lợi nhuận sau thuế đạt hơn 7.571 tỷ đồng, tăng 27%.",0.21271073997317472,0.7864506135709255,0.0008386658302327462
2025-09-19 00:00:00,"GAS: Nghị quyết HĐQT v/v tăng Vốn điều lệ, sửa đổi Điều lệ, thay đổi nội dung Đăng ký doanh nghiệp",https://cafef.vn/du-lieu/GAS-2300212/gas-nghi-quyet-hdqt-vv-tang-von-dieu-le-sua-doi-dieu-le-thay-doi-noi-dung-dang-ky-doanh-nghiep.chn,,0.2929043769836426,0.6840832829475403,0.02301238849759102
2025-09-15 00:00:00,PVG: Nghị quyết HĐQT thông qua nội dung chính hợp đồng thuê vỏ chai LPG,https://cafef.vn/du-lieu/GAS-2296600/pvg-nghi-quyet-hdqt-thong-qua-noi-dung-chinh-hop-dong-thue-vo-chai-lpg.chn,,0.001084767165593803,0.9413028955459595,0.05761237442493439
2025-09-11 00:00:00,PGS: Nghị quyết HĐQT tham gia đấu giá lô chai cũ LPG rỗng của PVGAS,https://cafef.vn/du-lieu/GAS-2293836/pgs-nghi-quyet-hdqt-tham-gia-dau-gia-lo-chai-cu-lpg-rong-cua-pvgas.chn,,0.004135495517402887,0.5574401617050171,0.43842431902885437
2025-09-09 17:32:00,GAS: Thông báo thay đổi số lượng cổ phiếu có quyền biểu quyết và báo cáo kết quả phát hành cổ phiếu để tăng vốn cổ phần tứ NVCSH,https://cafef.vn/du-lieu/GAS-2292168/gas-thong-bao-thay-doi-so-luong-co-phieu-co-quyen-bieu-quyet-va-bao-cao-ket-qua-phat-hanh-co-phieu-de-tang-von-co-phan-tu-nvcsh.chn,,0.0008140178979374468,0.9968569278717041,0.0023289897944778204
2025-09-06 08:32:00,"Những doanh nghiệp có nhân viên “kiếm tiền” khoẻ nhất sàn chứng khoán: Bình quân mỗi người mang về 3-5 tỷ doanh thu/tháng, bất ngờ với top 1",https://cafef.vn/nhung-doanh-nghiep-co-nhan-vien-kiem-tien-khoe-nhat-san-chung-khoan-binh-quan-moi-nguoi-mang-ve-35-ty-doanh-thuthang-bat-ngo-voi-top-1-18825090608323733.chn,,0.8888906836509705,0.061110083013772964,0.04999920725822449
2025-09-03 00:00:00,GAS: Thông báo giấy xác nhận thay đổi nội dung ĐKDN,https://cafef.vn/du-lieu/GAS-2289739/gas-thong-bao-giay-xac-nhan-thay-doi-noi-dung-dkdn.chn,,0.06312589347362518,0.22029466927051544,0.7165793776512146
2025-08-22 00:00:00,PSI: Nghị quyết HĐQT thông qua hợp đồng với PVGas,https://cafef.vn/du-lieu/GAS-2280246/psi-nghi-quyet-hdqt-thong-qua-hop-dong-voi-pvgas.chn,,0.15094523131847382,0.8321977853775024,0.01685696467757225
2025-08-22 00:00:00,GAS: Giấy chứng nhận đăng ký doanh nghiệp thay đổi lần thứ 22,https://cafef.vn/du-lieu/GAS-2281664/gas-giay-chung-nhan-dang-ky-doanh-nghiep-thay-doi-lan-thu-22.chn,,0.02419649250805378,0.018932808190584183,0.9568707346916199
2025-08-19 07:15:00,Những ‘đại gia’ đem tiền mặt đi trả hết nợ vẫn còn hơn chục nghìn tỷ,https://cafef.vn/nhung-dai-gia-dem-tien-mat-di-tra-het-no-van-con-hon-chuc-nghin-ty-188250819071520593.chn,,0.0037465468049049377,0.0012992898700758815,0.9949540495872498
2025-08-05 00:00:00,"GAS: 28.8.2025, ngày GDKHQ trả cổ tức năm 2024 bằng tiền (2.100 đ/cp), thưởng cp (tỷ lệ 100:3)",https://cafef.vn/du-lieu/GAS-2263659/gas-2882025-ngay-gdkhq-tra-co-tuc-nam-2024-bang-tien-2100-dcp-thuong-cp-ty-le-1003.chn,,0.02667487971484661,0.8213963508605957,0.15192875266075134
2025-08-02 09:13:00,"20 doanh nghiệp niêm yết lãi lớn nhất 6T2025: 60% là ngân hàng, 15% là bất động sản, chỉ có 1 DN sản xuất",https://cafef.vn/20-doanh-nghiep-niem-yet-lai-lon-nhat-6t2025-60-la-ngan-hang-15-la-bat-dong-san-chi-co-1-dn-san-xuat-188250802085619235.chn,,0.015759186819195747,0.43023189902305603,0.5540089011192322
2025-07-30 00:00:00,GAS: Báo cáo tình hình quản trị công ty 06 tháng đầu năm 2025,https://cafef.vn/du-lieu/GAS-2292830/gas-bao-cao-tinh-hinh-quan-tri-cong-ty-06-thang-dau-nam-2025.chn,,0.011535177007317543,0.9711532592773438,0.01731155626475811
2025-07-29 00:00:00,GAS: Thông báo số 29 và 30 ngày 28/07/2025,https://cafef.vn/du-lieu/GAS-2271861/gas-thong-bao-so-29-va-30-ngay-28072025.chn,,0.010832886211574078,0.9819774031639099,0.007189704105257988
2025-07-25 00:00:00,GAS: Nghị quyết HĐQT v/v trả cổ tức năm 2024,https://cafef.vn/du-lieu/GAS-2256830/gas-nghi-quyet-hdqt-vv-tra-co-tuc-nam-2024.chn,,0.011070153675973415,0.9818618893623352,0.007067965809255838
2025-07-04 10:09:00,"Dự án trọng điểm Lô B – Ô Môn, Sư Tử Trắng 2B…. đang tạo ra 'khối lượng công việc khổng lồ' lên đến hàng tỷ USD cho PVD, PVS",https://cafef.vn/du-an-trong-diem-lo-b-o-mon-su-tu-trang-2b-dang-tao-ra-khoi-luong-cong-viec-khong-lo-len-den-hang-ty-usd-cho-pvd-pvs-18825070410061419.chn,,0.9945476055145264,0.004021087661385536,0.0014313871506601572
2025-07-04 00:00:00,GAS: Nghị quyết HĐQT số 68 và ký hợp đồng kiểm toán BCTC,https://cafef.vn/du-lieu/GAS-2239405/gas-nghi-quyet-hdqt-so-68-va-ky-hop-dong-kiem-toan-bctc.chn,,0.005479407962411642,0.9906212091445923,0.003899372648447752
2025-07-02 07:03:00,"Cuộc đua vốn hóa 25 năm: Một công ty thủy điện từng giữ ngôi vua trước khi những 'gã khổng lồ' FPT, Vinamilk, Vietcombank 'tràn' lên sàn",https://cafef.vn/cuoc-dua-von-hoa-25-nam-mot-cong-ty-thuy-dien-tung-giu-ngoi-vua-truoc-khi-nhung-ga-khong-lo-fpt-vinamilk-vietcombank-tran-len-san-188250702070405395.chn,,0.04673551768064499,0.045011915266513824,0.9082525968551636
2025-07-02 00:00:00,GAS: Nghị quyết HĐQT số 66 ngày 30/06/2025,https://cafef.vn/du-lieu/GAS-2236099/gas-nghi-quyet-hdqt-so-66-ngay-30062025.chn,,0.0064920964650809765,0.9853142499923706,0.00819359440356493
2025-06-23 10:05:00,"Giá dầu tăng nóng sau diễn biến mới tại Trung Đông, cổ phiếu dầu khí đồng loạt “bốc đầu”",https://cafef.vn/gia-dau-tang-nong-sau-dien-bien-moi-tai-trung-dong-co-phieu-dau-khi-dong-loat-boc-dau-188250623093139531.chn,,0.08592555671930313,0.3829297423362732,0.5311447381973267
